handle,name,tweet_id,author_id,lang,replied_to,created_at,tweet_text,possibly_sensitive,conversation_id,retweet_count,reply_count,like_count,quote_count
HerreraBeutler,Jaime Herrera Beutler,1311451651094519808,242926427,en,1311451651094519808,2020-09-30T23:43:33.000Z,"We now have 179 signatures for my discharge petition to bypass congressional gridlock, temporarily take control away from Speaker Pelosi, &amp; bring small business relief to the House Floor. 

Momentum &amp; support for this crucial effort is growing — stay tuned for more updates.",False,1311451651094519808,2252,305,305,190
HerreraBeutler,Jaime Herrera Beutler,1311378305782865929,242926427,en,1311378305782865929,2020-09-30T18:52:06.000Z,"Last night's debate was the worst I've ever seen. Since it wasn't made clear last night, let me state unequivocally that all of us must reject white supremacy in all its forms and violence by anyone for any reason. The President needs to clarify his remarks immediately.",False,1311378305782865929,90,922,922,146
HerreraBeutler,Jaime Herrera Beutler,1311354408807137280,242926427,en,1311354408807137280,2020-09-30T17:17:09.000Z,"With almost two dozen Democrats signaling this week they will sign my petition if no bipartisan COVID package is produced, I’m going to keep the pressure going on this effort. Stay tuned. (2/2)",False,1311354408039448576,30,16,16,2
HerreraBeutler,Jaime Herrera Beutler,1311354408039448576,242926427,en,1311354408039448576,2020-09-30T17:17:09.000Z,"Discharge petition update: As of now, we have received 148 signatures to bypass Speaker Pelosi and rush emergency relief to small businesses and workers. (1/2)",False,1311354408039448576,185,62,62,20
HerreraBeutler,Jaime Herrera Beutler,1311075857985929217,242926427,en,1311075857985929217,2020-09-29T22:50:17.000Z,"RT @RepRobinKelly: Today, the House passed my bipartisan #HelpingMOMS Act (#HR4996) to increase access to healthcare coverage for new moms.…",False,1311075857985929217,27,0,0,0
HerreraBeutler,Jaime Herrera Beutler,1310695704185262080,242926427,en,1310695704185262080,2020-09-28T21:39:42.000Z,"ICYMI ➡️ I've filed a discharge petition to force Speaker Pelosi to hold a vote to extend the job-saving Paycheck Protection Program. Stay tuned for updates when Members of Congress are back in D.C. &amp; we’re able to collect more signatures &amp; build support.
https://t.co/xgFvuqIeyD",False,1310695704185262080,32,48,48,6
HerreraBeutler,Jaime Herrera Beutler,1310583615789715456,242926427,en,1310583615789715456,2020-09-28T14:14:18.000Z,"My focus is on helping Southwest Washington residents any way I can during these challenging times. 

If you need help obtaining unemployment benefits, or with federal agencies, please let me know. You can call me at (360) 695-6292 or send me a message at https://t.co/ptFZCYH3aE https://t.co/eOiqiHfjpT",False,1310583615789715456,4,11,11,0
HerreraBeutler,Jaime Herrera Beutler,1309534470102487041,242926427,en,1309534470102487041,2020-09-25T16:45:22.000Z,"Thank you to all my colleagues who have signed my discharge petition this morning — While this is a tool of last resort, it’s our last and best hope if we don’t reach a deal for our hard working families and small businesses across the country. 

#FightForSmallBiz",False,1309534470102487041,32,38,38,2
HerreraBeutler,Jaime Herrera Beutler,1309480398003613698,242926427,en,1309480398003613698,2020-09-25T13:10:30.000Z,"I'm heading into the Capitol to officially file my discharge petition. It's time to put an end to the political gamesmanship we've been seeing here in D.C. 

Southwest Washington businesses cannot wait any longer. https://t.co/cJxLKTkDGS",False,1309480398003613698,67,70,70,16
HerreraBeutler,Jaime Herrera Beutler,1309227017024536577,242926427,en,1309227017024536577,2020-09-24T20:23:39.000Z,"Update on my discharge petition that could force the House to vote on relief for small businesses and workers. 

Watch ⬇️ https://t.co/F5k2soVAu0",False,1309227017024536577,156,85,85,12
HerreraBeutler,Jaime Herrera Beutler,1308887555220426752,242926427,en,1308887555220426752,2020-09-23T21:54:45.000Z,"I’m fighting tooth and nail in Congress to make sure our small businesses and workers receive the assistance they need. 

I’m hopeful our bipartisan effort will break the political logjam that’s hurting too many of our folks here in Southwest Washington. https://t.co/qpjbMjjblO",False,1308887555220426752,3,24,24,2
HerreraBeutler,Jaime Herrera Beutler,1308828476888231940,242926427,en,1308828476888231940,2020-09-23T18:00:00.000Z,".@RepSteveChabot and I are working to get relief to small businesses, employers, and workers who desperately need it. 

Congress must act now so our mom-and-pop shops in Southwest Washington and across the country aren’t permanently shuttered. https://t.co/h0tLkQ0wb4",False,1308828476888231940,1,7,7,0
HerreraBeutler,Jaime Herrera Beutler,1308811795407273984,242926427,en,1308811795407273984,2020-09-23T16:53:43.000Z,"My effort to short circuit political gridlock in Congress is gaining traction because Republicans and solution-oriented Democrats know that small business relief should not be a partisan issue. 

My full House Floor remarks ⬇️ https://t.co/6h7JCsvpHp",False,1308811795407273984,16,19,19,0
HerreraBeutler,Jaime Herrera Beutler,1308566456511148033,242926427,en,1308566456511148033,2020-09-23T00:38:49.000Z,"Update: a number of House Democrat members are “strongly considering” bucking Nancy Pelosi and working with me to help our nation’s small businesses.

You better believe I’ll keep the pressure going on this effort.
https://t.co/YnxrsP8IPO",False,1308566456511148033,541,153,153,69
HerreraBeutler,Jaime Herrera Beutler,1308080482580680708,242926427,en,1308080482580680708,2020-09-21T16:27:44.000Z,"Small business survival should not be a political football.

@politico is talking about my legislative move allowing Republicans to take control of the House Floor from Speaker Pelosi to extend emergency aid to small businesses in Southwest Washington &amp; throughout the country. ⬇️ https://t.co/BEfDpXtv8P",False,1308080482580680708,9,28,28,2
HerreraBeutler,Jaime Herrera Beutler,1307807519461515265,242926427,en,1307807519461515265,2020-09-20T22:23:05.000Z,"Every year I have the distinct honor of nominating a few outstanding young individuals from Southwest Washington to our nation's military academies.

My office is currently accepting applications &amp; all interested students are encouraged to apply. ➡️ https://t.co/Zn9lROu4Q3 https://t.co/0sbWUjvqSn",False,1307807519461515265,5,4,4,0
HerreraBeutler,Jaime Herrera Beutler,1307119393340563458,242926427,en,1307119393340563458,2020-09-19T00:48:43.000Z,"Justice Ruth Bader Ginsburg was a trailblazer and an inspiration to women. She served her time on the Supreme Court with distinction and honor. My thoughts and prayers are with her family, friends, and colleagues tonight.",False,1307119393340563458,3,21,21,0
HerreraBeutler,Jaime Herrera Beutler,1306944504012963844,242926427,en,1306944504012963844,2020-09-18T13:13:46.000Z,"If we’re successful in gathering the 218 Member signatures needed to circumvent Speaker Pelosi, we’ll be closer to rushing aid to small businesses who desperately need it. (4/4)",False,1306944501584474112,19,10,10,2
HerreraBeutler,Jaime Herrera Beutler,1306944503283154945,242926427,en,1306944503283154945,2020-09-18T13:13:46.000Z,Failing to extend it will mean the PPP was a bridge to nowhere because small businesses remain on the brink of survival and need assistance to keep their doors open. (3/4),False,1306944501584474112,8,4,4,0
HerreraBeutler,Jaime Herrera Beutler,1306944502523924481,242926427,en,1306944502523924481,2020-09-18T13:13:45.000Z,"The PPP has been a bridge for almost 9,500 businesses in Southwest Washington alone and millions across the nation, but it expired on August 8 – even though it has $134 billion in unspent funds. (2/4)",False,1306944501584474112,5,5,5,0
HerreraBeutler,Jaime Herrera Beutler,1306944501584474112,242926427,en,1306944501584474112,2020-09-18T13:13:45.000Z,"I’m taking the lead on employing a rarely-used legislative maneuver, called a discharge petition, to go around Speaker Pelosi’s unwillingness to make the Paycheck Protection Program a priority for Congress. (1/4)
https://t.co/zewJYIlyB4",False,1306944501584474112,150,69,69,12
HerreraBeutler,Jaime Herrera Beutler,1306710449912770560,242926427,en,1306710449912770560,2020-09-17T21:43:43.000Z,"This article about my colleague @SenJoniErnst is little more than thinly-veiled survivor blaming by a mudslinger who calls herself a journalist. 
https://t.co/NQrNP9qyO6",False,1306710449912770560,3,15,15,0
HerreraBeutler,Jaime Herrera Beutler,1306676673174269954,242926427,en,1306676673174269954,2020-09-17T19:29:30.000Z,"I have good news on a bill I'm leading in Congress (which passed the House today!) to help pregnant workers in Southwest Washington have safe and healthy pregnancies. 

Watch ⬇️ 

More info on this critical legislation: https://t.co/kJEoLVyWx1 https://t.co/nwm2nan6qY",False,1306676673174269954,4,21,21,1
HerreraBeutler,Jaime Herrera Beutler,1306421622639923200,242926427,en,1306421622639923200,2020-09-17T02:36:01.000Z,Southwest Washington businesses can’t wait while the PPP is treated like a political football. I’ve talked to several that are hanging on by a thread financially. Time for Congress to move. (2/2),False,1306421621834604545,7,9,9,0
HerreraBeutler,Jaime Herrera Beutler,1306421621834604545,242926427,en,1306421621834604545,2020-09-17T02:36:01.000Z,I’m introducing a Discharge Petition in the U.S. House to force a vote on allowing our desperate small businesses the ability to access the remaining $134 billion in the Paycheck Protection Program. More details to come shortly. (1/2) https://t.co/f0DcEiqGPs,False,1306421621834604545,88,56,56,7
HerreraBeutler,Jaime Herrera Beutler,1305898765501554689,242926427,en,1305898765501554689,2020-09-15T15:58:22.000Z,"I worked in Congress to secure this funding so Southwest Washington communities like Ridgefield can safely accommodate more jobs, offer more educational resources, &amp; keep it a wonderful place to live as it grows in the coming years. (2/2)

More info here: https://t.co/enxw4zCXOn",False,1305898764398456834,2,6,6,0
HerreraBeutler,Jaime Herrera Beutler,1305898764398456834,242926427,en,1305898764398456834,2020-09-15T15:58:22.000Z,"Ridgefield is one of our state's fastest growing cities &amp; we need infrastructure to match this growth &amp; allow more employment opportunities to come here, too. (1/2) https://t.co/3B6LhNlS3J",False,1305898764398456834,4,13,13,0
HerreraBeutler,Jaime Herrera Beutler,1305535148834910208,242926427,en,1305535148834910208,2020-09-14T15:53:29.000Z,"Whether it’s helping a veteran who’s been given the run-around by the VA, or a senior citizen who hasn’t received their Social Security check, to now ensuring folks receive their unemployment benefits – I’m here to serve and assist you.

Read more ➡️ https://t.co/26weCSI2Ka https://t.co/lOAt9e1tln",False,1305535148834910208,1,14,14,0
HerreraBeutler,Jaime Herrera Beutler,1304425497426788353,242926427,en,1304425497426788353,2020-09-11T14:24:08.000Z,"19 years have passed since the horrific terrorist attack on our country claimed thousands of innocent American lives. 
Today we honor &amp; remember those lost on Sep. 11, 2001. To the families who lost loved ones on that fateful day, our thoughts &amp; prayers are with you. #NeverForget https://t.co/u7UB2hT4hA",False,1304425497426788353,7,13,13,0
HerreraBeutler,Jaime Herrera Beutler,1304108175398973441,242926427,en,1304108175398973441,2020-09-10T17:23:12.000Z,"RT @ClarkCoWA_PH: Air quality is unhealthy across Clark County this morning. Everyone, especially sensitive groups, should limit time outdo…",False,1304108175398973441,29,0,0,0
HerreraBeutler,Jaime Herrera Beutler,1304108125750992902,242926427,en,1304108125750992902,2020-09-10T17:23:00.000Z,"Clark County residents: Information on a fire near Yale Reservoir, below, that could near Clark Co. 

Please stay tuned for information on evacuations ⬇️ https://t.co/HtkDnlVvxV",False,1304108125750992902,2,4,4,0
HerreraBeutler,Jaime Herrera Beutler,1303763056724520969,242926427,en,1303763056724520969,2020-09-09T18:31:50.000Z,"To monitor the conditions related to the ongoing fires affecting our region and state, please stay tuned to @waEMD’s page and your local county sheriff's office.",False,1303763055084474368,1,5,5,0
HerreraBeutler,Jaime Herrera Beutler,1303763055084474368,242926427,en,1303763055084474368,2020-09-09T18:31:49.000Z,To our first responders and firefighters working tirelessly to protect our communities from fires popping up in our region – thank you! We owe a debt of gratitude for your bravery and service to Southwest Washington.,False,1303763055084474368,2,10,10,0
HerreraBeutler,Jaime Herrera Beutler,1303376552068108289,242926427,en,1303376552068108289,2020-09-08T16:56:00.000Z,"With so many of our small businesses struggling in Southwest Washington, I’m making it my mission to stand up, protect, and fight for our employers, workers, and families so they can emerge from this crisis stronger than before. 
https://t.co/3rWzktQYq7",False,1303376552068108289,7,28,28,1
HerreraBeutler,Jaime Herrera Beutler,1303118964885782528,242926427,en,1303118964885782528,2020-09-07T23:52:26.000Z,"As mentors, parents, &amp; friends it’s our duty to help lead young adults on the path to living healthy lives. 

In SW WA we have several programs to help fight against youth substance use &amp; I was pleased to help secure federal funds for these vital programs.
https://t.co/nSkgtV04Kh",False,1303118964885782528,3,16,16,0
HerreraBeutler,Jaime Herrera Beutler,1303000323208949766,242926427,en,1303000323208949766,2020-09-07T16:01:00.000Z,To all of the hardworking folks in Southwest Washington who make our communities a great place to live and work – Happy Labor Day! https://t.co/yvmjBq3q2t,False,1303000323208949766,6,7,7,1
HerreraBeutler,Jaime Herrera Beutler,1301644005374009344,242926427,en,1301644005374009344,2020-09-03T22:11:28.000Z,"Creating jobs &amp; improving Southwest Washington’s infrastructure is of paramount importance, which is why I helped secure this critical grant for the Port of Woodland.

An estimated 120+ jobs &amp; $6M in private investments will be generated from this project.
https://t.co/suz7XQuZUo",False,1301644005374009344,2,21,21,1
HerreraBeutler,Jaime Herrera Beutler,1301182259907768324,242926427,en,1301182259907768324,2020-09-02T15:36:40.000Z,I’m going to keep pushing our congressional leaders to come to the negotiating table so we can deliver common-sense relief that will positively impact communities throughout Southwest Washington.,False,1301182258985021442,0,12,12,0
HerreraBeutler,Jaime Herrera Beutler,1301182258985021442,242926427,en,1301182258985021442,2020-09-02T15:36:39.000Z,It’s unacceptable that Congress has not stepped up to the plate to extend vital job saving programs – like the Paycheck Protection Program – to help our employers keep workers paid so they can continue to provide for their families. https://t.co/yaD5hX1Myq,False,1301182258985021442,14,26,26,5
HerreraBeutler,Jaime Herrera Beutler,1300915929946165249,242926427,en,1300915929946165249,2020-09-01T21:58:22.000Z,"RT @PNWaterways: It was a great pleasure to join yesterday with @RonWyden , @HerreraBeutler , @RepBonamici, and our partners at @PortlandCo…",False,1300915929946165249,1,0,0,0
HerreraBeutler,Jaime Herrera Beutler,1300834866880221184,242926427,en,1300834866880221184,2020-09-01T16:36:15.000Z,"It was great to see first-hand the progress the @PortlandCorps has made in rehabilitating our jetties, and to officially kick-off the work on the South Jetty rehabilitation project! https://t.co/u9PbolO8k4",False,1300834858986545152,0,4,4,0
HerreraBeutler,Jaime Herrera Beutler,1300834858986545152,242926427,en,1300834858986545152,2020-09-01T16:36:13.000Z,Jetties on the mouth of the Columbia River are vital in protecting against storms &amp; preventing erosion &amp; buildup of sediment that impacts the livelihoods of our ports and coastal communities — which is why I’ve worked in Congress to secure funding to shore up our jetties. https://t.co/3ec80tBTtF,False,1300834858986545152,2,8,8,0
HerreraBeutler,Jaime Herrera Beutler,1300613285180514307,242926427,en,1300613285180514307,2020-09-01T01:55:46.000Z,"Please restore order and support peaceful demonstrations. Absent order, no protest can be heard, much less bring needed change.",False,1300613282231877633,1,21,21,1
HerreraBeutler,Jaime Herrera Beutler,1300613283867758595,242926427,en,1300613283867758595,2020-09-01T01:55:45.000Z,"It's clear to anyone of any political leaning that Portland's elected leadership has failed its citizens. 

To the mayor and to the governor, I add my voice to that of those from all political stripes when I say, enough is enough.",False,1300613282231877633,2,11,11,0
HerreraBeutler,Jaime Herrera Beutler,1300613282231877633,242926427,en,1300613282231877633,2020-09-01T01:55:45.000Z,"Some of the most progressive groups in Portland, including the Democratic Socialists of America &amp; the Portland Resistance, are calling for the mayor to resign because of the violence in the streets of that city.",False,1300613282231877633,4,23,23,2
HerreraBeutler,Jaime Herrera Beutler,1299400248561893376,242926427,en,1299400248561893376,2020-08-28T17:35:35.000Z,"I’m joining several lawmakers from our region calling on the Oregon Gov. &amp; OED to respond &amp; make Southwest Washington residents a priority. 

If you haven't received your unemployment benefits, please give me a call at (360) 695-6292 or send me a message: https://t.co/ptFZCYH3aE",False,1299400247668600834,0,5,5,0
HerreraBeutler,Jaime Herrera Beutler,1299400247668600834,242926427,en,1299400247668600834,2020-08-28T17:35:35.000Z,"It’s unacceptable that Southwest Washington residents who work in Oregon haven’t been able to secure their benefits – or even receive a simple response – from the Oregon Employment Department. 
https://t.co/u8AudncWTv",False,1299400247668600834,4,6,6,1
HerreraBeutler,Jaime Herrera Beutler,1299098925559885831,242926427,en,1299098925559885831,2020-08-27T21:38:14.000Z,"I was honored to play a role in this expansion when my bill was signed into law to repeal an antiquated 1834 ban on distilling alcohol on tribal lands. 

This simply put tribal members on equal footing to pursue these same business opportunities as everyone else. https://t.co/d7kLTc3XcR",False,1299098917083254786,0,1,1,0
HerreraBeutler,Jaime Herrera Beutler,1299098917083254786,242926427,en,1299098917083254786,2020-08-27T21:38:12.000Z,"It was great to visit the Chehalis Tribe’s new Talking Cedar Distillery today! 

They recently opened their doors to the public, which ushered in 70+ new jobs for our region. https://t.co/NFRV7DJW00",False,1299098917083254786,4,14,14,0
HerreraBeutler,Jaime Herrera Beutler,1298669739024306176,242926427,en,1298669739024306176,2020-08-26T17:12:48.000Z,"If you haven’t received your unemployment benefits, or you're having trouble connecting with OED or Washington’s Employment Security Department, please contact me. 

You can give me a call at (360) 695-6292 or send me a message at https://t.co/ptFZCYH3aE",False,1298669730740527108,2,1,1,0
HerreraBeutler,Jaime Herrera Beutler,1298669737430462467,242926427,en,1298669737430462467,2020-08-26T17:12:48.000Z,"This is why I joined a bipartisan group of lawmakers from our region, formally calling on Oregon Governor Kate Brown and the OED to improve unemployment assistance for Southwest Washington residents. 

Read our letter ⬇️ https://t.co/17DJNJ9DRe",False,1298669730740527108,4,2,2,0
HerreraBeutler,Jaime Herrera Beutler,1298669730740527108,242926427,en,1298669730740527108,2020-08-26T17:12:46.000Z,"Southwest Washington residents who work in Oregon and pay Oregon taxes should receive timely responses and their unemployment benefits from the Oregon Employment Department (OED).

Unfortunately, too many residents here have gone weeks or months without a response from OED.",False,1298669730740527108,5,9,9,0
HerreraBeutler,Jaime Herrera Beutler,1298278985596624897,242926427,en,1298278985596624897,2020-08-25T15:20:05.000Z,I'm committed to helping our businesses get through this challenging time &amp; then empowering them to succeed when they emerge from this crisis.,False,1298278984107667456,0,4,4,0
HerreraBeutler,Jaime Herrera Beutler,1298278984107667456,242926427,en,1298278984107667456,2020-08-25T15:20:05.000Z,"It's an honor to be named a ""Guardian of Small Business"" once again, especially as businesses across Southwest Washington need as many guardians in Congress as they can get to help keep their doors open &amp; workers employed. https://t.co/SV1Q8GrWUt",False,1298278984107667456,4,19,19,2
HerreraBeutler,Jaime Herrera Beutler,1297302963350917122,242926427,en,1297302963350917122,2020-08-22T22:41:43.000Z,"The U.S. House should stay in D.C. until we pass legislation to extend the Paycheck Protection Program &amp; address expired unemployment benefits that ran out weeks ago. 

I was pleased to vote to shore up the post office today, but we have other urgent needs. 

My full comments ⬇️ https://t.co/kQbuYVgqTp",False,1297302963350917122,25,48,48,9
HerreraBeutler,Jaime Herrera Beutler,1296880795521560576,242926427,en,1296880795521560576,2020-08-21T18:44:11.000Z,"I’m pleased my sea lion bill – passed through Congress and signed into law in 2018 – is now officially being implemented. 

This is going to help save our endangered, precious native salmon and steelhead runs in the Columbia River. https://t.co/N4ZGWTgytU",False,1296880795521560576,6,20,20,1
HerreraBeutler,Jaime Herrera Beutler,1296572401648574465,242926427,en,1296572401648574465,2020-08-20T22:18:44.000Z,"With the success of the PPP – over 95,000 jobs preserved so far in our region – we must continue to bolster this program so our Main Street businesses can retain their employees, and pay workers so they can continue to put food on their tables. (2/2) https://t.co/91l9EGcc9K",False,1296572400948125696,11,26,26,1
HerreraBeutler,Jaime Herrera Beutler,1296572400948125696,242926427,en,1296572400948125696,2020-08-20T22:18:44.000Z,Today I’m calling on congressional leaders to immediately reconvene the House to pass legislation to extend the Paycheck Protection Program in order to provide assistance to small businesses to keep residents employed. (1/2),False,1296572400948125696,26,29,29,4
HerreraBeutler,Jaime Herrera Beutler,1296140106861096961,242926427,zxx,1296140106861096961,2020-08-19T17:40:57.000Z,https://t.co/4cFAnOlwgY https://t.co/CtJa8g503V,False,1296140106861096961,2,5,5,0
HerreraBeutler,Jaime Herrera Beutler,1295765048506318848,242926427,en,1295765048506318848,2020-08-18T16:50:36.000Z,Celebrating the 100 year anniversary of the ratification of the #19thAmendment – forever enshrining women’s right to vote. https://t.co/DamnTRMYav,False,1295765048506318848,39,32,32,5
HerreraBeutler,Jaime Herrera Beutler,1295503531299016704,242926427,en,1295503531299016704,2020-08-17T23:31:25.000Z,"I’ve supported efforts to strengthen the USPS in Congress, such as advocating for six-day delivery and providing USPS with emergency resources to operate during COVID-19 – and folks here don’t want to see those efforts undermined. (2/2) https://t.co/HBCJKClYR7",False,1295503530002984970,3,3,3,3
HerreraBeutler,Jaime Herrera Beutler,1295503530002984970,242926427,en,1295503530002984970,2020-08-17T23:31:25.000Z,"I’ve formally called on the U.S. Postal Service to immediately address mail delays affecting so many Southwest Washington residents, particularly those in rural areas and seniors who need their prescriptions. (1/2)",False,1295503530002984970,7,34,34,4
HerreraBeutler,Jaime Herrera Beutler,1294430195345231872,242926427,en,1294430195345231872,2020-08-15T00:26:22.000Z,"I have some great news in the fight to save our endangered salmon in the Columbia River from sea lion predation! 

Watch ⬇️

Read more here: https://t.co/pEPN2paLOM https://t.co/9IjMtFQ6Bi",False,1294430195345231872,6,52,52,3
HerreraBeutler,Jaime Herrera Beutler,1294308302206140417,242926427,en,1294308302206140417,2020-08-14T16:22:00.000Z,"The historic pact between Israel &amp; the UAE to normalize diplomatic relations is a significant step toward peace, stability, and prosperity in the Middle East. I’m encouraged this agreement will lead to a brighter &amp; more secure future for the people of Israel &amp; the entire region.",False,1294308302206140417,8,33,33,0
HerreraBeutler,Jaime Herrera Beutler,1293328486980104193,242926427,en,1293328486980104193,2020-08-11T23:28:34.000Z,"Now more than ever, it’s important we invest in child care to support our families, children, and child care workers across the country &amp; in Southwest Washington. 

Watch my recent interview w/@CBSNews on my work in Congress to support working families. ⬇️ https://t.co/kSLytYbxH2",False,1293328486980104193,3,16,16,1
HerreraBeutler,Jaime Herrera Beutler,1292931926572109824,242926427,en,1292931926572109824,2020-08-10T21:12:47.000Z,"I’ll continue working in Congress to protect and improve the Columbia River’s infrastructure so our ports, shippers, and tugboat operators can more efficiently support our region’s economy.",False,1292931925515161607,0,9,9,0
