handle,name,tweet_id,author_id,lang,replied_to,created_at,tweet_text,possibly_sensitive,conversation_id,retweet_count,reply_count,like_count,quote_count
HerreraBeutler,Jaime Herrera Beutler,938086019177615362,242926427,en,938086019177615362,2017-12-05T16:41:50.000Z,I’ll keep advocating for children in SW WA and across the country to have access to quality health care. Thank you to Children's National for the excellent care you provide to our kids! It was an honor to speak with you last night. https://t.co/Hpb7qNdU4O,False,938086019177615362,4,45,45,1
HerreraBeutler,Jaime Herrera Beutler,936697211051798528,242926427,en,936697211051798528,2017-12-01T20:43:12.000Z,Southwest Washington's Regional Transportation Committee needs to weigh in on Oregon’s tolling plan at their committee meeting next week. You can read the letter I sent them here: https://t.co/4nzzU2YsYA,False,936697211051798528,2,24,24,1
HerreraBeutler,Jaime Herrera Beutler,935638311342919680,242926427,en,935638311342919680,2017-11-28T22:35:31.000Z,"We must address the mental health crisis our nation is facing. Today, I joined my colleagues in sending a letter urging the Administration to fund mental health and substance use programs: https://t.co/G3BvcJJheL",False,935638311342919680,2,30,30,3
HerreraBeutler,Jaime Herrera Beutler,933029586870423558,242926427,en,933029586870423558,2017-11-21T17:49:23.000Z,The future of salmon and steelhead depends on us being able to reduce the ever-increasing sea lion population: https://t.co/cDxrVJidYc,False,933029586870423558,2,26,26,1
HerreraBeutler,Jaime Herrera Beutler,932772157742047232,242926427,und,932772157742047232,2017-11-21T00:46:27.000Z,Yep. https://t.co/NJwIsdLpCq,False,932772157742047232,1,6,6,0
HerreraBeutler,Jaime Herrera Beutler,932679249672187913,242926427,en,932679249672187913,2017-11-20T18:37:16.000Z,"Also, a big thank you to @DrPhilRoe for spending time listening to our local vets share their concerns &amp; for all your hard work on behalf of our nations’ heroes. It was a privilege to host you in Southwest Washington! https://t.co/eRmHjNa1Fu",False,932679249672187913,3,7,7,2
HerreraBeutler,Jaime Herrera Beutler,932679109574057984,242926427,en,932679109574057984,2017-11-20T18:36:42.000Z,Thank you to the veterans who shared their challenges w/ the VA at our roundtable Sat. morn in Vancouver. I heard some great suggestions &amp; I took lots of notes on how I can continue to advocate for quality health care for all SW WA veterans. https://t.co/fmWAOLqeiO,False,932679109574057984,2,8,8,0
HerreraBeutler,Jaime Herrera Beutler,932666967265370112,242926427,en,932666967265370112,2017-11-20T17:48:27.000Z,"Due to the short, holiday week, we will not have mobile office hours in Lewis County tomorrow, Tuesday, Nov. 21. If you need assistance, please call our Vancouver office at 360-695-6292.",False,932666967265370112,0,10,10,0
HerreraBeutler,Jaime Herrera Beutler,931616962416869381,242926427,en,931616962416869381,2017-11-17T20:16:07.000Z,Oregon has confirmed that its I-5 and I-205 tolling advisory committee has “no statutory authority” over Oregon’s actual decision making on whether or how to toll those bridges. Read their response to my questions here: https://t.co/ADbeVDn9iZ,False,931616962416869381,2,13,13,0
HerreraBeutler,Jaime Herrera Beutler,931247174922461185,242926427,en,931247174922461185,2017-11-16T19:46:42.000Z,"I proudly voted today to help middle-income Southwest Washington families keep almost $2,000 more of their money instead of paying it in taxes &amp; to boost their paychecks by $2,672 each year. To read more about my support of #TaxCutsAndJobsAct click here: https://t.co/FoMfqffhEM",False,931247174922461185,4,140,140,16
HerreraBeutler,Jaime Herrera Beutler,930936730483675137,242926427,en,930936730483675137,2017-11-15T23:13:07.000Z,"The U.S. House’s #TaxCutsAndJobsAct is a good deal for Southwest Washington taxpayers, and I will support it. A family of 4 in SW WA making a median salary of $83,874 will get to keep $1,929 more. Read my full statement here: https://t.co/n8FZYidVzv",False,930936730483675137,5,141,141,16
HerreraBeutler,Jaime Herrera Beutler,930593714266886144,242926427,en,930593714266886144,2017-11-15T00:30:05.000Z,"Did you know OR scheduled its I-5, I-205 bridge tolling advisory committee mtg. Mon, 11/20 @ 8:30am? Read about my push to understand what it can (and can't) do, and how SW WA residents are being informed: https://t.co/Pt5PEcHFb8",False,930593714266886144,3,11,11,1
HerreraBeutler,Jaime Herrera Beutler,930558706714103815,242926427,en,930558706714103815,2017-11-14T22:10:59.000Z,"Proud to vote for a pay raise for our military service members today, and permanently preserve giving an allowance to surviving military spouses. https://t.co/Z1YDBQZ9c5",False,930558706714103815,14,22,22,0
HerreraBeutler,Jaime Herrera Beutler,928699375957823491,242926427,en,928699375957823491,2017-11-09T19:02:40.000Z,I’m pleased to share this Veterans’ Day tribute on my website throughout the month of November honoring Southwest Washington veterans: https://t.co/2Y5uH57H3H https://t.co/X3MZaXvfDe,False,928699375957823491,3,8,8,0
HerreraBeutler,Jaime Herrera Beutler,926203841766481920,242926427,en,926203841766481920,2017-11-02T21:46:18.000Z,I applaud the Trump Admin. for providing much-needed relief for the U.S. softwood lumber industry. Read more here: https://t.co/VQW0lUev2A,False,926203841766481920,6,30,30,0
HerreraBeutler,Jaime Herrera Beutler,925852171966517250,242926427,en,925852171966517250,2017-11-01T22:28:53.000Z,"Pleased to help advance a much-needed, bipartisan bill to reform our forest management. My full statement is here: https://t.co/Zn7vCfYddY",False,925852171966517250,1,12,12,0
HerreraBeutler,Jaime Herrera Beutler,925087471687340032,242926427,en,925087471687340032,2017-10-30T19:50:15.000Z,Honored to receive an award from Society for Maternal-Fetal Medicine for efforts to improve life for moms and babies. @MySMFM https://t.co/iixv5QbIbP,False,925087471687340032,5,11,11,1
HerreraBeutler,Jaime Herrera Beutler,925057075289509889,242926427,en,925057075289509889,2017-10-30T17:49:28.000Z,“Oregon’s tolling plans adds barriers to easing bridge congestion” Great read by @ElizabethHovde in wkd's @Oregonian https://t.co/BQSWJzNCOf,False,925057075289509889,0,6,6,0
HerreraBeutler,Jaime Herrera Beutler,923255196909821952,242926427,en,923255196909821952,2017-10-25T18:29:26.000Z,"Powerful testimony in this morning's Labor, HHS subcommittee on advocating for Down syndrome medical research: https://t.co/fhoqnOd9ZW",False,923255196909821952,0,12,12,0
HerreraBeutler,Jaime Herrera Beutler,922944809555451904,242926427,en,922944809555451904,2017-10-24T21:56:04.000Z,Loved being w/ you all this AM for @AST_info's #TransplantPatientSummit. Keep up the good work in advocating for organ donors #Power2Save https://t.co/aHtNjLpyca,False,922944809555451904,5,3,3,0
HerreraBeutler,Jaime Herrera Beutler,922884850398453761,242926427,en,922884850398453761,2017-10-24T17:57:49.000Z,Honored to introduce @fredhutch's Dr. Gary Gilliland at today’s House Approps. hearing. Talked about imp. of funding for cancer research. https://t.co/AqByLVSULt,False,922884850398453761,5,2,2,0
HerreraBeutler,Jaime Herrera Beutler,922574984932986880,242926427,en,922574984932986880,2017-10-23T21:26:31.000Z,Safe disposal of prescription drugs = safe kids. Nati. Prescription Drug Take Back Day is this Sat. from 10am–2pm https://t.co/Pd6kQZWS3U,False,922574984932986880,2,10,10,0
HerreraBeutler,Jaime Herrera Beutler,921159416048648197,242926427,en,921159416048648197,2017-10-19T23:41:33.000Z,Cowlitz Co. put on another successful Veterans Stand Down this year! So great to see veterans supported &amp; receive free services. https://t.co/dNMgoBwqwB,False,921159416048648197,4,6,6,0
HerreraBeutler,Jaime Herrera Beutler,920717512844742667,242926427,en,920717512844742667,2017-10-18T18:25:35.000Z,"Thank you, Southwest Washington wildland fire strike team, for joining the efforts to battle the CA wildfires. https://t.co/lLQK8TD9em",False,920717512844742667,6,1,1,0
HerreraBeutler,Jaime Herrera Beutler,920706531951349760,242926427,en,920706531951349760,2017-10-18T17:41:57.000Z,Keeping a close eye on the large fire burning @ Underwood Fruit &amp; Warehouse Co. Praying for minimal loss &amp; safety for all in Klickitat Co.,False,920706531951349760,0,2,2,0
HerreraBeutler,Jaime Herrera Beutler,920432370175619073,242926427,en,920432370175619073,2017-10-17T23:32:32.000Z,What an awesome day hearing two dozen SW WA veterans tell their stories to be preserved @ the Library of Congress #VeteransHistoryProject https://t.co/TXidbXUYO7,False,920432370175619073,6,7,7,0
HerreraBeutler,Jaime Herrera Beutler,918628445130838017,242926427,en,918628445130838017,2017-10-13T00:04:23.000Z,My statement on the President's executive order on Association Health Plans is here (updated link): https://t.co/YUNRxenQZz,False,918628445130838017,3,19,19,0
HerreraBeutler,Jaime Herrera Beutler,915587084022317057,242926427,en,915587084022317057,2017-10-04T14:39:06.000Z,"I’m adding a second veterans history event in Lewis County on Oct. 16. For more info &amp; to sign up, visit https://t.co/9Pt8vHSMRp",False,915587084022317057,4,13,13,0
HerreraBeutler,Jaime Herrera Beutler,915296797228175360,242926427,en,915296797228175360,2017-10-03T19:25:36.000Z,Urging @SenatorCantwell &amp; @PattyMurray to uphold my prohibition on OR's tolling scheme: https://t.co/BZXhQsQ7mt,False,915296797228175360,5,6,6,2
HerreraBeutler,Jaime Herrera Beutler,915266710663581696,242926427,en,915266710663581696,2017-10-03T17:26:03.000Z,This @nwcouncil article highlights the science-based need for my bill to protect endangered salmon from extinction: https://t.co/TMiW6GfTVf,False,915266710663581696,2,6,6,2
HerreraBeutler,Jaime Herrera Beutler,914894489399054336,242926427,en,914894489399054336,2017-10-02T16:46:58.000Z,4/4 … are wounded. May God be close to the brokenhearted.,False,914894489399054336,0,20,20,1
HerreraBeutler,Jaime Herrera Beutler,914894421887475714,242926427,en,914894421887475714,2017-10-02T16:46:42.000Z,"3/4 … courage of the first responders on the scene, I am praying for strength for the families of the victims and healing for those who…",False,914894421887475714,0,6,6,1
HerreraBeutler,Jaime Herrera Beutler,914894357743980544,242926427,en,914894357743980544,2017-10-02T16:46:27.000Z,2/4 ...resulted in the devastating loss of innocent lives and has left so many with questions that can’t be answered. I commend the…,False,914894357743980544,1,4,4,1
HerreraBeutler,Jaime Herrera Beutler,914894286025576448,242926427,en,914894286025576448,2017-10-02T16:46:10.000Z,1/4 What a heartbreaking day for our country. I am grieving with those in Las Vegas in the wake of this senseless act of evil that has…,False,914894286025576448,6,45,45,6
HerreraBeutler,Jaime Herrera Beutler,913025954578157571,242926427,en,913025954578157571,2017-09-27T13:02:05.000Z,Honored to be one of 15 U.S. Representatives to receive @NTU Taxpayers’ Friend Award for consistently voting to protect SW WA taxpayers. https://t.co/xUaBufYsES,False,913025954578157571,5,15,15,0
HerreraBeutler,Jaime Herrera Beutler,912786767748698112,242926427,en,912786767748698112,2017-09-26T21:11:38.000Z,"RT @NTU: Congratulations @HerreraBeutler on your first ""Taxpayers' Friend Award!"" Thank you for all your hard work on behalf of Taxpayers!…",False,912786767748698112,1,0,0,0
HerreraBeutler,Jaime Herrera Beutler,912786488479371264,242926427,en,912786488479371264,2017-09-26T21:10:32.000Z,"2/2 Veterans, I'd love to hear your story &amp; preserve it for future generations. To RSVP, visit my website: https://t.co/ljDQ4FQmPu",False,912786488479371264,3,3,3,0
HerreraBeutler,Jaime Herrera Beutler,912786339657060352,242926427,en,912786339657060352,2017-09-26T21:09:56.000Z,1/2 I’m inviting SW WA veterans to participate in a live event to record their military stories to be preserved in the Library of Congress.,False,912786339657060352,5,1,1,0
HerreraBeutler,Jaime Herrera Beutler,912426669209735168,242926427,en,912426669209735168,2017-09-25T21:20:44.000Z,It's encouraging to see the U.S. Forest Service taking steps toward forest stewardship after years of asking: https://t.co/Fj7MUR7ZnD.,False,912426669209735168,0,3,3,0
HerreraBeutler,Jaime Herrera Beutler,912345561927385088,242926427,en,912345561927385088,2017-09-25T15:58:27.000Z,Military service academy info. session Sat. Sept. 30 from 10-12 @ the Vancouver Comm. Library. For prospective candidates &amp; their families.,False,912345561927385088,4,2,2,0
HerreraBeutler,Jaime Herrera Beutler,911306923160555520,242926427,en,911306923160555520,2017-09-22T19:11:16.000Z,"Let's #BeThere for veterans in crisis. Visit https://t.co/qJvraNot8I or text 838255 to receive confidential support 24 hrs, 7 days a week.",False,911306923160555520,8,6,6,0
HerreraBeutler,Jaime Herrera Beutler,910909824203882496,242926427,en,910909824203882496,2017-09-21T16:53:20.000Z,"Met w/ 2 small businesses working to improve Rx drug safety. They bring in $15 million to our region. Great job, @ControlTek &amp; GSL Solutions https://t.co/G6eDswB5Mq",False,910909824203882496,4,7,7,1
HerreraBeutler,Jaime Herrera Beutler,910627635339898880,242926427,en,910627635339898880,2017-09-20T22:12:01.000Z,"I'm urging @SecretarySonny, US Forest Service to help w/ the funding crisis in Skamania Co. Read the letter I sent: https://t.co/bzzmAMyOJD",False,910627635339898880,7,2,2,0
HerreraBeutler,Jaime Herrera Beutler,910273239275929600,242926427,en,910273239275929600,2017-09-19T22:43:46.000Z,"Had a great time today w/ the Longview Pioneer Lions talking about preserving salmon, preventing wildfires, &amp; tolling. Thanks for having me! https://t.co/tkHCzmXlec",False,910273239275929600,4,5,5,0
HerreraBeutler,Jaime Herrera Beutler,908778809469669376,242926427,en,908778809469669376,2017-09-15T19:45:27.000Z,"We also secured $$ for salmon runs, wildfire prevention, Coast Guard disaster relief efforts, pay raise for military https://t.co/H8rTdsAVKK",False,908778809469669376,4,4,4,1
HerreraBeutler,Jaime Herrera Beutler,908777302590476288,242926427,en,908777302590476288,2017-09-15T19:39:27.000Z,Pleased many SW WA priorities were included in the House spending plan like defending commuters from being forced to pay Oregon tolls...,False,908777302590476288,3,14,14,1
HerreraBeutler,Jaime Herrera Beutler,908765716362547200,242926427,en,908765716362547200,2017-09-15T18:53:25.000Z,We passed all 12 of our critical funding bills in the U.S. House – marking a significant accomplishment for the @HouseAppropsGOP,False,908765716362547200,4,1,1,0
HerreraBeutler,Jaime Herrera Beutler,908435536813096962,242926427,en,908435536813096962,2017-09-14T21:01:24.000Z,Calling all Southwest Washington students! Congressional App Challenge is open: https://t.co/ZAtVvkHXkD @CongressionalAC #HouseOfCode #STEM,False,908435536813096962,6,7,7,0
HerreraBeutler,Jaime Herrera Beutler,908066609524346881,242926427,en,908066609524346881,2017-09-13T20:35:25.000Z,Here's a good summary of the letter nine SW WA lawmakers &amp; I sent to @GovInslee re: Oregon's tolling scheme: https://t.co/8hX9JEInfk,False,908066609524346881,3,4,4,0
HerreraBeutler,Jaime Herrera Beutler,907713492807032832,242926427,en,907713492807032832,2017-09-12T21:12:15.000Z,"I support USFS Chief Tooke’s call for passage of the Wildfire Disaster Funding Act, which I cosponsored. Our forests depend on it.",False,907713492807032832,10,9,9,1
HerreraBeutler,Jaime Herrera Beutler,907702352425209857,242926427,en,907702352425209857,2017-09-12T20:27:59.000Z,What’s the health impact of being a firefighter? Proud to cosponsor a bill the House passed that helps advocates for firefighters' health.,False,907702352425209857,4,4,4,1
HerreraBeutler,Jaime Herrera Beutler,907664649163874304,242926427,en,907664649163874304,2017-09-12T17:58:10.000Z,Just sent a letter w/ WA state legislators urging @JayInslee to take action against OR’s tolling scheme. Read more: https://t.co/5tEloUct85,False,907664649163874304,2,7,7,2
HerreraBeutler,Jaime Herrera Beutler,907295863000719360,242926427,en,907295863000719360,2017-09-11T17:32:45.000Z,Our country was forever altered 16 yrs ago. We witnessed the heart &amp; fortitude of Americans amidst terrorism &amp; loss. We will not forget. https://t.co/K6Ftvo0Px1,False,907295863000719360,7,1,1,0
HerreraBeutler,Jaime Herrera Beutler,905949684694482945,242926427,en,905949684694482945,2017-09-08T00:23:31.000Z,You can watch my opening remarks last night in support of my successful amendment prohibiting OR from unfair tolling https://t.co/4vjaxwCe6C,False,905949684694482945,2,5,5,1
HerreraBeutler,Jaime Herrera Beutler,905630733854760960,242926427,en,905630733854760960,2017-09-07T03:16:07.000Z,"US House just passed my prohibition on unfair OR toll scheme on I-5, 205. Working to protect SW WA commuters’ money! https://t.co/4osWWSQdUL",False,905630733854760960,15,11,11,3
HerreraBeutler,Jaime Herrera Beutler,905531104639279104,242926427,en,905531104639279104,2017-09-06T20:40:13.000Z,Dave Reichert has led with honor. My statement regarding the announcement of @davereichert retirement: https://t.co/JrtQhNbiAx,False,905531104639279104,0,2,2,0
HerreraBeutler,Jaime Herrera Beutler,905449658188779522,242926427,en,905449658188779522,2017-09-06T15:16:35.000Z,I’m sending out a district update this eve about the work I’m doing in SW WA. Sign up for my e-newsletter @ https://t.co/5wZKa1OeNo,False,905449658188779522,1,8,8,0
HerreraBeutler,Jaime Herrera Beutler,905156903667453953,242926427,en,905156903667453953,2017-09-05T19:53:17.000Z,"As wildfires burn in Skamania, I know folks are having to evacuate. I am praying for and standing ready to help those in harm’s way.",False,905156903667453953,3,6,6,0
HerreraBeutler,Jaime Herrera Beutler,905132103523762176,242926427,en,905132103523762176,2017-09-05T18:14:44.000Z,Read my statement on #DACA here: https://t.co/OqUmuwiMel,False,905132103523762176,5,30,30,6
HerreraBeutler,Jaime Herrera Beutler,905113804958310400,242926427,en,905113804958310400,2017-09-05T17:02:01.000Z,"Residents all across Southwest Wash. are feeling the effects of the wildfire smoke. Protect yourself, take care: https://t.co/l0qjreeBEB",False,905113804958310400,6,5,5,1
HerreraBeutler,Jaime Herrera Beutler,905113117893558272,242926427,en,905113117893558272,2017-09-05T16:59:18.000Z,Be alert: Follow Skamania Co. Sheriff’s advisories here re: wildfires in Skamania Co: https://t.co/WtwW1Q461Y,False,905113117893558272,1,1,1,0
HerreraBeutler,Jaime Herrera Beutler,903640450191556609,242926427,en,903640450191556609,2017-09-01T15:27:26.000Z,We all play a role in preventing suicide. Sept. is Suicide Prevention &amp; Awareness Month: https://t.co/K2zttQyPl5 #SuicidePrevention,False,903640450191556609,2,6,6,0
HerreraBeutler,Jaime Herrera Beutler,902919856760250368,242926427,en,902919856760250368,2017-08-30T15:44:03.000Z,How to help disaster survivors in Texas: @fema has compiled a list of trusted orgs engaged in relief efforts: https://t.co/FZmzI9OFZm,False,902919856760250368,9,1,1,0
HerreraBeutler,Jaime Herrera Beutler,902232964779692032,242926427,en,902232964779692032,2017-08-28T18:14:36.000Z,"Praying for those who have lost so much in #HurricaneHarvey &amp; thankful for all who are on the ground, courageously helping others @redcross",False,902232964779692032,1,3,3,0
HerreraBeutler,Jaime Herrera Beutler,902207388287209472,242926427,en,902207388287209472,2017-08-28T16:32:58.000Z,"Fighting to protect endangered salmon, steelhead by eliminating 1 of their biggest threats. My @thecolumbian column: https://t.co/hVyI8MLI5V",False,902207388287209472,3,4,4,0
HerreraBeutler,Jaime Herrera Beutler,901125809490071554,242926427,en,901125809490071554,2017-08-25T16:55:09.000Z,Interested in attending one of the US Military Service Academies? Apply for a congress. nomination thru my office: https://t.co/lYiHhNFWqY,False,901125809490071554,2,14,14,0
HerreraBeutler,Jaime Herrera Beutler,900134314880401408,242926427,en,900134314880401408,2017-08-22T23:15:19.000Z,Celebrating with our SW WA crab fishermen after @POTUS signed my bipartisan bill to provide a permanent solution to manage Dungeness crab.,False,900134314880401408,3,9,9,1
HerreraBeutler,Jaime Herrera Beutler,900093317932830720,242926427,en,900093317932830720,2017-08-22T20:32:24.000Z,Proud to facilitate another good jobs fair. Thank you to the dozens of employers &amp; all who came to learn about job opportunities right here. https://t.co/t70N2CB4A7,False,900093317932830720,4,7,7,0
HerreraBeutler,Jaime Herrera Beutler,897906875722866688,242926427,en,897906875722866688,2017-08-16T19:44:16.000Z,Guide to Grants Seminar today was a home run! A big thank you to all the presenters &amp; participants for making it so valuable. https://t.co/ePbYbFdJRd,False,897906875722866688,0,18,18,2
HerreraBeutler,Jaime Herrera Beutler,897557815686045696,242926427,en,897557815686045696,2017-08-15T20:37:13.000Z,"I’m offering a free Guide to Grants Seminar tom, Aug 16, 9-12 @ WSU-Vanc. Come learn from agency experts. More info: https://t.co/1sQIBUjH9s https://t.co/ZDIK0bu6Y8",False,897557815686045696,0,10,10,1
HerreraBeutler,Jaime Herrera Beutler,897530516743835650,242926427,en,897530516743835650,2017-08-15T18:48:45.000Z,Pleased by great turnout at our Job Hunting Workshop today. Here’s to SW WA folks getting better jobs soon. And Jobs Fair is next week! https://t.co/FD5Uua5crN,False,897530516743835650,1,6,6,2
HerreraBeutler,Jaime Herrera Beutler,897200570938863616,242926427,en,897200570938863616,2017-08-14T20:57:39.000Z,My annual jobs fair is in one week on 8/21! We’ve got some stellar employers showing up who are ready to hire. Info: https://t.co/zKB7oSEYKy https://t.co/Nn8P5tiKK3,False,897200570938863616,3,6,6,0
HerreraBeutler,Jaime Herrera Beutler,897158733264035840,242926427,en,897158733264035840,2017-08-14T18:11:25.000Z,Learn how to put your best foot 4ward when applying for a job! Free job hunting workshop tom Aug15 @ 9-11:30am Info: https://t.co/zKB7oSEYKy https://t.co/VWfvP22WR6,False,897158733264035840,1,9,9,1
HerreraBeutler,Jaime Herrera Beutler,895726634044489728,242926427,en,895726634044489728,2017-08-10T19:20:46.000Z,"I’ll be offering a free Guide to Grants Seminar this Wed, Aug. 16, 9-12 at WSU-Vancouver. To RSVP &amp; learn more: https://t.co/oEERx4hJL9 https://t.co/4PWUAB1Gjy",False,895726634044489728,5,10,10,0
HerreraBeutler,Jaime Herrera Beutler,895379374287007744,242926427,en,895379374287007744,2017-08-09T20:20:52.000Z,More than two dozen employers have signed up for my Jobs Fair on August 21. View the open job positions here: https://t.co/MtdSI1bfi8,False,895379374287007744,3,7,7,2
HerreraBeutler,Jaime Herrera Beutler,895376313829257216,242926427,en,895376313829257216,2017-08-09T20:08:43.000Z,Congrats to @Insitu_Inc – an employer in Bingen that is accomplishing big things – on logging your one millionth hour of unmanned flight.,False,895376313829257216,5,1,1,0
HerreraBeutler,Jaime Herrera Beutler,895026647266668544,242926427,en,895026647266668544,2017-08-08T20:59:16.000Z,I recently secured funding to better screen mothers for postpartum depression. You can read more here: https://t.co/BCJOyhd2PK,False,895026647266668544,1,7,7,0
HerreraBeutler,Jaime Herrera Beutler,895025957236617216,242926427,en,895025957236617216,2017-08-08T20:56:31.000Z,Nearly 1 out of 7 moms suffer from postpartum depression. This is a critical issue we must address: https://t.co/3ILQDsLgOW,False,895025957236617216,0,9,9,2
HerreraBeutler,Jaime Herrera Beutler,894949150399320064,242926427,en,894949150399320064,2017-08-08T15:51:19.000Z,A great editorial from the @DailyAstorian on our recent bipartisan win for Southwest Washington fishermen: https://t.co/lOwV81VVD2,False,894949150399320064,3,1,1,0
HerreraBeutler,Jaime Herrera Beutler,893559462564376576,242926427,en,893559462564376576,2017-08-04T19:49:12.000Z,I applaud the Senate for quickly passing my bill to manage Dungeness crab. Now to the President! Read more here: https://t.co/XdJdtXvxar,False,893559462564376576,3,11,11,0
HerreraBeutler,Jaime Herrera Beutler,890674810337886209,242926427,en,890674810337886209,2017-07-27T20:46:37.000Z,"Thank you to our interns - Mike, Irina and Jane, all from Vancouver - for serving our D.C. office so well this summer. Wish u all the best! https://t.co/IZaz8J3CM2",False,890674810337886209,0,1,1,1
HerreraBeutler,Jaime Herrera Beutler,890618231643291649,242926427,en,890618231643291649,2017-07-27T17:01:47.000Z,My solution for small biz health plans passed in a recent committee spending plan. Thanks @awbolympia for ur support https://t.co/FdNidpGGaL,False,890618231643291649,1,3,3,1
HerreraBeutler,Jaime Herrera Beutler,890607979438985216,242926427,en,890607979438985216,2017-07-27T16:21:03.000Z,Thank you for coming; it was great seeing you all! @NorthwestFCS https://t.co/USqvYXg5oD,False,890607979438985216,2,2,2,0
HerreraBeutler,Jaime Herrera Beutler,890282876037730305,242926427,en,890282876037730305,2017-07-26T18:49:12.000Z,Preparing our workforce for tech jobs in Southwest Washington using the apprenticeship model https://t.co/uVzwafwjlR,False,890282876037730305,5,13,13,4
HerreraBeutler,Jaime Herrera Beutler,889939882394693633,242926427,en,889939882394693633,2017-07-25T20:06:16.000Z,"Job-seekers &amp; employers: You’re invited to my 7th Annual Jobs Fair on Monday, August 21. You can read more here: https://t.co/pBaheqvQPY https://t.co/0BbqcmBjsI",False,889939882394693633,1,6,6,0
HerreraBeutler,Jaime Herrera Beutler,889914880974876675,242926427,en,889914880974876675,2017-07-25T18:26:56.000Z,My bill to keep sea lion population ⬇️ &amp; salmon numbers ⬆️ is getting one step closer. Committee markup @ 4:00pm ET: https://t.co/DkQlc7FPjH,False,889914880974876675,0,5,5,0
