handle,name,tweet_id,author_id,lang,replied_to,created_at,tweet_text,possibly_sensitive,conversation_id,retweet_count,reply_count,like_count,quote_count
HerreraBeutler,Jaime Herrera Beutler,1152315350798782466,242926427,en,1152315350798782466,2019-07-19T20:32:43.000Z,"Pleased to join my colleague @RepRoybalAllard in introducing legislation to address the growing maternity care provider shortage. Our bipartisan bill establishes two new funding streams for midwifery education. #MidwivesMakeADifference

https://t.co/Xnbws1ZfoK",False,1152315350798782466,4,6,6,0
HerreraBeutler,Jaime Herrera Beutler,1152275308445425664,242926427,en,1152275308445425664,2019-07-19T17:53:36.000Z,"Interested in learning how to write competitive grants? I’m excited to again host the Guide to Grants Seminar on August 8 – free and open to all Southwest Washington residents. You can register and learn more here: 
https://t.co/7CSfdd2EiI",False,1152275308445425664,3,7,7,1
HerreraBeutler,Jaime Herrera Beutler,1151870683728764929,242926427,en,1151870683728764929,2019-07-18T15:05:46.000Z,"The first major piece of legislation has been signed into law, but our work to save moms is far from finished. I’m working with my colleagues right now on the next bipartisan step.",False,1151870682353098752,2,8,8,0
HerreraBeutler,Jaime Herrera Beutler,1151870682353098752,242926427,en,1151870682353098752,2019-07-18T15:05:46.000Z,Thanks @dailybriefing and @DanaPerino for raising awareness on the #maternalmortality crisis that’s impacting Southwest Washington and communities across the nation. https://t.co/HKmgloSK1M,False,1151870682353098752,2,5,5,0
HerreraBeutler,Jaime Herrera Beutler,1151630480216862735,242926427,en,1151630480216862735,2019-07-17T23:11:17.000Z,Widely-bipartisan support to repeal the “Cadillac tax” – a health care tax on working families – just now in the U.S. House. Read more: https://t.co/lRVFR65vZy,False,1151630480216862735,1,10,10,1
HerreraBeutler,Jaime Herrera Beutler,1151224759037898754,242926427,en,1151224759037898754,2019-07-16T20:19:05.000Z,"As we look ahead, the possibility of future human exploration – including the first woman! – is exciting. https://t.co/FUqQ6Bh9iO",False,1150850965035204609,1,9,9,3
HerreraBeutler,Jaime Herrera Beutler,1151224495274958849,242926427,en,1151224495274958849,2019-07-16T20:18:03.000Z,"One small step for man, one giant leap for mankind. - Neil Armstrong #Apollo11 #Apollo50th https://t.co/3zrcKwEWd9",False,1150850965035204609,0,8,8,0
HerreraBeutler,Jaime Herrera Beutler,1151193157872377859,242926427,en,1151193157872377859,2019-07-16T18:13:31.000Z,Over 600 million people worldwide watched the U.S. lead the world in sending the first man to the moon. #Apollo11 #Apollo50th https://t.co/ImGjzC4E2R,False,1150850965035204609,0,3,3,0
HerreraBeutler,Jaime Herrera Beutler,1151169469500338177,242926427,en,1151169469500338177,2019-07-16T16:39:23.000Z,In 1961 President JFK announced the U.S. would put a man on the moon by the end of the decade… 8 years later #Apollo11 brought that dream to life! https://t.co/uPlR0wCKYG,False,1150850965035204609,0,4,4,0
HerreraBeutler,Jaime Herrera Beutler,1151150120366485504,242926427,en,1151150120366485504,2019-07-16T15:22:30.000Z,"The three astronauts, @TheRealBuzz, Neil Armstrong &amp; @AstroMCollins, who put the U.S. on the moon! 🌑 https://t.co/uvfLUQkp4B",False,1150850965035204609,0,1,1,0
HerreraBeutler,Jaime Herrera Beutler,1151124849219309569,242926427,en,1151124849219309569,2019-07-16T13:42:05.000Z,50 years ago the first man stepped foot on the moon as part of #Apollo11 I will be sharing some of my favorite pictures from that historic day! #Apollo50th @NASA https://t.co/nkZmWJzNY3,False,1150850965035204609,1,2,2,0
HerreraBeutler,Jaime Herrera Beutler,1150906919487451136,242926427,en,1150906919487451136,2019-07-15T23:16:07.000Z,"While I disagree on most policy matters w/ the Dem. congresswomen who were the subject of the president’s tweets this wkd, we are all Americans – as is the president. We can &amp; must defend our ideas on how to improve our country w/o descending into divisive &amp; demeaning language.",False,1150906919487451136,14,137,137,18
HerreraBeutler,Jaime Herrera Beutler,1150850965035204609,242926427,en,1150850965035204609,2019-07-15T19:33:46.000Z,"This week, we are celebrating the #Apollo50th anniversary of the U.S. sending the first man to the moon. As a member of the @housesciencegop committee, I am excited to share with you a little history tomorrow – courtesy of some awesome @NASA photos! https://t.co/ElSF0WYqOE",False,1150850965035204609,3,28,28,2
HerreraBeutler,Jaime Herrera Beutler,1150771563555381248,242926427,en,1150771563555381248,2019-07-15T14:18:15.000Z,"Congrats Thea, Natasha and Jade! Hope you had fun in D.C. It’s great to see more and more young women getting involved in expanded STEM opportunities. Let’s keep it going, girls! https://t.co/LjcVKzZqCp",False,1150771563555381248,1,9,9,1
HerreraBeutler,Jaime Herrera Beutler,1149755194076479489,242926427,en,1149755194076479489,2019-07-12T18:59:34.000Z,"RT @waEMD: Want something to do this weekend? That expensive TV In your house, if it’s not secured in an #earthquake, it’s doomed. Those un…",False,1149755194076479489,11,0,0,0
HerreraBeutler,Jaime Herrera Beutler,1149755132571242496,242926427,en,1149755132571242496,2019-07-12T18:59:19.000Z,"RT @waEMD: If you feel an #earthquake, drop, cover &amp; hold. If you’re on the coast and you feel shaking, head to high ground immediately. Do…",False,1149755132571242496,24,0,0,0
HerreraBeutler,Jaime Herrera Beutler,1149755101109727232,242926427,en,1149755101109727232,2019-07-12T18:59:12.000Z,"RT @waEMD: Remember, drop, cover &amp; Hold on is the best action to take — whether you’re outside or inside.

Practice makes perfect. https://…",False,1149755101109727232,76,0,0,0
HerreraBeutler,Jaime Herrera Beutler,1149755002455494656,242926427,en,1149755002455494656,2019-07-12T18:58:48.000Z,"RT @waEMD: Always a good reminder that an #earthquake can happen at anytime. If you’re with family, how about talking about your plans? If…",False,1149755002455494656,99,0,0,0
HerreraBeutler,Jaime Herrera Beutler,1149753799348764672,242926427,en,1149753799348764672,2019-07-12T18:54:01.000Z,.@waEMD has us covered. A good place to start is by building an emergency kit to prepare for a disaster. https://t.co/nLF7iv6meB,False,1149753798660952064,0,0,0,0
HerreraBeutler,Jaime Herrera Beutler,1149753798660952064,242926427,en,1149753798660952064,2019-07-12T18:54:01.000Z,"Thankful the 4.6 earthquake this morning north of us didn’t take lives or cause significant damage, but this is a sobering reminder for each of us to be prepared in the event of a more catastrophic event.",False,1149753798660952064,1,4,4,0
HerreraBeutler,Jaime Herrera Beutler,1148993110837534721,242926427,zxx,1148993110837534721,2019-07-10T16:31:19.000Z,https://t.co/k0zj17KcwQ,False,1148993110837534721,2,8,8,0
HerreraBeutler,Jaime Herrera Beutler,1148683848529711107,242926427,en,1148683848529711107,2019-07-09T20:02:25.000Z,".@WDFW ""Few federal actions have done more to promote stable, productive salmon &amp; steelhead fisheries in the Pacific Northwest than the adoption of the Mitchell Act of 1938 &amp; the Pacific Salmon Treaty of 1985.”

Pleased we got this critical hatchery funding approved in the House.",False,1148683848529711107,3,7,7,0
HerreraBeutler,Jaime Herrera Beutler,1148620682776981506,242926427,en,1148620682776981506,2019-07-09T15:51:25.000Z,One way to empower folks to earn more is to ensure they have the skills and training necessary to compete for available jobs. https://t.co/0gJjDANLfN,False,1148620682776981506,2,8,8,0
HerreraBeutler,Jaime Herrera Beutler,1148339587724525575,242926427,en,1148339587724525575,2019-07-08T21:14:27.000Z,"With this bill now the law of the land, we’re doing right by our incredible military service members who, though wounded in combat, continue to fight for our freedom. https://t.co/TPeKP1Z9AM",False,1148339587724525575,1,9,9,0
HerreraBeutler,Jaime Herrera Beutler,1144330428142301184,242926427,en,1144330428142301184,2019-06-27T19:43:29.000Z,Such an honor to be awarded the “Champion for Children’s Health” award for my work to get #ACEKidsAct signed into law. This is one of my proudest efforts because it shows that we can accomplish hard stuff on behalf of vulnerable kids and families. https://t.co/pgyVsqx7ac,False,1144330428142301184,1,14,14,3
HerreraBeutler,Jaime Herrera Beutler,1144304618568134656,242926427,en,1144304618568134656,2019-06-27T18:00:55.000Z,"RT @speaknowforkids: Earlier this year, Congress passed the #AceKidsAct to improve care for kids. Today, we’re proud to honor @HerreraBeutl…",False,1144304618568134656,3,0,0,0
HerreraBeutler,Jaime Herrera Beutler,1144297303190188032,242926427,en,1144297303190188032,2019-06-27T17:31:51.000Z,"Congratulations, Monica, on earning the honor of being a 2019 Presidential Scholar! We’re glad you and your parents could tour the Capitol. Have fun in DC! https://t.co/dLIo3m4Qkw https://t.co/QpgkC8F061",False,1144297303190188032,0,1,1,0
HerreraBeutler,Jaime Herrera Beutler,1143998426843176960,242926427,en,1143998426843176960,2019-06-26T21:44:14.000Z,"I’m proud to join @RepAGonzalez @RepRichmond @RepAndyLevin @RepJohnKatko @RepHorsford to expand Pell Grant eligibility to cover high-quality, short-term job training programs so more folks can gain upward mobility.",False,1143998426843176960,2,3,3,0
HerreraBeutler,Jaime Herrera Beutler,1143997841871953922,242926427,en,1143997841871953922,2019-06-26T21:41:54.000Z,"My focus has always been on making sure SW WA residents can get good-paying jobs, which means providing a path for workers to pursue better opportunities. https://t.co/UYvVPq0UaI",False,1143997841871953922,0,3,3,0
HerreraBeutler,Jaime Herrera Beutler,1143967218302160896,242926427,en,1143967218302160896,2019-06-26T19:40:13.000Z,Walking to the Capitol to vote... and crossing my fingers Isana can grab a nap. https://t.co/llDgXoR5JO,False,1143967218302160896,8,8,8,3
HerreraBeutler,Jaime Herrera Beutler,1143902844115988480,242926427,en,1143902844115988480,2019-06-26T15:24:25.000Z,"Good dive into this issue impacting many kids in SW WA and across the country. When I directed the @USGAO to conduct this report, it was a necessary first step toward what we hope will be better training, resources and ultimately, treatment of students. https://t.co/jU9AdCL2ET",False,1143902844115988480,1,5,5,0
HerreraBeutler,Jaime Herrera Beutler,1143558481347317761,242926427,en,1143558481347317761,2019-06-25T16:36:02.000Z,"Marina, your painting looks beautiful in the Capitol! Hope you and your mom enjoy your visit in DC. https://t.co/JmEJS42D0c",False,1143558481347317761,2,2,2,0
HerreraBeutler,Jaime Herrera Beutler,1143255916055281664,242926427,en,1143255916055281664,2019-06-24T20:33:45.000Z,Inspiring story and lady. I will continue to work to #ENDALZ https://t.co/43X2A1NLBi,False,1143255916055281664,3,3,3,0
HerreraBeutler,Jaime Herrera Beutler,1142118933153112064,242926427,en,1142118933153112064,2019-06-21T17:15:47.000Z,I continue to speak with residents who are struggling to balance the high cost of housing with saving for the future. Proud to help lead this bipartisan effort. https://t.co/ZZFXlKwGS0,False,1142118933153112064,0,14,14,0
HerreraBeutler,Jaime Herrera Beutler,1141769660821643264,242926427,en,1141769660821643264,2019-06-20T18:07:54.000Z,"Boosting salmon hatchery production on the Columbia River is critical. I’ll keep working to advance my bipartisan proposal that conserves our natural resources and protects jobs, as well as sports and tribal interests. https://t.co/rBBawDlHSI",False,1141769660821643264,1,8,8,0
HerreraBeutler,Jaime Herrera Beutler,1141387835649548288,242926427,en,1141387835649548288,2019-06-19T16:50:40.000Z,"At my directive, @USGAO conducted a new report on the use of seclusion &amp; restraint in schools -- clearly, there's a problem w/ the data. 

Parents also must be notified when this occurs; and educators should be provided training &amp; resources to properly care for every student. https://t.co/pnBP2KaVs2",False,1141387835649548288,5,9,9,0
HerreraBeutler,Jaime Herrera Beutler,1141066639238205440,242926427,en,1141066639238205440,2019-06-18T19:34:21.000Z,".@News_Reflector put together a good round-up of the many solutions I’ve been working on to make life better for Southwest Washington residents. 

I encourage you to read it here: https://t.co/ZYmxZz1K3P",False,1141066639238205440,2,9,9,0
HerreraBeutler,Jaime Herrera Beutler,1140754708434436098,242926427,zxx,1140754708434436098,2019-06-17T22:54:51.000Z,https://t.co/4dYV4Ozlj0,False,1140754708434436098,3,10,10,2
HerreraBeutler,Jaime Herrera Beutler,1139558014279704576,242926427,en,1139558014279704576,2019-06-14T15:39:37.000Z,"Congress should give the military the tools it needs to ensure troop readiness, and an important part of that is providing our service members with quality medical care in a timely manner while serving. Read more ⬇️

https://t.co/IAix2ouAm0",False,1139558014279704576,1,4,4,0
HerreraBeutler,Jaime Herrera Beutler,1139270063696089088,242926427,en,1139270063696089088,2019-06-13T20:35:24.000Z,@RepScottPeters and I introduced a new bill to tackle the affordable housing crisis in Southwest Washington and across the country. Read more here: https://t.co/efy0CU547c,False,1139270063029129216,0,0,0,1
HerreraBeutler,Jaime Herrera Beutler,1139270063029129216,242926427,en,1139270063029129216,2019-06-13T20:35:24.000Z,"When the majority of your monthly income goes toward paying rent or a mortgage, there is little money left over to pay bills, buy groceries and cover emergencies.",False,1139270063029129216,4,15,15,0
HerreraBeutler,Jaime Herrera Beutler,1139213519923154944,242926427,en,1139213519923154944,2019-06-13T16:50:43.000Z,"It’s an honor to assist active duty Purple Heart recipients achieve home ownership. @MOPH_HQ 

https://t.co/RVk0YxCIbN https://t.co/snuqY2tmRs",False,1139213519923154944,4,7,7,1
HerreraBeutler,Jaime Herrera Beutler,1138877988370624513,242926427,en,1138877988370624513,2019-06-12T18:37:26.000Z,"RT @MainStreetGOP: New in @Forbes⬇️

How #RMSP members like @repgregwalden and @HerreraBeutler  are tackling the hidden costs of motherhood…",False,1138877988370624513,1,0,0,0
HerreraBeutler,Jaime Herrera Beutler,1138869291544170497,242926427,en,1138869291544170497,2019-06-12T18:02:52.000Z,This bipartisan legislation promises to spark innovative solutions to this serious threat facing our coastal communities. Hopeful the Senate will pass it soon. #oceanacidification https://t.co/g3AC64yfgd https://t.co/vkxfvoE6Ej,False,1138869291544170497,1,6,6,0
HerreraBeutler,Jaime Herrera Beutler,1138502521004204032,242926427,en,1138502521004204032,2019-06-11T17:45:28.000Z,"I hope you had a great time in DC, Stevens family! To you, and all other SW WA residents, please let me know if there’s anything with which my office can assist. 

Tours in DC? Requesting a flag? Military service nomination? We’re here to help: https://t.co/lEcKq5trCj https://t.co/fiiFhuWIcQ",False,1138502521004204032,1,8,8,0
HerreraBeutler,Jaime Herrera Beutler,1136989179265658880,242926427,en,1136989179265658880,2019-06-07T13:31:59.000Z,Shellfish and fishing industry jobs in Pacific County are jeopardized by the detrimental effects of ocean acidification. I’m pleased the House passed my bipartisan bill this week – now to the U.S. Senate! https://t.co/BRAt2SfghI,False,1136989179265658880,3,8,8,0
HerreraBeutler,Jaime Herrera Beutler,1136685407943450624,242926427,en,1136685407943450624,2019-06-06T17:24:54.000Z,"“So many men died that day, so many men. I can say the number: 2,500. We won the war, but so many men died.” Today, and every day, we remember their sacrifice with tremendous gratitude. #DDay75thAnniversary https://t.co/BZj5FgjSxQ",False,1136685401186455553,1,7,7,0
HerreraBeutler,Jaime Herrera Beutler,1136685401186455553,242926427,en,1136685401186455553,2019-06-06T17:24:52.000Z,"Today marks the 75th anniversary of D-Day, a turning point in World War II. But this historic military invasion in Normandy came at a cost. 
 
During an interview for the #VeteransHistoryProject we launched a few years back, a WWII veteran from Vancouver recalled:",False,1136685401186455553,0,1,1,0
HerreraBeutler,Jaime Herrera Beutler,1136282417596178433,242926427,en,1136282417596178433,2019-06-05T14:43:34.000Z,"Now that we’re able to remove more sea lions from the Columbia River, increasing hatchery production of salmon is the next most important step to conserving our iconic fish species. https://t.co/161BGZmOhI",False,1136282417596178433,5,12,12,0
HerreraBeutler,Jaime Herrera Beutler,1134102885514567683,242926427,en,1134102885514567683,2019-05-30T14:22:53.000Z,"I’m one of a few – but growing – number of moms w/ young kids in Congress. I’ve talked to countless moms who, like me, have experienced maternal health challenges. I’m bringing these stories to the table as we seek an end to the #maternalmortality crisis. 
https://t.co/HvEMofFwOp",False,1134102885514567683,2,7,7,0
HerreraBeutler,Jaime Herrera Beutler,1133795349439680512,242926427,en,1133795349439680512,2019-05-29T18:00:50.000Z,"Ridgefield residents, &amp; all of us who live nearby, can celebrate this milestone toward making the new Community &amp; Nature Center a reality. I’m glad we could put these resources in place so that construction can begin. I can’t wait to see the final facility https://t.co/IqgT8lC6a0",False,1133795349439680512,1,5,5,0
HerreraBeutler,Jaime Herrera Beutler,1133386428765941760,242926427,en,1133386428765941760,2019-05-28T14:55:56.000Z,"It is heartbreaking to see so many veterans facing homelessness and mental health crises in SW WA. 

The VA must follow the directive set forth by Congress to expand access to lifesaving resources for the men and women who served our country. https://t.co/awuHzPReeU",False,1133386428765941760,4,6,6,0
HerreraBeutler,Jaime Herrera Beutler,1133030197161267200,242926427,qme,1133030197161267200,2019-05-27T15:20:24.000Z,#MemorialDay https://t.co/gSYFRLWCVp,False,1133030197161267200,12,24,24,1
HerreraBeutler,Jaime Herrera Beutler,1131997489375174656,242926427,en,1131997489375174656,2019-05-24T18:56:47.000Z,I hear you @allysonfelix @karagoucher @AlysiaMontano This must change. Last week I wrote to Nike with my colleague @RepRoybalAllard asking the company to spell out policies to protect athletes during pregnancy and postpartum recovery. https://t.co/B2bWqjrZNl,False,1131997489375174656,31,9,9,4
HerreraBeutler,Jaime Herrera Beutler,1131973751166382081,242926427,en,1131973751166382081,2019-05-24T17:22:27.000Z,RT @OPB: New baby in the House. https://t.co/w6DgVdCCG1,False,1131973751166382081,3,0,0,0
HerreraBeutler,Jaime Herrera Beutler,1131967332555927552,242926427,en,1131967332555927552,2019-05-24T16:56:57.000Z,"Don’t miss a single update! I send regular emails about the work I’m doing for Southwest Washington. Subscribe here: https://t.co/AhACxHXLAg and follow me on Facebook, Twitter and Instagram for the latest news. https://t.co/lJH50ePptD",False,1131967332555927552,7,184,184,5
HerreraBeutler,Jaime Herrera Beutler,1131681932570439687,242926427,en,1131681932570439687,2019-05-23T22:02:53.000Z,Dan &amp; I thank you for all your prayers &amp; support!,False,1131681931412815872,0,0,0,0
HerreraBeutler,Jaime Herrera Beutler,1131681931412815872,242926427,en,1131681931412815872,2019-05-23T22:02:52.000Z,"Our little girl, Isana Mae Beutler, was born Tuesday morning. It made me smile when I realized that Isana, which means strong-willed woman, was born on the Women’s Suffrage Centennial. We’re healthy and doing well. Abigail &amp; Ethan are over the moon. https://t.co/VqdoBalDYC",False,1131681931412815872,13,39,39,8
HerreraBeutler,Jaime Herrera Beutler,1130834326566969344,242926427,en,1130834326566969344,2019-05-21T13:54:47.000Z,"Commemorating 100 years of women’s right to vote – the largest expansion of American democracy. 

#womensvote100 #suffragents #suffragesisters https://t.co/cO5pZkIUqU",False,1130834326566969344,64,43,43,4
HerreraBeutler,Jaime Herrera Beutler,1129452297380093952,242926427,en,1129452297380093952,2019-05-17T18:23:06.000Z,The latest report confirms the crisis for working families struggling to find and afford child care for their kids. I’m working right now with my colleagues on both sides of the aisle on real solutions. https://t.co/kuHfOC4BhQ,False,1129452297380093952,7,19,19,0
HerreraBeutler,Jaime Herrera Beutler,1129374060813668353,242926427,en,1129374060813668353,2019-05-17T13:12:13.000Z,"Those who have called to breach the Snake River dams don't have the best interests of Vancouver residents in mind &amp; they do so w/o proper study or scientific basis.

I’m calling on @portvanusa to help protect our hydropower for Clark County ratepayers. https://t.co/DtCKcmNarJ",False,1129374060813668353,3,2,2,4
HerreraBeutler,Jaime Herrera Beutler,1129147065320263685,242926427,en,1129147065320263685,2019-05-16T22:10:13.000Z,"Read about it here: 
https://t.co/SfO6QS3m8x @MOPH_HQ",False,1129147064707932161,1,3,3,0
HerreraBeutler,Jaime Herrera Beutler,1129147064707932161,242926427,en,1129147064707932161,2019-05-16T22:10:13.000Z,"Passed the House! Combat wounded veterans who choose to continue serving in the U.S. military are among our nation’s bravest &amp; best.

My bill recognizes their sacrifice &amp; assists them by waiving a fee that could inhibit some from being able to achieve the dream of home ownership.",False,1129147064707932161,0,2,2,0
HerreraBeutler,Jaime Herrera Beutler,1129052743317053440,242926427,en,1129052743317053440,2019-05-16T15:55:25.000Z,"Testifying this morning @WaysMeansCmte hearing on the tragic reality of #maternalmortality in the U.S. Right here in our own communities, mothers are dying, and we’re taking action to save them. https://t.co/RhHZ4McYA5",False,1129052743317053440,3,10,10,2
HerreraBeutler,Jaime Herrera Beutler,1128304857667067905,242926427,en,1128304857667067905,2019-05-14T14:23:35.000Z,"We must continue protecting the youngest, and often the most vulnerable, members of our society. https://t.co/hokU5vrbEb",False,1128304857667067905,3,3,3,0
HerreraBeutler,Jaime Herrera Beutler,1127974374550724608,242926427,en,1127974374550724608,2019-05-13T16:30:22.000Z,"Congratulations to our Congressional Art Competition winner, Marina Mamaeva-Wooden of Vancouver! Her stunning “Kindred” will hang in @visitthecapitol for visitors to admire. You can also view the second and third place winners’ art here: https://t.co/F1PbEtxb3e https://t.co/zRz4QGVhiq",False,1127974374550724608,2,1,1,0
HerreraBeutler,Jaime Herrera Beutler,1127684988131008512,242926427,en,1127684988131008512,2019-05-12T21:20:27.000Z,"America should be a safe, welcoming place for every woman to have a baby. It’s well past time we advocate for the women across our country who choose one of the highest callings: motherhood. https://t.co/rJH1D9vT1Z",False,1127684988131008512,3,11,11,0
HerreraBeutler,Jaime Herrera Beutler,1126828849218637825,242926427,en,1126828849218637825,2019-05-10T12:38:27.000Z,We can't fail these kids. #ACEKidsAct https://t.co/1evTP5kny9,False,1126828849218637825,5,13,13,1
HerreraBeutler,Jaime Herrera Beutler,1126520727937613830,242926427,en,1126520727937613830,2019-05-09T16:14:05.000Z,"In an era where so many solutions get caught in partisan gridlock, this is proof lawmakers from both sides of the aisle can work to improve health care for some of our most vulnerable. #ACEKidsAct

Read my latest in @seattletimes @SeaTimesOpinion 

https://t.co/rIwhEoYuzW",False,1126520727937613830,2,2,2,0
HerreraBeutler,Jaime Herrera Beutler,1126160010189389824,242926427,en,1126160010189389824,2019-05-08T16:20:44.000Z,"...expanded mental health telemedicine, and other critical resources for those in crisis. #MentalHealthAwarenessMonth #MentalHealthAwareness https://t.co/ACnee63XFq",False,1126160009472151553,2,2,2,0
HerreraBeutler,Jaime Herrera Beutler,1126160009472151553,242926427,en,1126160009472151553,2019-05-08T16:20:43.000Z,"From children and teens, to postpartum moms and retirees – we must care for those struggling with mental health conditions. 

From my role on @HouseAppropsGOP I’m working to ensure funding continues for pediatric mental health grants, the suicide lifeline, school counselors...",False,1126160009472151553,3,9,9,0
HerreraBeutler,Jaime Herrera Beutler,1125901509957443585,242926427,en,1125901509957443585,2019-05-07T23:13:32.000Z,"You either are a mom, or you’ve got a mom. https://t.co/tmD0OwAGsD",False,1125901509957443585,0,6,6,0
HerreraBeutler,Jaime Herrera Beutler,1125897667182305280,242926427,en,1125897667182305280,2019-05-07T22:58:16.000Z,"Such an honor to be recognized tonight by @mom_congress for my work to prevent maternal deaths. It’s staggering this is necessary in 21st Century America!

Proud to partner with many other ordinary women, citizens &amp; organizations as we fight to save moms’ lives. #MomCongress2019 https://t.co/wx7jZEKkty",False,1125897667182305280,1,2,2,2
HerreraBeutler,Jaime Herrera Beutler,1125810108129267713,242926427,en,1125810108129267713,2019-05-07T17:10:20.000Z,I’m proud to join this bipartisan effort to ensure that comprehensive newborn screening programs continue and are improved to protect more babies. https://t.co/3TXs03Jzs5,False,1125810108129267713,1,1,1,0
HerreraBeutler,Jaime Herrera Beutler,1125473747748708354,242926427,en,1125473747748708354,2019-05-06T18:53:46.000Z,"Weekly newspapers provide critical coverage and service in a district like Southwest Washington with large swaths of rural communities. It was great to stop by and chat with Philip, editor of @SkamaniaPioneer https://t.co/iAfaIWoQI2",False,1125473747748708354,1,2,2,2
