handle,name,tweet_id,author_id,lang,replied_to,created_at,tweet_text,possibly_sensitive,conversation_id,retweet_count,reply_count,like_count,quote_count
MarshaBlackburn,Sen. Marsha Blackburn,1534335960959401986,278145569,en,1534335960959401986,2022-06-08T00:46:14.000Z,"Biden’s welcome package for the new caravan marching toward our border includes a free phone, a free plane ticket, and free baby formula. https://t.co/THzNKG9mmS",False,1534335960959401986,2136,1763,1763,288
MarshaBlackburn,Sen. Marsha Blackburn,1534312356540456961,278145569,en,1534312356540456961,2022-06-07T23:12:26.000Z,A good case for the DHS disinformation board. @USMinistryTruth https://t.co/eq17JxQdGx,False,1534312356540456961,359,518,518,61
MarshaBlackburn,Sen. Marsha Blackburn,1534296462821056512,278145569,en,1534296462821056512,2022-06-07T22:09:17.000Z,"The Biden welcome package for the migrant caravan:

❌ Amnesty

❌ Free phone

❌ Free baby formula 

❌ Free plane ticket",False,1534296462821056512,750,617,617,77
MarshaBlackburn,Sen. Marsha Blackburn,1534232949519949824,278145569,en,1534232949519949824,2022-06-07T17:56:54.000Z,How will this lower the price of gas @JoeBiden? https://t.co/awlIa1TPwy,False,1534232949519949824,182,417,417,33
MarshaBlackburn,Sen. Marsha Blackburn,1534189609047007233,278145569,en,1534189609047007233,2022-06-07T15:04:41.000Z,"$1.9 trillion for a liberal wish list is a cause of record-high inflation.

Not Putin.",False,1534189609047007233,2285,1955,1955,175
MarshaBlackburn,Sen. Marsha Blackburn,1534166182982467591,278145569,en,1534166182982467591,2022-06-07T13:31:36.000Z,"Tennessee students are changing the world as we know it with their discoveries. Amazing work! 
@tennesseetech https://t.co/24gjP1PVp4",False,1534166182982467591,24,79,79,9
MarshaBlackburn,Sen. Marsha Blackburn,1534148423036854272,278145569,en,1534148423036854272,2022-06-07T12:21:01.000Z,"Biden’s State Department has added “we do not support Taiwan independence” back to their website.

Care to explain, @StateDept?",False,1534148423036854272,1460,504,504,119
MarshaBlackburn,Sen. Marsha Blackburn,1533991663823204352,278145569,en,1533991663823204352,2022-06-07T01:58:07.000Z,"What could be the largest caravan ever is heading toward our southern border, claiming Joe Biden promised them asylum. 

This is a nightmare. @POTUS needs to get out in front of this and tell them to turn around immediately.",False,1533991663823204352,1567,1398,1398,195
MarshaBlackburn,Sen. Marsha Blackburn,1533969663373332480,278145569,en,1533969663373332480,2022-06-07T00:30:42.000Z,"The Biden administration has been playing the inflation blame game for a while, but Americans aren’t buying it. https://t.co/33kQBrtMnv",False,1533969663373332480,637,384,384,44
MarshaBlackburn,Sen. Marsha Blackburn,1533969288855314432,278145569,en,1533969288855314432,2022-06-07T00:29:12.000Z,"@RepJohnRose Thank you, @RepJohnRose!",False,1533964761116844036,1,8,8,0
MarshaBlackburn,Sen. Marsha Blackburn,1533949987813466115,278145569,en,1533949987813466115,2022-06-06T23:12:31.000Z,"Hey, @UTKnoxville. I heard a professor needs help defining the word ‘woman.’

I’d be happy to help you out. https://t.co/KX1gvr5OGT https://t.co/3CqgPpdDAL",False,1533949987813466115,97,304,304,36
MarshaBlackburn,Sen. Marsha Blackburn,1533927412450328576,278145569,en,1533927412450328576,2022-06-06T21:42:48.000Z,No surprise that the radical left is attacking Justice Amy Coney Barrett for being a devout Catholic.,False,1533927412450328576,1067,1977,1977,170
MarshaBlackburn,Sen. Marsha Blackburn,1533901824180092929,278145569,en,1533901824180092929,2022-06-06T20:01:08.000Z,"Thank you to our Border Patrol officers for helping to keep our communities safe every single day. 

This is why we must secure the southern border now to stop drugs like this from being pushed across and endangering American lives. https://t.co/HYz9bwZMFd",False,1533901824180092929,92,187,187,11
MarshaBlackburn,Sen. Marsha Blackburn,1533891675562573824,278145569,en,1533891675562573824,2022-06-06T19:20:48.000Z,RT @Kredo0: JUST IN: Chinese Surveillance Giant Arming Iran With Advanced Spy Tech Amid Crackdown on Protestors -- Sen. @MarshaBlackburn an…,False,1533891675562573824,171,0,0,0
MarshaBlackburn,Sen. Marsha Blackburn,1533882846544384000,278145569,en,1533882846544384000,2022-06-06T18:45:43.000Z,"@SenatorHagerty Thank you, @SenatorHagerty!",False,1533865052037648385,2,28,28,0
MarshaBlackburn,Sen. Marsha Blackburn,1533880479732187137,278145569,en,1533880479732187137,2022-06-06T18:36:19.000Z,Teachers' unions wanted to keep our children masked and our schools closed — and the Biden administration listened. https://t.co/3RgaRWmS2z,False,1533880479732187137,203,250,250,25
MarshaBlackburn,Sen. Marsha Blackburn,1533855302122184704,278145569,en,1533855302122184704,2022-06-06T16:56:16.000Z,"Just like any other crisis, the Biden administration wants to pretend the border crisis isn’t worsening by the day.

@FaulknerFocus https://t.co/f3AbSgucwe",False,1533855302122184704,155,329,329,21
MarshaBlackburn,Sen. Marsha Blackburn,1533849068866248704,278145569,en,1533849068866248704,2022-06-06T16:31:30.000Z,The NBA has allowed itself to be censored by Beijing over human rights issues while simultaneously acting as the biggest social justice warrior in the USA. https://t.co/atSKWBPYn7,False,1533849068866248704,112,114,114,16
MarshaBlackburn,Sen. Marsha Blackburn,1533840864409264128,278145569,en,1533840864409264128,2022-06-06T15:58:54.000Z,"HOW are you going to “lower everyday costs for Americans,” Mr. President? This plan is just full of more empty promises — not solutions. https://t.co/1ZXFHYzbxR",False,1533840864409264128,125,233,233,16
MarshaBlackburn,Sen. Marsha Blackburn,1533810907649822720,278145569,en,1533810907649822720,2022-06-06T13:59:51.000Z,"Joe Biden’s disastrous withdrawal from Afghanistan pushed Communist China into working with the Taliban. Now, they’re poised to make several deals to mine Afghanistan’s natural resources together.",False,1533810907649822720,838,755,755,76
MarshaBlackburn,Sen. Marsha Blackburn,1533791962385498112,278145569,en,1533791962385498112,2022-06-06T12:44:34.000Z,"78 years ago, U.S. soldiers stormed the beaches of Normandy to fight for freedom and justice around the world. We are forever indebted to them for their courage and sacrifice. #DDay",False,1533791962385498112,1143,667,667,89
MarshaBlackburn,Sen. Marsha Blackburn,1533606130596855808,278145569,en,1533606130596855808,2022-06-06T00:26:09.000Z,"Biden’s out-of-control, unpredictable #BuildBackBroke agenda has many Americans worried and squeezing their budgets. https://t.co/KHVnJQARV4",False,1533606130596855808,240,481,481,46
MarshaBlackburn,Sen. Marsha Blackburn,1533537358615830528,278145569,en,1533537358615830528,2022-06-05T19:52:52.000Z,"Happy 40th anniversary to a beloved Nashville spot — The Bluebird Cafe. Thank you for giving our songwriters and artists a space to come together to foster creativity and celebrate music!
@BluebirdCafeTN",False,1533537358615830528,99,127,127,6
MarshaBlackburn,Sen. Marsha Blackburn,1533460231270834177,278145569,en,1533460231270834177,2022-06-05T14:46:24.000Z,"“Let your speech always be gracious, seasoned with salt, so that you may know how you ought to answer each person.” — Colossians 4:6",False,1533460231270834177,339,2985,2985,214
MarshaBlackburn,Sen. Marsha Blackburn,1533255652474294272,278145569,en,1533255652474294272,2022-06-05T01:13:28.000Z,"Inflation is crippling the American economy, but all Biden’s Treasury Secretary can do is throw her hands up and say, ‘sorry, I was wrong.’ 

There’s a solution — stop spending trillions of dollars and unleash American energy.",False,1533255652474294272,1578,1507,1507,126
MarshaBlackburn,Sen. Marsha Blackburn,1533185514165108739,278145569,en,1533185514165108739,2022-06-04T20:34:46.000Z,The Biden Administration has set 18 new records for gas prices in 19 days.,False,1533185514165108739,3036,5944,5944,567
MarshaBlackburn,Sen. Marsha Blackburn,1533167387125731330,278145569,en,1533167387125731330,2022-06-04T19:22:44.000Z,"Communist China wants to pretend this never happened.

The world will not forget Beijing’s barbaric actions. #TiananmenSquareMassacre https://t.co/VypUkwSMMI",False,1533167387125731330,632,284,284,42
MarshaBlackburn,Sen. Marsha Blackburn,1533131622408761345,278145569,en,1533131622408761345,2022-06-04T17:00:37.000Z,"Average gas price June 2022: $4.76

Average gas price June 2020: $2.17

Joe Biden, you did this. https://t.co/MewihjO1Pr",False,1533131622408761345,578,1230,1230,92
MarshaBlackburn,Sen. Marsha Blackburn,1533100349577433090,278145569,en,1533100349577433090,2022-06-04T14:56:21.000Z,"33 years ago, the Chinese Communist regime showed its true colors by murdering pro-democracy protestors in Tiananmen Square.

Those who fought for liberty against the CCP that day will not be forgotten, and we stand with those still in the fight. #TiananmenSquareMassacre",False,1533100349577433090,493,224,224,31
MarshaBlackburn,Sen. Marsha Blackburn,1532898003811454976,278145569,en,1532898003811454976,2022-06-04T01:32:18.000Z,More Americans are broke since Joe Biden took office. https://t.co/KLKCQc8JOG,False,1532898003811454976,532,580,580,65
MarshaBlackburn,Sen. Marsha Blackburn,1532832279097221120,278145569,en,1532832279097221120,2022-06-03T21:11:08.000Z,Biden’s real plan to fight inflation. https://t.co/POX7xfQ3Zp,False,1532832279097221120,786,492,492,49
MarshaBlackburn,Sen. Marsha Blackburn,1532792474636255234,278145569,en,1532792474636255234,2022-06-03T18:32:58.000Z,"Tennesseans are heroes! 

https://t.co/5x6xZR1vRM",False,1532792474636255234,44,156,156,4
MarshaBlackburn,Sen. Marsha Blackburn,1532774007627448320,278145569,en,1532774007627448320,2022-06-03T17:19:35.000Z,"China wishes to make other countries dependent on their own technologies. I urge the U.K. to reconsider this deal.

https://t.co/YGSsYYG4dm",False,1532774007627448320,107,104,104,18
MarshaBlackburn,Sen. Marsha Blackburn,1532756622535278594,278145569,en,1532756622535278594,2022-06-03T16:10:30.000Z,"If business leaders knew about the baby formula shortage in February, why was Biden not aware until April?",False,1532756622535278594,1760,2541,2541,286
MarshaBlackburn,Sen. Marsha Blackburn,1532722568628776960,278145569,en,1532722568628776960,2022-06-03T13:55:11.000Z,Gas prices have nearly doubled since Joe Biden took office.,False,1532722568628776960,2832,6981,6981,663
MarshaBlackburn,Sen. Marsha Blackburn,1532705032227160064,278145569,en,1532705032227160064,2022-06-03T12:45:30.000Z,"Biden’s COVID coordinator refused to answer if all schools “will and must be open this fall.”

It’s unbelievable we’re still having this conversation. Our schools should be open — period. https://t.co/RoMSNW2Pz9",False,1532705032227160064,203,287,287,35
MarshaBlackburn,Sen. Marsha Blackburn,1532677662505943041,278145569,en,1532677662505943041,2022-06-03T10:56:45.000Z,"This is a step in the right direction, but more must be done to protect our kids online. 

For far too long, Big Tech has put profit above the well-being of minors, which is why @SenBlumenthal and I have introduced the Kids Online Safety Act. 
https://t.co/WCpPUROZvU",False,1532677662505943041,47,157,157,10
MarshaBlackburn,Sen. Marsha Blackburn,1532553658080055296,278145569,en,1532553658080055296,2022-06-03T02:44:00.000Z,The White House is REFUSING to tell the American people exactly when Joe Biden was briefed about the baby formula shortage.,False,1532553658080055296,1543,1708,1708,147
MarshaBlackburn,Sen. Marsha Blackburn,1532497956326330385,278145569,en,1532497956326330385,2022-06-02T23:02:39.000Z,"The Xinjiang police files reveal the horrifying truth about Xi Jinping and his communist regime.

Their monstrous treatment of the Uyghurs should be an immediate wake-up call to the West. https://t.co/w5woKt16cf",False,1532497956326330385,75,120,120,14
MarshaBlackburn,Sen. Marsha Blackburn,1532482188570132481,278145569,en,1532482188570132481,2022-06-02T22:00:00.000Z,How can student loans be Biden’s top priority when hardworking Americans are struggling to put gas in their car?,False,1532482188570132481,4191,5081,5081,637
MarshaBlackburn,Sen. Marsha Blackburn,1532443242545004556,278145569,en,1532443242545004556,2022-06-02T19:25:15.000Z,"Mr. President, an immediate action you could take is to have a plan to make us energy independent again. 

Your Green New Deal is a root cause. https://t.co/QTXLJIkMaZ",False,1532443242545004556,288,502,502,52
MarshaBlackburn,Sen. Marsha Blackburn,1532419670539739142,278145569,en,1532419670539739142,2022-06-02T17:51:35.000Z,"Inflation has hit record highs because of Biden’s spending, and now he’s spending another $6 billion to cancel student loans.",False,1532419670539739142,1034,1368,1368,167
MarshaBlackburn,Sen. Marsha Blackburn,1532385928924303362,278145569,en,1532385928924303362,2022-06-02T15:37:30.000Z,Canceling student loans is a gift to the rich and unfair to students who worked to pay for school.,False,1532385928924303362,3415,6620,6620,976
MarshaBlackburn,Sen. Marsha Blackburn,1532375344480755714,278145569,en,1532375344480755714,2022-06-02T14:55:26.000Z,Big tech has no issue prioritizing the propaganda of the CCP while they continue to silence Americans. @Google https://t.co/L9B6JfhKCT,False,1532375344480755714,162,89,89,13
MarshaBlackburn,Sen. Marsha Blackburn,1532355145065025539,278145569,en,1532355145065025539,2022-06-02T13:35:11.000Z,"Iranian-backed hackers launched a cyber attack against Boston Children’s hospital.

How can Joe Biden still be pushing for another failed nuclear deal with Tehran?",False,1532355145065025539,781,318,318,46
MarshaBlackburn,Sen. Marsha Blackburn,1532188379668004865,278145569,en,1532188379668004865,2022-06-02T02:32:31.000Z,This is the man in charge. https://t.co/UGz1AUy4LA,False,1532188379668004865,1090,1196,1196,166
MarshaBlackburn,Sen. Marsha Blackburn,1532163042980528130,278145569,en,1532163042980528130,2022-06-02T00:51:50.000Z,How does the President’s top spokesperson not know when he was briefed about the baby formula shortage? Might it be because his staff is running the show? https://t.co/VAAPX0Yvc7,False,1532163042980528130,306,398,398,33
MarshaBlackburn,Sen. Marsha Blackburn,1532125058235346947,278145569,en,1532125058235346947,2022-06-01T22:20:54.000Z,RT @TNECD: .@NatGeoTravelUK named Nashville the top destination in the world to visit in June. Music City was the only U.S. city to make th…,False,1532125058235346947,21,0,0,0
MarshaBlackburn,Sen. Marsha Blackburn,1532124990904188929,278145569,en,1532124990904188929,2022-06-01T22:20:37.000Z,"RT @IranIntl_En: US Senator @MarshaBlackburn: ""The UN reports Iran has stockpiled enough Uranium to produce a nuclear weapon and has refuse…",False,1532124990904188929,54,0,0,0
MarshaBlackburn,Sen. Marsha Blackburn,1532109882140368896,278145569,en,1532109882140368896,2022-06-01T21:20:35.000Z,"Joe Biden is setting new records because of his inaction at the southern border. 

It needs to stop. https://t.co/ZBAuxU2kEt",False,1532109882140368896,259,290,290,29
MarshaBlackburn,Sen. Marsha Blackburn,1532086562556723201,278145569,en,1532086562556723201,2022-06-01T19:47:55.000Z,We must secure the southern border. This is a humanitarian crisis. https://t.co/5KDaypX1TO,False,1532086562556723201,141,265,265,14
MarshaBlackburn,Sen. Marsha Blackburn,1532057204391833601,278145569,en,1532057204391833601,2022-06-01T17:51:16.000Z,"Joe Biden's plan to fix inflation is to blame Putin and COVID, and spend more money. https://t.co/I4H2V7m3Cu",False,1532057204391833601,137,220,220,7
MarshaBlackburn,Sen. Marsha Blackburn,1532026008198578179,278145569,en,1532026008198578179,2022-06-01T15:47:18.000Z,Celebrating 226 years of the greatest state in the union! https://t.co/6DtadIZaZp,False,1532026008198578179,51,177,177,9
MarshaBlackburn,Sen. Marsha Blackburn,1532003209749069824,278145569,qam,1532003209749069824,2022-06-01T14:16:43.000Z,@SenRickScott @SenBillCassidy @SenRubioPress @SenThomTillis @SenatorBraun @SenTedCruz @SenKevinCramer @RepBobGood,False,1532003208033406977,24,62,62,2
MarshaBlackburn,Sen. Marsha Blackburn,1532003208033406977,278145569,en,1532003208033406977,2022-06-01T14:16:42.000Z,"The Biden admin should not re-enter a deal that legitimizes Iran’s regime while they continue to fund terrorism, endorse the CCP and enable genocide. I introduced the Iran China Accountability Act to stop taxpayer dollars from funding any deal until US interests are guaranteed.",False,1532003208033406977,342,220,220,18
MarshaBlackburn,Sen. Marsha Blackburn,1531825940988305411,278145569,en,1531825940988305411,2022-06-01T02:32:18.000Z,Americans cannot get cancer screenings because of Communist China. We must bring our supply chains back to the USA. https://t.co/saNxET39n0,False,1531825940988305411,178,378,378,25
MarshaBlackburn,Sen. Marsha Blackburn,1531815749748146176,278145569,es,1531815749748146176,2022-06-01T01:51:49.000Z,Investigate Hillary Clinton.,False,1531815749748146176,4227,14621,14621,1553
MarshaBlackburn,Sen. Marsha Blackburn,1531800021489831936,278145569,en,1531800021489831936,2022-06-01T00:49:19.000Z,"Wrapped up visits in Cannon, DeKalb, Van Buren, and Warren counties. Inflation is hitting our farmers and workforce hard, while sheriffs are worried about the uptick in fentanyl stemming from our southern border. https://t.co/EtvSi1e57S",False,1531800021489831936,51,253,253,21
MarshaBlackburn,Sen. Marsha Blackburn,1531775802337107974,278145569,en,1531775802337107974,2022-05-31T23:13:04.000Z,Joe Biden keeps making history! Gas is at $4.61 a gallon.,False,1531775802337107974,571,4265,4265,330
MarshaBlackburn,Sen. Marsha Blackburn,1531740601204592647,278145569,en,1531740601204592647,2022-05-31T20:53:12.000Z,How can @JoeBiden not support making schools more safe? This is truly unbelievable. https://t.co/z0oEZknKaR,False,1531740601204592647,280,2649,2649,217
MarshaBlackburn,Sen. Marsha Blackburn,1531727596542631936,278145569,en,1531727596542631936,2022-05-31T20:01:31.000Z,"We’re continuing our 95 county tour in Middle TN today, talking with Tennesseans about how #Bidenflation is impacting their family budgets — from the gas pump to the grocery store. https://t.co/ILUWUYTfb5",False,1531727596542631936,87,510,510,39
MarshaBlackburn,Sen. Marsha Blackburn,1531713096951246849,278145569,en,1531713096951246849,2022-05-31T19:03:54.000Z,Every single person who manufactured false allegations about Russian collusion against President Trump should be held fully accountable.,False,1531713096951246849,2726,3108,3108,342
MarshaBlackburn,Sen. Marsha Blackburn,1531689118014521345,278145569,en,1531689118014521345,2022-05-31T17:28:37.000Z,"The UN reports Iran has stockpiled enough Uranium to produce a nuclear weapon and has refused to directly answer questions about it. 

This should be reason enough to kill negotiations for a new Obama-era deal.",False,1531689118014521345,368,718,718,105
MarshaBlackburn,Sen. Marsha Blackburn,1531677578171502595,278145569,en,1531677578171502595,2022-05-31T16:42:46.000Z,"Michael Sussmann lied to the FBI about working for the Clinton campaign when he brought forward false allegations against Pres. Trump — that Hillary personally approved. 

Today’s verdict, while deeply disappointing, is not the end to ensuring this never happens in America again.",False,1531677578171502595,550,711,711,47
MarshaBlackburn,Sen. Marsha Blackburn,1531663287301152768,278145569,en,1531663287301152768,2022-05-31T15:45:59.000Z,"RT @ORNL: Meet Frontier — the world's first #exascale computer!

At 1.1 exaflops, Frontier is also the world's fastest #supercomputer and c…",False,1531663287301152768,195,0,0,0
MarshaBlackburn,Sen. Marsha Blackburn,1531632802743083009,278145569,en,1531632802743083009,2022-05-31T13:44:51.000Z,"Congratulations to @ORNL on the success of their exascale computing system, Frontier — #1 fastest in the world. What a great day for innovation in Tennessee and across America. https://t.co/RbFXRWB1ho",False,1531632802743083009,34,58,58,4
MarshaBlackburn,Sen. Marsha Blackburn,1531459602302246912,278145569,en,1531459602302246912,2022-05-31T02:16:36.000Z,What a beautiful way to honor Staff Sgt. Knauss. His sacrifice will never be forgotten. https://t.co/akbOqMy2OH,False,1531459602302246912,95,81,81,6
MarshaBlackburn,Sen. Marsha Blackburn,1531330016054755328,278145569,en,1531330016054755328,2022-05-30T17:41:41.000Z,"Today, we honor those who have worn the uniform and made the ultimate sacrifice for our freedoms. 🇺🇸 #MemorialDay https://t.co/7BYPcLSvm9",False,1531330016054755328,185,2039,2039,157
MarshaBlackburn,Sen. Marsha Blackburn,1531269952027734018,278145569,en,1531269952027734018,2022-05-30T13:43:00.000Z,"This Memorial Day, join me in praying for those who have lost their loved ones in the fight for freedom. We remember their sacrifice and honor their lasting legacy on our nation. https://t.co/z2D5uoAf4W",False,1531269952027734018,149,266,266,20
MarshaBlackburn,Sen. Marsha Blackburn,1530932901499609088,278145569,en,1530932901499609088,2022-05-29T15:23:41.000Z,"“Love bears all things, believes all things, hopes all things, endures all things.” — 1 Corinthians 13:7",False,1530932901499609088,333,1731,1731,135
MarshaBlackburn,Sen. Marsha Blackburn,1530592666668437506,278145569,en,1530592666668437506,2022-05-28T16:51:43.000Z,"Whether you’re driving to the grocery store or a family BBQ this holiday weekend, Biden’s gas price hike is making a stop at the pump all the more difficult. https://t.co/ECZcnbmZoE",False,1530592666668437506,271,1279,1279,95
MarshaBlackburn,Sen. Marsha Blackburn,1530330433283624961,278145569,en,1530330433283624961,2022-05-27T23:29:42.000Z,"RT @1st_SF_Command: Yesterday, Staff Sgt. Ryan Knauss was added to the @USASOCNews Memorial Wall, which honors those who made the ultimate…",False,1530330433283624961,137,0,0,0
MarshaBlackburn,Sen. Marsha Blackburn,1530293054674030592,278145569,en,1530293054674030592,2022-05-27T21:01:10.000Z,CBO’s latest budget outlook is positive proof that the government never gets enough of the taxpayer dollar. https://t.co/RD4ICPPo2Y,False,1530293054674030592,80,172,172,10
MarshaBlackburn,Sen. Marsha Blackburn,1530279844830924800,278145569,en,1530279844830924800,2022-05-27T20:08:40.000Z,RT @TNECD: 🏆 WINNER 🏆 @Ford Motor Company's Blue Oval City project in West Tennessee tied for the #1 spot on @SiteSelection's Top North Ame…,False,1530279844830924800,25,0,0,0
MarshaBlackburn,Sen. Marsha Blackburn,1530272421470674948,278145569,en,1530272421470674948,2022-05-27T19:39:11.000Z,Newly revealed information from police servers in Xinjiang shows horrendous crimes the Chinese Communist regime is committing against the Uyghurs — including issuing shoot-to-kill orders &amp; detaining people in concentration camps as young as 14.,False,1530272421470674948,491,520,520,67
MarshaBlackburn,Sen. Marsha Blackburn,1530244454422044675,278145569,en,1530244454422044675,2022-05-27T17:48:03.000Z,I’ve introduced the Stop The Inflationary Spending Spree Resolution to make it more difficult to pass spending packages during periods of high inflation. https://t.co/g238RXRCfp,False,1530244454422044675,163,438,438,22
MarshaBlackburn,Sen. Marsha Blackburn,1530199751425085440,278145569,en,1530199751425085440,2022-05-27T14:50:25.000Z,"Iran used secret U.N. records to create false stories to cover up their nuclear activity, yet the Biden administration continues to negotiate with the regime.",False,1530199751425085440,1144,619,619,83
MarshaBlackburn,Sen. Marsha Blackburn,1529958967882965003,278145569,en,1529958967882965003,2022-05-26T22:53:37.000Z,Here are ways to honor our heroes this Memorial Day weekend. https://t.co/egODxlwkUu,False,1529958967882965003,110,335,335,18
MarshaBlackburn,Sen. Marsha Blackburn,1529909583279443975,278145569,en,1529909583279443975,2022-05-26T19:37:23.000Z,I enjoyed visiting with so many Tennesseans this week! https://t.co/R8mMYz09Qi,False,1529909583279443975,58,551,551,29
MarshaBlackburn,Sen. Marsha Blackburn,1529851228544458753,278145569,en,1529851228544458753,2022-05-26T15:45:30.000Z,"Another incredible story that embodies the Tennessee Volunteer spirit!

Way to go, Ms. Marie, and thank you for serving your community faithfully. https://t.co/cEp6D6Dden",False,1529851228544458753,55,131,131,10
MarshaBlackburn,Sen. Marsha Blackburn,1529210018884554752,278145569,en,1529210018884554752,2022-05-24T21:17:34.000Z,"Horrified and heartbroken to learn of the significant loss of life in the shooting in Uvalde, Texas. Please join me in lifting their loved ones up in prayer. 

Thank you to the local first responders working on the scene.",False,1529210018884554752,699,10395,10395,1004
MarshaBlackburn,Sen. Marsha Blackburn,1529184693270327296,278145569,en,1529184693270327296,2022-05-24T19:36:56.000Z,President Biden's comments during his trip to Asia show he is not in charge. His staff cleaning up his remarks is running the show.,False,1529184693270327296,1047,868,868,91
MarshaBlackburn,Sen. Marsha Blackburn,1529165469005094915,278145569,en,1529165469005094915,2022-05-24T18:20:32.000Z,"Not a word from the NBA on the CCP’s egregious human rights violations after NBA games returned to Chinese state-run TV.

Perhaps it has a lot to do with the over $10 billion NBA owners have invested in China. https://t.co/GmgjW2AWga",False,1529165469005094915,115,155,155,18
MarshaBlackburn,Sen. Marsha Blackburn,1529141463510044672,278145569,en,1529141463510044672,2022-05-24T16:45:09.000Z,"Known terrorists are coming across the U.S.-Mexico border.

This is a national security crisis.

Secure our southern border immediately.",False,1529141463510044672,1159,699,699,102
MarshaBlackburn,Sen. Marsha Blackburn,1529118155397812224,278145569,zxx,1529118155397812224,2022-05-24T15:12:32.000Z,https://t.co/nUJjzZDBIG,False,1529118020085469186,153,141,141,20
