handle,name,tweet_id,author_id,lang,replied_to,created_at,tweet_text,possibly_sensitive,conversation_id,retweet_count,reply_count,like_count,quote_count
MarshaBlackburn,Sen. Marsha Blackburn,1564292793979265025,278145569,en,1564292793979265025,2022-08-29T16:43:59.000Z,"The White House has yet to give a thorough explanation on how they will pay for Biden’s student loan forgiveness announcement. 

This administration continues to stray further left, with no clear plan for the American people.",False,1564292793979265025,445,2016,2016,157
MarshaBlackburn,Sen. Marsha Blackburn,1564276874997530625,278145569,en,1564276874997530625,2022-08-29T15:40:44.000Z,"Taiwan has its own president, military, and constitution.
 
It’s obvious it is an independent country. https://t.co/qDD775Sfso",False,1564276874997530625,398,822,822,123
MarshaBlackburn,Sen. Marsha Blackburn,1564229937996906498,278145569,en,1564229937996906498,2022-08-29T12:34:13.000Z,Tennesseans do not want socialism.,False,1564229937996906498,1867,13961,13961,1382
MarshaBlackburn,Sen. Marsha Blackburn,1564043752322306049,278145569,en,1564043752322306049,2022-08-29T00:14:23.000Z,"We are so proud of the @NolensvilleLLB team for their incredible run this year. 

Their hard work and positive attitude earned them the Sportsmanship Award. Way to represent the Volunteer State!",False,1564043752322306049,45,79,79,1
MarshaBlackburn,Sen. Marsha Blackburn,1564021483067801602,278145569,en,1564021483067801602,2022-08-28T22:45:54.000Z,"@timburchett @EastTNChildrens Wonderful news, @timburchett! Continuing to pray for a full recovery.",False,1563891724245680134,0,0,0,0
MarshaBlackburn,Sen. Marsha Blackburn,1563996968988409857,278145569,en,1563996968988409857,2022-08-28T21:08:29.000Z,Thank you to the men and women of our military for protecting and defending our freedoms.,False,1563996968988409857,1176,3639,3639,264
MarshaBlackburn,Sen. Marsha Blackburn,1563897160898314240,278145569,en,1563897160898314240,2022-08-28T14:31:53.000Z,"“All Scripture is breathed out by God and profitable for teaching, for reproof, for correction, and for training in righteousness, that the man of God may be complete, equipped for every good work.” — 2 Timothy 3:16-17",False,1563897160898314240,280,3831,3831,210
MarshaBlackburn,Sen. Marsha Blackburn,1563661178299203584,278145569,en,1563661178299203584,2022-08-27T22:54:10.000Z,"At the beginning of the pandemic, Beijing threatened to withhold critical life-saving medications from the USA.

We must unravel our supply chains from the Chinese Communist Party.",False,1563661178299203584,1532,1415,1415,127
MarshaBlackburn,Sen. Marsha Blackburn,1563626068724121600,278145569,en,1563626068724121600,2022-08-27T20:34:40.000Z,Enjoyed my visit to National Chiang Kai-shek Memorial Hall in Taipei that remembers the work of President Chiang Kai-shek. https://t.co/73t54jFud1,False,1563626068724121600,671,1763,1763,556
MarshaBlackburn,Sen. Marsha Blackburn,1563569979668439042,278145569,en,1563569979668439042,2022-08-27T16:51:47.000Z,We cannot back down to authoritarian leaders.,False,1563569979668439042,1579,9563,9563,687
MarshaBlackburn,Sen. Marsha Blackburn,1563548239294390273,278145569,en,1563548239294390273,2022-08-27T15:25:24.000Z,RT @FoxNews: Two Chinas? @MarshaBlackburn calls Taiwan an 'independent nation' in visit to island https://t.co/6L9oX0301W,False,1563548239294390273,151,0,0,0
MarshaBlackburn,Sen. Marsha Blackburn,1563360907849187328,278145569,zh,1563360907849187328,2022-08-27T03:01:00.000Z,"台灣是我們在印太區域最堅實的夥伴

至感榮幸能與蔡總統@iingwen會面，重申對台灣自由及未來成就的支持

這也是我在美國聯邦參議院努力確保台灣擁有自我防衛能力的原因",False,1563360907849187328,632,502,502,57
MarshaBlackburn,Sen. Marsha Blackburn,1563360373298049024,278145569,en,1563360373298049024,2022-08-27T02:58:53.000Z,"Taiwan is our strongest partner in the Indo-Pacific Region. 
 
It was my honor to meet with President @iingwen in Taipei to reaffirm my support for Taiwan’s freedom and future success.  
 
That’s why in the Senate, I’m working to ensure Taiwan has the capacity to defend itself.",False,1563360373298049024,269,289,289,22
MarshaBlackburn,Sen. Marsha Blackburn,1563346866691276800,278145569,en,1563346866691276800,2022-08-27T02:05:13.000Z,Taiwan is a free and independent nation. https://t.co/DQvwsSPABG,False,1563346866691276800,813,1120,1120,125
MarshaBlackburn,Sen. Marsha Blackburn,1563316604116484096,278145569,en,1563316604116484096,2022-08-27T00:04:58.000Z,"Taiwan is independent of China.
 
Just ask anyone in Taiwan.",False,1563316604116484096,1641,2230,2230,205
MarshaBlackburn,Sen. Marsha Blackburn,1563288325162536960,278145569,en,1563288325162536960,2022-08-26T22:12:35.000Z,Taiwan is a true friend to the United States 🇺🇸🇹🇼,False,1563288325162536960,767,1419,1419,116
MarshaBlackburn,Sen. Marsha Blackburn,1563244044083269634,278145569,en,1563244044083269634,2022-08-26T19:16:38.000Z,"It is an honor to be in Taipei, demonstrating that the Chinese Communist Party can’t dictate U.S. foreign policy.",False,1563244044083269634,620,1353,1353,103
MarshaBlackburn,Sen. Marsha Blackburn,1563222483683028992,278145569,en,1563222483683028992,2022-08-26T17:50:58.000Z,RT @MOFA_Taiwan: .@MarshaBlackburn was lauded by Minister Wu during a welcome banquet for her spirited defiance of #China's coercion. The #…,False,1563222483683028992,223,0,0,0
MarshaBlackburn,Sen. Marsha Blackburn,1563221866315390976,278145569,en,1563221866315390976,2022-08-26T17:48:30.000Z,"The only way we will stop and reverse Beijing’s quest for global dominance is by demonstrating our resolve against their totalitarian regime. 
 
Read my op-ed in @townhallcom: https://t.co/fGdKdXOdfl",False,1563221866315390976,184,272,272,30
MarshaBlackburn,Sen. Marsha Blackburn,1563212033604354049,278145569,en,1563212033604354049,2022-08-26T17:09:26.000Z,"RT @GordonGChang: Sen. @MarshaBlackburn has called #Taiwan a “country.” Yes! As Confucius told us, we must always call things by their prop…",False,1563212033604354049,182,0,0,0
MarshaBlackburn,Sen. Marsha Blackburn,1563195057657696258,278145569,en,1563195057657696258,2022-08-26T16:01:59.000Z,One of the reasons I’ve come to Taipei to have these conversations with Taiwan’s leaders is because we can’t afford to let the Chinese Communist Party write the world’s foreign policy. https://t.co/5ampJ0pCgg,False,1563195057657696258,440,922,922,99
MarshaBlackburn,Sen. Marsha Blackburn,1563164067308929024,278145569,en,1563164067308929024,2022-08-26T13:58:50.000Z,"Our shared values of freedom and democracy bind the U.S., Taiwan, and Pacific Islands. 

Beijing does not share our same values, which is why freedom-loving people reject their influence.",False,1563164067308929024,377,547,547,43
MarshaBlackburn,Sen. Marsha Blackburn,1563137849259888648,278145569,en,1563137849259888648,2022-08-26T12:14:39.000Z,".@MOFA_Taiwan and I are both committed to strengthening bilateral ties between the United States and Taiwan. 
 
In Congress, I am helping to lead the effort to increase military support to Taiwan and strengthen security for Pacific Island nations. https://t.co/K5j94lrP3g",False,1563137849259888648,193,215,215,18
MarshaBlackburn,Sen. Marsha Blackburn,1563115955307577345,278145569,zh,1563115955307577345,2022-08-26T10:47:39.000Z,至感榮幸能與蔡總統@iingwen會面，重申對台灣自由及未來成就的支持 https://t.co/YP4cPzhjp3,False,1563115955307577345,655,297,297,24
MarshaBlackburn,Sen. Marsha Blackburn,1563111874409172994,278145569,en,1563111874409172994,2022-08-26T10:31:26.000Z,"The CCP will stop at nothing to achieve global domination and destroy Taiwan’s independence.
 
That’s why I’m in Taipei to discuss ways to strengthen our relationships with @iingwen. https://t.co/mnpmdIrEZa",False,1563111874409172994,441,318,318,58
MarshaBlackburn,Sen. Marsha Blackburn,1563106046348238851,278145569,en,1563106046348238851,2022-08-26T10:08:17.000Z,RT @kelly_laco: EXCLUSIVE: @MarshaBlackburn spoke exclusively with @FoxNews  Digital while en route to Taiwan for a trip she hopes sends a…,False,1563106046348238851,79,0,0,0
MarshaBlackburn,Sen. Marsha Blackburn,1563104334187233281,278145569,en,1563104334187233281,2022-08-26T10:01:29.000Z,RT @iingwen: A warm #Taiwan welcome to Sen. @MarshaBlackburn from #Tennessee. I enjoyed our discussions &amp; look forward to working with frie…,False,1563104334187233281,958,0,0,0
MarshaBlackburn,Sen. Marsha Blackburn,1563016457549742081,278145569,en,1563016457549742081,2022-08-26T04:12:17.000Z,The people of the U.S. stand with the people of Taiwan 🇺🇸🇹🇼 https://t.co/9AckwGY1ly,False,1563016457549742081,649,815,815,85
MarshaBlackburn,Sen. Marsha Blackburn,1562992858998706176,278145569,en,1562992858998706176,2022-08-26T02:38:31.000Z,"Thank you, @iingwen, for your strong leadership in standing up against the Chinese Communist Party.
 
The United States supports Taiwan and its freedom-loving people. https://t.co/hNGADUk1ZJ",False,1562992858998706176,566,318,318,43
MarshaBlackburn,Sen. Marsha Blackburn,1562979993692815360,278145569,en,1562979993692815360,2022-08-26T01:47:23.000Z,RT @san_taiwan: Such a powerful message in Mandarin.,False,1562979993692815360,64,0,0,0
MarshaBlackburn,Sen. Marsha Blackburn,1562977174050574336,278145569,ja,1562977174050574336,2022-08-26T01:36:11.000Z,"RT @TaiwanTodayJP: 昨夜遅くに台湾を訪れたアメリカ共和党のブラックバーン上院議員。
訪台直後にTwitterを更新。繁体字中国語で

「この訪台は北京に対し、我々は（中国の）いじめを受け入れない、というメッセージを伝えるためのものだ」

と書き込みました。",False,1562977174050574336,69,0,0,0
MarshaBlackburn,Sen. Marsha Blackburn,1562952591805673473,278145569,en,1562952591805673473,2022-08-25T23:58:30.000Z,"I will continue to stand with the Taiwans and their right to freedom and democracy.
 
Xi Jinping doesn’t scare me.",False,1562952591805673473,1120,4902,4902,848
MarshaBlackburn,Sen. Marsha Blackburn,1562930615028260864,278145569,en,1562930615028260864,2022-08-25T22:31:11.000Z,I will never kowtow to the Chinese Communist Party.,False,1562930615028260864,1591,5554,5554,376
MarshaBlackburn,Sen. Marsha Blackburn,1562930434027167744,278145569,en,1562930434027167744,2022-08-25T22:30:27.000Z,RT @MOFA_Taiwan: The warmest of welcomes to @MarshaBlackburn from the #US🇺🇸 state of Tennessee! The visit amid regional tensions reaffirms…,False,1562930434027167744,400,0,0,0
MarshaBlackburn,Sen. Marsha Blackburn,1562906741636861952,278145569,en,1562906741636861952,2022-08-25T20:56:19.000Z,"Taiwan is demonstrating strength and courage, and the Chinese Communist Party envies this.",False,1562906741636861952,678,611,611,63
MarshaBlackburn,Sen. Marsha Blackburn,1562881619400486914,278145569,en,1562881619400486914,2022-08-25T19:16:29.000Z,"RT @Reuters: Marsha Blackburn, a U.S. senator who sits on the Senate's Commerce and Armed Services Committees, arrived in Taiwan, the third…",False,1562881619400486914,167,0,0,0
MarshaBlackburn,Sen. Marsha Blackburn,1562881587426955264,278145569,en,1562881587426955264,2022-08-25T19:16:22.000Z,RT @FoxNews: Sen. Marsha Blackburn lands in Taiwan for surprise visit after calling China 'New Axis of Evil': source https://t.co/zFRyaMXKWg,False,1562881587426955264,174,0,0,0
MarshaBlackburn,Sen. Marsha Blackburn,1562878850379677696,278145569,en,1562878850379677696,2022-08-25T19:05:29.000Z,RT @teco_in_atl: #USwithTaiwan 🇹🇼🤝🇺🇸🌏🕊️👩‍💼 Sen. @MarshaBlackburn has just landed in Taiwan! We thank Sen. Blackburn for her steadfast suppo…,False,1562878850379677696,84,0,0,0
MarshaBlackburn,Sen. Marsha Blackburn,1562865409681866752,278145569,en,1562865409681866752,2022-08-25T18:12:04.000Z,"It’s time we focus on rewarding Taiwan’s commitment to democratic values and ensure they have the necessary resources to combat Communist China and the New Axis of Evil.

That’s why I’m in Taiwan.",False,1562865409681866752,553,1042,1042,150
MarshaBlackburn,Sen. Marsha Blackburn,1562843422565625858,278145569,zxx,1562843422565625858,2022-08-25T16:44:42.000Z,https://t.co/bvrprlCK4K,False,1562841112674328577,66,76,76,7
MarshaBlackburn,Sen. Marsha Blackburn,1562843311844380672,278145569,zh,1562843311844380672,2022-08-25T16:44:16.000Z,"我剛抵達台灣是為了要向北京傳達一個訊息-我們不會接受霸凌
美國將堅定維護全球的自由，不會容忍傷害我們國家及盟友的行徑 https://t.co/BkDo6eQDJJ",False,1562843311844380672,3542,2966,2966,420
MarshaBlackburn,Sen. Marsha Blackburn,1562841112674328577,278145569,en,1562841112674328577,2022-08-25T16:35:32.000Z,"I just landed in Taiwan to send a message to Beijing — we will not be bullied. 
 
The United States remains steadfast in preserving freedom around the globe, and will not tolerate efforts to undermine our nation and our allies. https://t.co/yVcaYN7yIA",False,1562841112674328577,834,1410,1410,193
MarshaBlackburn,Sen. Marsha Blackburn,1562800971998081024,278145569,en,1562800971998081024,2022-08-25T13:56:01.000Z,"Under the Trump administration, the U.S. and our partners pledged to help collaborate on improving electricity across the island. This is a prime example of how we can work with our strategically important partners such as Papua New Guinea.",False,1562800971998081024,156,333,333,20
MarshaBlackburn,Sen. Marsha Blackburn,1562791957729927168,278145569,en,1562791957729927168,2022-08-25T13:20:12.000Z,"In Papua New Guinea, I met with Secretary of Defense Akipe and Deputy Chief of Defense Force Commodore Polewara focused on expanding our strategic relationship.
 
We know the CCP wants one thing – global domination. 
 
We must stand united against it. https://t.co/FPnEj9vzzi",False,1562791957729927168,100,130,130,16
MarshaBlackburn,Sen. Marsha Blackburn,1562760684680937473,278145569,en,1562760684680937473,2022-08-25T11:15:56.000Z,I enjoyed meeting with Prime Minister @JamesMarape in Papua New Guinea. I appreciate his leadership in furthering democracy and deepening economic cooperation in the Indo-Pacific region. https://t.co/DdP1lIfiqG,False,1562760684680937473,45,114,114,8
MarshaBlackburn,Sen. Marsha Blackburn,1562621370046955520,278145569,en,1562621370046955520,2022-08-25T02:02:21.000Z,"Good riddance once and for all to the DHS “disinformation board.”
 
The federal government has no business threatening the First Amendment by policing your free speech.",False,1562621370046955520,879,1075,1075,61
MarshaBlackburn,Sen. Marsha Blackburn,1562617896437948417,278145569,en,1562617896437948417,2022-08-25T01:48:33.000Z,"Which is it? We’re very interested in hearing an answer to this one, @SpeakerPelosi @POTUS. https://t.co/veeMBIQFCj",False,1562617896437948417,2363,1149,1149,151
MarshaBlackburn,Sen. Marsha Blackburn,1562602207614484481,278145569,en,1562602207614484481,2022-08-25T00:46:12.000Z,"As the CCP's influence grows, the US must deepen our relationship w/ the Pacific Islands &amp; ensure their operational &amp; physical security as well as our own.
 
I met w/ several Pacific Island Ambassadors in June &amp; recently introduced legislation to convey those critical priorities.",False,1562602207614484481,75,105,105,8
MarshaBlackburn,Sen. Marsha Blackburn,1562589582612303874,278145569,en,1562589582612303874,2022-08-24T23:56:02.000Z,"In the Solomon Islands, I met with opposition leaders of the government. I am inspired by their commitment to preserving their nation’s democracy.",False,1562589582612303874,167,344,344,35
MarshaBlackburn,Sen. Marsha Blackburn,1562572991732391937,278145569,en,1562572991732391937,2022-08-24T22:50:07.000Z,A strong U.S. relationship with the Solomon Islands is critical for advancing our shared economic and security interests.,False,1562572988234739712,18,34,34,1
MarshaBlackburn,Sen. Marsha Blackburn,1562572988234739712,278145569,en,1562572988234739712,2022-08-24T22:50:06.000Z,"I met with Solomon Islands PM Manasseh Damukana Sogavare about the importance of strong engagement between our two countries to deter security challenges in the region. 

The U.S. should expedite the establishment of an embassy in the Solomon Islands to increase our presence. https://t.co/WNT1j1qFIo",False,1562572988234739712,46,76,76,10
MarshaBlackburn,Sen. Marsha Blackburn,1562560583240945664,278145569,en,1562560583240945664,2022-08-24T22:00:48.000Z,"In Fiji, I met with our U.S. political and defense leadership. It is vitally important to have a strong U.S. diplomatic presence on each Pacific Island Country. @USEmbassySuva @USAmbSuva",False,1562560583240945664,56,133,133,12
MarshaBlackburn,Sen. Marsha Blackburn,1562548005617541120,278145569,en,1562548005617541120,2022-08-24T21:10:49.000Z,Ended a great day at Food Rite in Somerville. A special thanks to owner Joey Hays for showing us around and introducing us to their great employees! https://t.co/JffMY4sMcX,False,1562547978564673542,14,14,14,1
MarshaBlackburn,Sen. Marsha Blackburn,1562547997380345858,278145569,en,1562547997380345858,2022-08-24T21:10:47.000Z,".@Ford and SK Innovation’s Blue Oval City project, which will transform West Tennessee’s economy and create nearly 6,000 new jobs, is coming along in Haywood County! https://t.co/WKfnrmv8Ef",False,1562547978564673542,11,12,12,2
MarshaBlackburn,Sen. Marsha Blackburn,1562547991608950784,278145569,en,1562547991608950784,2022-08-24T21:10:46.000Z,"During my visit to Hardeman County, in addition to hearing from local leaders, I received an update from @LoneOaksFarm on the work they are doing to empower young agriculture leaders and to promote STEM education. I also got to tour the new 4-H camp being built. https://t.co/XPdIdY2whE",False,1562547978564673542,3,2,2,0
MarshaBlackburn,Sen. Marsha Blackburn,1562547984822255616,278145569,en,1562547984822255616,2022-08-24T21:10:44.000Z,"In Fayette County, I talked with community leaders about partnering together to close the digital divide and ensure more accessible healthcare options for all Tennesseans. https://t.co/ejmVb8ftc6",False,1562547978564673542,4,5,5,0
MarshaBlackburn,Sen. Marsha Blackburn,1562547978564673542,278145569,en,1562547978564673542,2022-08-24T21:10:43.000Z,"Diesel prices are still through the roof, making the job of a Tennessee farmer more difficult. 
 
Last week, I spoke with leaders in Crockett County about the importance of protecting our agriculture community for the next generation. 
 
We thank our farmers for all they do. https://t.co/LBIqwoYoBj",False,1562547978564673542,49,93,93,4
MarshaBlackburn,Sen. Marsha Blackburn,1562514267772895232,278145569,en,1562514267772895232,2022-08-24T18:56:46.000Z,"Even Larry Summers has called student loan forgiveness “highly regressive.”
 
Biden’s decision is a gimmick that won’t help middle-class Americans.",False,1562514267772895232,859,1785,1785,136
MarshaBlackburn,Sen. Marsha Blackburn,1562488434433748993,278145569,en,1562488434433748993,2022-08-24T17:14:07.000Z,"President Biden’s decision to waive student loan debt will increase inflation and is another gift to the rich. 
 
Tennesseans should not be forced to pay for coastal elites to get their PhD in gender studies.",False,1562488434433748993,1495,5653,5653,510
MarshaBlackburn,Sen. Marsha Blackburn,1562465470133202944,278145569,en,1562465470133202944,2022-08-24T15:42:51.000Z,"Inflation is hurting the American people.
 
But the Biden Administration believes that loan forgiveness is a priority.",False,1562465470133202944,530,1492,1492,113
MarshaBlackburn,Sen. Marsha Blackburn,1562435008110870529,278145569,en,1562435008110870529,2022-08-24T13:41:49.000Z,"Terrorists are coming across the wide-open southern border, but Biden is adding 87,000 IRS agents to target hardworking Americans.",False,1562435008110870529,1752,3108,3108,241
MarshaBlackburn,Sen. Marsha Blackburn,1562270727474216961,278145569,en,1562270727474216961,2022-08-24T02:49:01.000Z,"We should be hiring 87,000 border patrol officers, not IRS agents.",False,1562270727474216961,2788,3835,3835,307
MarshaBlackburn,Sen. Marsha Blackburn,1562193829016772611,278145569,en,1562193829016772611,2022-08-23T21:43:27.000Z,Bring manufacturing back to the USA.🇺🇸🇺🇸🇺🇸,False,1562193829016772611,1672,4564,4564,347
MarshaBlackburn,Sen. Marsha Blackburn,1562096400690823170,278145569,en,1562096400690823170,2022-08-23T15:16:18.000Z,"The DOJ executed a warrant at the home of President Biden’s top political opponent.

Americans are not okay with that.",False,1562096400690823170,3088,24634,24634,1566
MarshaBlackburn,Sen. Marsha Blackburn,1561892349432692736,278145569,en,1561892349432692736,2022-08-23T01:45:29.000Z,"Mayor Dale Kelley served the Huntingdon community with a passion for leaving things better than he found them. 

My prayers are with his wife, Carlene, and his loved ones during this difficult time.",False,1561892349432692736,47,62,62,4
MarshaBlackburn,Sen. Marsha Blackburn,1561868924051865600,278145569,en,1561868924051865600,2022-08-23T00:12:24.000Z,Read my op-ed with @BrendanCarrFCC on how we can better protect children online. https://t.co/59G0cy3xnj,False,1561868924051865600,29,123,123,6
MarshaBlackburn,Sen. Marsha Blackburn,1561868622460362754,278145569,en,1561868622460362754,2022-08-23T00:11:12.000Z,"RT @BrendanCarrFCC: School districts have been handing tablets to kids in unprecedented numbers.

Yet many of them do not include filters t…",False,1561868622460362754,53,0,0,0
MarshaBlackburn,Sen. Marsha Blackburn,1561802792217485315,278145569,en,1561802792217485315,2022-08-22T19:49:37.000Z,"Big day for Wilson County! @thermofisher’s investment in a new bioproduction manufacturing site in Lebanon will create around 1,400 new jobs and impact many lives. 

@GovBillLee @TNECD @MayorHutto @SenatorHagerty https://t.co/QFClTi3zwl",False,1561802792217485315,36,147,147,9
MarshaBlackburn,Sen. Marsha Blackburn,1561780315785498625,278145569,en,1561780315785498625,2022-08-22T18:20:18.000Z,"Wonderful to be among so many talented young leaders this morning at the 7th Annual @tnffa Ham Breakfast!

The future of the agriculture industry is in good hands. https://t.co/dt5h1ktK8Q",False,1561780315785498625,60,130,130,9
MarshaBlackburn,Sen. Marsha Blackburn,1561770955218862080,278145569,en,1561770955218862080,2022-08-22T17:43:06.000Z,Anthony Fauci should be required to answer to the American people about his mishandling of COVID prior to his departure.,False,1561770955218862080,2269,9524,9524,663
MarshaBlackburn,Sen. Marsha Blackburn,1561769259503689730,278145569,en,1561769259503689730,2022-08-22T17:36:22.000Z,"RT @FoxNews: FBI must return to being a nonpolitical agency, Sen. @MarshaBlackburn says https://t.co/QIYVlzR9A0",False,1561769259503689730,242,0,0,0
MarshaBlackburn,Sen. Marsha Blackburn,1561750153844899840,278145569,en,1561750153844899840,2022-08-22T16:20:27.000Z,"Nina, who funds the government? https://t.co/JHbhhK16kX",False,1561750153844899840,812,1249,1249,141
MarshaBlackburn,Sen. Marsha Blackburn,1561514644858195970,278145569,en,1561514644858195970,2022-08-22T00:44:37.000Z,"As I traveled across Tennessee last week, one concern was consistent: Tennesseans do not want the $369 billion Green New Deal or 87,000 new IRS agents. https://t.co/JwWpHf96Bi",False,1561514644858195970,2856,4856,4856,397
MarshaBlackburn,Sen. Marsha Blackburn,1561465705744187393,278145569,en,1561465705744187393,2022-08-21T21:30:09.000Z,Banning individuals based on their skin color is called racism. https://t.co/tIr4OcKSGu,False,1561465705744187393,1327,1374,1374,160
MarshaBlackburn,Sen. Marsha Blackburn,1561379409264787456,278145569,en,1561379409264787456,2022-08-21T15:47:14.000Z,RT @GovBillLee: Today marks one year since the devastating floods in Waverly &amp; Humphreys County. 20 lives lost – countless homes &amp; business…,False,1561379409264787456,32,0,0,0
MarshaBlackburn,Sen. Marsha Blackburn,1561348943589539840,278145569,en,1561348943589539840,2022-08-21T13:46:11.000Z,"“He will wipe away every tear from their eyes, and death shall be no more, neither shall there be mourning, nor crying, nor pain anymore, for the former things have passed away.” — Revelation 21:4",False,1561348943589539840,621,3069,3069,216
MarshaBlackburn,Sen. Marsha Blackburn,1561062460227993600,278145569,en,1561062460227993600,2022-08-20T18:47:48.000Z,The Biden administration must reject any deal with the dangerous Iranian regime to signal to the world that the United States will not abide terrorism.,False,1561062460227993600,1006,1447,1447,136
MarshaBlackburn,Sen. Marsha Blackburn,1560781059259777026,278145569,en,1560781059259777026,2022-08-20T00:09:37.000Z,"Ended the day in Loudon County, where we discussed the importance of cutting big government bureaucracy to allow our local communities and families to make the best decisions for themselves. https://t.co/NtrsERPeFt",False,1560638627754950656,29,74,74,2
MarshaBlackburn,Sen. Marsha Blackburn,1560780958156070912,278145569,en,1560780958156070912,2022-08-20T00:09:12.000Z,"Blount County leaders are troubled with the latest passage of a $739 billion spending package, which includes funding for 87,000 new IRS agents. 

Biden’s #BuildBackBroke plan will increase taxes and devastate Main Street America. https://t.co/9YXMDg9hHM",False,1560638627754950656,50,141,141,13
MarshaBlackburn,Sen. Marsha Blackburn,1560780948064567297,278145569,en,1560780948064567297,2022-08-20T00:09:10.000Z,"In Sevier County, I heard from many people worried about the grip Communist China has on U.S. sectors — from technology to agriculture to manufacturing.

Bring manufacturing back to the USA, and stop the CCP’s purchase of American farmland. https://t.co/lffKb90Pgc",False,1560638627754950656,23,22,22,3
