handle,name,tweet_id,author_id,lang,replied_to,created_at,tweet_text,possibly_sensitive,conversation_id,retweet_count,reply_count,like_count,quote_count
MarshaBlackburn,Sen. Marsha Blackburn,1499749628484497416,278145569,en,1499749628484497416,2022-03-04T14:12:30.000Z,"Dr. Fauci’s agency lied to you about the origins of COVID-19, and they lied to you about China’s role in this pandemic.

No tax dollar should ever fund these kinds of lies again.",False,1499749628484497416,1546,792,792,104
MarshaBlackburn,Sen. Marsha Blackburn,1499590502408237060,278145569,en,1499590502408237060,2022-03-04T03:40:11.000Z,The pandemic was long over before today; Democrats just didn’t want to admit it.,False,1499590502408237060,1208,755,755,71
MarshaBlackburn,Sen. Marsha Blackburn,1499567112695824385,278145569,en,1499567112695824385,2022-03-04T02:07:14.000Z,"Putin is accusing a Jewish president of being pro-Nazi when, in fact, he is aiming missiles at highly Jewish populated areas in Ukraine.
https://t.co/zLydLkuGb7",False,1499567112695824385,97,130,130,13
MarshaBlackburn,Sen. Marsha Blackburn,1499540252029071360,278145569,en,1499540252029071360,2022-03-04T00:20:30.000Z,Send her to the southern border. https://t.co/LEhIdVIFx2,False,1499540252029071360,177,419,419,44
MarshaBlackburn,Sen. Marsha Blackburn,1499527513239867392,278145569,en,1499527513239867392,2022-03-03T23:29:53.000Z,"Two years ago today, tornadoes ravaged across Middle TN causing devastating loss for so many. Today, we continue to stand with all those who were affected by this horrific day. https://t.co/q0OSZ15je5",False,1499527513239867392,25,40,40,0
MarshaBlackburn,Sen. Marsha Blackburn,1499511611903688704,278145569,en,1499511611903688704,2022-03-03T22:26:42.000Z,"We are thrilled that day will soon arrive. We thank all who have worked tirelessly alongside them to make this joyful homecoming a reality, and we wish them all happiness as they return home to Tennessee.",False,1499511610314010635,12,8,8,0
MarshaBlackburn,Sen. Marsha Blackburn,1499511610314010635,278145569,en,1499511610314010635,2022-03-03T22:26:42.000Z,"Greg and Dee Kelly have endured an ordeal that has spanned years of false allegations, confinement to Japan and a lengthy court battle. They have been strong &amp; kept up hope that they would be able to return home to their family, children, grandchildren, friends and community.",False,1499511610314010635,25,11,11,0
MarshaBlackburn,Sen. Marsha Blackburn,1499504373155647489,278145569,en,1499504373155647489,2022-03-03T21:57:56.000Z,"If Putin's oil dried up, he would be left with an empty tank.",False,1499504373155647489,515,984,984,109
MarshaBlackburn,Sen. Marsha Blackburn,1499487196184731654,278145569,en,1499487196184731654,2022-03-03T20:49:41.000Z,Where was Biden’s plan in his State of the Union address to counter our adversaries? https://t.co/NxoKwLYwU5,False,1499487196184731654,104,169,169,10
MarshaBlackburn,Sen. Marsha Blackburn,1499464811394088961,278145569,en,1499464811394088961,2022-03-03T19:20:44.000Z,"When Putin and Xi met at the Olympic Opening Ceremony, were they discussing Russia’s ‘perfect’ time to invade Ukraine?",False,1499464811394088961,332,267,267,32
MarshaBlackburn,Sen. Marsha Blackburn,1499447876140867586,278145569,en,1499447876140867586,2022-03-03T18:13:26.000Z,"TikTok’s days of putting profit above the wellbeing of our kids, and getting away with it, are over.

Yesterday’s announcement of a nationwide, bipartisan probe into TikTok compliments the Kids Online Safety Act to demand much-needed accountability. @SenBlumenthal",False,1499447876140867586,58,74,74,9
MarshaBlackburn,Sen. Marsha Blackburn,1499447531952082944,278145569,en,1499447531952082944,2022-03-03T18:12:04.000Z,"RT @TNMilitaryDept: Today is Tennessee National Guard Day, a day, proclaimed by the Governor, to honor and recognize Tennessee National Gua…",False,1499447531952082944,33,0,0,0
MarshaBlackburn,Sen. Marsha Blackburn,1499422582994522113,278145569,en,1499422582994522113,2022-03-03T16:32:56.000Z,"Everyone knew China was withholding data, but the agency Fauci had oversight of lied about it anyway. 

Why would they do that? Where does their loyalty lie?",False,1499422582994522113,753,404,404,58
MarshaBlackburn,Sen. Marsha Blackburn,1499401207302934531,278145569,en,1499401207302934531,2022-03-03T15:08:00.000Z,Communist China reportedly asked Russia to wait until after the Genocide Games to invade Ukraine.,False,1499401207302934531,433,195,195,34
MarshaBlackburn,Sen. Marsha Blackburn,1499393874829086726,278145569,en,1499393874829086726,2022-03-03T14:38:51.000Z,"Good on them. 

Companies should do the same with Communist China. https://t.co/B7oR94IX11",False,1499393874829086726,68,94,94,12
MarshaBlackburn,Sen. Marsha Blackburn,1499371090539335680,278145569,en,1499371090539335680,2022-03-03T13:08:19.000Z,"This month, we celebrate and commemorate the tremendous strides women in America have made. Here’s to the women who make history! #WomensHistoryMonth https://t.co/et6v5qrcuo",False,1499371090539335680,26,275,275,24
MarshaBlackburn,Sen. Marsha Blackburn,1499187330913079296,278145569,en,1499187330913079296,2022-03-03T00:58:07.000Z,Biden sure didn’t make his party happy with his “fund the police” remarks last night. https://t.co/Ce2R9e1Yfz,False,1499187330913079296,128,185,185,11
MarshaBlackburn,Sen. Marsha Blackburn,1499172729014177792,278145569,en,1499172729014177792,2022-03-03T00:00:06.000Z,Praying for the orphans in Ukraine.,False,1499172729014177792,452,455,455,36
MarshaBlackburn,Sen. Marsha Blackburn,1499169703092269061,278145569,en,1499169703092269061,2022-03-02T23:48:05.000Z,"You’re right, Jen. This is a pattern of weak leadership. https://t.co/cFJPePSGSZ",False,1499169703092269061,220,192,192,10
MarshaBlackburn,Sen. Marsha Blackburn,1499155562856079360,278145569,en,1499155562856079360,2022-03-02T22:51:53.000Z,RT @SenatorHagerty: Huge group of Tennesseans at yesterday’s #TennesseeTuesday with @MarshaBlackburn! Washington always feels a little more…,False,1499155562856079360,17,0,0,0
MarshaBlackburn,Sen. Marsha Blackburn,1499151688581664771,278145569,en,1499151688581664771,2022-03-02T22:36:30.000Z,"RT @thehill: Sen. Marsha Blackburn: ""Tennesseans want the spending brought under control, they want inflation to be dealt with, they want t…",False,1499151688581664771,32,0,0,0
MarshaBlackburn,Sen. Marsha Blackburn,1499146482666164231,278145569,en,1499146482666164231,2022-03-02T22:15:48.000Z,"Over 150K people a day in Ukraine, Belarus &amp; Russia continue to access the internet despite the Russian government intensifying its censorship operation. This is thanks to @PsiphonInc, made possible by the bipartisan Open Technology Fund Authorization Act I led w/@SenatorMenendez",False,1499146482666164231,33,46,46,4
MarshaBlackburn,Sen. Marsha Blackburn,1499137993830973441,278145569,en,1499137993830973441,2022-03-02T21:42:05.000Z,"RT @TheTNStar: Senator Blackburn Introduces Resolution to Urge Biden Administration to Remove Russia from the UN Security Council
https://t…",False,1499137993830973441,20,0,0,0
MarshaBlackburn,Sen. Marsha Blackburn,1499127515050393601,278145569,en,1499127515050393601,2022-03-02T21:00:26.000Z,"Putin’s actions against the Ukrainian people cannot be tolerated. 

Remove Russia entirely from the SWIFT banking system and UN Security Council immediately.",False,1499127515050393601,236,213,213,28
MarshaBlackburn,Sen. Marsha Blackburn,1499105764228702212,278145569,en,1499105764228702212,2022-03-02T19:34:00.000Z,"Thank you, @AMVETSHQ of Tennessee, for stopping by this morning! It’s an honor to fight for Tennessee veterans and ensure they have access to the care they deserve. https://t.co/FdbRkii9ud",False,1499105764228702212,8,37,37,1
MarshaBlackburn,Sen. Marsha Blackburn,1499072282802720768,278145569,en,1499072282802720768,2022-03-02T17:20:58.000Z,"Biden’s plan is still a liberal wish list that keeps our borders open, increases our debt, and makes America dependent on tyrannical regimes for energy. https://t.co/A0icUTUqjk",False,1499072282802720768,178,272,272,15
MarshaBlackburn,Sen. Marsha Blackburn,1499052949569425413,278145569,en,1499052949569425413,2022-03-02T16:04:08.000Z,"Joe Biden and Kamala Harris weaponized COVID.

They refused to take a vaccine developed by President Trump.",False,1499052949569425413,767,3858,3858,569
MarshaBlackburn,Sen. Marsha Blackburn,1499017365056598020,278145569,en,1499017365056598020,2022-03-02T13:42:44.000Z,Joe Biden gifted Putin the Nord Stream 2 pipeline and is pushing for a new Iran nuclear deal to push Iranian oil into the world market.,False,1499017365056598020,734,325,325,50
MarshaBlackburn,Sen. Marsha Blackburn,1498869133785579521,278145569,en,1498869133785579521,2022-03-02T03:53:43.000Z,Joe Biden is attempting to rewrite history — his party is leading the fight to defund the police. https://t.co/y8Ptvcv9rT,False,1498869133785579521,164,158,158,15
MarshaBlackburn,Sen. Marsha Blackburn,1498859578368434184,278145569,en,1498859578368434184,2022-03-02T03:15:45.000Z,"Like I said, build the wall.",False,1498859578368434184,459,400,400,27
MarshaBlackburn,Sen. Marsha Blackburn,1498858330122592256,278145569,en,1498858330122592256,2022-03-02T03:10:47.000Z,The state of our union is weakened by Joe Biden’s leadership.,False,1498858330122592256,276,322,322,24
MarshaBlackburn,Sen. Marsha Blackburn,1498858150577020931,278145569,en,1498858150577020931,2022-03-02T03:10:05.000Z,Is Joe Biden delusional? Americans are suffering under his failed leadership.,False,1498858150577020931,331,218,218,25
MarshaBlackburn,Sen. Marsha Blackburn,1498857958209474567,278145569,en,1498857958209474567,2022-03-02T03:09:19.000Z,"Joe Biden thinks Americans are better off under his policies.
 
How do rising inflation, an unprecedented border crisis, and emboldened adversaries make us better off?",False,1498857958209474567,82,94,94,9
MarshaBlackburn,Sen. Marsha Blackburn,1498855264400949248,278145569,en,1498855264400949248,2022-03-02T02:58:37.000Z,"Want infrastructure? 

Build the wall.",False,1498855264400949248,1778,2261,2261,211
MarshaBlackburn,Sen. Marsha Blackburn,1498855072096301058,278145569,en,1498855072096301058,2022-03-02T02:57:51.000Z,"Instead of securing the border, Joe Biden has put the lives of women, children, and families knowingly into the hands of cartels. #SOTU",False,1498855072096301058,110,69,69,2
MarshaBlackburn,Sen. Marsha Blackburn,1498854489616527361,278145569,en,1498854489616527361,2022-03-02T02:55:32.000Z,"Voter ID is necessary to vote in U.S. elections, and that's the way it should stay.",False,1498854489616527361,338,109,109,10
MarshaBlackburn,Sen. Marsha Blackburn,1498854187928596482,278145569,en,1498854187928596482,2022-03-02T02:54:20.000Z,Joe Biden would rather fire unvaccinated police officers than back the blue. #SOTU,False,1498854187928596482,152,91,91,6
MarshaBlackburn,Sen. Marsha Blackburn,1498853932872908801,278145569,en,1498853932872908801,2022-03-02T02:53:19.000Z,Democrats’ demands to “Defund the Police” have ruined our cities.,False,1498853932872908801,109,83,83,3
MarshaBlackburn,Sen. Marsha Blackburn,1498852914135281671,278145569,en,1498852914135281671,2022-03-02T02:49:16.000Z,Mask theater does not stop the spread of COVID-19. #SOTU,False,1498852914135281671,29,68,68,5
MarshaBlackburn,Sen. Marsha Blackburn,1498852574090383362,278145569,en,1498852574090383362,2022-03-02T02:47:55.000Z,"For the left, it’s never been about science – it’s always been about power. #SOTU",False,1498852574090383362,95,134,134,9
MarshaBlackburn,Sen. Marsha Blackburn,1498852198322778112,278145569,en,1498852198322778112,2022-03-02T02:46:26.000Z,Don't let the left fool you. They are only lifting COVID restrictions now because it's politically expedient to do so. #SOTU,False,1498852198322778112,385,136,136,11
MarshaBlackburn,Sen. Marsha Blackburn,1498851636390895621,278145569,en,1498851636390895621,2022-03-02T02:44:12.000Z,"Want to lower the deficit? 

Spend less and cut the size of the federal government. #SOTU",False,1498851636390895621,69,168,168,5
MarshaBlackburn,Sen. Marsha Blackburn,1498851217837113344,278145569,en,1498851217837113344,2022-03-02T02:42:32.000Z,"If Joe wants to return manufacturing to the US, he should support my SAM-C bill to bring back pharmaceutical manufacturing from Communist China. #SOTU",False,1498851217837113344,111,70,70,7
MarshaBlackburn,Sen. Marsha Blackburn,1498850896960180233,278145569,en,1498850896960180233,2022-03-02T02:41:15.000Z,"Joe is laying it out. 

He wants cradle to grave government control. #SOTU",False,1498850896960180233,102,89,89,11
MarshaBlackburn,Sen. Marsha Blackburn,1498850431283478529,278145569,en,1498850431283478529,2022-03-02T02:39:24.000Z,Biden spent over $3 trillion in taxpayer dollars last year in the name of 'COVID relief' and 'infrastructure.' Americans do not want his socialist 'Build Back Broke' plan. #SOTU,False,1498850431283478529,103,76,76,9
MarshaBlackburn,Sen. Marsha Blackburn,1498849609086550017,278145569,en,1498849609086550017,2022-03-02T02:36:08.000Z,Inflation is a tax on hardworking American families courtesy of Joe Biden. #SOTU,False,1498849609086550017,125,81,81,4
MarshaBlackburn,Sen. Marsha Blackburn,1498848685907755014,278145569,en,1498848685907755014,2022-03-02T02:32:28.000Z,Biden’s reckless spending is pushing prices even higher. #SOTU,False,1498848685907755014,59,58,58,4
MarshaBlackburn,Sen. Marsha Blackburn,1498847876516044803,278145569,en,1498847876516044803,2022-03-02T02:29:15.000Z,Joe Biden canceled the Keystone Pipeline – but he gifted Putin the Nordstream 2 pipeline. #SOTU,False,1498847876516044803,440,124,124,12
MarshaBlackburn,Sen. Marsha Blackburn,1498846991257849856,278145569,en,1498846991257849856,2022-03-02T02:25:44.000Z,Biden has taxed hardworking Americans while Trump gave us a tax cut. #Inflation #SOTU2022,False,1498846991257849856,566,356,356,29
MarshaBlackburn,Sen. Marsha Blackburn,1498846537488683015,278145569,en,1498846537488683015,2022-03-02T02:23:56.000Z,"Under Joe Biden, inflation is the highest it's been in four decades. #SOTU2022",False,1498846537488683015,539,152,152,20
MarshaBlackburn,Sen. Marsha Blackburn,1498845410181402624,278145569,en,1498845410181402624,2022-03-02T02:19:27.000Z,Russia is a gas station with an army. #SOTU2022,False,1498845410181402624,63,115,115,12
MarshaBlackburn,Sen. Marsha Blackburn,1498844898300239879,278145569,en,1498844898300239879,2022-03-02T02:17:25.000Z,Joe Biden has given up the biggest bargaining chip we’ve had against the New Axis of Evil — energy independence.,False,1498844898300239879,130,66,66,11
MarshaBlackburn,Sen. Marsha Blackburn,1498844169200099336,278145569,en,1498844169200099336,2022-03-02T02:14:31.000Z,This is the second time Putin has invaded a foreign country while Joe Biden has been in the White House. #SOTU2022,False,1498844169200099336,151,76,76,7
MarshaBlackburn,Sen. Marsha Blackburn,1498843607385710597,278145569,en,1498843607385710597,2022-03-02T02:12:17.000Z,The United States is back to leading from behind under President Biden. #SOTU2022,False,1498843607385710597,68,73,73,5
MarshaBlackburn,Sen. Marsha Blackburn,1498835382389125120,278145569,en,1498835382389125120,2022-03-02T01:39:36.000Z,"Agree with @IngrahamAngle – Biden must sanction Communist China for bolstering Russia’s invasion of Ukraine.
 
Russia, China, Iran and North Korea are the new axis of evil.
 
They must be stopped. https://t.co/dmx0r74mcE",False,1498835382389125120,61,59,59,15
MarshaBlackburn,Sen. Marsha Blackburn,1498833222632935430,278145569,en,1498833222632935430,2022-03-02T01:31:01.000Z,My heart breaks for my fellow Christians in Ukraine that are fighting for their freedom. Christians around the world should join us and pray for Ukraine. 🇺🇦 https://t.co/qMd6A4iVvF,False,1498833222632935430,50,1068,1068,239
MarshaBlackburn,Sen. Marsha Blackburn,1498829680509693954,278145569,en,1498829680509693954,2022-03-02T01:16:57.000Z,Russia does not deserve a seat on the UN Security Council after its egregious actions toward Ukraine. https://t.co/qz24oQcHMK,False,1498829680509693954,72,78,78,9
MarshaBlackburn,Sen. Marsha Blackburn,1498825959142744064,278145569,en,1498825959142744064,2022-03-02T01:02:10.000Z,"Joe Biden has had over a year to secure the border.

Instead, he’s made it worse.",False,1498825959142744064,574,367,367,38
MarshaBlackburn,Sen. Marsha Blackburn,1498787977719431172,278145569,en,1498787977719431172,2022-03-01T22:31:14.000Z,The UN must strip Russia of its ability to veto in the security council.,False,1498787977719431172,219,162,162,23
MarshaBlackburn,Sen. Marsha Blackburn,1498774541786660865,278145569,en,1498774541786660865,2022-03-01T21:37:51.000Z,It’s time to stop financing Putin’s war and restart America’s energy.,False,1498774541786660865,1060,369,369,58
MarshaBlackburn,Sen. Marsha Blackburn,1498757349028290566,278145569,en,1498757349028290566,2022-03-01T20:29:32.000Z,Russia must be exiled from the international community for its war crimes and unprovoked attack on innocent Ukrainians. https://t.co/PlvAULsLJB,False,1498757349028290566,91,149,149,18
MarshaBlackburn,Sen. Marsha Blackburn,1498743766496202756,278145569,en,1498743766496202756,2022-03-01T19:35:33.000Z,Pray for Ukrainian freedom fighters 🇺🇦 https://t.co/im871wBBmm,False,1498743766496202756,85,220,220,15
MarshaBlackburn,Sen. Marsha Blackburn,1498728399786987521,278145569,en,1498728399786987521,2022-03-01T18:34:30.000Z,"Thank you, @elonmusk, for supporting the freedom fighters in Ukraine. Starlink will assist thousands of men and women in their fight to stand up to Putin.",False,1498728399786987521,301,206,206,10
MarshaBlackburn,Sen. Marsha Blackburn,1498698323544481807,278145569,en,1498698323544481807,2022-03-01T16:34:59.000Z,Joe Biden has given up the biggest bargaining chip we have against evil — energy independence.,False,1498698323544481807,1460,496,496,98
MarshaBlackburn,Sen. Marsha Blackburn,1498687571123220483,278145569,zxx,1498687571123220483,2022-03-01T15:52:15.000Z,https://t.co/P2tgcSjRtu,False,1498686868879294469,73,71,71,5
MarshaBlackburn,Sen. Marsha Blackburn,1498686868879294469,278145569,en,1498686868879294469,2022-03-01T15:49:28.000Z,"In his #SOTU address tonight, Biden should address if his administration lied — did $5 million in federal taxpayer dollars go toward funding crack pipes in the name of ‘COVID relief?’",False,1498686868879294469,417,328,328,34
MarshaBlackburn,Sen. Marsha Blackburn,1498673112438775813,278145569,en,1498673112438775813,2022-03-01T14:54:48.000Z,"Using their playbook from Syria, Russian military forces are allegedly employing cluster munitions against at least two civilian targets.

That is a war crime.",False,1498673112438775813,249,226,226,25
MarshaBlackburn,Sen. Marsha Blackburn,1498639786264911876,278145569,en,1498639786264911876,2022-03-01T12:42:23.000Z,Americans have made it clear they want a secure border.,False,1498639786264911876,818,537,537,68
MarshaBlackburn,Sen. Marsha Blackburn,1498484279176839173,278145569,en,1498484279176839173,2022-03-01T02:24:27.000Z,Tennessee mamas aren’t happy under Biden’s failed policies! https://t.co/CFxtGa60mK,False,1498484279176839173,166,292,292,20
MarshaBlackburn,Sen. Marsha Blackburn,1498474341289312257,278145569,en,1498474341289312257,2022-03-01T01:44:57.000Z,Borders matter — Joe Biden needs to secure our southern one.,False,1498474341289312257,691,379,379,49
MarshaBlackburn,Sen. Marsha Blackburn,1498453529127788553,278145569,en,1498453529127788553,2022-03-01T00:22:15.000Z,"The Women’s Health Protection Act is an attack against the health of women &amp; unborn children. Today, I voted against this legislation which would open the pathway for abortion on demand &amp; legalize late term abortions.",False,1498453529127788553,208,182,182,16
MarshaBlackburn,Sen. Marsha Blackburn,1498445130466041856,278145569,en,1498445130466041856,2022-02-28T23:48:53.000Z,"The Keystone pipeline decreased our reliance on the Kremlin, and Joe Biden closed it.",False,1498445130466041856,1869,884,884,114
MarshaBlackburn,Sen. Marsha Blackburn,1498409493016846339,278145569,en,1498409493016846339,2022-02-28T21:27:16.000Z,"Under President Trump, America was an energy exporter. Now, the US &amp; Europe are empowering Russia with energy dependence.

https://t.co/WTYZtW2oBk",False,1498409493016846339,105,191,191,17
MarshaBlackburn,Sen. Marsha Blackburn,1498390237772406790,278145569,en,1498390237772406790,2022-02-28T20:10:46.000Z,My heartfelt sympathies are extended to Senator Feinstein and her family.,False,1498390237772406790,87,166,166,15
MarshaBlackburn,Sen. Marsha Blackburn,1498367017002455040,278145569,en,1498367017002455040,2022-02-28T18:38:29.000Z,Consumer goods are up in price from the Biden administration’s America last policies.,False,1498367017002455040,320,504,504,23
MarshaBlackburn,Sen. Marsha Blackburn,1498337538418917376,278145569,en,1498337538418917376,2022-02-28T16:41:21.000Z,Communist China is watching closely right now.,False,1498337538418917376,430,537,537,61
MarshaBlackburn,Sen. Marsha Blackburn,1498310617408708614,278145569,en,1498310617408708614,2022-02-28T14:54:23.000Z,Putin is committing war crimes.,False,1498310617408708614,553,993,993,111
MarshaBlackburn,Sen. Marsha Blackburn,1498276516630872071,278145569,en,1498276516630872071,2022-02-28T12:38:52.000Z,"If Biden knew Putin was preparing for this, why didn’t he do anything?",False,1498276516630872071,1700,1795,1795,254
MarshaBlackburn,Sen. Marsha Blackburn,1498135010628542465,278145569,en,1498135010628542465,2022-02-28T03:16:35.000Z,Securing our southern border must become a priority for the Biden administration.,False,1498135010628542465,1212,1339,1339,128
MarshaBlackburn,Sen. Marsha Blackburn,1498111855843237889,278145569,en,1498111855843237889,2022-02-28T01:44:34.000Z,RT @TravelGov: Russia: Airlines are cancelling flights in/out of Russia; numerous countries closed airspace to Russian airlines. U.S. citiz…,False,1498111855843237889,1107,0,0,0
MarshaBlackburn,Sen. Marsha Blackburn,1498102744552554500,278145569,en,1498102744552554500,2022-02-28T01:08:22.000Z,"RT @DesJarlaisTN04: Our @TennesseeGuard members are the best and brightest in the country.

I was honored to have the opportunity to speak…",False,1498102744552554500,10,0,0,0
MarshaBlackburn,Sen. Marsha Blackburn,1498101987908407302,278145569,en,1498101987908407302,2022-02-28T01:05:21.000Z,"Yesterday, I was honored to be with members of our @TNMilitaryDept @TennesseeGuard at their annual conference. These men and women represent the very best of our state, and we are so grateful for their service. @GovBillLee https://t.co/fYf8Y0lNsz",False,1498101987908407302,33,101,101,5
MarshaBlackburn,Sen. Marsha Blackburn,1498073884200943621,278145569,en,1498073884200943621,2022-02-27T23:13:41.000Z,"Migrant encounters nearly doubled this January compared to January 2021. 

Now is the time to secure the southern border.",False,1498073884200943621,442,294,294,41
MarshaBlackburn,Sen. Marsha Blackburn,1498033824223182855,278145569,en,1498033824223182855,2022-02-27T20:34:30.000Z,We must no longer rely on the Kremlin for energy. America must be energy independent.,False,1498033824223182855,2716,1610,1610,238
MarshaBlackburn,Sen. Marsha Blackburn,1498001202663071745,278145569,en,1498001202663071745,2022-02-27T18:24:52.000Z,"In 2021, Border Patrol apprehended more than 2 million immigrants from 160 countries attempting to cross our southern border illegally — not including the 600k known ‘got-aways.’ 

2022 is already on track to shatter those records. #BuildTheWall",False,1498001202663071745,394,313,313,42
MarshaBlackburn,Sen. Marsha Blackburn,1497951734924259336,278145569,en,1497951734924259336,2022-02-27T15:08:18.000Z,“It is the Lord who goes before you. He will be with you; he will not leave you or forsake you. Do not fear or be dismayed.” — Deuteronomy 31:8,False,1497951734924259336,542,1254,1254,94
MarshaBlackburn,Sen. Marsha Blackburn,1497927845091463172,278145569,en,1497927845091463172,2022-02-27T13:33:23.000Z,"RT @MZHemingway: Remember when Trump repeatedly called for moves like this to guard against Russia, and the propaganda press and other Demo…",False,1497927845091463172,2585,0,0,0
MarshaBlackburn,Sen. Marsha Blackburn,1497784790484979715,278145569,en,1497784790484979715,2022-02-27T04:04:56.000Z,"This is about holding a tyrant accountable. The United States must not stand for this kind of behavior, and we must ensure the world remembers the heinous crimes Vladimir Putin is committing.",False,1497784790484979715,517,734,734,76
MarshaBlackburn,Sen. Marsha Blackburn,1497772705445199872,278145569,en,1497772705445199872,2022-02-27T03:16:54.000Z,"Thank you, @V_Omelyan, for your bravery. A former Infrastructure Minister, he has left his family at home to take up arms and fight on the front lines against Russia. The USA is praying for you and all Ukrainians. 🇺🇸🇺🇦 https://t.co/iblwnPpnxi",False,1497772705445199872,62,98,98,5
MarshaBlackburn,Sen. Marsha Blackburn,1497745948499496960,278145569,en,1497745948499496960,2022-02-27T01:30:35.000Z,"RT @EricShawnTV: Vladimir Putin is an enemy of America and the ideals that we hold dear...democracy, human decency and human rights. Watch:…",False,1497745948499496960,24,0,0,0
MarshaBlackburn,Sen. Marsha Blackburn,1497713022101458944,278145569,en,1497713022101458944,2022-02-26T23:19:45.000Z,RT @elonmusk: @FedorovMykhailo Starlink service is now active in Ukraine. More terminals en route.,False,1497713022101458944,132775,0,0,0
