handle,name,tweet_id,author_id,lang,replied_to,created_at,tweet_text,possibly_sensitive,conversation_id,retweet_count,reply_count,like_count,quote_count
RepBarryMoore,Rep. Barry Moore,1601260349726265344,1339006078688825344,en,1601260349726265344,2022-12-09T16:59:52.000Z,RT @HouseVetAffairs: Great to be with @MissionRollCall yesterday to sign and send holiday cards to veterans who will be spending this Chris…,False,1601260349726265344,6,0,0,0
RepBarryMoore,Rep. Barry Moore,1600907018671312898,1339006078688825344,en,1600907018671312898,2022-12-08T17:35:51.000Z,The “Respect for Marriage Act” is a gift to radical progressive activists and a politicized DOJ who are hostile to Americans who hold faith in anything other than a benevolent big government. See my full statement below: https://t.co/tSwsWqz8Tn,False,1600907018671312898,4,11,11,5
RepBarryMoore,Rep. Barry Moore,1600572913077608448,1339006078688825344,en,1600572913077608448,2022-12-07T19:28:14.000Z,Ukraine is a young nation with rampant political corruption. With so many problems here at home - including historic inflation fueled by gov't spending &amp; a border crisis being ignored by Washington - don't the American people deserve to know how Kyiv is (mis)spending their money? https://t.co/uyhWuUh1ph,False,1600572913077608448,326,265,265,20
RepBarryMoore,Rep. Barry Moore,1600553688724115456,1339006078688825344,en,1600553688724115456,2022-12-07T18:11:50.000Z,God bless our law enforcement at the border. They face danger every day despite Washington not having their backs. Prayers lifted for this agent and his family. https://t.co/c4xay2Tvmp,False,1600553688724115456,0,1,1,0
RepBarryMoore,Rep. Barry Moore,1600521311071125506,1339006078688825344,en,1600521311071125506,2022-12-07T16:03:11.000Z,"Today, on this date which will live in infamy, we honor the brave men and women who perished 81 years ago during the attack on Pearl Harbor. Their service and sacrifice will never be forgotten. https://t.co/UwSetxP9RN",False,1600521311071125506,5,6,6,0
RepBarryMoore,Rep. Barry Moore,1600203423940370434,1339006078688825344,en,1600203423940370434,2022-12-06T19:00:01.000Z,"If they could, every single drug trafficker south of the border would vote for Joe Biden for president. That is why my colleagues and I will not vote for a spending package unless he takes necessary steps to improve our border security. https://t.co/eRBVT6VyXe",False,1600203423940370434,5,8,8,0
RepBarryMoore,Rep. Barry Moore,1600158025087868929,1339006078688825344,en,1600158025087868929,2022-12-06T15:59:37.000Z,"RT @HouseVetAffairs: While VA, HUD, other agencies, and hundreds of government and non-profit partners have made great strides in reducing…",False,1600158025087868929,2,0,0,0
RepBarryMoore,Rep. Barry Moore,1599839410123440129,1339006078688825344,en,1599839410123440129,2022-12-05T18:53:33.000Z,"Parents deserve a say in their children's education. No ideological cabal plotting to undermine parents - or use them as puppets to covertly push subversive schemes - can be allowed to guide Dept. of Education policy.

This is a great day for students and parents! https://t.co/pyI6q7kKEb",False,1599839410123440129,18,2,2,1
RepBarryMoore,Rep. Barry Moore,1599569247897788421,1339006078688825344,en,1599569247897788421,2022-12-05T01:00:01.000Z,"Do you need assistance with a federal agency? This month, my staff will be hosting mobile office hours in several counties! https://t.co/MUVDqkZnig",False,1599569247897788421,2,8,8,0
RepBarryMoore,Rep. Barry Moore,1599201148543463425,1339006078688825344,en,1599201148543463425,2022-12-04T00:37:20.000Z,Congratulations to Coach Sumrall and @TroyTrojansFB on their 45-26 victory over the Coastal Carolina Chanticleers in the Sun Belt Football Championship! https://t.co/ZnRmHTg3FZ,False,1599201148543463425,3,1,1,0
RepBarryMoore,Rep. Barry Moore,1598678695773933568,1339006078688825344,en,1598678695773933568,2022-12-02T14:01:17.000Z,I am excited to announce that my bipartisan bill with @RepMikeLevin passed the House of Representatives yesterday! The Mark O’Brien VA Clothing Allowance Act simplifies the process for veterans with service-connected conditions to receive the clothing allowances they deserve.,False,1598678695773933568,5,5,5,0
RepBarryMoore,Rep. Barry Moore,1598339107226255360,1339006078688825344,en,1598339107226255360,2022-12-01T15:31:53.000Z,"On this day in 1955, Rosa Parks was arrested for refusing to give up her seat on a Montgomery city bus. Today we celebrate her brave action which sparked the modern civil rights movement and her inspiring lifelong fight against injustice. https://t.co/zGyzTRDvkP",False,1598339107226255360,3,5,5,0
RepBarryMoore,Rep. Barry Moore,1597982895804743682,1339006078688825344,en,1597982895804743682,2022-11-30T15:56:26.000Z,Heather and I are praying for all the families affected by last night’s severe weather. My staff is monitoring the situation and ready to help with any related federal issues – please call us if you need assistance.  https://t.co/sJHNRg9haO,False,1597982895804743682,2,1,1,1
RepBarryMoore,Rep. Barry Moore,1597314226837934081,1339006078688825344,en,1597314226837934081,2022-11-28T19:39:22.000Z,Are you concerned about safety in your community? Frustrated about our open southern border? I want to hear from you tomorrow at my Law and Order Telephone Town Hall at 7PM CT! Call in or sign up to be called using the information below. https://t.co/7DF5XMsD64,False,1597314226837934081,3,5,5,0
RepBarryMoore,Rep. Barry Moore,1597017426083840000,1339006078688825344,en,1597017426083840000,2022-11-28T00:00:00.000Z,"Need help with a federal agency? Check out my upcoming mobile office hours calendar below! At mobile office hours, my staff will assist those who may have questions concerning Social Security benefits, veterans’ services, passports, or any other federal agency matter. https://t.co/rMUb9Y0hWl",False,1597017426083840000,3,8,8,0
RepBarryMoore,Rep. Barry Moore,1596556536037273601,1339006078688825344,en,1596556536037273601,2022-11-26T17:28:35.000Z,It’s Small Business Saturday! These institutions are the lifeblood of our communities. Make sure to check out some of our wonderful small businesses in southeast Alabama today!,False,1596556536037273601,2,10,10,0
RepBarryMoore,Rep. Barry Moore,1596204815595409408,1339006078688825344,en,1596204815595409408,2022-11-25T18:10:58.000Z,"A lethal dose of fentanyl is small enough to fit on the tip of a pencil. With 2.3 million migrant encounters at our southern border this fiscal year alone, how many lethal doses have made their way into our country?",False,1596204815595409408,10,24,24,3
RepBarryMoore,Rep. Barry Moore,1595816215603470337,1339006078688825344,en,1595816215603470337,2022-11-24T16:26:49.000Z,"Happy Thanksgiving! May you and your family enjoy a warm meal and a wonderful day of fellowship. 
“Enter his gates with thanksgiving and his courts with praise; give thanks to him and praise his name.” Psalm 100:4 https://t.co/Cki3G1HtO0",False,1595816215603470337,2,7,7,0
RepBarryMoore,Rep. Barry Moore,1595469521166499841,1339006078688825344,en,1595469521166499841,2022-11-23T17:29:10.000Z,"Thanks to President Biden’s policies, this is set to be the most expensive Thanksgiving in 40 years for American families. https://t.co/QFd9aLstaN",False,1595469521166499841,4,8,8,1
RepBarryMoore,Rep. Barry Moore,1595461914569723905,1339006078688825344,en,1595461914569723905,2022-11-23T16:58:57.000Z,"Politics TOUCHES everything, but politics ISN’T everything.

I hope y’all will join me in putting politics aside at the dinner table and simply enjoying the Thanksgiving holiday with loved ones. https://t.co/5GRLM2q1T8",False,1595461914569723905,13,6,6,2
RepBarryMoore,Rep. Barry Moore,1595460857542090755,1339006078688825344,en,1595460857542090755,2022-11-23T16:54:45.000Z,"RT @1819News: .@RepBarryMoore cosponsors bill to audit funds sent to Ukraine
By @CraigMonger1819 

https://t.co/DH5o7HW3xG",False,1595460857542090755,4,0,0,0
RepBarryMoore,Rep. Barry Moore,1594886600361938944,1339006078688825344,en,1594886600361938944,2022-11-22T02:52:51.000Z,"RT @yhn: “Ukraine is a young democracy, and we are sending American taxpayer money over there with no oversight. It creates problems, it cr…",False,1594886600361938944,6,0,0,0
RepBarryMoore,Rep. Barry Moore,1594727056205651968,1339006078688825344,en,1594727056205651968,2022-11-21T16:18:53.000Z,"Congratulations to Enterprise native Marcus Jones, who won the game for the New England Patriots yesterday in the final seconds of regulation against the New York Jets with an 84-yard punt return! https://t.co/aJuUlmV3dV",False,1594727056205651968,1,1,1,0
RepBarryMoore,Rep. Barry Moore,1594717196873236481,1339006078688825344,en,1594717196873236481,2022-11-21T15:39:42.000Z,"Democrats call the Capitol the ""Temple of Democracy"" but blocked the American people from entering. 🤔 https://t.co/BXceXsWAuf",False,1594717196873236481,1,2,2,1
RepBarryMoore,Rep. Barry Moore,1594492036106813440,1339006078688825344,en,1594492036106813440,2022-11-21T00:45:00.000Z,"The Biden family’s business deals are a national security threat. When Republicans take the House back in January, oversight is coming.",False,1594492036106813440,6,16,16,0
RepBarryMoore,Rep. Barry Moore,1594039050997858304,1339006078688825344,en,1594039050997858304,2022-11-19T18:45:00.000Z,"Temperatures are dropping, but energy prices are rising more than 30%. In a Republican majority, lowering these costs for working families will be a priority.",False,1594039050997858304,3,24,24,4
RepBarryMoore,Rep. Barry Moore,1593685268971896834,1339006078688825344,en,1593685268971896834,2022-11-18T19:19:12.000Z,"Democrats were outraged at President Trump for spending $4 billion to stop the flow of criminals and fentanyl across our southern border, but they have no problem giving $54 billion to Ukraine with no accountability. Proud to join @RepMTG to demand answers for American taxpayers. https://t.co/cYEbufUSVg",False,1593685268971896834,8,15,15,1
RepBarryMoore,Rep. Barry Moore,1593283864054595584,1339006078688825344,en,1593283864054595584,2022-11-17T16:44:09.000Z,"For years, Democrats and their mainstream media allies have downplayed Hunter Biden's scandals while sensationalizing bogus Russian collusion fantasies about President Trump.

Soon, the American people will know the truth. https://t.co/KOdJ4GX3co",False,1593283864054595584,6,10,10,1
RepBarryMoore,Rep. Barry Moore,1592942975843463168,1339006078688825344,en,1592942975843463168,2022-11-16T18:09:35.000Z,"RT @HouseAgGOP: 🦃 The cost of this year's #Thanksgiving dinner is 𝐔𝐏 𝟐𝟎% from last year.

Once again, #Bidenflation is impacting the holida…",False,1592942975843463168,12,0,0,0
RepBarryMoore,Rep. Barry Moore,1592530537419509761,1339006078688825344,en,1592530537419509761,2022-11-15T14:50:42.000Z,"As costs on just about everything continue to rise this holiday season, the Biden Administration is using your taxpayer dollars to resettle illegal immigrant minors in communities where they are guaranteed abortion on-demand. https://t.co/5tOUDoR7Bb",False,1592530537419509761,2,4,4,0
RepBarryMoore,Rep. Barry Moore,1591928903316160512,1339006078688825344,en,1591928903316160512,2022-11-13T23:00:01.000Z,Want to receive updates about what I’m doing in Washington and my upcoming district events? Sign up for my monthly newsletter here: https://t.co/YNKycdjrqL,False,1591928903316160512,1,3,3,0
RepBarryMoore,Rep. Barry Moore,1591475916995190788,1339006078688825344,en,1591475916995190788,2022-11-12T17:00:01.000Z,"Southeast Alabama, I am honored to continue serving you. It’s time to get to work on restoring a prosperous, safe and free America!",False,1591475916995190788,3,6,6,1
RepBarryMoore,Rep. Barry Moore,1591098439470833664,1339006078688825344,en,1591098439470833664,2022-11-11T16:00:03.000Z,Today and every day we thank our veterans for defending the freedoms we hold dear. I pray God's blessings on every veteran in Alabama and our nation. Happy Veterans Day! https://t.co/ce6cnjVgW7,False,1591098439470833664,4,4,4,1
RepBarryMoore,Rep. Barry Moore,1590757990507827200,1339006078688825344,en,1590757990507827200,2022-11-10T17:27:14.000Z,"Happy 247th Birthday, @USMC ! Thank you for all you do to protect American interests at home and abroad. https://t.co/WR86RjZxZY",False,1590757990507827200,1,2,2,0
RepBarryMoore,Rep. Barry Moore,1590434752581902336,1339006078688825344,en,1590434752581902336,2022-11-09T20:02:48.000Z,Really enjoyed speaking with students at Dauphin Junior High School in Enterprise yesterday and today. They had a lot of great questions about how our government works and some good ideas for how we can improve it. The future of Alabama's Second District is bright! https://t.co/0LeSrrdTKN,False,1590434752581902336,2,0,0,0
RepBarryMoore,Rep. Barry Moore,1590063040132976641,1339006078688825344,en,1590063040132976641,2022-11-08T19:25:45.000Z,"Need help with a federal agency? Tomorrow, November 9th, my staff will be hosting mobile office hours in Montgomery and Coffee counties at the times and locations listed below. https://t.co/qNbVsNPJze",False,1590063040132976641,1,3,3,0
RepBarryMoore,Rep. Barry Moore,1589361985975513088,1339006078688825344,en,1589361985975513088,2022-11-06T21:00:01.000Z,"During November, we’re taking the time to celebrate our Alabama military families. I hope you’ll join me in honoring these families who make so many sacrifices to keep our country safe! https://t.co/piE1RdQEmo",False,1589361985975513088,2,12,12,0
RepBarryMoore,Rep. Barry Moore,1588939203550875648,1339006078688825344,en,1588939203550875648,2022-11-05T17:00:01.000Z,"On this American Football Day and college football Saturday, I can’t pass up the chance to say War Eagle! https://t.co/Rt3AnTupYu",False,1588939203550875648,2,3,3,0
RepBarryMoore,Rep. Barry Moore,1588281254176116737,1339006078688825344,en,1588281254176116737,2022-11-03T21:25:34.000Z,"What will House Republican priorities be when we gain oversight and investigative powers next year? Look no further than CDC’s mishandling and politicization of the pandemic. It is criminal what bureaucrats did to our children, and someone must be held accountable. https://t.co/VMbOMD7BZ3",False,1588281254176116737,5,5,5,0
RepBarryMoore,Rep. Barry Moore,1587530569868607491,1339006078688825344,en,1587530569868607491,2022-11-01T19:42:37.000Z,"Americans deserve a CBP Commissioner who doesn't sleep through important meetings while thousands of illegals cross our border. Thanks for leading this effort, @CongressmanHice! https://t.co/DLg4bIxRvs",False,1587530569868607491,10,7,7,1
RepBarryMoore,Rep. Barry Moore,1587478561413337090,1339006078688825344,en,1587478561413337090,2022-11-01T16:15:57.000Z,"It’s National Adoption Month! In the United States, more than 100,000 children are adopted each year. This month we recognize them, their caregivers, and the child welfare professionals who help make these adoptions happen. https://t.co/XqXoCYPc0F",False,1587478561413337090,1,3,3,0
RepBarryMoore,Rep. Barry Moore,1587163778566823939,1339006078688825344,en,1587163778566823939,2022-10-31T19:25:07.000Z,"Thanks, @RepThomasMassie! Proud to be a co-sponsor of this legislation that would prevent service members from being forced to choose between the COVID-19 vaccine and their jobs. https://t.co/Tengag3e7y",False,1587163778566823939,177,43,43,2
RepBarryMoore,Rep. Barry Moore,1587105200489340928,1339006078688825344,en,1587105200489340928,2022-10-31T15:32:21.000Z,"Inflation is the spookiest part of this Halloween, with candy prices up 13% since last year. https://t.co/PTIbfyuyS4",False,1587105200489340928,2,13,13,0
RepBarryMoore,Rep. Barry Moore,1586855471750578176,1339006078688825344,en,1586855471750578176,2022-10-30T23:00:01.000Z,The Republican #CommitmenttoAmerica prioritizes the fight against skyrocketing inflation to ensure everyday Americans aren’t feeling pain at the pump and the grocery store. https://t.co/HQD0umtTJ9,False,1586855471750578176,1,2,2,0
RepBarryMoore,Rep. Barry Moore,1586387389173440515,1339006078688825344,en,1586387389173440515,2022-10-29T16:00:01.000Z,"As you and your family gear up for trick-or-treating, keep the tips below in mind! https://t.co/uyeN425suD",False,1586387389173440515,2,1,1,0
RepBarryMoore,Rep. Barry Moore,1586047825552367617,1339006078688825344,en,1586047825552367617,2022-10-28T17:30:43.000Z,🚨 LIVE LOOK from Mar-a-largo at @realDonaldTrump preparing his Twitter comeback @elonmusk https://t.co/fr3JsBUUsL,False,1586047825552367617,2,7,7,0
RepBarryMoore,Rep. Barry Moore,1586007416646221824,1339006078688825344,en,1586007416646221824,2022-10-28T14:50:09.000Z,"On this National First Responders Day, I’d like to thank all the brave men and women who work tirelessly to keep our communities safe. We are grateful for your service! https://t.co/Nv5nniWcUv",False,1586007416646221824,2,1,1,0
RepBarryMoore,Rep. Barry Moore,1585329853565644802,1339006078688825344,en,1585329853565644802,2022-10-26T17:57:45.000Z,"On this National Day of the Deployed, I want to express my gratitude to our service members deployed around the globe. The many sacrifices they have made to keep us safe do not go unnoticed, and they are always in our prayers. https://t.co/R7Q5R5GDf0",False,1585329853565644802,4,2,2,1
RepBarryMoore,Rep. Barry Moore,1585310505077309440,1339006078688825344,en,1585310505077309440,2022-10-26T16:40:52.000Z,Biden’s inflation crisis is costing Alabama families an additional $587 per month. His response? Increasing government spending by nearly $10 trillion. It’s no surprise Americans are supporting the Republican plan to make our economy strong again. https://t.co/egBRFvzLwt,False,1585310505077309440,2,10,10,1
RepBarryMoore,Rep. Barry Moore,1584920505383096326,1339006078688825344,en,1584920505383096326,2022-10-25T14:51:09.000Z,DON'T FORGET: I hope to see you at my town hall at The ATTA in Abbeville TODAY at 2:30PM where I will be discussing the Republican commitment to America in the new Congress and answering your questions. Bring your family and friends! https://t.co/HApx52J2Tt,False,1584920505383096326,1,1,1,0
RepBarryMoore,Rep. Barry Moore,1584605643251585030,1339006078688825344,en,1584605643251585030,2022-10-24T18:00:00.000Z,HENRY COUNTY RESIDENTS:  I hope to see you at my town hall tomorrow at The ATTA in Abbeville at 2:30PM where I will be discussing the Republican commitment to America in the new Congress and answering your questions. Bring your family and friends! https://t.co/9GJfe22giL,False,1584605643251585030,2,0,0,0
RepBarryMoore,Rep. Barry Moore,1584318760470691840,1339006078688825344,en,1584318760470691840,2022-10-23T23:00:02.000Z,"Below are my staff’s upcoming mobile office hours in Conecuh and Crenshaw counties! During these times, staff from Team Moore will meet with and assist those who may have questions concerning Social Security benefits, veterans’ services, passports, or any other federal matter. https://t.co/vc3qWIHQdl",False,1584318760470691840,3,1,1,2
RepBarryMoore,Rep. Barry Moore,1583534965404315648,1339006078688825344,en,1583534965404315648,2022-10-21T19:05:31.000Z,Anyone who DOESN’T have contempt for congress should go to prison.,False,1583534965404315648,3,11,11,4
RepBarryMoore,Rep. Barry Moore,1583463779697758209,1339006078688825344,en,1583463779697758209,2022-10-21T14:22:39.000Z,"On this National Pets for Vets Day, I am proud to be a co-sponsor of the PAWS for Veterans Therapy Act, which allows the VA to provide service dogs to veterans with mental illnesses who do not have mobility impairments. Every service member deserves a four-legged best friend! 🐾 https://t.co/j5x0HKjpLM",False,1583463779697758209,3,3,3,1
RepBarryMoore,Rep. Barry Moore,1582837090018291714,1339006078688825344,en,1582837090018291714,2022-10-19T20:52:24.000Z,"Thank you, @AEA! I will continue to fight against the Democrat mission to deplete our strategic reserve and stifle American energy production. https://t.co/V8QsH2EgG8",False,1582837090018291714,4,5,5,0
RepBarryMoore,Rep. Barry Moore,1582750637254938625,1339006078688825344,en,1582750637254938625,2022-10-19T15:08:52.000Z,"Birthing people rejoice, the solution to the baby formula crisis has been found! https://t.co/YGhQayafj0",False,1582750637254938625,3,4,4,0
RepBarryMoore,Rep. Barry Moore,1582739619782619137,1339006078688825344,en,1582739619782619137,2022-10-19T14:25:05.000Z,"Amidst rising gas prices, soaring food costs and an inflation rate of 8.2%, President Biden says his biggest priority is enshrining the right to abortion up until the moment of birth into law. How out of touch can he get?",False,1582739619782619137,1,9,9,1
RepBarryMoore,Rep. Barry Moore,1582044713250848769,1339006078688825344,en,1582044713250848769,2022-10-17T16:23:47.000Z,"DON'T FORGET: Tomorrow in Wetumpka from 2pm-5pm I am holding a Veterans Healthcare Fair, where my staff and other vendors will be available to answer your questions and assist with federal healthcare issues. See more information below! https://t.co/j3N7TeVPmD",False,1582044713250848769,3,2,2,0
RepBarryMoore,Rep. Barry Moore,1581736741232291841,1339006078688825344,en,1581736741232291841,2022-10-16T20:00:01.000Z,"Happy National Bosses Day to our wonderful boss! We are so thankful for his dedication to Alabama’s Second District, his leadership and his incredible family. - Staff of Congressman Moore https://t.co/UtyjfVqTcw",False,1581736741232291841,2,6,6,0
RepBarryMoore,Rep. Barry Moore,1581313957440143361,1339006078688825344,en,1581313957440143361,2022-10-15T16:00:01.000Z,"VETERANS: Do you need help with a federal healthcare issue? My staff and other vendors will be available to answer your questions at our Veterans Healthcare Fair on Tuesday, October 18th from 2pm to 5pm at my Wetumpka Office! See more information below. https://t.co/ca3XaGTyKY",False,1581313957440143361,2,2,2,1
RepBarryMoore,Rep. Barry Moore,1580605939480027139,1339006078688825344,en,1580605939480027139,2022-10-13T17:06:36.000Z,"President Biden said days ago “I don’t think there will be a recession.""

But CNBC, quoting the government's own numbers: ""Core inflation was up 6.6% from a year ago, the biggest 12-month gain since August 1982.""

Mr. Biden, this is HISTORIC inflation. How much worse must it get? https://t.co/7JMDFdln2M",False,1580605939480027139,2,2,2,0
RepBarryMoore,Rep. Barry Moore,1580595163856240641,1339006078688825344,en,1580595163856240641,2022-10-13T16:23:47.000Z,Happy 247th birthday to @USNavy and thank you to the many men and women who serve! https://t.co/1gaWYP98d7,False,1580595163856240641,3,3,3,0
RepBarryMoore,Rep. Barry Moore,1580570469211996160,1339006078688825344,en,1580570469211996160,2022-10-13T14:45:40.000Z,"Consumer price increases have been at or above 5% for 17 straight months, and real average hourly earnings fell 3% since last year, marking the 18th month in a row in which inflation has outpaced wages. https://t.co/re1prNwSxy",False,1580570469211996160,1,4,4,1
RepBarryMoore,Rep. Barry Moore,1580557148635160576,1339006078688825344,en,1580557148635160576,2022-10-13T13:52:44.000Z,"🚨 MORE INFLATION NEWS 🚨 
Consumer Price Index numbers are out this morning and have risen AGAIN. You’re now paying 8.3% more for consumer goods and services than this time last year.",False,1580557148635160576,3,4,4,1
RepBarryMoore,Rep. Barry Moore,1580245084209315840,1339006078688825344,en,1580245084209315840,2022-10-12T17:12:42.000Z,RT @AlabamaToday: Barry Moore says investigation of Hunter Biden 'long overdue' https://t.co/F2B9ygOdnR #ALPolitics https://t.co/mSP0WztqyK,False,1580245084209315840,3,0,0,0
RepBarryMoore,Rep. Barry Moore,1580211024518529024,1339006078688825344,en,1580211024518529024,2022-10-12T14:57:21.000Z,"🚨 NEW INFLATION NUMBERS: September’s Producer Price Index rose by 8.5% since last year. This is the 18th straight month with wholesale inflation over 5% year-over-year.

In Biden’s America, you pay more for gas, groceries, and goods.",False,1580211024518529024,3,3,3,0
RepBarryMoore,Rep. Barry Moore,1579891146599575552,1339006078688825344,en,1579891146599575552,2022-10-11T17:46:16.000Z,The decision for Biden's corrupt DOJ to indict President Trump was made long before any investigations began. This is impeachment all over again. https://t.co/rdGhVFXHVj,False,1579891146599575552,1,8,8,1
RepBarryMoore,Rep. Barry Moore,1579853501681008640,1339006078688825344,en,1579853501681008640,2022-10-11T15:16:41.000Z,A thorough investigation into Hunter Biden’s shady business dealings is long overdue. American banks have filed over 150 suspicious activity reports involving Hunter and James Biden. This is a threat to our national security!,False,1579853501681008640,2,4,4,0
RepBarryMoore,Rep. Barry Moore,1579489708572553217,1339006078688825344,en,1579489708572553217,2022-10-10T15:11:06.000Z,"530 years ago, Christopher Columbus landed in America and began a new chapter of world history. His great adventure is a reminder that our nation will always be the Home of the Brave. https://t.co/YFuWSsbpwj",False,1579489708572553217,4,10,10,2
RepBarryMoore,Rep. Barry Moore,1579233655506935808,1339006078688825344,en,1579233655506935808,2022-10-09T22:13:38.000Z,"ANDALUSIA RESIDENTS: I want to hear from you! I will be holding a town hall on Wednesday, October 12th at the City Hall Auditorium at 505 East Three Notch Street to talk about the Republican Commitment to America and answer your questions. I hope to see you there! https://t.co/cU01I07x8g",False,1579233655506935808,2,1,1,0
RepBarryMoore,Rep. Barry Moore,1578398067585327107,1339006078688825344,en,1578398067585327107,2022-10-07T14:53:19.000Z,"President Biden is upset with OPEC cuts, but there is a simple solution to the problem he created. https://t.co/5m06lEd26C",False,1578398067585327107,2,4,4,1
