handle,name,tweet_id,author_id,lang,replied_to,created_at,tweet_text,possibly_sensitive,conversation_id,retweet_count,reply_count,like_count,quote_count
RepBarryMoore,Rep. Barry Moore,1509577117364850701,1339006078688825344,en,1509577117364850701,2022-03-31T17:03:26.000Z,"No American worker should ever have to choose between providing for their families and being vaccinated. Congress must prevent the federal government's future blatant overreach of any unlawful mandate.

Proud to join @Rep_Clyde in the fight for our freedoms. https://t.co/X9T1gYTQq4",False,1509577117364850701,4,17,17,1
RepBarryMoore,Rep. Barry Moore,1509554958395400203,1339006078688825344,en,1509554958395400203,2022-03-31T15:35:22.000Z,"Joe Biden is preparing to order the release of millions of barrels of oil per day from the nation's SPR to control energy prices instead of unleashing American energy. This is insanity...

Our SPR is for real emergencies, NOT political emergencies.",False,1509554958395400203,25,18,18,2
RepBarryMoore,Rep. Barry Moore,1509548438094073859,1339006078688825344,en,1509548438094073859,2022-03-31T15:09:28.000Z,"The @FreedomCaucus represents the voice of the real people – not the process, not the special interests, but the people themselves.

And there’s good news - HFC is continuing to grow, giving Americans a stronger conservative voice in Washington.

https://t.co/vI1ZU1cWtZ",False,1509548438094073859,5,5,5,1
RepBarryMoore,Rep. Barry Moore,1509543272078848010,1339006078688825344,en,1509543272078848010,2022-03-31T14:48:56.000Z,"Biden is attempting to deflect blame from the disastrous consequences of his many policy failures – skyrocketing energy costs, broken supply chains, even food shortages.

Thank you to my @HouseAgGOP colleague @AustinScottGA08 for shedding light on this critical food supply issue. https://t.co/NLiESnxmGi",False,1509543272078848010,3,15,15,0
RepBarryMoore,Rep. Barry Moore,1509541650170843150,1339006078688825344,en,1509541650170843150,2022-03-31T14:42:29.000Z,"It was a treat getting to visit with @AuburnU President Dr. Gouge, incoming President Dr. Chris Roberts, and Bob Dumas. As an alum, I'm so proud of all AU does for our state and beyond, and I appreciate the update on exciting new developments at the university. #WarEagle https://t.co/Rj0QF7bCVp",False,1509541650170843150,1,0,0,1
RepBarryMoore,Rep. Barry Moore,1509253575360270339,1339006078688825344,en,1509253575360270339,2022-03-30T19:37:47.000Z,RT @GOPLeader: Mr. President: You can't spend America out of an inflation crisis.,False,1509253575360270339,1115,0,0,0
RepBarryMoore,Rep. Barry Moore,1509253073260236805,1339006078688825344,en,1509253073260236805,2022-03-30T19:35:47.000Z,"RT @RepChipRoy: Title 42 has been the lone vestige of southern border security policy under Biden and Mayorkas

If it expires, we're lookin…",False,1509253073260236805,27,0,0,0
RepBarryMoore,Rep. Barry Moore,1509253047867920386,1339006078688825344,en,1509253047867920386,2022-03-30T19:35:41.000Z,"RT @RepScottPerry: If Democrats are serious about securing our border and keeping Americans safe, here’s an opportunity to work in a bipart…",False,1509253047867920386,13,0,0,0
RepBarryMoore,Rep. Barry Moore,1509251233290330112,1339006078688825344,en,1509251233290330112,2022-03-30T19:28:29.000Z,"Ending Title 42 would generate overwhelming &amp; terrifying chaos at our border from emboldened drug cartels &amp; human traffickers.

I join my @freedomcaucus members in calling on @HouseDemocrats to stop this madness &amp; sign @RepChipRoy's discharge petition.

https://t.co/RQPjwAog81",False,1509251233290330112,16,32,32,3
RepBarryMoore,Rep. Barry Moore,1509214882624901123,1339006078688825344,en,1509214882624901123,2022-03-30T17:04:02.000Z,"RT @yhn: .@RepJerryCarl, @RepBarryMoore blast Biden budget proposal   #alpolitics https://t.co/Osfu3ZFPxg",False,1509214882624901123,3,0,0,0
RepBarryMoore,Rep. Barry Moore,1509204558098145280,1339006078688825344,en,1509204558098145280,2022-03-30T16:23:00.000Z,"American families are forced to face $5,200 in additional costs this year as a result of rising prices. And the American people are now having to bend over backward to afford Biden's failed policies.",False,1509204558098145280,2,35,35,0
RepBarryMoore,Rep. Barry Moore,1509203292278210563,1339006078688825344,en,1509203292278210563,2022-03-30T16:17:59.000Z,The need for reliable broadband in rural communities for our farmers is the utmost important. I am proud to join my @HouseAgGOP members on this effort! https://t.co/uToQGIKBDi,False,1509203292278210563,2,8,8,0
RepBarryMoore,Rep. Barry Moore,1509160405201043457,1339006078688825344,en,1509160405201043457,2022-03-30T13:27:34.000Z,"RT @jeff_poor: Today on The @JeffPoorShow on Mobile, AL's @fmtalk1065 (times CT)

9:30 am

U.S. @RepBarryMoore

10:30 am

State Sen. Shay S…",False,1509160405201043457,3,0,0,0
RepBarryMoore,Rep. Barry Moore,1508928347920904196,1339006078688825344,en,1508928347920904196,2022-03-29T22:05:27.000Z,"Today, I paid tribute to the brave Americans who served during the Vietnam War. Growing up in Enterprise, I was surrounded by Vietnam veterans, and each of them has a special place in my heart. We remember your sacrifice and service and are forever indebted to you. https://t.co/gDy4PqdWBs",False,1508928347920904196,1,4,4,0
RepBarryMoore,Rep. Barry Moore,1508920451464105991,1339006078688825344,en,1508920451464105991,2022-03-29T21:34:04.000Z,Ending Title 42 will be disastrous. The Biden administration needs to get serious before we see another mass migration at our southern border that will put communities across America in danger. https://t.co/dySxpEqPOz,False,1508920451464105991,30,12,12,0
RepBarryMoore,Rep. Barry Moore,1508908616866275336,1339006078688825344,en,1508908616866275336,2022-03-29T20:47:03.000Z,"They know how damaging the truth is, and the media and Democrats' will continue down this destructive path.",False,1508908613871575048,0,1,1,0
RepBarryMoore,Rep. Barry Moore,1508908616035807240,1339006078688825344,en,1508908616035807240,2022-03-29T20:47:02.000Z,"Ketanji Brown Jackson has a history of delivering soft-on-crime sentences, and when pressed during her confirmation, she could not adequately defend or explain her record on this issue. These were actions she took while being paid by the taxpayers.",False,1508908613871575048,1,2,2,0
RepBarryMoore,Rep. Barry Moore,1508908613871575048,1339006078688825344,en,1508908613871575048,2022-03-29T20:47:02.000Z,President Joe Biden has repeatedly promised to nominate a Far-Left radical to the Supreme Court and deliberately leave out details in materials given to the Judiciary Committee to fit their woke agenda.🧵,False,1508908613871575048,0,3,3,0
RepBarryMoore,Rep. Barry Moore,1508832886002274310,1339006078688825344,en,1508832886002274310,2022-03-29T15:46:07.000Z,"Biden's budget would grow America’s debt to a shocking $45 trillion by 2032. Let's get this clear -  Biden will continue to spend money that we don't have, strapping our children and grandchildren with unthinkable debt that they cannot afford to please the left-socialist wing.",False,1508832886002274310,1,8,8,2
RepBarryMoore,Rep. Barry Moore,1508805029116919811,1339006078688825344,en,1508805029116919811,2022-03-29T13:55:25.000Z,"What do the American people have to show for President Biden and House Democrats' outrageous spending: inflation, higher gas prices, empty shelves, and less money in your pocket.",False,1508805029116919811,1,6,6,0
RepBarryMoore,Rep. Barry Moore,1508559818264616962,1339006078688825344,en,1508559818264616962,2022-03-28T21:41:03.000Z,"The Biden admin released its $5.8 trillion budget. If the last year was any indication of the Dems' spending, then inflation will continue to rise. We need to get our country back on track, lower inflation, restore fiscal sanity that doesn't include higher taxes &amp; more spending.",False,1508559818264616962,2,9,9,1
RepBarryMoore,Rep. Barry Moore,1508514984887828492,1339006078688825344,en,1508514984887828492,2022-03-28T18:42:53.000Z,"RT @HouseGOP: Americans are paying an extra $296 a month due to Biden’s worsening inflation crisis.

Skyrocketing gas prices could cost the…",False,1508514984887828492,93,0,0,0
RepBarryMoore,Rep. Barry Moore,1508484763325190150,1339006078688825344,en,1508484763325190150,2022-03-28T16:42:48.000Z,"Since President Biden's first day in office, he has waged war on American Energy. The liberal media is working overtime to convince Americans that gas prices are rising because of the war in Ukraine. 

But in reality, it's Biden's anti-energy policies. https://t.co/2Q56b3bcvy",False,1508484763325190150,7,8,8,2
RepBarryMoore,Rep. Barry Moore,1507848988422295557,1339006078688825344,en,1507848988422295557,2022-03-26T22:36:27.000Z,"Biden gave Russia the greenlight to build a pipeline to Europe – giving them more leverage over our European allies – yet cancelled the Keystone XL pipeline that would have created jobs &amp; benefited both our country &amp; our ally Canada. 

Unleash American energy now! https://t.co/dMwC13vvVc",False,1507848988422295557,3,16,16,1
RepBarryMoore,Rep. Barry Moore,1507429076763615243,1339006078688825344,en,1507429076763615243,2022-03-25T18:47:53.000Z,"RT @HouseAgGOP: More than a third of U.S. farmers are north of 65 years old.

Thank you to youth development organizations like @4H and @Na…",False,1507429076763615243,4,0,0,0
RepBarryMoore,Rep. Barry Moore,1507395256941445126,1339006078688825344,en,1507395256941445126,2022-03-25T16:33:29.000Z,"The Medal of Honor is the highest honor a servicemember in our nation can receive. On #NationalMedalofHonorDay, we commemorate American heroes who have earned this honor by defending our great country. 

Thank you for your bravery &amp; service! https://t.co/diSnIT8rgS",False,1507395256941445126,5,15,15,1
RepBarryMoore,Rep. Barry Moore,1507394569943531523,1339006078688825344,en,1507394569943531523,2022-03-25T16:30:46.000Z,RT @Jim_Jordan: The only thing more busted than your bracket is Joe Biden’s agenda.,False,1507394569943531523,1579,0,0,0
RepBarryMoore,Rep. Barry Moore,1507092150168739843,1339006078688825344,en,1507092150168739843,2022-03-24T20:29:03.000Z,"Russian energy must be replaced with American energy and the U.S. should be accelerating energy exports to our allies. Instead, President Biden's anti-energy agenda emboldens Putin. 

We need to unleash American energy to lower prices here at home and support our allies abroad. https://t.co/qlA6ugwLw4",False,1507092150168739843,2,7,7,1
RepBarryMoore,Rep. Barry Moore,1507031010646675457,1339006078688825344,en,1507031010646675457,2022-03-24T16:26:06.000Z,"The situation at our southern border is out of control. 

We need to secure our border. Finish the wall. Fully reinstate the 'Remain-in-Mexico' policy. And Maintain Title 42 Authority.",False,1507031010646675457,5,15,15,0
RepBarryMoore,Rep. Barry Moore,1507014887662268421,1339006078688825344,en,1507014887662268421,2022-03-24T15:22:02.000Z,"RT @HouseAgGOP: Anti-energy policies are crippling our nation's farmers, ranchers, producers, and consumers.

It's high time to unleash Ame…",False,1507014887662268421,32,0,0,0
RepBarryMoore,Rep. Barry Moore,1506716995395407874,1339006078688825344,en,1506716995395407874,2022-03-23T19:38:19.000Z,RT @HouseAgGOP: A message from @HouseAgGOP Member @RepBarryMoore during #NationalAgWeek! 👇👇 https://t.co/a2DVUrhTVK,False,1506716995395407874,1,0,0,0
RepBarryMoore,Rep. Barry Moore,1506655969580924935,1339006078688825344,en,1506655969580924935,2022-03-23T15:35:50.000Z,"President Biden's harmful economic policies and rising inflation are battering American farmers.

We need leadership that puts America first, and that starts with prioritizing our farmers. #NationalAgWeek",False,1506655969580924935,11,101,101,2
RepBarryMoore,Rep. Barry Moore,1506281038649212937,1339006078688825344,en,1506281038649212937,2022-03-22T14:45:59.000Z,"Do you want the Biden Administration to renew the failed, Obama-era Iran Nuclear Deal with the world's leading state sponsor of terrorism?",False,1506281038649212937,1,20,20,1
RepBarryMoore,Rep. Barry Moore,1506278717508796422,1339006078688825344,en,1506278717508796422,2022-03-22T14:36:46.000Z,"Farmers are facing unprecedented disruptions in the supply chain, skyrocketing energy costs, and difficulty transporting their commodities. Ensuring farm families have a strong safety net is vital to rebuilding a robust rural economy. #NationalAgWeek",False,1506278717508796422,3,16,16,0
RepBarryMoore,Rep. Barry Moore,1506272735009251328,1339006078688825344,en,1506272735009251328,2022-03-22T14:12:59.000Z,"Happy #NationalAgDay to all of our hardworking farmers in the Wiregrass and across the nation. From growing up on a farm to now representing an agricultural district, I'm proud to celebrate the farmers, ranchers, and producers that work tirelessly to feed and fuel our world. https://t.co/TtP6qrclqW",False,1506272735009251328,11,12,12,1
RepBarryMoore,Rep. Barry Moore,1506004592777170954,1339006078688825344,en,1506004592777170954,2022-03-21T20:27:29.000Z,RT @HouseGOP: A Border Patrol agent told Fox News that there is a “frantic sense of urgency” in preparation for another surge at our southe…,False,1506004592777170954,32,0,0,0
RepBarryMoore,Rep. Barry Moore,1505992337964642304,1339006078688825344,en,1505992337964642304,2022-03-21T19:38:48.000Z,"RT @RepKenBuck: #BREAKING: As a result of Judge Jackson’s alarming judicial record, I am calling on the Senate Judiciary Committee to fully…",False,1505992337964642304,2576,0,0,0
RepBarryMoore,Rep. Barry Moore,1505965223135621121,1339006078688825344,en,1505965223135621121,2022-03-21T17:51:03.000Z,"On #WorldDownSyndromeDay, we celebrate the precious gift of life. I am wearing crazy socks for Bowen Poss, one of many incredible individuals with Down Syndrome. Bowen brings so much joy and happiness right here in Enterprise. https://t.co/8BHqJjrc8X",False,1505965223135621121,2,7,7,1
RepBarryMoore,Rep. Barry Moore,1505955493466025993,1339006078688825344,en,1505955493466025993,2022-03-21T17:12:23.000Z,"Trump was right, but media companies bent over backward to discredit Trump &amp; project lies over the truth. Now that Joe Biden is president, Hunter's laptop is real? And the media expects us to gloss over it? I'm sick &amp; tired of censorship, and so are the American people.",False,1505955492270645253,0,8,8,0
RepBarryMoore,Rep. Barry Moore,1505955492270645253,1339006078688825344,en,1505955492270645253,2022-03-21T17:12:23.000Z,The media lied. So did Democrats. And so did Big Tech. The mainstream media went to bat for Hunter Biden time &amp; time again claiming that his laptop wasn't real to advance their corrupt agenda.,False,1505955492270645253,3,12,12,1
RepBarryMoore,Rep. Barry Moore,1505716519556337664,1339006078688825344,en,1505716519556337664,2022-03-21T01:22:47.000Z,"RT @HouseGOP: President Biden should not be replacing oil from Russia with oil from Iran, Saudi Arabia, or Venezuela.

Instead, President B…",False,1505716519556337664,509,0,0,0
RepBarryMoore,Rep. Barry Moore,1505284389718089735,1339006078688825344,en,1505284389718089735,2022-03-19T20:45:39.000Z,"The Biden admin is preparing for yet another crisis on the border. And like many they face, this crisis is a consequence of Biden’s policies.

Biden officials fear a ""mass migration event"" if COVID policies end.

We need to secure our border NOW.

https://t.co/GLSfpwB8wO",False,1505284389718089735,1,7,7,0
RepBarryMoore,Rep. Barry Moore,1505181613671563268,1339006078688825344,en,1505181613671563268,2022-03-19T13:57:16.000Z,I am deeply saddened by the news of Don Young passing away. The Dean of the House and a champion for Alaska will be greatly missed in the halls of Congress. My prayers are with his family and all Alaskans.,False,1505181613671563268,3,5,5,0
RepBarryMoore,Rep. Barry Moore,1504922439251283974,1339006078688825344,en,1504922439251283974,2022-03-18T20:47:24.000Z,"In a world smoldering with countless crises of Biden’s making, the failed, Obama-era Iran nuclear deal represents perhaps the gravest threat to American security and safety. I am proud to join @RepJimBanks  resolution to condemn Biden’s attempt to negotiate with terrorists. https://t.co/UjuxbBc2L3",False,1504922439251283974,14,26,26,2
RepBarryMoore,Rep. Barry Moore,1504878440536842243,1339006078688825344,en,1504878440536842243,2022-03-18T17:52:34.000Z,My staff and I are cheering for our Tigers today from Washington. I've got them winning the championship in my bracket - who do you have? #WarEagle https://t.co/V5dHlTVdWX,False,1504878440536842243,2,4,4,1
RepBarryMoore,Rep. Barry Moore,1504877856253427721,1339006078688825344,en,1504877856253427721,2022-03-18T17:50:14.000Z,"RT @RepThomasMassie: Thank you to @RepBarryMoore for cosponsoring HR 5874, the Restoring America's Leadership in Innovation Act of 2021 (RA…",False,1504877856253427721,35,0,0,0
RepBarryMoore,Rep. Barry Moore,1504540404150116364,1339006078688825344,en,1504540404150116364,2022-03-17T19:29:20.000Z,"Government bureaucrats are waging a war against everyday American citizens and their constitutional freedoms. I joined my good friend, @RepThomasMassie  Massie, to permanently end the mask charade. https://t.co/NlFmGJf5p1",False,1504540404150116364,50,30,30,3
RepBarryMoore,Rep. Barry Moore,1504476777246171139,1339006078688825344,en,1504476777246171139,2022-03-17T15:16:30.000Z,"Steps Biden should take today: 
✅End federal freeze on all new oil &amp; gas projects
✅Cut off the money pipeline to Putin
✅Open the Keystone XL pipeline 
✅Remove US LNG export restrictions
✅Restart oil/gas leasing on federal lands &amp; water
✅Unleash American energy independence",False,1504476777246171139,5,19,19,3
RepBarryMoore,Rep. Barry Moore,1504185620712861698,1339006078688825344,en,1504185620712861698,2022-03-16T19:59:33.000Z,"RT @HouseVetAffairs: Our condolences to the entire @DAVHQ family on the passing of former Executive Director Garry Augustine.

Garry was a…",False,1504185620712861698,2,0,0,0
RepBarryMoore,Rep. Barry Moore,1504168503728914432,1339006078688825344,en,1504168503728914432,2022-03-16T18:51:32.000Z,"If things keep up, Democrats will watch from the sidelines this November as Republicans run up the score. Read my full March Madness op-ed here. ⬇️

https://t.co/SHtYTAoqCy",False,1504168503728914432,1,5,5,0
RepBarryMoore,Rep. Barry Moore,1504150783209652231,1339006078688825344,en,1504150783209652231,2022-03-16T17:41:07.000Z,"Under President Biden, deportations dropped to the lowest level in 26 years last year despite record-high border crossings. This administration's refusal to uphold the law puts every American community at risk. #BidenBorderCrisis",False,1504150783209652231,3,3,3,0
RepBarryMoore,Rep. Barry Moore,1504114389342949380,1339006078688825344,en,1504114389342949380,2022-03-16T15:16:30.000Z,RT @AlabamaToday: Barry Moore joins lawsuit to end mask mandate for air travel https://t.co/bl063zisZ1 #ALPolitics https://t.co/oZ9I7kOae6,False,1504114389342949380,1,0,0,0
RepBarryMoore,Rep. Barry Moore,1504113664005181440,1339006078688825344,en,1504113664005181440,2022-03-16T15:13:37.000Z,RT @WDHN: Representative Barry Moore (AL-02) joined sixteen other U.S. representatives in a lawsuit against the Centers for Disease Control…,False,1504113664005181440,2,0,0,0
RepBarryMoore,Rep. Barry Moore,1504101797627150339,1339006078688825344,en,1504101797627150339,2022-03-16T14:26:28.000Z,Just heard President Zelenskyy's address to Congress and the American people. He is a true leader and will not back down from Putin's aggression. https://t.co/LYF0p59qLr,False,1504101797627150339,9,46,46,3
RepBarryMoore,Rep. Barry Moore,1504087572821299206,1339006078688825344,en,1504087572821299206,2022-03-16T13:29:56.000Z,"Why is Joe Biden playing into Russia's hands?

Hit Putin where it hurts - unleash American energy! https://t.co/Z99nTKpBun",False,1504087572821299206,9,10,10,1
RepBarryMoore,Rep. Barry Moore,1503830310856892431,1339006078688825344,en,1503830310856892431,2022-03-15T20:27:40.000Z,"Inflation will cost Americans more than $3,500 this year. You'll pay an additional $2,000 just to fill up your gas tank.

These are real costs for American families that mean hard choices and canceled purchases.",False,1503830310856892431,2,11,11,0
RepBarryMoore,Rep. Barry Moore,1503809195505762306,1339006078688825344,en,1503809195505762306,2022-03-15T19:03:46.000Z,"I introduced the Quality Education for Veterans Act to protect taxpayers &amp; obstruct bad actors to ensure veterans have a smooth transition through higher education. I am proud to fight for our veterans!

Read the full release here.

https://t.co/JtkK6j8M4V",False,1503809195505762306,0,0,0,0
RepBarryMoore,Rep. Barry Moore,1503793492467793929,1339006078688825344,en,1503793492467793929,2022-03-15T18:01:22.000Z,RT @HouseGOP: REMINDER: Biden gifted Putin a pipeline. https://t.co/Dykc8XONHX,False,1503793492467793929,411,0,0,0
RepBarryMoore,Rep. Barry Moore,1503789461573967872,1339006078688825344,ca,1503789461573967872,2022-03-15T17:45:21.000Z,"RT @yhn: .@RepBarryMoore defends veterans, declares war on VA GI bill fraud  #alpolitics https://t.co/1rVk4QOVXr",False,1503789461573967872,3,0,0,0
RepBarryMoore,Rep. Barry Moore,1503432192650850312,1339006078688825344,en,1503432192650850312,2022-03-14T18:05:41.000Z,"In a week, gas prices soared in EVERY single county in the Wiregrass. 

President Biden and Democrats' policies are responsible for putting hard-working Alabamians in this position. We need to unleash American energy and become energy independent. https://t.co/dCPZ39MbJ2",False,1503432192650850312,1,17,17,0
RepBarryMoore,Rep. Barry Moore,1503392586341535745,1339006078688825344,en,1503392586341535745,2022-03-14T15:28:18.000Z,BELLA+CANVAS' investment in Elmore County will create new jobs and economic opportunities for the Wiregrass. This is welcome news and will restore manufacturing jobs right here in the United States! https://t.co/NJmyYkOwXT,False,1503392586341535745,1,0,0,0
RepBarryMoore,Rep. Barry Moore,1502773742396755972,1339006078688825344,en,1502773742396755972,2022-03-12T22:29:15.000Z,"Americans are paying more for just about everything because of inflation:  

🚗Used cars &amp; trucks are UP 41.2%
⛽️Gasoline is UP 38.0%
🥓Bacon is UP 18.8%
🥜Peanut butter is UP 15.6%
🐖Pork is UP 14.0%
✈️Airline fees are UP 12.7%
🚗New vehicles are UP 12.4%
🥚Eggs are UP 11.4%",False,1502773742396755972,2,20,20,0
RepBarryMoore,Rep. Barry Moore,1502381829097205766,1339006078688825344,en,1502381829097205766,2022-03-11T20:31:55.000Z,"Inflation is taxation, and it has gone up every month of Joe Biden's presidency.",False,1502381829097205766,4,18,18,0
RepBarryMoore,Rep. Barry Moore,1502355967362621447,1339006078688825344,en,1502355967362621447,2022-03-11T18:49:09.000Z,I stopped by Carroll High School to speak with a group of seniors. Thanks for having me and asking me tough questions. The future is bright for these students! Go Eagles! https://t.co/IO0pNbi8By,False,1502355967362621447,1,2,2,0
RepBarryMoore,Rep. Barry Moore,1502348556992135175,1339006078688825344,en,1502348556992135175,2022-03-11T18:19:42.000Z,RT @HouseGOP: Workers are taking a pay cut because of the Biden administration and Congressional Democrats’ failed agenda. #Bidenflation,False,1502348556992135175,76,0,0,0
RepBarryMoore,Rep. Barry Moore,1502026900515995648,1339006078688825344,en,1502026900515995648,2022-03-10T21:01:34.000Z,RT @HouseGOP: “It’s almost a miracle that any oil and gas production is occurring in America amid this political hostility. The Ukraine cri…,False,1502026900515995648,38,0,0,0
RepBarryMoore,Rep. Barry Moore,1501991760062521351,1339006078688825344,en,1501991760062521351,2022-03-10T18:41:55.000Z,Soaring gas prices &amp; out-of-control inflation should rest upon Joe Biden's shoulders not the American peoples.,False,1501991760062521351,2,8,8,1
RepBarryMoore,Rep. Barry Moore,1501924069830279172,1339006078688825344,en,1501924069830279172,2022-03-10T14:12:57.000Z,"The last time inflation was this high? The year Michael Jackson released Thriller.

Its time for @JoeBiden to Beat It. #Bidenflation",False,1501924069830279172,49,61,61,1
RepBarryMoore,Rep. Barry Moore,1501704936270278658,1339006078688825344,art,1501704936270278658,2022-03-09T23:42:11.000Z,👇 https://t.co/qQvBJ6smEO,False,1501704936270278658,5,23,23,1
RepBarryMoore,Rep. Barry Moore,1501611144825430016,1339006078688825344,en,1501611144825430016,2022-03-09T17:29:30.000Z,"House Dems will attempt to pass a 2700-page spending bill that was released in the DEAD of night and force us to vote on it in a few hours.

Our nation is facing historic inflation &amp; wasteful spending &amp; Democrats want us to trust them with another $1.5 trillion on God-knows-what.",False,1501611144825430016,4,46,46,2
RepBarryMoore,Rep. Barry Moore,1501587846368575494,1339006078688825344,en,1501587846368575494,2022-03-09T15:56:55.000Z,"With a stroke of a pen, President Biden knowingly destroyed thousands of jobs by killing the Keystone XL Pipeline. Now Biden's radical America Last energy policies are directly causing our energy crisis.

Biden MUST unleash American energy NOW! https://t.co/FC5LPofUHJ",False,1501587846368575494,8,35,35,1
RepBarryMoore,Rep. Barry Moore,1501570503370280961,1339006078688825344,en,1501570503370280961,2022-03-09T14:48:00.000Z,Biden's energy policies are crystal clear: America LAST.,False,1501570503370280961,14,19,19,2
RepBarryMoore,Rep. Barry Moore,1501284400864055297,1339006078688825344,en,1501284400864055297,2022-03-08T19:51:08.000Z,"In a world of penguins, @coachbrucepearl is a 🅿️eacock 🦚

Congrats, my friend! https://t.co/koW2sJa5AX https://t.co/kfg7BHyMPN",False,1501284400864055297,2,9,9,0
