handle,name,tweet_id,author_id,lang,replied_to,created_at,tweet_text,possibly_sensitive,conversation_id,retweet_count,reply_count,like_count,quote_count
RepConnieConway,Connie Conway,1549020511081996290,1544718378987933703,en,1549020511081996290,2022-07-18T13:17:23.000Z,"Average price of gasoline in California is $5.91. We need to regain our energy independence &amp; bring costs down for CenVal families. Instead of investing in American Energy, this Admin turns to foreign dictatorships. We invited @POTUS to tour our energy producing communities. https://t.co/gye36lf2lI",False,1549020511081996290,11,5,5,1
RepConnieConway,Connie Conway,1548731784690548740,1544718378987933703,en,1548731784690548740,2022-07-17T18:10:06.000Z,"Last week @CAFarmBureau President Jamie Johansson dropped by my office to discuss critical issues including drought, rising production costs, and crop protection.  It’s time to support our farmers. #MyJobDependsOnAg #CaliforniaAgriculture https://t.co/DsW3WCx7k3",False,1548731784690548740,3,2,2,0
RepConnieConway,Connie Conway,1548333379845701634,1544718378987933703,en,1548333379845701634,2022-07-16T15:46:59.000Z,I’m proud to cosponsor @RepDustyJohnson's “Keep Nine Amendment”. This would amend the Constitution to require that the Supreme Court be composed of NINE JUSTICES. The Supreme Court shouldn't be packed with judges for the sole purpose of ramming through a radical agenda. #KeepNine https://t.co/WSF6yZJq4y,False,1548333379845701634,3,2,2,1
RepConnieConway,Connie Conway,1548052177175793673,1544718378987933703,en,1548052177175793673,2022-07-15T21:09:35.000Z,"An update on my recent and upcoming activities in Congress, where I'm focusing on California wildfires and assistance for military veterans. https://t.co/YDLaFXnsUs",False,1548052177175793673,4,2,2,0
RepConnieConway,Connie Conway,1547948218406690818,1544718378987933703,en,1547948218406690818,2022-07-15T14:16:29.000Z,We’ll hear from those on the ground including CAL FIRE and Tulare County’s own Denise England. #SaveOurSequoias #CA22,False,1547948216758374407,1,0,0,0
RepConnieConway,Connie Conway,1547948216758374407,1544718378987933703,en,1547948216758374407,2022-07-15T14:16:29.000Z,"I’ll be sitting down with my colleagues this morning to examine the growing threat of catastrophic wildfire, its impact on the awe-inspiring Giant Sequoias and the Save Our Sequoias Act. #SaveOurSequoias #CA22  

WATCH HERE: https://t.co/ZFCAgyNikl",False,1547948216758374407,3,2,2,0
RepConnieConway,Connie Conway,1546595462886694921,1544718378987933703,en,1546595462886694921,2022-07-11T20:41:07.000Z,"Serving on the @HouseVetAffairs and the @NatResources was a top priority for me.  Water for our Valley and taking care of our veterans are must haves and I’ll work on these committees to make a difference! #CA22

https://t.co/am2fxqdBX5",False,1546595462886694921,1,1,1,0
