handle,name,tweet_id,author_id,lang,replied_to,created_at,tweet_text,possibly_sensitive,conversation_id,retweet_count,reply_count,like_count,quote_count
repdarrellissa,Rep. Darrell Issa,1601318932786257921,63650107,en,1601318932786257921,2022-12-09T20:52:39.000Z,"Every time Joe Biden negotiates one-on-one with a foreign adversary, America loses ground.",False,1601318932786257921,112,48,48,6
repdarrellissa,Rep. Darrell Issa,1601267327684993024,63650107,en,1601267327684993024,2022-12-09T17:27:35.000Z,We now know Twitter's corrupted Trust &amp; Safety Council couldn't be trusted and was unsafe for free speech.,False,1601267327684993024,80,24,24,6
repdarrellissa,Rep. Darrell Issa,1601074815062126592,63650107,en,1601074815062126592,2022-12-09T04:42:37.000Z,"We knew Twitter was lying about shadow banning accounts and censoring conservatives. Now we have the proof.

What else is Big Tech hiding?",False,1601074815062126592,109,45,45,0
repdarrellissa,Rep. Darrell Issa,1600908794787397632,63650107,en,1600908794787397632,2022-12-08T17:42:54.000Z,Big tech censors hate free speech because they can’t control free speech.,False,1600908794787397632,63,21,21,1
repdarrellissa,Rep. Darrell Issa,1600307164479860738,63650107,en,1600307164479860738,2022-12-07T01:52:14.000Z,RT @JudiciaryGOP: 🚨#BREAKING: The ATF notified @Jim_Jordan that it intends to destroy the firearms associated with the botched Operation Fa…,False,1600307164479860738,1504,0,0,0
repdarrellissa,Rep. Darrell Issa,1600306206165241857,63650107,en,1600306206165241857,2022-12-07T01:48:26.000Z,"The Obama Administration had many scandals — but the worst may have been Fast and Furious, the DOJ’s illegal gunrunning operation that got a brave Border Patrol agent named Brian Terry killed. 

To this day, Obama claims his White House years were scandal-free.",False,1600306206165241857,1144,611,611,78
repdarrellissa,Rep. Darrell Issa,1600263252868374529,63650107,en,1600263252868374529,2022-12-06T22:57:45.000Z,"No one is buying that Biden is too busy to visit our southern border. 
He doesn't want you to see him have to face the damage he's done.",False,1600263252868374529,447,153,153,28
repdarrellissa,Rep. Darrell Issa,1600218440538595328,63650107,en,1600218440538595328,2022-12-06T19:59:41.000Z,"I don't give a damn what Sec. Austin wants. His military vaccine mandate has harmed thousands of military families and ended careers of honor and service.
https://t.co/daL7sA3fvG",False,1600218440538595328,121,45,45,7
repdarrellissa,Rep. Darrell Issa,1599888045053865984,63650107,en,1599888045053865984,2022-12-05T22:06:49.000Z,The total repeal of the Biden military vaccine mandate must be accompanied by an even stronger commitment of repair for the unprecedented damage it did to lives of service and careers of honor.,False,1599888045053865984,201,49,49,9
repdarrellissa,Rep. Darrell Issa,1599161664460374016,63650107,en,1599161664460374016,2022-12-03T22:00:26.000Z,"Now would be a good time for Big Tech companies to preserve their internal communications.

We must know the truth of how they censor conservatives and influence our elections.",False,1599161664460374016,329,80,80,13
repdarrellissa,Rep. Darrell Issa,1598792169657180188,63650107,en,1598792169657180188,2022-12-02T21:32:12.000Z,"Today, we need the whole truth how Twitter’s previous ownership suppressed the truth about the Hunter Biden laptop.",False,1598792169657180188,370,115,115,11
repdarrellissa,Rep. Darrell Issa,1598749532996907008,63650107,en,1598749532996907008,2022-12-02T18:42:46.000Z,"Yesterday, Tim Cook made a commitment to me that Apple would remain neutral and keep its thumb off the political scale.

I will hold him to that promise.",False,1598749532996907008,203,130,130,24
repdarrellissa,Rep. Darrell Issa,1598492465165701121,63650107,en,1598492465165701121,2022-12-02T01:41:16.000Z,I’ve seen enough: Time for Congress to repeal Biden’s Covid vaccine mandate on our military.,False,1598492465165701121,367,99,99,9
repdarrellissa,Rep. Darrell Issa,1598124510838153216,63650107,en,1598124510838153216,2022-12-01T01:19:09.000Z,"No one is buying that the big tech censors who blocked the Hunter Biden laptop now think they made a mistake.

I don’t believe them.",False,1598124510838153216,315,102,102,11
repdarrellissa,Rep. Darrell Issa,1597683721502883840,63650107,en,1597683721502883840,2022-11-29T20:07:37.000Z,Looking forward to Elon Musk exposing Twitter’s past suppression of free speech. 🍿,False,1597683721502883840,162,62,62,5
repdarrellissa,Rep. Darrell Issa,1597350916226953217,63650107,en,1597350916226953217,2022-11-28T22:05:10.000Z,The White House wants to take down Elon Musk and take back Twitter.,False,1597350916226953217,623,382,382,51
repdarrellissa,Rep. Darrell Issa,1596180890413330432,63650107,en,1596180890413330432,2022-11-25T16:35:54.000Z,I guess Biden’s DOJ couldn’t find a special counsel who wasn’t leading the IRS targeting of conservatives during the Obama years.,False,1596180890413330432,949,301,301,22
repdarrellissa,Rep. Darrell Issa,1595546773711458305,63650107,en,1595546773711458305,2022-11-23T22:36:09.000Z,"The White House staff is sending out Biden talking points they want you to use at Thanksgiving.

I bet they’re really fun at parties.",False,1595546773711458305,136,74,74,11
repdarrellissa,Rep. Darrell Issa,1595211130112299009,63650107,en,1595211130112299009,2022-11-23T00:22:25.000Z,I guess the DOJ couldn’t find a special prosecutor whose spouse wasn’t a Biden donor or produced a film for the Obamas.,False,1595211130112299009,1463,273,273,39
repdarrellissa,Rep. Darrell Issa,1594090710936195073,63650107,en,1594090710936195073,2022-11-19T22:10:16.000Z,The liberal media no longer controls Twitter — and they absolutely can’t stand it.,False,1594090710936195073,2502,693,693,84
repdarrellissa,Rep. Darrell Issa,1593717716728573953,63650107,en,1593717716728573953,2022-11-18T21:28:08.000Z,"70 years ago today, my 97-year-old constituent won the greatest military aerial dogfight you’ve never heard of – and that for decades was officially declared by the Pentagon as having never happened.

Read Royce Williams' story. You'll never forget it. 
https://t.co/xcSR4SPKv0",False,1593717716728573953,64,12,12,2
repdarrellissa,Rep. Darrell Issa,1593361504493080577,63650107,en,1593361504493080577,2022-11-17T21:52:40.000Z,"Nancy Pelosi was a consequential Speaker, but she leaves the Congress in difficult shape and in need of a return to its best traditions. 

The voters removed Pelosi’s grip from the Speaker’s gavel and gave it to a GOP majority that now must lead in a new and better way.",False,1593361504493080577,110,96,96,8
repdarrellissa,Rep. Darrell Issa,1593121910401138688,63650107,en,1593121910401138688,2022-11-17T06:00:36.000Z,Nancy Pelosi is officially an ex-Speaker.,False,1593121910401138688,174,122,122,13
repdarrellissa,Rep. Darrell Issa,1592710559132106753,63650107,en,1592710559132106753,2022-11-16T02:46:03.000Z,"Biden:

Hiring 87,000 IRS agents.

Firing 87,000 military service members.",False,1592710559132106753,1141,229,229,37
repdarrellissa,Rep. Darrell Issa,1592385259769040898,63650107,en,1592385259769040898,2022-11-15T05:13:25.000Z,Congratulations to my friend @KenCalvert on a great campaign and a great win. We need him in Congress.,False,1592385259769040898,26,12,12,1
repdarrellissa,Rep. Darrell Issa,1591812866935607298,63650107,en,1591812866935607298,2022-11-13T15:18:56.000Z,"If “the border is secure” — why did the White House fire its top border appointee?

We don’t need a fall guy for the failure of Biden’s open borders.",False,1591812866935607298,285,83,83,10
repdarrellissa,Rep. Darrell Issa,1591191620623663105,63650107,en,1591191620623663105,2022-11-11T22:10:19.000Z,"If Biden really wants to fire someone over his disastrous open borders, why not his Border Czar? #FireKamala

https://t.co/kkrm8kqo7c",False,1591191620623663105,60,25,25,3
repdarrellissa,Rep. Darrell Issa,1591132389723738112,63650107,en,1591132389723738112,2022-11-11T18:14:58.000Z,"On the 11th hour of the 11th day of the 11th month in 1918, WWI officially ended.

Veterans Day is for the millions who have worn the nation’s uniform and answered the call of our country. 

They will always have the thanks of a grateful nation — especially this Army Captain.",False,1591132389723738112,88,34,34,4
repdarrellissa,Rep. Darrell Issa,1590797332123045888,63650107,en,1590797332123045888,2022-11-10T20:03:34.000Z,"Happy birthday @USMC!

For 247 years, Marines have improvised, adapted, and overcome all obstacles in all situations at home and abroad, land and sea, and even in the air.

Marines selflessly serve and defend America with everlasting honor and indomitable courage. Semper Fi! https://t.co/ucDjg58Ip8",False,1590797332123045888,11,6,6,0
repdarrellissa,Rep. Darrell Issa,1590539026804903937,63650107,en,1590539026804903937,2022-11-10T02:57:09.000Z,"It should be election day.

Not election month.",False,1590539026804903937,665,173,173,20
repdarrellissa,Rep. Darrell Issa,1590203035988668417,63650107,en,1590203035988668417,2022-11-09T04:42:02.000Z,"I backed @JDVance1 early on because he was a great candidate — and I know he’ll be a true leader in the Senate. Congratulations, JD!",False,1590203035988668417,44,21,21,1
repdarrellissa,Rep. Darrell Issa,1590174924047781891,63650107,en,1590174924047781891,2022-11-09T02:50:20.000Z,.@GovRonDeSantis has been the gold standard for Republican governors — congratulations and keep Florida great and free!,False,1590174924047781891,62,20,20,1
repdarrellissa,Rep. Darrell Issa,1590170593562791936,63650107,en,1590170593562791936,2022-11-09T02:33:08.000Z,Congratulations to my friend @marcorubio on his great win in Florida tonight! Glad to have you back for another great six years.,False,1590170593562791936,46,6,6,1
repdarrellissa,Rep. Darrell Issa,1589999311282409472,63650107,en,1589999311282409472,2022-11-08T15:12:31.000Z,"Now Biden tweets that Americans don’t “get to” speak out against his failed administration?

Wrong. Today’s the day we get to let him know what we really think.",False,1589999311282409472,407,234,234,24
repdarrellissa,Rep. Darrell Issa,1589767346604113920,63650107,en,1589767346604113920,2022-11-07T23:50:46.000Z,"The lived experience of millions of Americans is their neighborhoods aren’t as safe as they used to be, there are fewer cops after the defunding of police, and Democrats keep telling them they’re imagining things.",False,1589767346604113920,87,34,34,4
repdarrellissa,Rep. Darrell Issa,1589747938305376257,63650107,en,1589747938305376257,2022-11-07T22:33:39.000Z,"It is a great idea for Twitter to remove Iran’s supreme leader. 

If the Ayatollah won’t let the people of Iran use Twitter, then his access should be denied as well.",False,1589747938305376257,293,41,41,2
repdarrellissa,Rep. Darrell Issa,1589382756274163713,63650107,en,1589382756274163713,2022-11-06T22:22:33.000Z,".@GovRonDeSantis was a star on the House Oversight Committee when I was chairman, and over the last four years he’s set the standard for America’s governors.

The people of Florida know it — and that’s why he’ll win big on Tuesday.",False,1589382756274163713,175,69,69,8
repdarrellissa,Rep. Darrell Issa,1589342182800248832,63650107,en,1589342182800248832,2022-11-06T19:41:19.000Z,"Biden doesn’t “regret” his promise to shut down America’s coal industry and destroy energy jobs.

Biden regrets that the American people are about to render a judgment on his failed energy policies.",False,1589342182800248832,374,140,140,7
repdarrellissa,Rep. Darrell Issa,1589297504512012288,63650107,en,1589297504512012288,2022-11-06T16:43:47.000Z,Biden’s open borders are on the ballot. https://t.co/CFruRWc0xT,False,1589297504512012288,141,50,50,7
repdarrellissa,Rep. Darrell Issa,1589112917001383936,63650107,en,1589112917001383936,2022-11-06T04:30:18.000Z,Here’s the bad news for Democrats: Democracy isn’t on the ballot. They are.,False,1589112917001383936,1313,828,828,80
repdarrellissa,Rep. Darrell Issa,1588665473675456512,63650107,en,1588665473675456512,2022-11-04T22:52:19.000Z,Can Joe Biden go just one day without making an embarrassing gaffe or telling a fable about his failed record?,False,1588665473675456512,529,409,409,45
repdarrellissa,Rep. Darrell Issa,1588567004377927680,63650107,en,1588567004377927680,2022-11-04T16:21:02.000Z,"Now Biden says “We’re gonna free Iran.”

But after abandoning Americans in Afghanistan and leaving our partners there to die, his promise to the brave people in the streets of Tehran simply isn’t credible.",False,1588567004377927680,144,57,57,10
repdarrellissa,Rep. Darrell Issa,1588283849834106880,63650107,en,1588283849834106880,2022-11-03T21:35:53.000Z,"Nation’s highest gas prices ✔️ Skyrocketing energy costs ✔️
Record inflation ✔️
Worst economic record in 40 years ✔️
Historic illegal immigration ✔️
Deadly fentanyl crisis ✔️ https://t.co/wJ3dkv2nKD",False,1588283849834106880,61,33,33,5
repdarrellissa,Rep. Darrell Issa,1588191440537980929,63650107,en,1588191440537980929,2022-11-03T15:28:41.000Z,"Biden’s in San Diego to campaign for Democrats, but he should make time to see firsthand what I have dozens of times: the children and deadly fentanyl trafficked every day across our border with Mexico that he opened wide and has refused to secure.",False,1588191440537980929,184,60,60,7
repdarrellissa,Rep. Darrell Issa,1588014675073048579,63650107,en,1588014675073048579,2022-11-03T03:46:17.000Z,No one is making a better case to vote against Democrats than Joe Biden.,False,1588014675073048579,764,284,284,23
repdarrellissa,Rep. Darrell Issa,1587956159364857857,63650107,en,1587956159364857857,2022-11-02T23:53:45.000Z,"Biden is the most divisive president in memory.

No one is buying he wants to unite the country.",False,1587956159364857857,838,605,605,42
repdarrellissa,Rep. Darrell Issa,1587861019887632388,63650107,en,1587861019887632388,2022-11-02T17:35:42.000Z,"I’ve seen enough. Ban TikTok.

We must protect America from Chinese surveillance.",False,1587861019887632388,881,244,244,47
repdarrellissa,Rep. Darrell Issa,1587848254821113857,63650107,en,1587848254821113857,2022-11-02T16:44:59.000Z,The White House just found out it can’t tweet out Joe Biden’s false statements and have the company’s old regime cover it up. https://t.co/VBPHJrWVi3,False,1587848254821113857,195,57,57,20
repdarrellissa,Rep. Darrell Issa,1587635576894808065,63650107,en,1587635576894808065,2022-11-02T02:39:53.000Z,Twitter already seems more fair and balanced.,False,1587635576894808065,105,178,178,3
repdarrellissa,Rep. Darrell Issa,1587507914667065344,63650107,en,1587507914667065344,2022-11-01T18:12:35.000Z,One thing is clear: Biden’s DHS is out of control.,False,1587507914667065344,672,433,433,37
repdarrellissa,Rep. Darrell Issa,1587142412610281473,63650107,en,1587142412610281473,2022-10-31T18:00:13.000Z,"You can say true things on Twitter again: 

In 2020, Twitter, Facebook, and the DOJ teamed up to help Democrats and interfere in the final days of a presidential election.",False,1587142412610281473,2425,692,692,73
repdarrellissa,Rep. Darrell Issa,1586078891944181761,63650107,en,1586078891944181761,2022-10-28T19:34:10.000Z,"If @elonmusk’s support for free speech is a problem for Twitter employees, they shouldn’t be surprised when they aren’t asked to stick around.",False,1586078891944181761,176,112,112,4
repdarrellissa,Rep. Darrell Issa,1586063379797397505,63650107,en,1586063379797397505,2022-10-28T18:32:32.000Z,I’m shocked by news of the terrible attack on Paul Pelosi in his own home. Hoping for a very swift and full recovery.,False,1586063379797397505,14,71,71,6
repdarrellissa,Rep. Darrell Issa,1585731390024609792,63650107,en,1585731390024609792,2022-10-27T20:33:19.000Z,Follow me on TRUTH Social! https://t.co/3EHNKLoJJ8,False,1585731390024609792,33,29,29,1
repdarrellissa,Rep. Darrell Issa,1585307427855282177,63650107,en,1585307427855282177,2022-10-26T16:28:39.000Z,The critical shortfall of our emergency smallpox vaccine supply is a signature failure of this Administration and puts the nation at risk. Read my letter with @RepRichHudson here: https://t.co/f4bKIXnQkz https://t.co/YxxYWLy5zT,False,1585307427855282177,26,20,20,3
repdarrellissa,Rep. Darrell Issa,1584894535691567104,63650107,en,1584894535691567104,2022-10-25T13:07:57.000Z,"When Biden took office, he promised to avoid partisanship, govern as a moderate, and bring the country together.

He’s done none of the above.",False,1584894535691567104,496,765,765,59
repdarrellissa,Rep. Darrell Issa,1584661668264521728,63650107,en,1584661668264521728,2022-10-24T21:42:37.000Z,It’s no longer news when Joe Biden swears he’s right and the White House explains that he’s wrong again.,False,1584661668264521728,411,148,148,16
repdarrellissa,Rep. Darrell Issa,1584609594118385664,63650107,en,1584609594118385664,2022-10-24T18:15:42.000Z,"It's revealing that mainstream media fact checkers can't seem to find the time to fact-check Biden, Harris, Pelosi, and other Democrats.",False,1584609594118385664,867,418,418,30
repdarrellissa,Rep. Darrell Issa,1584585666259996673,63650107,en,1584585666259996673,2022-10-24T16:40:37.000Z,"TikTok is a surveillance threat of a foreign adversary. That’s why I instructed my staff to never download the app.

The White House has refused to take any action, and its personnel use TikTok practically every day. The damage is likely already done.",False,1584585666259996673,162,86,86,13
repdarrellissa,Rep. Darrell Issa,1584261037292822528,63650107,en,1584261037292822528,2022-10-23T19:10:40.000Z,Message to President Biden: Taxpayer dollars aren’t your money.,False,1584261037292822528,1983,2343,2343,186
repdarrellissa,Rep. Darrell Issa,1583622654594285568,63650107,en,1583622654594285568,2022-10-22T00:53:57.000Z,Joe Biden is toxic. And every Democrat asking him to please stay away from their campaign knows it.,False,1583622654594285568,702,529,529,40
repdarrellissa,Rep. Darrell Issa,1583150229100015616,63650107,en,1583150229100015616,2022-10-20T17:36:42.000Z,This may be the most embarrassing moment for MSNBC since the network endorsed the theory that time travelers wrote Joy Reid’s anti-gay blog posts. https://t.co/I0U8bOgmIr,False,1583150229100015616,65,60,60,7
repdarrellissa,Rep. Darrell Issa,1583145933323177984,63650107,en,1583145933323177984,2022-10-20T17:19:38.000Z,RT @AEA: Congratulations @repdarrellissa for scoring a 100% on the American Energy Scorecard! Thank you for being a champion for American e…,False,1583145933323177984,6,0,0,0
repdarrellissa,Rep. Darrell Issa,1582893310175084544,63650107,en,1582893310175084544,2022-10-20T00:35:48.000Z,"Sadly, this is not the Onion. https://t.co/qM1WqxOBzo",False,1582893310175084544,51,49,49,5
repdarrellissa,Rep. Darrell Issa,1582813787081428992,63650107,en,1582813787081428992,2022-10-19T19:19:48.000Z,"Joe Biden is running on empty — and soon, the Strategic Petroleum Reserve will be too.",False,1582813787081428992,884,632,632,50
repdarrellissa,Rep. Darrell Issa,1582758919016849409,63650107,en,1582758919016849409,2022-10-19T15:41:47.000Z,Biden family corruption is not about Hunter’s taxes. We’ve seen evidence of criminal violations at the very center of their influence peddling and selling of access. https://t.co/XGYYIhtd0d,False,1582758919016849409,308,193,193,21
repdarrellissa,Rep. Darrell Issa,1582465993129226240,63650107,en,1582465993129226240,2022-10-18T20:17:48.000Z,Does Joe Biden think he looks good munching his ice cream cone and bragging about the worst economic record in 40 years?,False,1582465993129226240,584,661,661,55
repdarrellissa,Rep. Darrell Issa,1582203864388104193,63650107,en,1582203864388104193,2022-10-18T02:56:11.000Z,Even the White House admits its Inflation Reduction Act isn’t reducing inflation.,False,1582203864388104193,372,240,240,16
repdarrellissa,Rep. Darrell Issa,1582191740282630144,63650107,en,1582191740282630144,2022-10-18T02:08:01.000Z,"If a charity harms those it is supposed to help, it has truly failed.

Sen. Warnock has a lot of explaining to do.

https://t.co/kgEXnD608b",False,1582191740282630144,54,42,42,5
repdarrellissa,Rep. Darrell Issa,1582109390923960321,63650107,en,1582109390923960321,2022-10-17T20:40:47.000Z,This is the time to support the brave people of Iran as they stand up to the brutal regime that controls their country. https://t.co/lSIV42hF9l,False,1582109390923960321,111,51,51,3
repdarrellissa,Rep. Darrell Issa,1582036949615116291,63650107,en,1582036949615116291,2022-10-17T15:52:56.000Z,"When Eric Holder and Lois Lerner defy Congressional subpoenas, the DOJ does nothing.

But the DOJ goes after Republicans with indictments and prison.",False,1582036949615116291,3856,906,906,182
repdarrellissa,Rep. Darrell Issa,1580993114835062784,63650107,en,1580993114835062784,2022-10-14T18:45:06.000Z,The American people need to know how much the White House colluded with PayPal to target  conservatives and silence their free speech. https://t.co/ylz09IvNtU,False,1580993114835062784,95,57,57,3
repdarrellissa,Rep. Darrell Issa,1580954636030480384,63650107,en,1580954636030480384,2022-10-14T16:12:12.000Z,"VP Harris: “The border is secure.”

Sanctuary city Democrats: “Send us money to deal with the crisis of illegal immigrants crossing the border.”",False,1580954636030480384,514,169,169,21
repdarrellissa,Rep. Darrell Issa,1580713015237693440,63650107,en,1580713015237693440,2022-10-14T00:12:05.000Z,"Message to Speaker Pelosi: It’s still the economy, stupid.",False,1580713015237693440,222,125,125,12
repdarrellissa,Rep. Darrell Issa,1580628280457109504,63650107,en,1580628280457109504,2022-10-13T18:35:23.000Z,Can't get very excited about the season finale of the Jan. 6 committee when the show is about to be cancelled.,False,1580628280457109504,1078,2049,2049,154
repdarrellissa,Rep. Darrell Issa,1580615856098189313,63650107,en,1580615856098189313,2022-10-13T17:46:01.000Z,The historic Lebanon-Israel maritime border agreement will provide economic opportunity and energy security for both nations and bring stability to the region. https://t.co/Lzn1TmTwV6,False,1580615856098189313,13,21,21,0
repdarrellissa,Rep. Darrell Issa,1580356669128597504,63650107,en,1580356669128597504,2022-10-13T00:36:06.000Z,"The Jan. 6 Committee says it’s conducting an investigation. That’s not true. It’s a desperate, federally funded campaign to save the Democrats before the voters toss them out in November.",False,1580356669128597504,1199,1052,1052,75
repdarrellissa,Rep. Darrell Issa,1580257221660639232,63650107,en,1580257221660639232,2022-10-12T18:00:56.000Z,"Biden doesn't know, can't remember, or won't admit that he's driven our economy into a recession.",False,1580257221660639232,360,489,489,29
repdarrellissa,Rep. Darrell Issa,1579920798164602880,63650107,en,1579920798164602880,2022-10-11T19:44:06.000Z,"VP Harris might be able to criticize GOP border governors if she visited the border since she became, you know, border czar.",False,1579920798164602880,218,205,205,14
repdarrellissa,Rep. Darrell Issa,1579854174090842113,63650107,en,1579854174090842113,2022-10-11T15:19:22.000Z,"BOMBSHELL: My Congressional office has uncovered the truth about the Pentagon manipulating the steep decline in military recruitment and covering up a crisis in morale among our service members.

https://t.co/yuf1GhGvZf",False,1579854174090842113,81,62,62,4
repdarrellissa,Rep. Darrell Issa,1578411567791513600,63650107,en,1578411567791513600,2022-10-07T15:46:57.000Z,"Of all the lies told to advance the Bidens’ selling of access, the worst may have been “we are not lobbyists.”

https://t.co/7oPpkgjZFe",False,1578411567791513600,222,124,124,12
repdarrellissa,Rep. Darrell Issa,1578132869481988113,63650107,en,1578132869481988113,2022-10-06T21:19:31.000Z,New developments are emerging in the Biden family corruption scandal. Tune in TONIGHT at 6 ET/3 PT as I join @EveningEdit to discuss the latest. https://t.co/Sld0OoghHq,False,1578132869481988113,25,80,80,4
repdarrellissa,Rep. Darrell Issa,1578128003443343360,63650107,en,1578128003443343360,2022-10-06T21:00:10.000Z,Biden family corruption means the peddling of influence and the selling of access that the Biden family has done all around the world and for many years — including the President.,False,1578128003443343360,465,330,330,24
repdarrellissa,Rep. Darrell Issa,1578114412178771969,63650107,en,1578114412178771969,2022-10-06T20:06:10.000Z,"When we talk about “Biden family corruption,” we don’t mean that Hunter swiped the M&amp;Ms from Air Force Two.",False,1578114412178771969,177,116,116,8
repdarrellissa,Rep. Darrell Issa,1577411699455524866,63650107,en,1577411699455524866,2022-10-04T21:33:50.000Z,DHS is covering up the truth of a massive increase in illegal immigrants deemed national security risks. It’s only a matter of time before the American people pay for this with their lives. https://t.co/LHntjP21Ng,False,1577411699455524866,164,36,36,11
repdarrellissa,Rep. Darrell Issa,1577294862596165634,63650107,en,1577294862596165634,2022-10-04T13:49:34.000Z,"Last year, Biden’s excuse for his border crisis and unprecedented number of migrants who are national security risks was that it was “normal” or “seasonal” migration. 

Now we know it was just the latest lie.",False,1577294862596165634,150,189,189,16
repdarrellissa,Rep. Darrell Issa,1576738283110875139,63650107,en,1576738283110875139,2022-10-03T00:57:55.000Z,The Biden Administration is a disaster. https://t.co/aNuCEZi6mT,False,1576738283110875139,116,175,175,13
