handle,name,tweet_id,author_id,lang,replied_to,created_at,tweet_text,possibly_sensitive,conversation_id,retweet_count,reply_count,like_count,quote_count
repdarrellissa,Rep. Darrell Issa,1516071103692632074,63650107,en,1516071103692632074,2022-04-18T15:08:13.000Z,I stand with Elon Musk.,False,1516071103692632074,4594,4393,4393,468
repdarrellissa,Rep. Darrell Issa,1515917670918471681,63650107,en,1515917670918471681,2022-04-18T04:58:31.000Z,"In this time of Passover, Ramadan, and Easter, may people of faith and goodwill come together as God intended.",False,1515917670918471681,55,60,60,5
repdarrellissa,Rep. Darrell Issa,1515722519373877249,63650107,en,1515722519373877249,2022-04-17T16:03:04.000Z,Have a blessed and glorious Easter.,False,1515722519373877249,30,22,22,2
repdarrellissa,Rep. Darrell Issa,1515672200317222918,63650107,en,1515672200317222918,2022-04-17T12:43:07.000Z,"The White House is desperately teasing they will cancel student debt — and time it for maximum political benefit.

Someone should tell them they shouldn’t say the quiet part out loud.",False,1515672200317222918,152,72,72,7
repdarrellissa,Rep. Darrell Issa,1515357593954406416,63650107,en,1515357593954406416,2022-04-16T15:52:59.000Z,Nobody’s buying this White House doesn’t know it’s lying.,False,1515357593954406416,368,224,224,7
repdarrellissa,Rep. Darrell Issa,1515134672694652928,63650107,en,1515134672694652928,2022-04-16T01:07:10.000Z,"First the White House said issuing new oil and gas leases wouldn’t help lessen Biden’s energy crisis.

Now they’re bragging about doing it. But charging companies more.

Can’t anybody there govern?",False,1515134672694652928,266,80,80,11
repdarrellissa,Rep. Darrell Issa,1515052387182026757,63650107,en,1515052387182026757,2022-04-15T19:40:12.000Z,Here’s what I’m hearing from law enforcement: There is a straight line connecting Biden’s border crisis to the unprecedented deadly fentanyl crisis.,False,1515052387182026757,2480,546,546,149
repdarrellissa,Rep. Darrell Issa,1514716743293308928,63650107,en,1514716743293308928,2022-04-14T21:26:28.000Z,The Washington Post editorial page panicking about a billionaire purchasing a media property just made my day.,False,1514716743293308928,1199,394,394,62
repdarrellissa,Rep. Darrell Issa,1514601784370552841,63650107,en,1514601784370552841,2022-04-14T13:49:39.000Z,The panic coming from blue-check media after Elon Musk’s offer to buy Twitter is the fear of losing the ability to censor conservatives online and silence free speech they don’t like.,False,1514601784370552841,4021,1640,1640,175
repdarrellissa,Rep. Darrell Issa,1514478875723517955,63650107,en,1514478875723517955,2022-04-14T05:41:16.000Z,"More than ever, I’m convinced Joe Biden isn’t up to the job.",False,1514478875723517955,253,179,179,30
repdarrellissa,Rep. Darrell Issa,1514108313243332610,63650107,en,1514108313243332610,2022-04-13T05:08:47.000Z,"Make no mistake: With Elon Musk not on its board of directors, he’s positioned to be more involved in reforming Twitter, not less.",False,1514108313243332610,2410,1913,1913,198
repdarrellissa,Rep. Darrell Issa,1514007668205096961,63650107,en,1514007668205096961,2022-04-12T22:28:51.000Z,No one is buying that Biden isn’t to blame for America’s inflation crisis.,False,1514007668205096961,285,289,289,30
repdarrellissa,Rep. Darrell Issa,1513737850683940865,63650107,en,1513737850683940865,2022-04-12T04:36:42.000Z,"Black Lives Matter sent some angry tweets, but still hasn’t come close to explaining its purchase of a $6 million mansion in L.A. — using donations to its charity.

We need an investigation more than ever.",False,1513737850683940865,1842,365,365,71
repdarrellissa,Rep. Darrell Issa,1513371763576492032,63650107,en,1513371763576492032,2022-04-11T04:22:00.000Z,"Joe Biden’s story that he knew nothing about Hunter’s dealings with China and other foreign clients is getting impossible to believe. 

Since this White House won’t come clean, Congress should be getting at the truth right now.",False,1513371763576492032,279,90,90,18
repdarrellissa,Rep. Darrell Issa,1512641032105562116,63650107,en,1512641032105562116,2022-04-09T03:58:20.000Z,"So many red flags raised by the $6 million purchase of an L.A. mansion by the charity of Black Lives Matter.

BLM hasn’t come close to explaining this. And the Biden DOJ can’t ignore it any longer.",False,1512641032105562116,2273,432,432,111
repdarrellissa,Rep. Darrell Issa,1512240586291523584,63650107,en,1512240586291523584,2022-04-08T01:27:06.000Z,"The Biden family scandals aren’t going away.

More than 150 global financial transactions involving Hunter Biden or Joe Biden’s brother were flagged by U.S. banks.

This is just the beginning.",False,1512240586291523584,919,200,200,48
repdarrellissa,Rep. Darrell Issa,1512084124135313409,63650107,en,1512084124135313409,2022-04-07T15:05:23.000Z,"I hear Twitter employees are panicking about Elon Musk. 

What are they afraid of? Might get harder to censor and silence conservatives?",False,1512084124135313409,5073,4095,4095,350
repdarrellissa,Rep. Darrell Issa,1511798978857345031,63650107,en,1511798978857345031,2022-04-06T20:12:19.000Z,Message for Hunter Biden: There's still time for you to get ahead of what's coming.,False,1511798978857345031,168,104,104,18
repdarrellissa,Rep. Darrell Issa,1511728358853332993,63650107,en,1511728358853332993,2022-04-06T15:31:41.000Z,"The White House says ""We don't comment on the laptop.""

Well, they will next year.",False,1511728358853332993,200,86,86,8
repdarrellissa,Rep. Darrell Issa,1511513880257826822,63650107,en,1511513880257826822,2022-04-06T01:19:26.000Z,Hunter Biden is now on notice: My colleagues on the House Judiciary Committee and I have officially warned him not to delete or destroy any evidence of coordination and collusion in the coverup of his laptop scandal.,False,1511513880257826822,4516,5859,5859,639
repdarrellissa,Rep. Darrell Issa,1511411393819557888,63650107,en,1511411393819557888,2022-04-05T18:32:11.000Z,"I see President “If you like your doctor, you can keep your doctor” was back in the White House complaining about misinformation.",False,1511411393819557888,472,96,96,13
repdarrellissa,Rep. Darrell Issa,1511397334382518281,63650107,en,1511397334382518281,2022-04-05T17:36:19.000Z,"Elon Musk's extraordinary breakthroughs are owed to the innovation of free minds and the precision of free markets. He knows that free expression is just as important.

Elon can only make Twitter better.",False,1511397334382518281,83,36,36,7
repdarrellissa,Rep. Darrell Issa,1511310740904361985,63650107,en,1511310740904361985,2022-04-05T11:52:14.000Z,"Just when you think Biden can’t make his border crisis any worse — he makes it worse.

Our Border Patrol friends tell us they’re overwhelmed as never before and the White House wants it that way.",False,1511310740904361985,223,77,77,18
repdarrellissa,Rep. Darrell Issa,1511040090331623433,63650107,en,1511040090331623433,2022-04-04T17:56:45.000Z,"Secret Service is reportedly paying $30,000 a month to rent a Malibu mansion to keep watch on Hunter Biden.

Looks like the cost of protecting Hunter is being shared by Big Tech, the mainstream media … and now the taxpayers as well.",False,1511040090331623433,398,140,140,31
repdarrellissa,Rep. Darrell Issa,1510845493747888129,63650107,en,1510845493747888129,2022-04-04T05:03:30.000Z,We won’t stop until the American people know the truth about the censorship of the Hunter Biden laptop and the Big Tech/Mainstream Media cover up of Biden Family scandals.,False,1510845493747888129,1609,541,541,64
repdarrellissa,Rep. Darrell Issa,1510616533843812361,63650107,en,1510616533843812361,2022-04-03T13:53:42.000Z,"Either The NY Times printed fake news or Joe Biden is pressuring his Attorney General to prosecute Trump and others. 

The White House won’t say.

The House Judiciary Committee should be getting these answers next week.",False,1510616533843812361,693,185,185,19
repdarrellissa,Rep. Darrell Issa,1510311341759860740,63650107,en,1510311341759860740,2022-04-02T17:40:58.000Z,"This is welcome news. But it’s not the end of the fight.
https://t.co/RFb85CoS4y",False,1510311341759860740,17,15,15,0
repdarrellissa,Rep. Darrell Issa,1510262258445828099,63650107,en,1510262258445828099,2022-04-02T14:25:56.000Z,No one is buying that America’s energy crisis is anyone’s fault except Joe Biden.,False,1510262258445828099,2324,711,711,102
repdarrellissa,Rep. Darrell Issa,1510116019561455620,63650107,en,1510116019561455620,2022-04-02T04:44:50.000Z,"Twitter says they’re working on an edit button.

They should work on stopping their censorship of conservatives.",False,1510116019561455620,182,75,75,10
repdarrellissa,Rep. Darrell Issa,1509907255826788392,63650107,en,1509907255826788392,2022-04-01T14:55:17.000Z,"I hear Jen Psaki is taking a job with MSNBC.

At least she'll still be working for the White House.",False,1509907255826788392,308,87,87,20
repdarrellissa,Rep. Darrell Issa,1509594867776860162,63650107,en,1509594867776860162,2022-03-31T18:13:58.000Z,"The attacks on Clarence and Ginni Thomas by Speaker Pelosi, AOC, and other Democrats should be beneath Members of Congress.",False,1509594867776860162,238,137,137,36
repdarrellissa,Rep. Darrell Issa,1509349482743357445,63650107,en,1509349482743357445,2022-03-31T01:58:53.000Z,"Hillary’s 2016 campaign was fined by the FCC for lying about the Steele Dossier.

Not sure the mainstream media wanted you to know.",False,1509349482743357445,333,159,159,25
repdarrellissa,Rep. Darrell Issa,1509303225400320005,63650107,en,1509303225400320005,2022-03-30T22:55:05.000Z,What the Wash Post calls a deep dive into the Hunter Biden scandal is a pretty shallow plunge. And it left out the best part: An apology for the Post dismissing accurate reporting about the laptop and running interference for the Biden campaign.,False,1509303225400320005,152,64,64,7
repdarrellissa,Rep. Darrell Issa,1509158711469789185,63650107,en,1509158711469789185,2022-03-30T13:20:50.000Z,I stand with Justice Clarence Thomas.,False,1509158711469789185,3523,6016,6016,588
repdarrellissa,Rep. Darrell Issa,1508919469384650762,63650107,en,1508919469384650762,2022-03-29T21:30:10.000Z,I'm even more convinced that Joe Biden isn't up to the job.,False,1508919469384650762,232,144,144,15
repdarrellissa,Rep. Darrell Issa,1508885337115922443,63650107,en,1508885337115922443,2022-03-29T19:14:32.000Z,"No one is buying the White House simply forgot to provide the Senate with details of how Ketanji Brown Jackson went easy on crimes involving child pornography. 

They know how damaging the truth is.",False,1508885337115922443,201,57,57,6
repdarrellissa,Rep. Darrell Issa,1508846031945056261,63650107,en,1508846031945056261,2022-03-29T16:38:21.000Z,"Today is Vietnam Veterans Day. We owe these men and women – more than nine million strong – a debt beyond words and gratitude beyond measure.

Every year on this day, we honor those who answered our country's call and set records for courage and commitment. Thank you, veterans.",False,1508846031945056261,58,21,21,0
repdarrellissa,Rep. Darrell Issa,1508639750768533507,63650107,en,1508639750768533507,2022-03-29T02:58:40.000Z,Every time Biden says he’s not walking back something he said … the White House walks it back.,False,1508639750768533507,292,64,64,12
repdarrellissa,Rep. Darrell Issa,1508563616471175175,63650107,en,1508563616471175175,2022-03-28T21:56:08.000Z,Hunter Biden is now on notice: Do not delete or destroy any evidence of your coordination and collusion to prevent accurate reporting of your laptop from being seen by the American people.,False,1508563616471175175,346,73,73,22
repdarrellissa,Rep. Darrell Issa,1508270350316015619,63650107,en,1508270350316015619,2022-03-28T02:30:48.000Z,Nobody is buying the White House spin that Biden didn’t go off the rails when they let him speak before a live audience.,False,1508270350316015619,203,45,45,2
repdarrellissa,Rep. Darrell Issa,1507835397073776645,63650107,en,1507835397073776645,2022-03-26T21:42:27.000Z,"Biden says U.S. will use chemical weapons. White House corrects him.

Biden says the 82nd Airborne is on its way to Ukraine. Corrected again.

Biden calls for regime change in Russia. Corrected a third time.

Maybe whoever is correcting Biden should be given The Football too.",False,1507835397073776645,4410,644,644,309
repdarrellissa,Rep. Darrell Issa,1507742746127253510,63650107,en,1507742746127253510,2022-03-26T15:34:17.000Z,Biden’s bystander routine looks just as bad overseas as it does at home.,False,1507742746127253510,112,52,52,5
repdarrellissa,Rep. Darrell Issa,1507474371476344832,63650107,en,1507474371476344832,2022-03-25T21:47:52.000Z,"I have now put John Brennan, James Clapper and other Democrat partisans in the Intelligence Community on notice: Don’t delete or destroy any evidence of your coordination and collusion in the Hunter Biden laptop scandal.",False,1507474371476344832,4044,837,837,181
repdarrellissa,Rep. Darrell Issa,1507385540034895904,63650107,en,1507385540034895904,2022-03-25T15:54:53.000Z,I have now put Mark Zuckerberg and Meta on notice; Don’t delete or destroy any evidence of your coordination and collusion in the Hunter Biden laptop scandal. https://t.co/RtWTNRY1wG,False,1507385540034895904,3610,828,828,195
repdarrellissa,Rep. Darrell Issa,1507112516790460420,63650107,en,1507112516790460420,2022-03-24T21:49:59.000Z,"Today, I put this White House — including Jen Psaki and Ron Klain — on notice: Don’t delete or destroy any evidence of your coordination and collusion in the Hunter Biden laptop scandal.",False,1507112516790460420,6520,1932,1932,345
repdarrellissa,Rep. Darrell Issa,1507027502862114823,63650107,en,1507027502862114823,2022-03-24T16:12:10.000Z,"Big Tech is at it again.

YouTube has again removed one of my recent speeches and many from my Republican colleagues as well. 

There should be hell to pay for silencing conservative free speech.",False,1507027502862114823,342,128,128,24
repdarrellissa,Rep. Darrell Issa,1506695382537064457,63650107,en,1506695382537064457,2022-03-23T18:12:26.000Z,Facebook is now on notice; Don’t delete or destroy any evidence of your coordination and collusion in the Hunter Biden laptop scandal.,False,1506695382537064457,5843,637,637,189
repdarrellissa,Rep. Darrell Issa,1506652254211911689,63650107,en,1506652254211911689,2022-03-23T15:21:04.000Z,"Today, we are sending our first document preservation notices in getting to the bottom of the Hunter Biden/Big Tech/Mainstream Media scandal and coverup.

Twitter: Check your inbox.",False,1506652254211911689,372,81,81,20
repdarrellissa,Rep. Darrell Issa,1506432343791263749,63650107,en,1506432343791263749,2022-03-23T00:47:13.000Z,"On day one, President Biden declared war on American energy independence. The highest-ever gas prices that have followed is the direct result.
 
I’m proud to join my friend Rep. Schweikert in this urgent letter to the White House. https://t.co/g5IOvPNgME",False,1506432343791263749,74,99,99,3
repdarrellissa,Rep. Darrell Issa,1506350956983816198,63650107,en,1506350956983816198,2022-03-22T19:23:49.000Z,"We don't have anything close to all the dirty details about the Biden Administration's new and even worse Iran nuclear deal.

You better believe I'll be fighting to stop this in Congress.",False,1506350956983816198,205,76,76,4
repdarrellissa,Rep. Darrell Issa,1506349800178003973,63650107,zxx,1506349800178003973,2022-03-22T19:19:13.000Z,https://t.co/hTGQjYs9wj,False,1506349800178003973,36,11,11,0
repdarrellissa,Rep. Darrell Issa,1506328289845157891,63650107,en,1506328289845157891,2022-03-22T17:53:45.000Z,"Free @TheBabylonBee!

What's the matter, Twitter? Can't take a joke?",False,1506328289845157891,222,43,43,10
repdarrellissa,Rep. Darrell Issa,1506040950719717376,63650107,en,1506040950719717376,2022-03-21T22:51:58.000Z,"As excessive Covid regulations are being relaxed and reconsidered everywhere -- Biden's abusive military vaccine mandate is still in force, driving soldiers out of the service every day. Tens of thousands more may be next.

We need to stop this now.",False,1506040950719717376,142,52,52,4
repdarrellissa,Rep. Darrell Issa,1505982634148704259,63650107,en,1505982634148704259,2022-03-21T19:00:14.000Z,Nobody should be surprised the Washington Post and New York Times are trying to rewrite history about their collusion in the last days of the 2020 election with Big Tech and powerful Democrats to censor the NY Post and cover up Biden family scandals.,False,1505982634148704259,237,43,43,6
repdarrellissa,Rep. Darrell Issa,1505769703259705346,63650107,en,1505769703259705346,2022-03-21T04:54:07.000Z,Prayers tonight for a swift recovery for the extraordinary Justice Clarence Thomas.,False,1505769703259705346,177,41,41,10
repdarrellissa,Rep. Darrell Issa,1505691279220428808,63650107,en,1505691279220428808,2022-03-20T23:42:30.000Z,"Every time Biden has an hour-plus phone call with one of our adversaries, it seems like America gets less safe, not more.",False,1505691279220428808,207,61,61,11
repdarrellissa,Rep. Darrell Issa,1505278678380560389,63650107,en,1505278678380560389,2022-03-19T20:22:58.000Z,"I won’t stop until we get the full truth about how Big Tech, the mainstream media colluded to shut down the truth about Hunter Biden’s influence peddling and the ways Joe Biden may have benefitted from it. Enough of lies to protect the guilty.",False,1505278678380560389,393,106,106,29
repdarrellissa,Rep. Darrell Issa,1505225547546341378,63650107,en,1505225547546341378,2022-03-19T16:51:50.000Z,"The mainstream media won’t cover my call for an investigation into its collusion with Big Tech and Democrats in and out of government to suppress the Biden family scandals and influence the 2020 election.

This is the truth no one in the White House wants you to know.",False,1505225547546341378,310,85,85,11
repdarrellissa,Rep. Darrell Issa,1505027365084307456,63650107,en,1505027365084307456,2022-03-19T03:44:20.000Z,"Don Young was more than a friend, colleague, and Dean of our House. He was an institution and a legend — the quintessential consequential Congressman with a legacy as large as the Alaska he loved. This is a night of great sadness but immense appreciation. He was one of a kind.",False,1505027365084307456,15,8,8,1
repdarrellissa,Rep. Darrell Issa,1504640443513978880,63650107,en,1504640443513978880,2022-03-18T02:06:51.000Z,"Tonight, I’m calling for a Congressional investigation into how big tech, mainstream media, and the Democrat industrial complex colluded to suppress the Hunter Biden scandals — and during the last days of the 2020 election.",False,1504640443513978880,6781,1563,1563,396
repdarrellissa,Rep. Darrell Issa,1504582492493332494,63650107,en,1504582492493332494,2022-03-17T22:16:34.000Z,Now we know Biden's plan: Ensure Iran goes nuclear and Russia makes billions helping them do it.,False,1504582492493332494,268,87,87,21
repdarrellissa,Rep. Darrell Issa,1504581660850929664,63650107,en,1504581660850929664,2022-03-17T22:13:16.000Z,RT @Kredo0: SCOOP: Senate Moves to Block Biden Admin from Waiving Sanctions So Russia Can Build Iranian Nuke Sites -- @SenTedCruz &amp; colleag…,False,1504581660850929664,278,0,0,0
repdarrellissa,Rep. Darrell Issa,1504512650381774859,63650107,en,1504512650381774859,2022-03-17T17:39:03.000Z,Take it from me: Anyone who didn't like Obama's terrible Iran nuclear deal is going to like Biden's new one even less.,False,1504512650381774859,210,47,47,14
repdarrellissa,Rep. Darrell Issa,1504474242439520263,63650107,en,1504474242439520263,2022-03-17T15:06:25.000Z,"Why is the NY Times now confirming the Hunter Biden scandals they declared misinformation and helped to censor? 

They don't think they need to cover it up any longer.",False,1504474242439520263,264,117,117,16
repdarrellissa,Rep. Darrell Issa,1504425355624525826,63650107,en,1504425355624525826,2022-03-17T11:52:10.000Z,Can’t say Biden didn’t keep his promise to wage war … against America’s energy producers.,False,1504425355624525826,117,25,25,7
repdarrellissa,Rep. Darrell Issa,1504211929119735816,63650107,en,1504211929119735816,2022-03-16T21:44:05.000Z,"California has the highest gas tax in America.

Suspend it now.",False,1504211929119735816,61,11,11,2
repdarrellissa,Rep. Darrell Issa,1504147979720175616,63650107,en,1504147979720175616,2022-03-16T17:29:58.000Z,Of course Biden took no questions. He doesn't have any answers.,False,1504147979720175616,274,48,48,15
repdarrellissa,Rep. Darrell Issa,1504147823423541262,63650107,en,1504147823423541262,2022-03-16T17:29:21.000Z,Biden was an an hour and a half late. I'm not sure it helped.,False,1504147823423541262,60,24,24,5
repdarrellissa,Rep. Darrell Issa,1504111900178763778,63650107,en,1504111900178763778,2022-03-16T15:06:36.000Z,President Zelensky has again shown courage under fire and the gallant determination of a nation that wants to live on its feet and not on its knees.,False,1504111900178763778,26,29,29,3
repdarrellissa,Rep. Darrell Issa,1503885348136538113,63650107,en,1503885348136538113,2022-03-16T00:06:22.000Z,You’ll know this White House is serious about governing when it rolls out hashtags about Ukraine *and* TikTok stars about gas prices.,False,1503885348136538113,102,36,36,6
repdarrellissa,Rep. Darrell Issa,1503784122052919296,63650107,en,1503784122052919296,2022-03-15T17:24:08.000Z,Time for Team Biden to give up the dream of a Rose Garden signing ceremony with Iran.,False,1503784122052919296,109,32,32,7
repdarrellissa,Rep. Darrell Issa,1503772465352392705,63650107,en,1503772465352392705,2022-03-15T16:37:49.000Z,The Biden foreign policy is on fire all over the world. Not in a good way.,False,1503772465352392705,179,52,52,5
repdarrellissa,Rep. Darrell Issa,1503477862669729793,63650107,en,1503477862669729793,2022-03-14T21:07:10.000Z,"Interested in learning more about the legislative process, media communications, and how Congress works?

My office is looking for spring and summer interns to work in my D.C. and Southern California offices. For more information, visit the link below:

https://t.co/iQ8EuEv5yG https://t.co/29IapByQXY",False,1503477862669729793,7,14,14,1
repdarrellissa,Rep. Darrell Issa,1503458855715495947,63650107,en,1503458855715495947,2022-03-14T19:51:38.000Z,Maria Bartiromo was right. https://t.co/Te6Du8f0Rx,False,1503458855715495947,138,296,296,14
repdarrellissa,Rep. Darrell Issa,1503420046747521034,63650107,en,1503420046747521034,2022-03-14T17:17:25.000Z,Democrats aren’t even pretending to support American energy independence.,False,1503420046747521034,189,52,52,10
repdarrellissa,Rep. Darrell Issa,1503177059425738756,63650107,en,1503177059425738756,2022-03-14T01:11:53.000Z,"For months, the Biden Administration has been crafting another nuclear deal with Iran. 

But we’re not meeting with the Mullahs face to face. The broker for the two sides has been — and I’m not making this up — Russia.

Biden’s foreign policy makes zero sense.",False,1503177059425738756,250,55,55,22
repdarrellissa,Rep. Darrell Issa,1503011612080414723,63650107,en,1503011612080414723,2022-03-13T14:14:27.000Z,Does the Biden Administration understand what happens when you trust the Mullahs in Iran? Or will the next attack convince them?,False,1503011612080414723,100,42,42,12
repdarrellissa,Rep. Darrell Issa,1502648596998598661,63650107,en,1502648596998598661,2022-03-12T14:11:58.000Z,Ladies and gentlemen: The Vice President of the United States: https://t.co/fXHryYx0st,False,1502648596998598661,149,99,99,32
repdarrellissa,Rep. Darrell Issa,1502362093269438466,63650107,en,1502362093269438466,2022-03-11T19:13:30.000Z,"The Biden Administration has made it perfectly clear it has no idea what to do about the crises they’ve created, made worse, and failed to stop.",False,1502362093269438466,169,48,48,11
repdarrellissa,Rep. Darrell Issa,1502022567439347716,63650107,en,1502022567439347716,2022-03-10T20:44:20.000Z,Starting in just 15 minutes - join us! https://t.co/0CIRpZgs64,False,1502022567439347716,5,8,8,0
repdarrellissa,Rep. Darrell Issa,1502004831757778946,63650107,en,1502004831757778946,2022-03-10T19:33:52.000Z,Is anyone really surprised that the White House let VP Harris back on the international stage and hilarity ensued?,False,1502004831757778946,125,72,72,11
repdarrellissa,Rep. Darrell Issa,1501963893580746753,63650107,en,1501963893580746753,2022-03-10T16:51:12.000Z,"Inflation has now hit a 40-year high. The Biden Administration is now a historic failure.

It's incredible this isn't a top priority for Congress right now. The Democrat majority can't end soon enough.",False,1501963893580746753,68,38,38,0
repdarrellissa,Rep. Darrell Issa,1501945598613733381,63650107,en,1501945598613733381,2022-03-10T15:38:30.000Z,Pelosi and the Democrats are now huddled at their political retreat in Philadelphia -- seems like a good time for an intervention.,False,1501945598613733381,49,23,23,6
repdarrellissa,Rep. Darrell Issa,1501780500482084867,63650107,en,1501780500482084867,2022-03-10T04:42:27.000Z,Fact: Gas prices have risen month over month throughout the entire Biden presidency.,False,1501780500482084867,335,101,101,21
repdarrellissa,Rep. Darrell Issa,1501647726278230018,63650107,en,1501647726278230018,2022-03-09T19:54:51.000Z,"Biden says he ""can't do much"" about gas prices. But he's done everything he can to drive them higher.

Nobody is buying his excuses. But we're sure paying for them.",False,1501647726278230018,208,60,60,12
repdarrellissa,Rep. Darrell Issa,1501629175689531393,63650107,en,1501629175689531393,2022-03-09T18:41:09.000Z,"Another short work week for the Pelosi Congress. Democrats need to get out of town today so they can party all weekend at their team-building retreat in Philadelphia.

There's work to do in Washington. Cancel your party.",False,1501629175689531393,67,23,23,3
