handle,name,tweet_id,author_id,lang,replied_to,created_at,tweet_text,possibly_sensitive,conversation_id,retweet_count,reply_count,like_count,quote_count
repfinstad,Congressman Brad Finstad,1601321753850281984,1563316176717246464,en,1601321753850281984,2022-12-09T21:03:51.000Z,"Proud to support this year's NDAA, which:   
🇺🇸 Increases defense spending by $45B
🇺🇸 Repeals the COVID-19 vaccine mandate for servicemembers
🇺🇸 Raises pay for our men and women in uniform

Read my full statement here ⬇️ 
https://t.co/lEJVI6dsZF",False,1601321753850281984,1,0,0,0
repfinstad,Congressman Brad Finstad,1600886616536809473,1563316176717246464,en,1600886616536809473,2022-12-08T16:14:47.000Z,"Big congrats to my friend &amp; colleague @CongressmanGT! G.T. has a proven record of fighting for rural communities &amp; working across the aisle to find solutions. 

Under his leadership, the House Ag Committee will deliver a Farm Bill that is good policy for both farmers &amp; taxpayers. https://t.co/OCDMf47fqF",False,1600886616536809473,5,2,2,0
repfinstad,Congressman Brad Finstad,1600506653031505921,1563316176717246464,en,1600506653031505921,2022-12-07T15:04:56.000Z,"Today we remember and honor the more than 2,400 Americans who tragically lost their lives in the attack on Pearl Harbor 81 years ago. We will never forget the sacrifices our service men and women make to protect our freedom. #PearlHarborRemembranceDay https://t.co/LPQEhbyBiS",False,1600506653031505921,2,1,1,0
repfinstad,Congressman Brad Finstad,1600244000258068480,1563316176717246464,en,1600244000258068480,2022-12-06T21:41:15.000Z,"Proud to cosponsor the Farmers Deserve Notification Act, led by @RepJimBaird. Herbicides &amp; pesticides are vital to growers. This bill makes sure that farmers won’t have to worry about @EPA making spur-of-the-moment changes that may impact their harvest.
https://t.co/I3ZRAUoFAu",False,1600244000258068480,4,3,3,1
repfinstad,Congressman Brad Finstad,1600175371629887488,1563316176717246464,en,1600175371629887488,2022-12-06T17:08:33.000Z,Enjoyed meeting with @_AACC board members while they were in D.C. last week to talk about laboratory developed tests. Thanks for stopping by! https://t.co/rdyviIEqy5,False,1600175371629887488,2,1,1,1
repfinstad,Congressman Brad Finstad,1598756489409224704,1563316176717246464,en,1598756489409224704,2022-12-02T19:10:25.000Z,"During her time in Congress, @RepWalorski fought relentlessly for the health of mothers and children. Today, Congress made sure her legacy will be remembered, and that the MACHV program will continue to serve the families that need it most.",False,1598756486519267328,1,0,0,0
repfinstad,Congressman Brad Finstad,1598756486519267328,1563316176717246464,en,1598756486519267328,2022-12-02T19:10:24.000Z,"Today, I was proud to vote in support of H.R. 8876, The Jackie Walorski Maternal and Child Home Visiting (MACHV) Reauthorization Act. 
 
https://t.co/Uiepqxb2FW",False,1598756486519267328,2,2,2,1
repfinstad,Congressman Brad Finstad,1598410859726139392,1563316176717246464,en,1598410859726139392,2022-12-01T20:17:00.000Z,"While these volumes significantly discount the projected growth of advanced biofuels, like biodiesel and renewable diesel, it is encouraging to see annual increases in volumes for conventional biofuels like ethanol – which is essential to southern Minnesota’s economy.",False,1598410858039836672,2,0,0,0
repfinstad,Congressman Brad Finstad,1598410858039836672,1563316176717246464,en,1598410858039836672,2022-12-01T20:17:00.000Z,"This week, the @realEPAgov released a first glance at their proposed Renewable Fuel Standard (RFS) volumes for 2023-2025. 
https://t.co/fFu7DQ9paO",False,1598410858039836672,2,1,1,0
repfinstad,Congressman Brad Finstad,1598002756274749440,1563316176717246464,en,1598002756274749440,2022-11-30T17:15:21.000Z,"The strength of our military starts with the support &amp; encouragement they receive on the home front. Thank you to all of our brave servicemembers, their spouses, &amp; families for the sacrifices they make on behalf of our nation. #MilitaryFamilyMonth https://t.co/aLajbak4Og",False,1598002756274749440,4,3,3,0
repfinstad,Congressman Brad Finstad,1597730109028720641,1563316176717246464,en,1597730109028720641,2022-11-29T23:11:57.000Z,"For many across #MN01, record-high inflation will mean fewer presents under the tree this year. But it isn’t keeping families from SPRUCE-ing up their homes with a fresh-cut tree.🎄Glad to see our local small businesses going strong this holiday season! https://t.co/uwLpCtHFCM",False,1597730109028720641,2,1,1,0
repfinstad,Congressman Brad Finstad,1597346929394221056,1563316176717246464,en,1597346929394221056,2022-11-28T21:49:19.000Z,"Great to sit down with the @SJPlaindealer to talk about my experience in Congress, my priorities under the new majority, and the upcoming reauthorization of the Farm Bill. Read it here ➡️ 
https://t.co/PHEYgfQbPH",False,1597346929394221056,1,0,0,0
repfinstad,Congressman Brad Finstad,1597271058025164802,1563316176717246464,en,1597271058025164802,2022-11-28T16:47:50.000Z,"Safe travels to @MNSoybean of Mankato on their trip to Spain &amp; Portugal this week for a USDA agribusiness trade mission. Proud of them for representing the best of MN agriculture!
https://t.co/VgxFEE3tFT",False,1597271058025164802,1,0,0,1
repfinstad,Congressman Brad Finstad,1596587090749190145,1563316176717246464,en,1596587090749190145,2022-11-26T19:30:00.000Z,"Subscribe to my newsletter for updates on what I’m doing in Washington and around the First District! 👇

https://t.co/6hLHREOegE",False,1596587090749190145,3,0,0,0
repfinstad,Congressman Brad Finstad,1596171862878277632,1563316176717246464,en,1596171862878277632,2022-11-25T16:00:02.000Z,"I hope you’ll join me in participating in #SmallBusinessSaturday tomorrow. When we #shopsmall, we support our communities and our fellow southern Minnesotans. This holiday season, remember to shop local and support small businesses! https://t.co/maR24iVeb1",False,1596171862878277632,1,0,0,0
repfinstad,Congressman Brad Finstad,1595799400588185605,1563316176717246464,en,1595799400588185605,2022-11-24T15:20:00.000Z,"Wishing everyone across #MN01 a happy, healthy Thanksgiving. Let’s take time today to enjoy our loved ones and count our blessings for all the great things we have. https://t.co/6tlRdd5x7B",False,1595799400588185605,3,1,1,0
repfinstad,Congressman Brad Finstad,1595498601530200089,1563316176717246464,en,1595498601530200089,2022-11-23T19:24:44.000Z,"During the recent district work period, my team and I traveled more than 1,500 miles across #MN01 meeting with constituents, businessowners, and local community leaders; hearing from them about the issues impacting southern Minnesotans. Check it out! https://t.co/yEHJvAWnU4",False,1595498601530200089,3,0,0,1
repfinstad,Congressman Brad Finstad,1595070263103979522,1563316176717246464,en,1595070263103979522,2022-11-22T15:02:40.000Z,"Great to meet with the folks from @mtusolutions  yesterday. Their Mankato facility provides 300+ jobs in the community, manufacturing gas and diesel engine systems that serve customers in the defense industry, as well as the marine and infrastructure sectors. Thanks for the tour! https://t.co/JN98QMPsRf",False,1595070263103979522,3,2,2,0
repfinstad,Congressman Brad Finstad,1594364948523761669,1563316176717246464,en,1594364948523761669,2022-11-20T16:20:00.000Z,"Did you know MN is ranked #1 in the country for turkey production? MN’s turkey industry generates $1B in economic activity and over 26K jobs in the state. Supply is strong, stores are stocked, and now is a great time to get your Thanksgiving turkey! 

https://t.co/CCtFOpUgmh",False,1594364948523761669,6,6,6,1
repfinstad,Congressman Brad Finstad,1593632086937804803,1563316176717246464,en,1593632086937804803,2022-11-18T15:47:52.000Z,"Glad to talk with Mike from @DarlingIngredie this week about the importance of renewable diesel facilities. Darling Ingredients develops &amp; produces sustainable natural ingredients from bio-nutrients used in the animal feed, fuel, and fertilizer industries. Thanks for the visit! https://t.co/P5UzJm1uXd",False,1593632086937804803,1,3,3,1
repfinstad,Congressman Brad Finstad,1593340700858335232,1563316176717246464,en,1593340700858335232,2022-11-17T20:30:00.000Z,Thank you @MNPoliceAssn for inviting me to speak at this year’s convention. It was great opportunity to meet the law enforcement officers that keep our communities safe and hear about the challenges they face on the job every day. https://t.co/Ur0YrO1dX7,False,1593340700858335232,2,1,1,0
repfinstad,Congressman Brad Finstad,1593262957835829249,1563316176717246464,en,1593262957835829249,2022-11-17T15:21:05.000Z,I had the pleasure of meeting with @amerambassoc in D.C. this week. We had a great conversation about the need for lifesaving access to ambulances and EMS services in rural communities. https://t.co/vKx452Nig0,False,1593262957835829249,2,0,0,0
repfinstad,Congressman Brad Finstad,1592543794133880832,1563316176717246464,en,1592543794133880832,2022-11-15T15:43:23.000Z,"This is a real crisis. Without a reliable, affordable diesel supply, truckers can’t deliver our goods and families can’t heat their homes. We must stop relying upon foreign countries to meet our energy needs and end this war on American energy.
 
https://t.co/04AaRaZPlN",False,1592543794133880832,7,8,8,0
repfinstad,Congressman Brad Finstad,1591082022168330241,1563316176717246464,en,1591082022168330241,2022-11-11T14:54:49.000Z,"Today and every day, we honor the brave men and women who have served our great nation. Happy Veterans Day! https://t.co/0afOGSoWoK",False,1591082022168330241,6,2,2,1
repfinstad,Congressman Brad Finstad,1590822839124250624,1563316176717246464,en,1590822839124250624,2022-11-10T21:44:55.000Z,Glad to tour the @MSCSoutheast Winona campus last week. Our community and technical colleges are key to addressing the current workforce shortage and I will continue to support solutions that bolster career and technical education. https://t.co/h0V88HR5dr,False,1590822839124250624,1,0,0,0
repfinstad,Congressman Brad Finstad,1590733178700197889,1563316176717246464,en,1590733178700197889,2022-11-10T15:48:38.000Z,Happy 247th Birthday to the United States Marine Corps! Thank you to all of our Marines who have bravely served our country. 🇺🇸 https://t.co/VtkHm8aqHY,False,1590733178700197889,4,1,1,0
repfinstad,Congressman Brad Finstad,1589007145860669440,1563316176717246464,en,1589007145860669440,2022-11-05T21:30:00.000Z,"Canoe believe it?? 🛶 For 55 years, @WenonahCanoe has been right here in our own backyard. Thanks to Mike and his staff for a look inside their operation this week. Proud of our #MN01 manufacturers! #GrabAPaddle #MadeinMN https://t.co/lWemOWMwZc",False,1589007145860669440,1,0,0,0
repfinstad,Congressman Brad Finstad,1588937706192932864,1563316176717246464,en,1588937706192932864,2022-11-05T16:54:04.000Z,Good to meet with the folks at the @gundersenhealth  Clinic in La Crescent this week. I appreciated hearing from their team about the issues they’re facing as rural healthcare providers. https://t.co/bc1OQycgs2,False,1588937706192932864,1,0,0,0
repfinstad,Congressman Brad Finstad,1588664931926560769,1563316176717246464,en,1588664931926560769,2022-11-04T22:50:10.000Z,"As the oldest two-year college in MN, @RochesterCTC is leading the way for accessible, affordable education and competitive vocational programs that meet the needs of today’s workforce. Great to be on campus earlier this week. Thanks to President Boyd and his team for the visit! https://t.co/5DLvBNsiCK",False,1588664931926560769,1,0,0,0
repfinstad,Congressman Brad Finstad,1587871151023423502,1563316176717246464,en,1587871151023423502,2022-11-02T18:15:58.000Z,"Our electric co-ops are critical to rural communities, safely providing members with reliable electric service at the lowest possible cost. 🔌 Great to be in Blue Earth to talk with members of BENCO Electric Cooperative. Thanks for the visit! https://t.co/FrK8BkHtmt",False,1587871151023423502,1,2,2,1
repfinstad,Congressman Brad Finstad,1587542575090700289,1563316176717246464,en,1587542575090700289,2022-11-01T20:30:19.000Z,"Proud to cosponsor the Government Office Realignment and Closure Act. We owe it to our kids to leave our country in better financial shape than we found it. This is a commonsense way to rein in wasteful spending and drive down our national debt.
 
https://t.co/7DeER4U38D",False,1587542575090700289,2,3,3,0
repfinstad,Congressman Brad Finstad,1587449380247769088,1563316176717246464,en,1587449380247769088,2022-11-01T14:20:00.000Z,Thanks to @POETbiofuels for showing me around the Lake Crystal plant. Their team produces 56M gallons of ethanol per year from locally-grown corn &amp; also produces premium @poetnutrition livestock feed for both local &amp; global consumers. Proud to support our #MN01 ethanol producers! https://t.co/mmKdmED4IC,False,1587449380247769088,7,1,1,0
repfinstad,Congressman Brad Finstad,1587190301025882114,1563316176717246464,en,1587190301025882114,2022-10-31T21:10:30.000Z,Wishing everyone across #MN01 a safe and happy Halloween! https://t.co/RvNW3etN4F,False,1587190301025882114,1,1,1,0
repfinstad,Congressman Brad Finstad,1586794907309862912,1563316176717246464,en,1586794907309862912,2022-10-30T18:59:21.000Z,"Busy week visiting some outstanding rural hospitals in #MN01. I stopped at @MankatoClinic, Gillette Children's Clinic, &amp; @NewUlmMedicalCt to listen to rural healthcare professionals about the challenges they face &amp; how we can improve access to health care in rural communities. https://t.co/GsEkiN6eaM",False,1586794907309862912,2,1,1,0
repfinstad,Congressman Brad Finstad,1586449470845505536,1563316176717246464,en,1586449470845505536,2022-10-29T20:06:43.000Z,"Proud to cosponsor the Metastatic Breast Cancer Access to Care Act, which would allow individuals with metastatic breast cancer to have immediate access to critical support and medical care by eliminating waiting periods for patients to access SSDI and Medicare benefits. https://t.co/g6VGUthF4u",False,1586449470845505536,3,1,1,2
repfinstad,Congressman Brad Finstad,1586359203979198464,1563316176717246464,en,1586359203979198464,2022-10-29T14:08:02.000Z,"Today is @DEAHQ Prescription Drug Take Back Day. Disposing of unwanted or unneeded medications can save lives and prevent addiction. To learn more and to find a collection site near you, visit: https://t.co/cy2h3JHmQY https://t.co/rF2py8L1P4",False,1586359203979198464,1,1,1,0
repfinstad,Congressman Brad Finstad,1586112068326895616,1563316176717246464,en,1586112068326895616,2022-10-28T21:46:00.000Z,"I'm proud to #SupportEMS and I talked with @ABC6NEWS about making sure our rural EMS depts have the resources they need to provide life-saving services to our communities. Watch it here ⤵️
https://t.co/dSlNlP3wkI",False,1586112068326895616,3,2,2,0
repfinstad,Congressman Brad Finstad,1586111816517779458,1563316176717246464,en,1586111816517779458,2022-10-28T21:45:00.000Z,"Happy #FirstRespondersDay to the brave men &amp; women who dedicate their lives to saving others. We appreciate you, today and every day.🚑",False,1586111816517779458,2,1,1,0
repfinstad,Congressman Brad Finstad,1586071627233886208,1563316176717246464,en,1586071627233886208,2022-10-28T19:05:18.000Z,"We teach our kids that it is possible to respectfully disagree with others, and we have to do the same as a society. We have to lead by example and put civility and kindness back in today’s political discourse.",False,1586071625413365762,2,0,0,1
repfinstad,Congressman Brad Finstad,1586071625413365762,1563316176717246464,en,1586071625413365762,2022-10-28T19:05:17.000Z,"Whether we agree or disagree on policy issues, violence like this is horrific. Jackie and I are keeping the entire Pelosi family in our prayers. 
https://t.co/c85jsm4GMh",False,1586071625413365762,1,2,2,0
repfinstad,Congressman Brad Finstad,1585757028105920515,1563316176717246464,en,1585757028105920515,2022-10-27T22:15:12.000Z,"Truckers are essential to our economy, delivering the food, supplies, &amp; equipment we all depend on. Thanks to all of them for the important work they do!",False,1585757026071633920,2,0,0,0
repfinstad,Congressman Brad Finstad,1585757026071633920,1563316176717246464,en,1585757026071633920,2022-10-27T22:15:11.000Z,"Glad to meet with members of @mntruck this week in Rochester. I heard from them about how they’ve been impacted by driver shortages, supply chain disruptions, &amp; the increasing costs of operation due to record-high fuel prices. https://t.co/SqVVwv2K7T",False,1585757026071633920,1,1,1,0
repfinstad,Congressman Brad Finstad,1584992628315389952,1563316176717246464,en,1584992628315389952,2022-10-25T19:37:44.000Z,"Proud to cosponsor The Presidential Budget Accountability Act, which would prohibit the President from traveling on the taxpayer’s dime if the budget is not submitted on time. https://t.co/sResq19mJv",False,1584992628315389952,1,0,0,0
repfinstad,Congressman Brad Finstad,1584631311142199297,1563316176717246464,en,1584631311142199297,2022-10-24T19:42:00.000Z,#MN01 students! The @congressionalac is an excellent opportunity to showcase your creativity and develop your skills in the #STEM fields. Register today and submit your apps by 11/1! #Congress4CS https://t.co/APBpUi3aOl,False,1584631311142199297,1,0,0,0
repfinstad,Congressman Brad Finstad,1584566585477726208,1563316176717246464,en,1584566585477726208,2022-10-24T15:24:48.000Z,"Rainbow fentanyl is coming across the southern border and making its way into southern MN. Record illegal border crossings under this administration have led to more drugs and more crime. A secure border is the Republican #CommittmenttoAmerica
 
https://t.co/5eIWaiTrev",False,1584566585477726208,1,1,1,1
repfinstad,Congressman Brad Finstad,1583831792875757569,1563316176717246464,en,1583831792875757569,2022-10-22T14:45:00.000Z,"October is #CrimePreventionMonth and we can all “Take a Bite Out of Crime” by getting to know our neighbors, locking our doors and windows, and being aware of online scams. Great running into @McGruffatNCPC and @RepRutherfordFL in D.C. earlier this month. https://t.co/SVw8kuWWEL",False,1583831792875757569,3,1,1,0
repfinstad,Congressman Brad Finstad,1583111547668365313,1563316176717246464,en,1583111547668365313,2022-10-20T15:03:00.000Z,"The SPR is at its lowest point since 1984. This administration’s America LAST energy policies are hurting family pocketbooks. We need to end the federal freeze on oil &amp; gas leases, reinvest in our pipelines, &amp; return to American energy independence.
https://t.co/sWENTmFmI5",False,1583111547668365313,6,6,6,0
repfinstad,Congressman Brad Finstad,1582784391293575170,1563316176717246464,en,1582784391293575170,2022-10-19T17:23:00.000Z,"Enjoyed visiting with Dr. Anne Lamb and her team at In Touch Physical Therapy in Owatonna this week. We talked about the importance of practices like hers, that provide access to physical therapy services in rural areas. Thanks to Dr. Lamb and her fantastic team! https://t.co/cftaKwGeY5",False,1582784391293575170,7,1,1,1
repfinstad,Congressman Brad Finstad,1582476305559605248,1563316176717246464,en,1582476305559605248,2022-10-18T20:58:46.000Z,"Good to meet with the folks at @EllingsonCo in West Concord yesterday. Ellingson is a third-generation southern MN business, and a leader in agricultural water management solutions. Thanks to Ellingson for the visit and for the work they do for our farmers! https://t.co/tAqWLzjoeg",False,1582476305559605248,2,0,0,0
repfinstad,Congressman Brad Finstad,1581738048127369216,1563316176717246464,en,1581738048127369216,2022-10-16T20:05:12.000Z,"Thanks to @BlueEarthCounty officials for the opportunity to tour the Rapidan Dam. I appreciated the up-close look at the dam, learning about future repair or removal options, and talking about the federal resources available. https://t.co/SKTcTQt0Fc",False,1581738048127369216,1,0,0,0
repfinstad,Congressman Brad Finstad,1581054429922369537,1563316176717246464,en,1581054429922369537,2022-10-14T22:48:45.000Z,"MN leads the U.S. in sugar beet production. Each harvested acre of sugar beets gives us nearly 4 tons of refined sugar, used in foods like cereal, candy, molasses, &amp; ice cream. Happy #NationalRealSugarDay to our pretty “sweet” sugar beet farmers &amp; processing plant workers! https://t.co/QZzCAg508g",False,1581054429922369537,4,1,1,0
repfinstad,Congressman Brad Finstad,1580918725217161217,1563316176717246464,en,1580918725217161217,2022-10-14T13:49:30.000Z,"Great to be in SE MN yesterday and hear from local officials about the needs of their communities, like sewer and wastewater upgrades and flood relief projects. Thanks to Wanamingo, Kasson, and Stewartville for hosting these important discussions. 
https://t.co/jT0Je1alsv",False,1580918725217161217,2,0,0,0
repfinstad,Congressman Brad Finstad,1580626926212767744,1563316176717246464,en,1580626926212767744,2022-10-13T18:30:00.000Z,"Are you a high school student in southern Minnesota? Are you interested in a career in the STEM fields? If so, be sure to participate in this year’s Congressional App Challenge. Submissions are due November 1st. Learn more: https://t.co/xTwO5ZXNfs https://t.co/TBftP6vjbo",False,1580626926212767744,1,1,1,0
repfinstad,Congressman Brad Finstad,1580566527325048833,1563316176717246464,en,1580566527325048833,2022-10-13T14:30:00.000Z,"Had a good visit with the team at @DaVita Kidney Care, who provide life-saving services for those living with chronic kidney disease. Great to see their Mankato center and talk about legislation in Congress impacting their patients. Thanks to them for the important work they do! https://t.co/sLrjW6lxWg",False,1580566527325048833,1,1,1,0
repfinstad,Congressman Brad Finstad,1580275358431121425,1563316176717246464,en,1580275358431121425,2022-10-12T19:13:00.000Z,"Thanks to the folks at Kato Engineering for an inside look at their manufacturing facility. They’ve been in Mankato for nearly 100 years, and as part of @NidecMotorCorp, they are a global supplier of turbine generators &amp; specialized motor-generator sets. Thanks for a great visit! https://t.co/oj8BUvkRK8",False,1580275358431121425,1,1,1,0
repfinstad,Congressman Brad Finstad,1580213600257716224,1563316176717246464,en,1580213600257716224,2022-10-12T15:07:35.000Z,"As a fourth-generation farmer, I’m proud of the work that America’s farmers, ranchers, and producers do day-in and day-out to feed and clothe the world. Wishing my fellow farmers a Happy National Farmers Day and a safe and bountiful harvest! #NationalFarmersDay  #ThankAFarmer https://t.co/eigxO5Nx13",False,1580213600257716224,6,2,2,0
repfinstad,Congressman Brad Finstad,1579918996421607425,1563316176717246464,en,1579918996421607425,2022-10-11T19:36:56.000Z,"Forcing America into an all-electric fleet will undoubtedly impede America’s return to energy independence, but more importantly – it will give California the power to make the decision for every American family about what kind of car they can drive.",False,1579918994618081281,1,1,1,0
repfinstad,Congressman Brad Finstad,1579918994618081281,1563316176717246464,en,1579918994618081281,2022-10-11T19:36:56.000Z,"Last week, I joined House Republican Leadership and more than 150 House members in a letter urging @POTUS to oppose California’s gas-powered vehicle ban. Read my full statement⬇️ https://t.co/lgvBTd6icM",False,1579918994618081281,1,2,2,0
repfinstad,Congressman Brad Finstad,1579850308359843840,1563316176717246464,en,1579850308359843840,2022-10-11T15:04:00.000Z,Great to be at @SCCollege in Mankato and see the good things they’re doing to relieve the labor shortage with apprenticeships and career/technical programs that are training students to meet the needs of today’s workforce. Thanks to Dr. Parker and her team for the visit! https://t.co/VW0u1jBfmq,False,1579850308359843840,1,2,2,0
repfinstad,Congressman Brad Finstad,1579517365649559553,1563316176717246464,en,1579517365649559553,2022-10-10T17:01:00.000Z,"Enjoyed speaking w/ @ktoenews about the work we’ve been doing in the district this past week. I'm hearing from a lot of folks about the increasing cost of operations due to inflation, workforce shortage issues, &amp; supply chain disruption. Listen here:
https://t.co/TvXbNWXhEX",False,1579517365649559553,1,1,1,0
repfinstad,Congressman Brad Finstad,1579178449629220866,1563316176717246464,en,1579178449629220866,2022-10-09T18:34:16.000Z,"This morning I spoke with @WCCO about my first few months in Congress, what’s been going on in D.C., and the issues I’m hearing about from constituents in the district. Watch here:
https://t.co/DzzNRRMMDu",False,1579178449629220866,4,1,1,1
repfinstad,Congressman Brad Finstad,1578767707574763521,1563316176717246464,en,1578767707574763521,2022-10-08T15:22:08.000Z,4-H empowers youth develop their strengths and improve the world around them. Happy #National4HWeek to all the 4-H members and volunteers across the district! https://t.co/IXIyZ72KrC,False,1578767707574763521,1,0,0,0
repfinstad,Congressman Brad Finstad,1578525770451804160,1563316176717246464,en,1578525770451804160,2022-10-07T23:20:45.000Z,"These restrictions are burdensome to travelers, and have had a direct impact on commerce between the U.S. &amp; Canada, by disrupting the supply chain and fueling inflation for U.S. consumers. It is time for us to fully normalize our borders and get back to regular business.",False,1578525768636043265,2,0,0,0
