handle,name,tweet_id,author_id,lang,replied_to,created_at,tweet_text,possibly_sensitive,conversation_id,retweet_count,reply_count,like_count,quote_count
RepGregPence,Rep. Greg Pence,1601292915279646720,1082369392229400576,en,1601292915279646720,2022-12-09T19:09:16.000Z,"Law enforcement officers are working overtime to get deadly poisons off our streets.

Yet, they get no support from Biden because he won’t take action to secure the southern border.

This Administration’s dereliction of duty is threatening Hoosier lives. https://t.co/ZwAKe0hrAs",False,1601292915279646720,2,3,3,0
RepGregPence,Rep. Greg Pence,1600958568806621220,1082369392229400576,en,1600958568806621220,2022-12-08T21:00:41.000Z,"Democrats knew energy prices would skyrocket when they declared war on fossil fuels. They didn’t care.

Americans shouldn’t be paying the price for liberals ill-fated policies.

Next year @HouseCommerce⁩ will work to end this energy crisis. https://t.co/DpaGnmiLiN",False,1600958568806621220,4,5,5,1
RepGregPence,Rep. Greg Pence,1600884672459849728,1082369392229400576,en,1600884672459849728,2022-12-08T16:07:03.000Z,"To the Hoosiers of Indiana’s Sixth District, family and friends — we’ve moved offices! You can now find us at 404 Cannon House Office Building when you’re visiting Washington, D.C. 🇺🇸 https://t.co/B4heqJElrn",False,1600884672459849728,0,2,2,1
RepGregPence,Rep. Greg Pence,1600620829481508872,1082369392229400576,en,1600620829481508872,2022-12-07T22:38:38.000Z,"My good friend @RepPeteStauber &amp; I spent time with the @RedCross today writing messages to our troops, veterans &amp; their families this Christmas season. 🎄

Our American Heroes sacrifice so much for our Freedom, especially during the Holidays — we can never thank them enough! 🇺🇸 https://t.co/m0iY65Xt0X",False,1600620829481508872,2,10,10,0
RepGregPence,Rep. Greg Pence,1600519290905583619,1082369392229400576,en,1600519290905583619,2022-12-07T15:55:09.000Z,"Today, on Pearl Harbor Remembrance Day, we honor the more than 2,400 brave Americans who were tragically taken from us on that infamous day eighty-one years ago.

We will Never Forget the sacrifice of the heroes of our Armed Services who paid the ultimate price for our Freedom. https://t.co/5fZfLendq9",False,1600519290905583619,3,1,1,0
RepGregPence,Rep. Greg Pence,1598755474349883400,1082369392229400576,en,1598755474349883400,2022-12-02T19:06:23.000Z,"The late Congresswoman Jackie Walorski had a servant’s heart, which was very clearly reflected in her dedication to helping our most vulnerable.

Today, I’m proud the House passed legislation honoring her legacy of work supporting women, children &amp; families across the nation. 🇺🇸 https://t.co/Hk9jdGIRce",False,1598755474349883400,4,13,13,0
RepGregPence,Rep. Greg Pence,1595779312539832320,1082369392229400576,en,1595779312539832320,2022-11-24T14:00:10.000Z,"Today, we come together with loved ones with the opportunity to reflect on the many great blessings the Lord has given us this year. 🙏

From our family to yours — Denise and I would like to wish everyone across Indiana and America, a happy and peaceful Thanksgiving! https://t.co/ITsJay36LW",False,1595779312539832320,0,10,10,0
RepGregPence,Rep. Greg Pence,1592929802121805825,1082369392229400576,en,1592929802121805825,2022-11-16T17:17:14.000Z,"Thank you to @USMC_LegAffairs for honoring Congressional Marines this week for the @USMC’s 247th Birthday. 

These fine service members do an outstanding job aiding us on Capitol Hill in serving our Marine constituents.

Semper Fi! 🇺🇸 https://t.co/2kRBeoyQ1k",False,1592929802121805825,1,3,3,0
RepGregPence,Rep. Greg Pence,1592641253421813761,1082369392229400576,en,1592641253421813761,2022-11-15T22:10:39.000Z,"Today, with a heavy heart, I honored a dear friend – Anthony “Tony” Moravec on the U.S. House Floor.

It’s exceptionally hard to underscore what an immense loss Tony’s passing is to our community.

May his memory be a blessing to all those who knew him.  https://t.co/YctvXR5N1b",False,1592641253421813761,3,6,6,0
RepGregPence,Rep. Greg Pence,1591221433791057920,1082369392229400576,en,1591221433791057920,2022-11-12T00:08:47.000Z,"Another due and deserving thank-you to America’s Veterans from Denise and I on this special day. 

May God Bless our American Heroes. May God Bless America. 🇺🇸 #SemperFi https://t.co/F15vwfJ75z",False,1591221433791057920,1,8,8,1
RepGregPence,Rep. Greg Pence,1591179980494753792,1082369392229400576,en,1591179980494753792,2022-11-11T21:24:04.000Z,"Today, and everyday we honor the millions of brave and courageous service members who took an oath to serve our Nation.

America remains a Free nation because of their fortitude and patriotism.

On behalf of a grateful nation: thank you to our veterans of our Armed Forces. 🇺🇸 https://t.co/sNUApiphzR",False,1591179980494753792,2,4,4,1
RepGregPence,Rep. Greg Pence,1591099019513982977,1082369392229400576,en,1591099019513982977,2022-11-11T16:02:22.000Z,"It was honor to serve our Country in the @USMC, and it’s an honor to serve again as the U.S. Representative for #IN06 fighting for our Veterans in Congress.

This morning, I joined fellow Marines to honor what Veterans Day means for our nation. Freedom isn’t Free. 🇺🇸 https://t.co/28k14ayWT1",False,1591099019513982977,3,4,4,0
RepGregPence,Rep. Greg Pence,1590875644883148800,1082369392229400576,en,1590875644883148800,2022-11-11T01:14:45.000Z,Thank you to Judge Worton for inviting me to share my story of service in the Marine Corps. My hope is that the participants in the Bartholomew County Veterans Treatment Court are inspired this Veterans Day in their journey of recovery and redemption. 🇺🇸 https://t.co/Oagipe0XxD,False,1590875644883148800,1,4,4,0
RepGregPence,Rep. Greg Pence,1590875501538988032,1082369392229400576,en,1590875501538988032,2022-11-11T01:14:11.000Z,"RT @tperkins: ""I'm looking forward to us getting about the business of Congress, passing bills reducing regulations, which is how I think i…",False,1590875501538988032,7,0,0,0
RepGregPence,Rep. Greg Pence,1590808699538313216,1082369392229400576,en,1590808699538313216,2022-11-10T20:48:44.000Z,"Happy 247th Birthday to the @USMC!

Today, we celebrate the brave Americans of the USMC, who took an oath to God, to Corps, and to Country. 

There is no shortage of bravery amongst our U.S. Marines who have sacrificed to earn the Eagle, Globe and Anchor. 

SEMPER FI! 🇺🇸 https://t.co/obx5g45tjg",False,1590808699538313216,4,3,3,0
RepGregPence,Rep. Greg Pence,1590672336877154306,1082369392229400576,en,1590672336877154306,2022-11-10T11:46:53.000Z,"Denise and I ask everyone to join us in praying for the Moravec family, and their friends and loved ones during this difficult time. https://t.co/rh1oshdI5Y",False,1590672336877154306,3,4,4,0
RepGregPence,Rep. Greg Pence,1587570938765254656,1082369392229400576,en,1587570938765254656,2022-11-01T22:23:02.000Z,"It is a testament of the Edelman’s service and the people of Richmond that this state-of-the-art center was named in Israel’s honor.

Thanks to Chief Purcell, Sen. Raatz &amp; Rep. Barrett our law enforcement is equipped with the training they need to keep Hoosiers safe &amp; save lives. https://t.co/9fPLwza9hX",False,1587570914639679494,0,3,3,0
RepGregPence,Rep. Greg Pence,1587570914639679494,1082369392229400576,en,1587570914639679494,2022-11-01T22:22:56.000Z,"It was a profound honor to tour the new Fire &amp; Police Training Center in Richmond today with Debra Edelman who’s late Son, Israel “Izzy” David Edelman, the center stands dedicated in memory of.

The Edelman Family is a pillar of the community. https://t.co/OffrixCcnV",False,1587570914639679494,1,4,4,0
RepGregPence,Rep. Greg Pence,1587528897847263232,1082369392229400576,en,1587528897847263232,2022-11-01T19:35:58.000Z,"On behalf of a grateful nation, thank you for your service, Tom. Your courage and fortitude is an example for Hoosiers and all Americans. 🇺🇸 https://t.co/e2WvkU1r6G",False,1587528897847263232,1,3,3,0
RepGregPence,Rep. Greg Pence,1587528027491155970,1082369392229400576,en,1587528027491155970,2022-11-01T19:32:31.000Z,"Our nation is forever indebted to the Greatest Generation for their sacrifice &amp; service, and Tom Ecoff is one of those American Heroes.  

One of McCordsville’s very own, Mr. Ecoff is both a Bronze Star &amp; Purple Heart Recipient for his bravery during WWII. https://t.co/qBo4NtGWV1",False,1587528027491155970,2,4,4,1
RepGregPence,Rep. Greg Pence,1584877072735936513,1082369392229400576,en,1584877072735936513,2022-10-25T11:58:34.000Z,"Fentanyl isn’t just poisoning those who ingest it, it’s poisoning our brave first responders &amp; law enforcement officers tasked with getting it off the streets.

We MUST secure the southern border &amp; stop this flood of fentanyl coming into our communities https://t.co/wsdWEWxvsI",False,1584877072735936513,2,9,9,1
RepGregPence,Rep. Greg Pence,1584216201139392512,1082369392229400576,en,1584216201139392512,2022-10-23T16:12:30.000Z,"Today is about the heroes of the 1983 ⁦@USMC⁩ Barracks Bombing who laid down their lives to protect our freedoms.

On the 39th anniversary of this horrific attack, and every day, we must strive to ensure that all are remembered and honored. https://t.co/oI3v2wJRTT",False,1584216201139392512,4,9,9,0
RepGregPence,Rep. Greg Pence,1583113581825904641,1082369392229400576,en,1583113581825904641,2022-10-20T15:11:05.000Z,"RT @FAHhospitals: Yesterday, @RepGregPence visited Columbus Behavioral Center for Children and Adolescents to discuss the children's mental…",False,1583113581825904641,5,0,0,0
RepGregPence,Rep. Greg Pence,1583107560424759296,1082369392229400576,en,1583107560424759296,2022-10-20T14:47:09.000Z,RT @AEA: Congratulations @RepGregPence  for scoring a 100% on the American Energy Scorecard! Thank you for being a champion for American en…,False,1583107560424759296,2,0,0,0
RepGregPence,Rep. Greg Pence,1582819397416067073,1082369392229400576,en,1582819397416067073,2022-10-19T19:42:06.000Z,"The Hoosier Gym made famous by the namesake film recently had it’s hardwood floors refurbished in all it’s glory, and now this iconic locale is ready to welcome back visitors. Open Monday through Saturday from noon until 5 PM — stop by to shoot a few hoops! 🏀 https://t.co/Uk6212Wrka",False,1582819397416067073,1,8,8,0
RepGregPence,Rep. Greg Pence,1582754086818312194,1082369392229400576,en,1582754086818312194,2022-10-19T15:22:35.000Z,"RT @GOPLeader: As a result of “Defund the Police” efforts, law enforcement officers across the country are facing the toughest working cond…",False,1582754086818312194,136,0,0,0
RepGregPence,Rep. Greg Pence,1582464591917088768,1082369392229400576,en,1582464591917088768,2022-10-18T20:12:14.000Z,"It sure was Fall today in #IN06 during my tour of Wenning Farms.

Across America, our farmers are working tirelessly on this year’s harvest to keep our nation moving forward. 

Thanks again to the Wenning Family for the opportunity to get an update from the field in Henry County! https://t.co/iGMaRbrwDE",False,1582464591917088768,1,6,6,0
RepGregPence,Rep. Greg Pence,1582420450943987722,1082369392229400576,en,1582420450943987722,2022-10-18T17:16:50.000Z,"Stopped into our Richmond office today while traveling the Sixth District to get an update on our team’s constituent services work.

➡️ Remember, if you need assistance with a federal agency our office is here to help. Visit: https://t.co/r6j7CJa231 https://t.co/8qPbOOt6D9",False,1582420450943987722,1,3,3,0
RepGregPence,Rep. Greg Pence,1582420339459780609,1082369392229400576,en,1582420339459780609,2022-10-18T17:16:23.000Z,"RT @hoosieragtoday: California and New York plan to ban the sale of new vehicles with gas and diesel-powered engines by 2035, which would h…",False,1582420339459780609,2,0,0,0
RepGregPence,Rep. Greg Pence,1582391483755159553,1082369392229400576,en,1582391483755159553,2022-10-18T15:21:43.000Z,Stopped in Liberty today and got to see the mural recently dedicated to the late Bob Jenkins — the Voice of the 500. My family and I have many fond memories hearing Bob call races at @IMS! 🏁 https://t.co/yYWUds9PoK,False,1582391483755159553,1,3,3,0
RepGregPence,Rep. Greg Pence,1580919747436171264,1082369392229400576,en,1580919747436171264,2022-10-14T13:53:34.000Z,"RT @GLFOP: Since Monday, at least 12 police officers have been shot.

The spewing of anti-police rhetoric by some political and media figur…",False,1580919747436171264,653,0,0,0
RepGregPence,Rep. Greg Pence,1580572295294496768,1082369392229400576,en,1580572295294496768,2022-10-13T14:52:55.000Z,"Democrats ultra-liberal, out-of-control spending policies have proven what a disaster their one-party rule in Washington has been for the rest of America. https://t.co/rA8PKOYlvS",False,1580572295294496768,2,10,10,0
RepGregPence,Rep. Greg Pence,1580572132890722304,1082369392229400576,en,1580572132890722304,2022-10-13T14:52:16.000Z,"Americans are still struggling to buy gas, put dinner on the table, keep up with their bills, put kids through college, and more. Now, this prompts the Fed to raise interest rates again — squeezing all of our budgets even tighter. https://t.co/4xGQUa4yhR",False,1580572132890722304,3,8,8,1
RepGregPence,Rep. Greg Pence,1580571241122914304,1082369392229400576,en,1580571241122914304,2022-10-13T14:48:44.000Z,"Inflation rose 0.4% in September, and while Democrats and their corporate media allies continue to try and convince us all it’s “not really that bad,” we know the truth.  It is that bad. https://t.co/nXb0OJWtsB",False,1580571241122914304,3,5,5,1
RepGregPence,Rep. Greg Pence,1580570878881845248,1082369392229400576,en,1580570878881845248,2022-10-13T14:47:17.000Z,RT @BrendanCarrFCC: Appreciated the chance to join Congressman @RepGregPence in Indiana today and visit with first responders + public safe…,False,1580570878881845248,2,0,0,0
RepGregPence,Rep. Greg Pence,1580268654683336704,1082369392229400576,en,1580268654683336704,2022-10-12T18:46:21.000Z,"This Fall, I’m wishing all our farmers a safe and successful harvest as they work sun up to sun down to feed our Nation. 

If you ate today – thank a farmer! 

Without them, America and Indiana would be nothing. 🚜#NationalFarmersDay  https://t.co/ZMBVjeeKdn",False,1580268654683336704,1,0,0,0
RepGregPence,Rep. Greg Pence,1579924949736693761,1082369392229400576,en,1579924949736693761,2022-10-11T20:00:36.000Z,"Every single American is feeling the pain of inflation. It’s only going to get worse as this economic crisis grips our farmers.

Our Ag producers feed our country &amp; keep our nation moving forward. 

I’ll never stop fighting on Capitol Hill on their behalf. https://t.co/kjM0F84nF6",False,1579924949736693761,1,3,3,0
RepGregPence,Rep. Greg Pence,1579479578594410497,1082369392229400576,en,1579479578594410497,2022-10-10T14:30:51.000Z,RT @IvyTechCC: Congressman Greg Pence joined Ivy Tech State Trustee Jesse Brand and President Sue Ellspermann for the Moravec Hall ribbon c…,False,1579479578594410497,3,0,0,0
RepGregPence,Rep. Greg Pence,1579479241779204098,1082369392229400576,en,1579479241779204098,2022-10-10T14:29:31.000Z,"Great to spend time this morning with the Kiwanis Club of Columbus. Mom, thank you for introducing me this morning and for your longstanding commitment, along with these great members, to serving our hometown! https://t.co/261b0wZvPS",False,1579479241779204098,2,4,4,0
RepGregPence,Rep. Greg Pence,1577707150994018308,1082369392229400576,en,1577707150994018308,2022-10-05T17:07:51.000Z,"RT @US_OGA: OPEC says no, SPR options all but  gone...

The WH has one option left and it is the one option they should have never turned a…",False,1577707150994018308,2141,0,0,0
RepGregPence,Rep. Greg Pence,1577668336565067776,1082369392229400576,en,1577668336565067776,2022-10-05T14:33:37.000Z,"We CANNOT rely on foreign adversaries to support our goal of American energy independence.

Hoosiers are going struggle to heat their homes &amp; get to work this winter because of Biden’s kowtowing to liberals in their war on fossil fuels. Let’s get back to energy independence NOW!",False,1577668334933446656,3,8,8,0
RepGregPence,Rep. Greg Pence,1577668334933446656,1082369392229400576,en,1577668334933446656,2022-10-05T14:33:37.000Z,"Just months ago, President Biden flew overseas and humiliated the U.S. on the world stage, begging the OPEC Oil Cartel to dig him out of the energy crisis he created for our country.

No one should be surprised that today that plan completely backfired. https://t.co/rt1zO0lvoc",False,1577668334933446656,7,15,15,1
RepGregPence,Rep. Greg Pence,1577666741991342083,1082369392229400576,en,1577666741991342083,2022-10-05T14:27:17.000Z,RT @IN_Task_Force_1: The team and our force protection officers have been collecting damaged American Flags along the way to properly handl…,False,1577666741991342083,29,0,0,0
RepGregPence,Rep. Greg Pence,1577405065484242963,1082369392229400576,en,1577405065484242963,2022-10-04T21:07:29.000Z,"To our Jewish friends and neighbors in #IN06 and across the nation who will be observing this evening, Denise and I would like to wish you all a meaningful and peaceful fast this Yom Kippur.

G'mar chatima tova! https://t.co/TBn5hNFECL",False,1577405065484242963,2,4,4,0
RepGregPence,Rep. Greg Pence,1575159381674557445,1082369392229400576,en,1575159381674557445,2022-09-28T16:23:56.000Z,"I urge any #IN06 constituents who may be in Florida to heed directions from state and local officials, and remain safe and vigilant.

For more information:

Follow: @FLSERT 

Visit: https://t.co/985kfqZoHR",False,1575159378969337858,2,2,2,0
RepGregPence,Rep. Greg Pence,1575159378969337858,1082369392229400576,en,1575159378969337858,2022-09-28T16:23:55.000Z,"Denise and I ask Hoosiers to join us in praying for family, friends and fellow Americans who are in #HurricaneIan’s path of devastation, and our first responders — including @IN_Task_Force_1 — on the frontlines of the emergency response.
https://t.co/ImeNsqFFNQ",False,1575159378969337858,4,7,7,1
RepGregPence,Rep. Greg Pence,1574847953633742855,1082369392229400576,en,1574847953633742855,2022-09-27T19:46:26.000Z,Thanks to Todd and the team at @CrazyHorseHops for giving me a tour of their operations in Knightstown. Crazy Horse Hops supplies to breweries across Indiana and beyond! https://t.co/dEpr7wgSl2,False,1574847953633742855,3,3,3,1
RepGregPence,Rep. Greg Pence,1574791920454336515,1082369392229400576,en,1574791920454336515,2022-09-27T16:03:46.000Z,Thank you to Mr. Carr and all the students at Mt Vernon High School for hosting me today and for having so many great questions about my work as your representative in Congress! 🇺🇸 https://t.co/mwAZ7pllZz,False,1574791920454336515,3,3,3,0
RepGregPence,Rep. Greg Pence,1574146780819869696,1082369392229400576,en,1574146780819869696,2022-09-25T21:20:13.000Z,"To everyone celebrating this evening in #IN06, across the nation and around the world — Happy Rosh Hashanah! 

Denise and I are wishing everyone a healthy, prosperous and happy New Year. L'Shana Tova! https://t.co/eNI15Pxmnp",False,1574146780819869696,4,2,2,0
RepGregPence,Rep. Greg Pence,1573337388826460162,1082369392229400576,en,1573337388826460162,2022-09-23T15:43:59.000Z,"So great to have the @INFarmBureau drop in this week to update our office while working in Washington. A great honor to be named a Friend of @FarmBureau this year.

I will never stop fighting for our Hoosier farmers and Ag producers on Capitol Hill! 🇺🇸 https://t.co/52gzEWHmjY",False,1573337388826460162,2,4,4,1
RepGregPence,Rep. Greg Pence,1573334287407058945,1082369392229400576,en,1573334287407058945,2022-09-23T15:31:39.000Z,RT @93wibc: NEWS: @RepGregPence is telling the federal government to pump the breaks on any plans for drastic cut backs on fossil fuels for…,False,1573334287407058945,4,0,0,0
RepGregPence,Rep. Greg Pence,1573021183523577860,1082369392229400576,en,1573021183523577860,2022-09-22T18:47:30.000Z,"Have liberals still not learned from Europe’s cautionary tales when it comes to electrical grid reliability?

Hoosiers, and all Americans can’t afford the outages like we’ve seen in California. 

This is why America must embrace an all of the above approach to Energy. https://t.co/l8MqGo56h9",False,1573021183523577860,5,9,9,0
RepGregPence,Rep. Greg Pence,1572735590399086592,1082369392229400576,en,1572735590399086592,2022-09-21T23:52:39.000Z,RT @HouseCommerce: UP NEXT → @RepGregPence is demanding answers on the Biden administration’s work to undermine our power grid. It’s increa…,False,1572735590399086592,3,0,0,0
RepGregPence,Rep. Greg Pence,1572579519978147841,1082369392229400576,en,1572579519978147841,2022-09-21T13:32:29.000Z,"A fabulous wife, great mother, an amazing grandmother, dedicated businesswoman, devout woman of faith, proud American, my #1 supporter…

There aren’t enough words to describe how much I love my better half.

Happy Birthday, Denise! ❤️ https://t.co/PzqeWwxDz5",False,1572579519978147841,3,5,5,1
RepGregPence,Rep. Greg Pence,1572251759023902720,1082369392229400576,en,1572251759023902720,2022-09-20T15:50:05.000Z,"RT @JoelWGibbonsV: .@RepGregPence  (R) demands an end to proxy voting after Joe Biden said the ""pandemic is over"":

""In any other job in Am…",False,1572251759023902720,93,0,0,0
RepGregPence,Rep. Greg Pence,1571892247213506560,1082369392229400576,en,1571892247213506560,2022-09-19T16:01:30.000Z,"RT @GLFOP: 🔹 Blessed Are The Peacemakers 🔹

Police Officer Seara Burton

Richmond Police Department, Indiana

EOW: Sunday, September 18, 20…",False,1571892247213506560,108,0,0,0
RepGregPence,Rep. Greg Pence,1571888519794106371,1082369392229400576,en,1571888519794106371,2022-09-19T15:46:42.000Z,It is with profound sadness that Denise and I stand together with Hoosiers across Indiana in offering our deepest condolences to Richmond Police Officer Seara Burton's loved ones and fellow officers. https://t.co/yL67qnFwmV,False,1571888519794106371,2,1,1,0
RepGregPence,Rep. Greg Pence,1570829922658316290,1082369392229400576,en,1570829922658316290,2022-09-16T17:40:12.000Z,"Today, we honor the brave American heroes that never returned home — imprisoned, or fallen MIA.

To Indiana’s 55 service members &amp; countless others from across the Nation still missing: You Are Not Forgotten.

May God Bless this ultimate sacrifice those have made for our Freedom. https://t.co/X0DJUXnFvs",False,1570829922658316290,3,6,6,2
RepGregPence,Rep. Greg Pence,1570805595200196608,1082369392229400576,en,1570805595200196608,2022-09-16T16:03:32.000Z,"It’s an honor to receive the ⁦⁦@NFIB⁩’s Guardian of Small Business Award on behalf of the Hoosiers in #IN06 I represent, and look forward to continuing to advance policies that empower our small business owners and help their companies thrive. 🇺🇸 https://t.co/87mTzzsJXq",False,1570805595200196608,2,3,3,0
RepGregPence,Rep. Greg Pence,1570758922415349763,1082369392229400576,en,1570758922415349763,2022-09-16T12:58:05.000Z,"When Hoosier companies like Novolex invest in themselves, they’re also investing in advancing sustainability, our workers, and our state’s economy.

I’m looking forward to the good-paying jobs and fiscal boost this $10M expansion in #IN06 will create.  https://t.co/ktsLmKzySY",False,1570758922415349763,4,2,2,0
RepGregPence,Rep. Greg Pence,1570512646876844034,1082369392229400576,en,1570512646876844034,2022-09-15T20:39:28.000Z,It’s always great when constituents visit D.C &amp; and even better when I get to meet w/ them in between votes. Thank you to @IndianaPork for dropping by this week to discuss the issues the industry is facing &amp; how I can continue to support our Hoosier pork producers in Congress! https://t.co/pn1YhrcxXr,False,1570512646876844034,1,2,2,0
RepGregPence,Rep. Greg Pence,1570480894804361216,1082369392229400576,en,1570480894804361216,2022-09-15T18:33:18.000Z,The Hoosier state is rich in Agricultural products that have the opportunity to achieve American energy independence &amp; boost our economy. Thank you to @GrowthEnergy’s Indiana members for paying us a visit this morning on Capitol Hill to discuss these shared priorities! 🌽 https://t.co/2wUUiyVVMJ,False,1570480894804361216,4,2,2,0
RepGregPence,Rep. Greg Pence,1570132001285459971,1082369392229400576,en,1570132001285459971,2022-09-14T19:26:55.000Z,"RT @JStein_WaPo: Emerging impacts of potential rail shutdown:
- Amtrak cancels long-distance trips
- Ammonia, fertilizer, ag products pulle…",False,1570132001285459971,2686,0,0,0
RepGregPence,Rep. Greg Pence,1570113320652345346,1082369392229400576,en,1570113320652345346,2022-09-14T18:12:41.000Z,"I’m very concerned that a potential rail worker strike would further harm our already fragile economy and supply chain in the midst of an inflation crisis. 

My statement on the impending railway crisis. ↓ https://t.co/NVJltCbwWx",False,1570113320652345346,3,5,5,2
RepGregPence,Rep. Greg Pence,1570071604566040577,1082369392229400576,en,1570071604566040577,2022-09-14T15:26:55.000Z,"Proud to receive an A rating from @MomsForAmerica’s Congressional Report Card.

My Mother Nancy, my wife Denise and our daughters, and all Mothers are why I’m in Congress fighting for our values.

I’ll continue to work to protect our Freedom and empower Mom’s across America.🇺🇸 https://t.co/scS2xOywQU",False,1570071604566040577,7,6,6,0
