handle,name,tweet_id,author_id,lang,replied_to,created_at,tweet_text,possibly_sensitive,conversation_id,retweet_count,reply_count,like_count,quote_count
RepGregPence,Rep. Greg Pence,1417573323605782528,1082369392229400576,en,1417573323605782528,2021-07-20T19:53:12.000Z,"It is troubling that House Democrats are rushing through partisan legislation that increases federal bureaucracy instead of protecting consumers &amp; small businesses. 

Soon, I’m joining my @HouseCommerce colleagues on the House floor to debate H.R. 2668. → https://t.co/T7obmKnYqS https://t.co/xwNORFhpDO",False,1417573323605782528,3,0,0,1
RepGregPence,Rep. Greg Pence,1417549080675459076,1082369392229400576,en,1417549080675459076,2021-07-20T18:16:52.000Z,"Democrats here in Washington don’t care about the consequences their tax &amp; spend sprees will have for Hoosiers in #IN06. 

So now here we are in the midst of the #BidenInflation crisis, where hardworking Americans are unnecessarily paying more for everything from ⛽️ to 🥓. ↓ https://t.co/RBPCeHTgQ8",False,1417549080675459076,24,57,57,2
RepGregPence,Rep. Greg Pence,1417525170848284673,1082369392229400576,en,1417525170848284673,2021-07-20T16:41:51.000Z,"Banking is an industry that has an impact on the lives of ALL Hoosiers! 

It was pleasure to have @IndianaBankers back on Capitol Hill today to provide an update on the legislative issues in Washington that effects their members and the communities they serve in #IN06. https://t.co/7IsNovqebg",False,1417525170848284673,4,2,2,0
RepGregPence,Rep. Greg Pence,1417508689666314241,1082369392229400576,en,1417508689666314241,2021-07-20T15:36:22.000Z,Fair stop #12 in IN06 at the Delaware County Fair! Great to see so many young people involved in 4-H. https://t.co/hxU7aoLIZJ,False,1417508689666314241,1,2,2,0
RepGregPence,Rep. Greg Pence,1417216256239865858,1082369392229400576,en,1417216256239865858,2021-07-19T20:14:20.000Z,"RT @cathymcmorris: The NIH is finally no longer ruling out the possibility of a lab leak.

For MONTHS, @HouseCommerce has been asking @NIHD…",False,1417216256239865858,16,0,0,0
RepGregPence,Rep. Greg Pence,1417182287586856961,1082369392229400576,en,1417182287586856961,2021-07-19T17:59:21.000Z,"Good to see Mayor Marsh and meet many other constituents at the Decatur County Fair! 

Stopped by WTRE while I was in town to give an update about what I’ve been doing in Congress and in the district - catch my congressional updates on WTRE in Greensburg every other Monday. https://t.co/2ZEQ8li0wR",False,1417182287586856961,2,1,1,1
RepGregPence,Rep. Greg Pence,1416119317813411844,1082369392229400576,en,1416119317813411844,2021-07-16T19:35:30.000Z,Enjoyed getting to see so many constituents at the Franklin County Fair this week. Special thanks to our law enforcement for keeping everyone safe! https://t.co/Aw435GrIkv,False,1416119317813411844,1,6,6,1
RepGregPence,Rep. Greg Pence,1416081431424610308,1082369392229400576,en,1416081431424610308,2021-07-16T17:04:57.000Z,"From passport processing to help requesting tours and tickets, my office is here to help.

Read our July 2021 update to learn more about the services we offer to Hoosiers in #IN06. ↓ https://t.co/8JXnL2QLnn",False,1416081431424610308,1,3,3,0
RepGregPence,Rep. Greg Pence,1416023347528445956,1082369392229400576,en,1416023347528445956,2021-07-16T13:14:09.000Z,"Stopped by the Jefferson County Fair this week. Enjoyed speaking with constituents and checking out the booths. 

Great to talk with AJ at the WORX Radio booth! You can catch my congressional updates every other Monday on 96.7 in Madison. https://t.co/YfSQZP3k8i",False,1416023347528445956,1,5,5,1
RepGregPence,Rep. Greg Pence,1415698077235744776,1082369392229400576,en,1415698077235744776,2021-07-15T15:41:38.000Z,"The greatness of a free society can best be measured by how it cares for the most vulnerable.

That’s why I will continue to stand against the Dems in their mission to defeat the Hyde Amendment.

40+ years &amp; 2.5M lives saved. We MUST continue to protect life! #HydeSavesLives https://t.co/kv43sFcC5a",False,1415698077235744776,18,42,42,4
RepGregPence,Rep. Greg Pence,1415416200486600708,1082369392229400576,en,1415416200486600708,2021-07-14T21:01:34.000Z,"Great to be back in Washington, D.C. for the day to represent our #Hoosier values at today’s @HouseCommerce joint subcommittee hearing.

I will continue to advocate for an all-of-the above energy agenda and work with my colleagues to ensure #IN06 has a seat at the table. https://t.co/dYmKwvszjA",False,1415416200486600708,3,5,5,1
RepGregPence,Rep. Greg Pence,1415388871379099658,1082369392229400576,en,1415388871379099658,2021-07-14T19:12:58.000Z,"Had the OMB revised their MSA core population threshold, communities in #IN06 like Columbus &amp; Muncie could have seen federal resources severely reduced.

I am pleased we were able to secure a favorable outcome for my hometown &amp; others across America! ↓ https://t.co/hsduABrUfS",False,1415388871379099658,3,0,0,0
RepGregPence,Rep. Greg Pence,1415034729431281664,1082369392229400576,en,1415034729431281664,2021-07-13T19:45:44.000Z,"The Biden Inflation crisis is a threat to our Hoosier way of life in #IN06.

The worst part is that experts warn inflation is here to stay.

Whether it’s paying more to fill up at the pump or buy groceries — we are living with the consequences of Democrats’ disastrous policies. https://t.co/pPtWeX23YA",False,1415034729431281664,3,11,11,4
RepGregPence,Rep. Greg Pence,1414994818644774912,1082369392229400576,en,1414994818644774912,2021-07-13T17:07:08.000Z,Great to see Switzerland County Commissioner Grant Dean and Switzerland County Economic Development Corporation President Jon Bond at the fair yesterday. Thanks for showing me around the fair! https://t.co/Clp3yxD0Z6,False,1414994818644774912,1,2,2,0
RepGregPence,Rep. Greg Pence,1413555407046447109,1082369392229400576,en,1413555407046447109,2021-07-09T17:47:26.000Z,"A true honor to visit fellow Marines on base to see the hard work behind keeping our nation safe and securing our freedom.

Semper Fi! 🇺🇸 https://t.co/PCSSEJTYTM",False,1413555407046447109,3,1,1,1
RepGregPence,Rep. Greg Pence,1413155677187543042,1082369392229400576,en,1413155677187543042,2021-07-08T15:19:03.000Z,"Last week I was able to stop by the Rush County Fair, speak with some local business owners, and check out the 4-H rabbit show! 

Looking forward to the rest of the fairs in the 6th District! https://t.co/oFXSANNUnK",False,1413155677187543042,1,5,5,1
RepGregPence,Rep. Greg Pence,1412837448338579464,1082369392229400576,en,1412837448338579464,2021-07-07T18:14:31.000Z,"From data security concerns to moderation practices – #BigTech is becoming a rogue entity to our society.

We must all come to the table to actively hold these platforms accountable.

Our American values that support democracy are depending on it. ↓ https://t.co/bWDYsoJiox",False,1412837448338579464,32,225,225,6
RepGregPence,Rep. Greg Pence,1411685923088130054,1082369392229400576,en,1411685923088130054,2021-07-04T13:58:46.000Z,"245 years of Life, Liberty and the pursuit of Happiness.

As a Marine, and now a member of Congress it is truly an honor to defend and preserve the greatest, most free nation on earth. 

Wishing everyone a Happy Independence Day — May God Bless America! 🇺🇸 #FourthofJuly https://t.co/GXZ8AaRUC3",False,1411685923088130054,9,0,0,3
RepGregPence,Rep. Greg Pence,1410393580816973824,1082369392229400576,en,1410393580816973824,2021-07-01T00:23:28.000Z,"Codifying the ROUTES Initiative will ensure rural communities like #IN06 get their fair share of federal funding for infrastructure. 

I am pleased that tonight my Amendment was adopted that will that will drive economic competitiveness and improve safety for rural America! 🇺🇸 https://t.co/cw6zAhNyMb",False,1410393580816973824,2,5,5,3
RepGregPence,Rep. Greg Pence,1410295034684100613,1082369392229400576,en,1410295034684100613,2021-06-30T17:51:52.000Z,"Make no mistake, modernizing our energy transmission system for the 21st century must be a priority for Congress.

We can't do it at the cost of Hoosiers back at home in Indiana.

Free market investment, without overriding local authority can bring this shared goal into reality. https://t.co/EcE0UlY6UD",False,1410295034684100613,3,1,1,2
RepGregPence,Rep. Greg Pence,1410239051832102915,1082369392229400576,en,1410239051832102915,2021-06-30T14:09:25.000Z,"Check out the recap of my June district work period, #IN06AmericanHeroesWeek! https://t.co/GoFNjvH129",False,1410239051832102915,1,7,7,0
RepGregPence,Rep. Greg Pence,1409918353364459520,1082369392229400576,en,1409918353364459520,2021-06-29T16:55:05.000Z,"Back in D.C. today for an @HouseCommerce Energy Subcommittee Hearing.

My constituents in #IN06 need a reliable source of energy to power their lives. 🔌

Looking forward to discussing what Congress can do to advance grid modernization efforts that will benefit Hoosiers. https://t.co/DIMvp3DkwU",False,1409918353364459520,1,2,2,0
RepGregPence,Rep. Greg Pence,1409593898700267522,1082369392229400576,en,1409593898700267522,2021-06-28T19:25:49.000Z,"As #DairyMonth comes to a close, I’d like to take a moment to say THANK YOU to all the hardworking Hoosier dairy farmers that feed our state &amp; nation. 🐄 🥛 https://t.co/Kl2q28mEW8",False,1409593898700267522,3,1,1,0
RepGregPence,Rep. Greg Pence,1409563468412473344,1082369392229400576,en,1409563468412473344,2021-06-28T17:24:53.000Z,"Denise and I had a great time this weekend at the Bartholomew County Fair. I was honored to welcome @LGSuzanneCrouch to my hometown, and catch up with many friends and constituents! https://t.co/gRvz38xN0p",False,1409563468412473344,3,0,0,0
RepGregPence,Rep. Greg Pence,1409506515648749570,1082369392229400576,en,1409506515648749570,2021-06-28T13:38:35.000Z,"RT @RepMichaelGuest: Our summer interns had the opportunity to meet my good friend, @RepGregPence. Congressman Pence has been a great frien…",False,1409506515648749570,3,0,0,0
RepGregPence,Rep. Greg Pence,1408514453881114631,1082369392229400576,en,1408514453881114631,2021-06-25T19:56:29.000Z,"RT @HouseCommerce: Great news. This requirement, which was part of @RepGregPence's Broadband Interagency Coordination Act, will help minimi…",False,1408514453881114631,2,0,0,0
RepGregPence,Rep. Greg Pence,1408514404182900753,1082369392229400576,en,1408514404182900753,2021-06-25T19:56:17.000Z,"Countless Hoosiers in #IN06, and those in rural communities across America will greatly benefit from federal cooperation in closing the #DigitalDivide.

I am pleased to see facets of my Broadband Interagency Coordination Act becoming a reality. ➝ https://t.co/tmLzbX8HST https://t.co/iO1xPlkuHZ",False,1408514404182900753,3,0,0,0
RepGregPence,Rep. Greg Pence,1408438853996797962,1082369392229400576,en,1408438853996797962,2021-06-25T14:56:04.000Z,"🚨HOOSIER STUDENTS🚨

The 2021 Congressional App Challenge is officially open. You can register at the link below and submit your app before November 1, 2021! https://t.co/sem8fBEmiG https://t.co/AvIr5cC6Us",False,1408438853996797962,2,0,0,0
RepGregPence,Rep. Greg Pence,1408413043189600257,1082369392229400576,en,1408413043189600257,2021-06-25T13:13:31.000Z,"SOON: I’ll be speaking on the House Floor in opposition to reinstating harmful Obama-Era methane regulations.

Hoosiers back at home don’t need more federal red tape that makes it harder to live and do business in #IN06. 

WATCH. → https://t.co/c2bMO7WBSj",False,1408413043189600257,2,5,5,1
RepGregPence,Rep. Greg Pence,1408098024052740099,1082369392229400576,en,1408098024052740099,2021-06-24T16:21:44.000Z,"While I’m in DC participating in Energy and Commerce committee hearings, my staff at home in the Sixth District were able to attend the Hickory Outdoor Court Dedication in Knightstown with Governor Holcomb. Great things happening in Henry County! https://t.co/2Iy9pAIpUi",False,1408098024052740099,2,4,4,0
RepGregPence,Rep. Greg Pence,1407717550264303618,1082369392229400576,en,1407717550264303618,2021-06-23T15:09:52.000Z,"A long awaited day — back to in-person @HouseCommerce Committee work!

Pleased to be in Washington this morning, continuing to advocate for an all of the above approach to energy on behalf of Hoosiers back at home in #IN06. 

WATCH 📺: https://t.co/py19gG4dJJ https://t.co/8MFrkV2s43",False,1407717550264303618,3,1,1,0
RepGregPence,Rep. Greg Pence,1407434367736205322,1082369392229400576,en,1407434367736205322,2021-06-22T20:24:36.000Z,"Fun stop @ the Dearborn County Fair where I was able to meet w/constituents in the 6CD! 

4-H Fairs across the state provide great programs for our children to participate in. At the Dearborn County Fair, I got to check out their Youth Livestock Judging Contest. Great job! https://t.co/kFDm6s4mNV",False,1407434367736205322,2,1,1,0
RepGregPence,Rep. Greg Pence,1407086350805970958,1082369392229400576,en,1407086350805970958,2021-06-21T21:21:43.000Z,Glad the weather held off for us at the Wayne County Fair this afternoon! Great to meet with so many constituents in Richmond and see their talents and passions at the exhibits. https://t.co/7tjeeHcFEP,False,1407086350805970958,1,2,2,0
RepGregPence,Rep. Greg Pence,1407034139459608587,1082369392229400576,en,1407034139459608587,2021-06-21T17:54:14.000Z,"Hoosiers from Indiana’s Sixth District sent me to Washington to protect our conservative values. 

I will continue to do just that in Congress.

Thank you to @mschlapp and @Schneider_DC for presenting me with the @ACUFoundation’s Award for Conservative Achievement. https://t.co/kzrIhMGoMP",False,1407034139459608587,12,3,3,3
RepGregPence,Rep. Greg Pence,1406721226790277123,1082369392229400576,en,1406721226790277123,2021-06-20T21:10:50.000Z,"RT @Mike_Pence: Remembering my Dad on this Father’s Day. Ed Pence was a man of faith, a Korean War Veteran, a small businessman and the Bes…",False,1406721226790277123,197,0,0,0
RepGregPence,Rep. Greg Pence,1406684914825764864,1082369392229400576,en,1406684914825764864,2021-06-20T18:46:33.000Z,"Dad is the greatest job title I’ve ever held.

Wishing a Happy Father’s Day to all the amazing Hoosier dads across Indiana’s Sixth District. 🇺🇸 https://t.co/UDjBqKSZbr",False,1406684914825764864,3,5,5,1
RepGregPence,Rep. Greg Pence,1406648279778086915,1082369392229400576,en,1406648279778086915,2021-06-20T16:20:58.000Z,"Great time at the Jennings County Fair meeting with constituents this week. Good to see Jennings County Sheriff Freeman and friends. 

Thanks to Jennings County Fair Board President Randy Shepherd for putting together a great week! https://t.co/uNxtqoYFCn",False,1406648279778086915,1,1,1,0
RepGregPence,Rep. Greg Pence,1406346932402933761,1082369392229400576,en,1406346932402933761,2021-06-19T20:23:32.000Z,Stopped by the Hancock County Fair this week. Enjoyed some fair food and got to speak with Hancock County constituents. Special thanks to Hancock County Sheriff’s department for their hospitality and keeping everyone safe! https://t.co/iALrFOicMw,False,1406346932402933761,1,0,0,0
RepGregPence,Rep. Greg Pence,1406285932316221449,1082369392229400576,en,1406285932316221449,2021-06-19T16:21:08.000Z,"156 years ago today, with the enforcement of The Emancipation Proclamation, the abominable practice of slavery in the United States came to an end.

As we commemorate #JuneTeenth for the first time as a national holiday, let’s reaffirm the promise of liberty and justice for all. https://t.co/ooMjImVoLb",False,1406285932316221449,4,16,16,1
RepGregPence,Rep. Greg Pence,1405966912371187713,1082369392229400576,en,1405966912371187713,2021-06-18T19:13:28.000Z,Beautiful day to stop by the Shelby County Fair for lunch! Great to see Shelby County Prosecutor and sit down with other constituents as I make my way through the district today. https://t.co/JadzT3XPBx,False,1405966912371187713,1,2,2,1
RepGregPence,Rep. Greg Pence,1405612422702977026,1082369392229400576,en,1405612422702977026,2021-06-17T19:44:51.000Z,"For America to remain energy independent, we MUST invest at home.

Today, I sent a letter to @ENERGY emphasizing the importance of Hoosier energy innovation.

As a member of @HouseCommerce, I will continue to advocate for advancing Indiana’s role as a next generation energy hub. https://t.co/kLajpYPuuH",False,1405612422702977026,3,2,2,1
RepGregPence,Rep. Greg Pence,1405179715523125252,1082369392229400576,en,1405179715523125252,2021-06-16T15:05:25.000Z,"American Energy means jobs and economic investment for Hoosiers in #IN06. 

As a Member of @HouseCommerce, this continues to be one of my top priorities.

Thank you to @USEnergyStream &amp; @AnthonyLivanios for the pleasure of joining the Washington Oil and Gas Forum this morning. https://t.co/epjw8ACwEe",False,1405179715523125252,2,4,4,0
RepGregPence,Rep. Greg Pence,1404862360301494275,1082369392229400576,en,1404862360301494275,2021-06-15T18:04:22.000Z,"It was great to join @GlobalBiz to discuss my bipartisan Global Investment in American Jobs Act. 

Foreign Direct Investment would mean jobs &amp; economic investment in #IN06 &amp; our Nation.

We must ensure the U.S. is NOT leaving anything on the table — it’s how we’ll win the future. https://t.co/BC62msJNWB",False,1404862360301494275,3,1,1,2
RepGregPence,Rep. Greg Pence,1404607982789349378,1082369392229400576,en,1404607982789349378,2021-06-15T01:13:34.000Z,"The American people cannot afford for prices to continue to rise. 

They need to keep the lights on. Get to work. Put dinner on the table.

Today’s @HouseCommerce forum hosted by @RepMcKinley highlighted how detrimental the Biden Administration’s environmental policies are. https://t.co/rIUBAuydok",False,1404607982789349378,5,6,6,0
RepGregPence,Rep. Greg Pence,1404549794832519177,1082369392229400576,en,1404549794832519177,2021-06-14T21:22:21.000Z,RT @HouseCommerce: 🚨 Tune in NOW to the @HouseCommerce forum on the harm of Biden’s radical environmental agenda on the American people and…,False,1404549794832519177,5,0,0,0
RepGregPence,Rep. Greg Pence,1404548879907950594,1082369392229400576,en,1404548879907950594,2021-06-14T21:18:42.000Z,"246 years later, the @USArmy continues to stand firm in its commitment to defend our freedom at home and abroad.

Today, let’s honor the brave Americans who have answered the call to serve our nation. We are forever indebted to them.🇺🇸 #ArmyBirthday https://t.co/sIHJ16lD4B",False,1404548879907950594,1,0,0,0
RepGregPence,Rep. Greg Pence,1404481361382154242,1082369392229400576,en,1404481361382154242,2021-06-14T16:50:25.000Z,RT @SteveScalise: 4 years ago police officers saved dozens of lives—including mine—from a leftist who came to the baseball field to kill Re…,False,1404481361382154242,1514,0,0,0
RepGregPence,Rep. Greg Pence,1404443208579489793,1082369392229400576,en,1404443208579489793,2021-06-14T14:18:48.000Z,"The American Flag is a beacon of hope and freedom for many.

A true symbol of what our country stands for.

This Flag Day, let’s celebrate all that Old Glory means to our Nation. 🇺🇸 https://t.co/6Q2WqO1lKi",False,1404443208579489793,1,6,6,0
RepGregPence,Rep. Greg Pence,1403417849788567553,1082369392229400576,en,1403417849788567553,2021-06-11T18:24:24.000Z,"I had a great lunch with local veterans in my hometown during my district work week. We exchanged stories from our time in the service, and discussed some challenges they were facing. Serving our veterans is one of my top priorities as your congressman. https://t.co/Ocew5C3z9j",False,1403417849788567553,1,1,1,0
RepGregPence,Rep. Greg Pence,1403316889166753800,1082369392229400576,en,1403316889166753800,2021-06-11T11:43:13.000Z,"It’s our duty to be in Washington to legislate &amp; advocate on behalf of our constituents as they have sent us to do.

It’s time for us end proxy voting &amp; conduct committee hearings &amp; markups in person. 

My statement urging Congress to return to normal. ⬇️ https://t.co/UJ4lpH8Byh",False,1403316889166753800,2,4,4,1
RepGregPence,Rep. Greg Pence,1403038079376625675,1082369392229400576,en,1403038079376625675,2021-06-10T17:15:19.000Z,"I take my job representing Hoosiers seriously — and that means rolling up my sleeves &amp; getting to work in DC.

As a member of @HouseCommerce, I’m here in my Washington office today working through a full committee markup considering 6 bills.

WATCH LIVE → https://t.co/fBMZvnVPYk https://t.co/WP9M5ZebzD",False,1403038079376625675,2,2,2,1
RepGregPence,Rep. Greg Pence,1402995691627040778,1082369392229400576,en,1402995691627040778,2021-06-10T14:26:53.000Z,"Thanks to Bartholomew County Sheriff Myers for the demo of the sheriff department’s new camera system for vehicles &amp; officers. Sheriff Myers does an exemplary job as sheriff in Bartholomew County, &amp; I’m grateful I got to see him at work this past week!

#IN06AmericanHeroesWeek🇺🇸 https://t.co/3cRvHtr4Jr",False,1402995691627040778,1,0,0,0
RepGregPence,Rep. Greg Pence,1402725903793283074,1082369392229400576,en,1402725903793283074,2021-06-09T20:34:51.000Z,"Thank you to the Batesville Area Chamber of Commerce for the invitation to the Annual Dinner. Great evening seeing friends, local leaders and business owners! https://t.co/EZU8lD52KW",False,1402725903793283074,1,1,1,0
RepGregPence,Rep. Greg Pence,1402658982586691584,1082369392229400576,en,1402658982586691584,2021-06-09T16:08:56.000Z,"2 weeks ago, I was one of the only members of House E&amp;C who showed up to work in-person on behalf of my constituents.

Sadly, this same thing will happen again tomorrow with markups.

This is unacceptable — we were sent to DC to legislate. We cannot continue to phone it in. https://t.co/WfPIs8XaZ9",False,1402658982586691584,2,3,3,1
RepGregPence,Rep. Greg Pence,1402327523179085830,1082369392229400576,en,1402327523179085830,2021-06-08T18:11:50.000Z,"It was an honor to speak at the Indiana Fraternal Order of Police Convention today. 

The American way of life would not exist if it weren’t for our law enforcement who answer the call of duty each and every day. 

I also honored a fallen hero, Officer Greg Winters from Muncie. https://t.co/W9l1gphlkp",False,1402327523179085830,1,3,3,0
RepGregPence,Rep. Greg Pence,1402010071031296000,1082369392229400576,en,1402010071031296000,2021-06-07T21:10:23.000Z,"Bartholomew Co. Sheriff Myers, Columbus PD, Indiana DNR officers, ISP, &amp; Excise Police are the best of the best. I was honored to spend time w/them @ the Bartholomew County Sheriff’s Youth Academy, &amp; I’m grateful our kids have them to look up to as role models &amp; mentors! https://t.co/aoapX2RBKl",False,1402010071031296000,1,0,0,0
RepGregPence,Rep. Greg Pence,1401944244634402818,1082369392229400576,en,1401944244634402818,2021-06-07T16:48:49.000Z,"I’d like to ask you all to join me in wishing my brother, @Mike_Pence, a very Happy Birthday.

While I maybe biased — I’d say Michael was one of the best Vice Presidents we’ve ever had. 

Thank you for your service to #IN06 and our nation. 🇺🇸 #WeAreFamily https://t.co/yBRaJcHSL0",False,1401944244634402818,29,70,70,6
RepGregPence,Rep. Greg Pence,1401897879011315717,1082369392229400576,en,1401897879011315717,2021-06-07T13:44:35.000Z,"This past week I met w/our 6CD Veterans Advisory Board, a group of veterans and leaders throughout the district to discuss these issues &amp; how I can best serve our veterans in Congress. 

If you are a veteran and need help with a federal agency, please call my office: 812-799-5230 https://t.co/BR0AxvqQXS",False,1401897879011315717,1,2,2,0
RepGregPence,Rep. Greg Pence,1401541605413302272,1082369392229400576,en,1401541605413302272,2021-06-06T14:08:52.000Z,"Today, on the 77th Anniversary of #DDay, we honor the brave souls who undertook storming the beaches of Normandy in the name of Freedom.

We must never forget the historic &amp; valiant effort put forth that turned the tides of history.

God Bless the Greatest Generation. 🇺🇸 #DDay77 https://t.co/MUsLbSBeD8",False,1401541605413302272,5,3,3,0
RepGregPence,Rep. Greg Pence,1401264446014623744,1082369392229400576,en,1401264446014623744,2021-06-05T19:47:32.000Z,"Rushville Police Chief Tucker and the Rushville Police Department are leaders and innovators when it comes to policing, training, and building relationships with the community. It was an honor to be able to sit down with their department for lunch. 

#IN06AmericanHeroesWeek🇺🇸 https://t.co/t069qp8wAZ",False,1401264446014623744,1,2,2,0
RepGregPence,Rep. Greg Pence,1401215073713102848,1082369392229400576,en,1401215073713102848,2021-06-05T16:31:21.000Z,It was an honor to speak w/the kids participating in the Bartholomew County Sheriff’s Youth Academy yesterday. Thank you to Sheriff Myers for the invitation to this fantastic event. Programs like these continue to foster a connection b/w our law enforcement &amp; local community! https://t.co/FNYIiWPlit,False,1401215073713102848,2,1,1,0
RepGregPence,Rep. Greg Pence,1400946050840645633,1082369392229400576,en,1400946050840645633,2021-06-04T22:42:21.000Z,"Big thanks to Decatur County Sheriff Durant for showing me around their new facility in Greensburg!

I’m out in the district this week to hear about what’s important to my constituents that I need to take back to DC, &amp; my discussion with Sheriff Durant was just that. #BackTheBlue https://t.co/Imc1CkTuNr",False,1400946050840645633,1,3,3,0
RepGregPence,Rep. Greg Pence,1400852845499400192,1082369392229400576,en,1400852845499400192,2021-06-04T16:31:59.000Z,"Popped into Shelbyville to see Shelby County Sheriff Koch. 

Sheriff Koch does great work in Shelby County, glad we got to spend some time discussing what’s important to you and your department. 

#IN06AmericanHeroesWeek🇺🇸 https://t.co/uLmSSGHGPR",False,1400852845499400192,0,4,4,0
