handle,name,tweet_id,author_id,lang,replied_to,created_at,tweet_text,possibly_sensitive,conversation_id,retweet_count,reply_count,like_count,quote_count
RepJacobs,Rep. Chris Jacobs,1367332867513192455,1276232539510919168,en,1367332867513192455,2021-03-04T04:35:34.000Z,"H.R. 1, the “For the Politicians Act,” would allow public funds to be used to finance politicians’ reelection campaigns. There are far better and more urgent needs for public funds - Democrats are again putting their interests above the needs of the American people. https://t.co/Nd7vtoivw1",False,1367332867513192455,53,88,88,8
RepJacobs,Rep. Chris Jacobs,1367332589321732097,1276232539510919168,en,1367332589321732097,2021-03-04T04:34:27.000Z,"Tonight we voted on a partisan “police reform” bill that causes more harm than good.

It ties the hands of our police and limits access to needed equipment.

I agree we need accountability, but we also need to ensure our brave police are fully supported.
https://t.co/hBk34BRMib",False,1367332589321732097,1,11,11,2
RepJacobs,Rep. Chris Jacobs,1367288572395585540,1276232539510919168,en,1367288572395585540,2021-03-04T01:39:33.000Z,"Great to meet some of our incredible members of the New York National Guard who have been selflessly protecting the Capitol. Thank you for your service, my office and I are deeply grateful. https://t.co/nEdPan91m3",False,1367288572395585540,3,9,9,0
RepJacobs,Rep. Chris Jacobs,1365738963558952964,1276232539510919168,en,1365738963558952964,2021-02-27T19:01:57.000Z,"IMPORTANT: A mass vaccination site will be set up at Genesee Community College for one week starting on March 5th.

For more information: https://t.co/OrPB0i5DU7",False,1365738963558952964,1,3,3,2
RepJacobs,Rep. Chris Jacobs,1365560283146682368,1276232539510919168,en,1365560283146682368,2021-02-27T07:11:57.000Z,"Every previous COVID package had bipartisan support. Yet tonight Democrats shunned that precedent and forced through a massive $1.9T partisan package that focuses more on advancing an agenda than helping the American people or defeating COVID

My statement:https://t.co/JkrkiciXLZ",False,1365560283146682368,1,43,43,4
RepJacobs,Rep. Chris Jacobs,1365434996740210706,1276232539510919168,en,1365434996740210706,2021-02-26T22:54:06.000Z,"Students need schools to open for in-person learning now. So why does only 5% of the education funding in the Democrats’ massive package go to opening schools in 2021? This money must be targeted toward immediate needs. 
https://t.co/pcQrJLZ0zJ",False,1365434996740210706,1,15,15,1
RepJacobs,Rep. Chris Jacobs,1364716378301857796,1276232539510919168,en,1364716378301857796,2021-02-24T23:18:34.000Z,"Today I joined my colleagues to call on the Governor to release federal funding for adult education programs in New York. Without action, many providers will be forced to close their doors – some already have.
 
Full statement:https://t.co/8mBFbdTFfH",False,1364716378301857796,0,11,11,0
RepJacobs,Rep. Chris Jacobs,1364636422800572421,1276232539510919168,en,1364636422800572421,2021-02-24T18:00:51.000Z,I just cosponsored a resolution to designate this week National Future Farmers of America Week. Inspiring and educating younger generations on a career in farming is critical to ensure agriculture thrives for years to come. #FFAWeek https://t.co/nqQSV4UNPH,False,1364636422800572421,1,8,8,0
RepJacobs,Rep. Chris Jacobs,1364406523032727559,1276232539510919168,en,1364406523032727559,2021-02-24T02:47:19.000Z,"Tonight I joined Republicans and Democrats from the House and Senate to pay tribute to the 500,000 Americans that we have tragically lost to COVID-19. https://t.co/B33bA7mpse",False,1364406523032727559,1,9,9,2
RepJacobs,Rep. Chris Jacobs,1364313594062639115,1276232539510919168,en,1364313594062639115,2021-02-23T20:38:03.000Z,"During the Budget Committee’s COVID-19 markup last night, I introduced a proposal to require accountability and prevent further coverups of nursing home death data in NY or any other state. Democrats rejected this measure.
 
My statement:https://t.co/6O66qJRIuE",False,1364313594062639115,1,13,13,0
RepJacobs,Rep. Chris Jacobs,1364253529544744961,1276232539510919168,en,1364253529544744961,2021-02-23T16:39:22.000Z,RT @RD_NewYork: We are currently accepting applications for the Rural Business Development Grant (RBDG) program. This program supports proj…,False,1364253529544744961,1,0,0,0
RepJacobs,Rep. Chris Jacobs,1364252433980006403,1276232539510919168,en,1364252433980006403,2021-02-23T16:35:01.000Z,"We need a cooperative and binational plan to reopen the US - Canadian border, it is critical to WNY small businesses, families, and property owners.

I urge the President to have a productive conversation today on reopening with PM Trudeau. https://t.co/Kls9Xx2VJV",False,1364252433980006403,1,5,5,1
RepJacobs,Rep. Chris Jacobs,1363991120871645186,1276232539510919168,en,1363991120871645186,2021-02-22T23:16:39.000Z,RT @housebudgetGOP: HAPPENING NOW --&gt; @RepJacobs and @RepSmucker are standing up for the residents and staff of America’s nursing homes and…,False,1363991120871645186,3,0,0,0
RepJacobs,Rep. Chris Jacobs,1362922138932551683,1276232539510919168,en,1362922138932551683,2021-02-20T00:28:54.000Z,"The more that comes out, the more a federal investigation is warranted. 
https://t.co/zBRT0PPQfq",False,1362922138932551683,3,13,13,1
RepJacobs,Rep. Chris Jacobs,1362863726873960449,1276232539510919168,en,1362863726873960449,2021-02-19T20:36:47.000Z,"Congratulations @MoogSDG! It’s a great to see an awesome local company being part of history!

https://t.co/ePeuLAz3zG",False,1362863726873960449,1,3,3,0
RepJacobs,Rep. Chris Jacobs,1362810614813511681,1276232539510919168,en,1362810614813511681,2021-02-19T17:05:45.000Z,"I re-introduced the No Small Business Aid for China Act.

American small business aid should only support American businesses.

China is a proven national and economic security threat and I will continue to confront their malign activities.

My statement:https://t.co/lqQfNjivtT https://t.co/1kJt6l4XId",False,1362810614813511681,2,8,8,0
RepJacobs,Rep. Chris Jacobs,1362539393601445890,1276232539510919168,en,1362539393601445890,2021-02-18T23:08:00.000Z,"Dr. Fauci has said we can move forward with school reopening.

The CDC has said we can move forward with school reopening.

We need to stop playing politics, listen to experts, and open our schools.
https://t.co/aflypWa3sF",False,1362539393601445890,2,6,6,0
RepJacobs,Rep. Chris Jacobs,1362498672840294407,1276232539510919168,en,1362498672840294407,2021-02-18T20:26:12.000Z,"For weeks we have called for a federal investigation into Governor Cuomo and his staff. 

Now those calls have been answered.

He must be held accountable.

My full statement: https://t.co/svyBg8NEpR",False,1362498672840294407,1,8,8,0
RepJacobs,Rep. Chris Jacobs,1362195364523180032,1276232539510919168,en,1362195364523180032,2021-02-18T00:20:57.000Z,"It’s about time!

https://t.co/SYNAfI03L4",False,1362195364523180032,3,6,6,1
RepJacobs,Rep. Chris Jacobs,1362146022391226381,1276232539510919168,en,1362146022391226381,2021-02-17T21:04:53.000Z,"Students are falling behind while Biden administration continues to move the goals posts. 

The science is clear – open our schools https://t.co/zWx0dJ73E9",False,1362146022391226381,31,75,75,7
RepJacobs,Rep. Chris Jacobs,1362141778682478595,1276232539510919168,en,1362141778682478595,2021-02-17T20:48:02.000Z,"My deepest prayers and condolences are with Rush Limbaugh’s family and loved ones.

He was an iconic radio host who connected with and served as an inspiration to millions of Americans daily for the last 3 decades, his voice will be missed and is irreplaceable.",False,1362141778682478595,2,20,20,1
RepJacobs,Rep. Chris Jacobs,1361802000091013123,1276232539510919168,en,1361802000091013123,2021-02-16T22:17:52.000Z,"Last night I joined @news4buffalo to discuss the need to establish a safe and binational reopening plan for the US-Canada Border.

Developing a plan is critical for families, small businesses, and property owners who rely on cross border travel.https://t.co/zTZZDcxTt7",False,1361802000091013123,1,5,5,0
RepJacobs,Rep. Chris Jacobs,1361801819236745217,1276232539510919168,en,1361801819236745217,2021-02-16T22:17:09.000Z,"In December I called for the IJC to allow increased outflows from Lake Ontario to better protect shoreline communities from flooding.

They have now announced deviations from Plan 2014 that will allow for higher outflows in spring 2021.

Statement:https://t.co/zPDnuZHHIf",False,1361801819236745217,1,3,3,0
RepJacobs,Rep. Chris Jacobs,1361087191527620608,1276232539510919168,en,1361087191527620608,2021-02-14T22:57:28.000Z,"I announced this week I have joined the House Rural Broadband Caucus to further advocate for WNY students, businesses, farmers, and seniors.

Expanding high speed internet coverage for rural communities is critical for our region.

My full statement: https://t.co/V39l0U9SHy",False,1361087191527620608,2,4,4,0
RepJacobs,Rep. Chris Jacobs,1361086743366279169,1276232539510919168,en,1361086743366279169,2021-02-14T22:55:42.000Z,"This week I dropped off valentine cards for our great WNY veterans at the Buffalo VA Hospital.

Students from schools around #NY27 participated this year and wrote hundreds of heartfelt cards for our veterans. https://t.co/Oo9sBoeZbX",False,1361086743366279169,1,2,2,0
RepJacobs,Rep. Chris Jacobs,1360328812534386688,1276232539510919168,en,1360328812534386688,2021-02-12T20:43:57.000Z,"On today’s anniversary of the Flight 3407 tragedy, I sent a bipartisan letter with members of the WNY delegation asking for the Department of Transportation to implement additional aviation safety standards to better protect passengers and crew of commercial airline flights. https://t.co/reovbo0LlY",False,1360328812534386688,1,4,4,0
RepJacobs,Rep. Chris Jacobs,1360325478532472833,1276232539510919168,en,1360325478532472833,2021-02-12T20:30:42.000Z,"Governor Cuomo’s own staff admitted they withheld nursing home death information to avoid federal prosecutors.

My NY GOP colleagues and I are calling upon the DOJ to immediately open a criminal investigation into obstruction of justice.

Full statement:https://t.co/hJUVGpzbZx https://t.co/LJR6urzRuj",False,1360325478532472833,5,9,9,1
RepJacobs,Rep. Chris Jacobs,1360311386577002502,1276232539510919168,en,1360311386577002502,2021-02-12T19:34:42.000Z,"This morning myself and my lakeshore colleagues met with IJC Chair Jane Corwin to receive an update on Lake Ontario water levels. 

Preventing severe flooding and protecting homeowners and businesses along our lakeshore is a top priority. https://t.co/nnCbmgWK2E",False,1360311386577002502,2,3,3,0
RepJacobs,Rep. Chris Jacobs,1360051446255923204,1276232539510919168,en,1360051446255923204,2021-02-12T02:21:47.000Z,"Now that we have reporting that the Governor and his staff willfully withheld nursing home data to avoid federal prosecutors, a full investigation must be launched right now into this obstruction. Governor Cuomo and his staff must be held accountable.
https://t.co/EUKokzeW1j",False,1360051446255923204,7,7,7,1
RepJacobs,Rep. Chris Jacobs,1360013408658161668,1276232539510919168,en,1360013408658161668,2021-02-11T23:50:39.000Z,"RT @JaniceDean: This is a bombshell.  We were told just over 6,000 patients. The numbers are skyrocketing not only in terms of infected pat…",False,1360013408658161668,4453,0,0,0
RepJacobs,Rep. Chris Jacobs,1360013093120671751,1276232539510919168,en,1360013093120671751,2021-02-11T23:49:23.000Z,"The more information that comes out about the Governor’s order forcing COVID patients back into nursing homes, the more apparent the need for a federal investigation becomes.

How far do the lies and the cover-up of data go? New Yorkers deserve answers now.https://t.co/yC9CjC5k6T",False,1360013093120671751,4,13,13,2
RepJacobs,Rep. Chris Jacobs,1359911653962371075,1276232539510919168,en,1359911653962371075,2021-02-11T17:06:18.000Z,"Last night @HouseAgGOP offered amendments for COVID relief to support small producers, restart CFAP, and invest in rural broadband that should have bipartisan support.
 
Democrats rejected these and instead forced through a partisan package.
 
My statement:https://t.co/xWbQROijEa",False,1359911653962371075,1,5,5,0
RepJacobs,Rep. Chris Jacobs,1359546247653294086,1276232539510919168,en,1359546247653294086,2021-02-10T16:54:19.000Z,RT @news10nbc: The county will launch the availability starting today at noon. There will be a little over 100 slots available. https://t.c…,False,1359546247653294086,1,0,0,0
RepJacobs,Rep. Chris Jacobs,1359545744940797955,1276232539510919168,en,1359545744940797955,2021-02-10T16:52:19.000Z,"Proud to announce I have joined the House Northern Border Caucus to further advocate for Western New York families, small businesses, and farmers who rely on cross border travel and commerce.

Full statement: https://t.co/hG1QbPSFj8",False,1359545744940797955,1,3,3,0
RepJacobs,Rep. Chris Jacobs,1359324162817417217,1276232539510919168,en,1359324162817417217,2021-02-10T02:11:50.000Z,"The best thing for our small businesses is to let them reopen safely.

End the arbitrary lockdowns and additional costs on struggling small businesses – let them open. https://t.co/eVzhBceyuu",False,1359324162817417217,3,11,11,0
RepJacobs,Rep. Chris Jacobs,1359323896391086082,1276232539510919168,en,1359323896391086082,2021-02-10T02:10:46.000Z,"The Governor’s cover-up of nursing home deaths is finally being exposed after he was forced to release the real figures by a judge.
 
His obstruction makes the need for a full federal investigation obvious. He must be held accountable for his actions. https://t.co/q9MtEecmZz",False,1359323896391086082,5,15,15,1
RepJacobs,Rep. Chris Jacobs,1358894985089810434,1276232539510919168,en,1358894985089810434,2021-02-08T21:46:26.000Z,"I joined my colleagues in a bipartisan letter calling on the Biden Adminstration to make expanding rural broadband coverage a priority in any upcoming infrastructure proposal.

These are critical investments into the future of rural communities in Western New York. https://t.co/SzKmEEsi05",False,1358894985089810434,2,6,6,1
RepJacobs,Rep. Chris Jacobs,1358875990181761029,1276232539510919168,en,1358875990181761029,2021-02-08T20:30:57.000Z,"This morning I held a press conference with Legislature Chairwoman Johnson and the Orleans County United Way to highlight the urgent need to close the digital divide. 

Solving these problems is vital to our region’s future: https://t.co/h3O39668EV",False,1358875990181761029,2,3,3,0
RepJacobs,Rep. Chris Jacobs,1358871404918280199,1276232539510919168,en,1358871404918280199,2021-02-08T20:12:44.000Z,"RT @HouseGOP: We are mourning the devastating loss of Congressman Ron Wright. He dedicated his life to serving his community, Texas's 6th c…",False,1358871404918280199,148,0,0,0
RepJacobs,Rep. Chris Jacobs,1357841418543386624,1276232539510919168,en,1357841418543386624,2021-02-05T23:59:56.000Z,"There is still work to be done to defeat COVID-19, but forcing through a one-sided, partisan package is unproductive and damaging.

We successfully negotiated bipartisan packages before, let’s do it again.

https://t.co/jU0o2f8cyR",False,1357841418543386624,2,24,24,0
RepJacobs,Rep. Chris Jacobs,1357422385205555201,1276232539510919168,en,1357422385205555201,2021-02-04T20:14:50.000Z,"Reliable domestic manufacturing of semiconductors is not only a national security priority, but an economic one. 

https://t.co/IW7vU5pbly",False,1357422385205555201,2,36,36,1
RepJacobs,Rep. Chris Jacobs,1357085550587559946,1276232539510919168,en,1357085550587559946,2021-02-03T21:56:23.000Z,Today I spoke on the floor in support of bipartisanship and against the one-sided political process Democrats are using to force through a massive COVID bill. We negotiated and passed a package one month ago – we can work together again to address the urgent needs of Americans. https://t.co/uou3W31qWz,False,1357085550587559946,1,42,42,4
RepJacobs,Rep. Chris Jacobs,1357074625461682180,1276232539510919168,en,1357074625461682180,2021-02-03T21:12:58.000Z,"I joined the NY GOP congressional delegation in calling on the Dept. of Justice to subpoena Governor Cuomo and his administration for documents related to their nursing home policies during the pandemic. They must be held accountable.

Full statement:https://t.co/AMeIx5x81k https://t.co/ozuJIIXZR9",False,1357074625461682180,4,30,30,4
RepJacobs,Rep. Chris Jacobs,1356795599958507521,1276232539510919168,en,1356795599958507521,2021-02-03T02:44:13.000Z,"RT @HouseGOP: Today we welcome an American hero to the Capitol one final time.
 
Join us in praying for Officer Sicknick’s family and the @…",False,1356795599958507521,174,0,0,0
RepJacobs,Rep. Chris Jacobs,1356726607864619016,1276232539510919168,en,1356726607864619016,2021-02-02T22:10:04.000Z,"Reliable internet access is critical to moving our state forward, especially in the rural areas I represent.

The 1st step to closing the gap is gathering accurate data to identify coverage needs - the Governor’s veto of this bill keeps that gap open. https://t.co/seDFa9CW1Q",False,1356726607864619016,2,6,6,1
RepJacobs,Rep. Chris Jacobs,1356695084230672399,1276232539510919168,en,1356695084230672399,2021-02-02T20:04:48.000Z,"Proud to join my colleagues in calling for the USDA to resume processing applications and payments for the Coronavirus Food Assistance Program (CFAP).

I am committed to ensuring our farmers are continually supported. My full statement: https://t.co/2RIcigabZw https://t.co/q7kpZrEoGx",False,1356695084230672399,1,3,3,0
RepJacobs,Rep. Chris Jacobs,1355279286165528580,1276232539510919168,en,1355279286165528580,2021-01-29T22:18:56.000Z,"I’m proud to stand with my @HouseGOP colleagues in support of the right to life. 

All life is precious and I will continue my work in Congress to defend and protect the most vulnerable, the unborn, so they can reach their full potential. https://t.co/C8BTS2miRD",False,1355279286165528580,1,35,35,2
RepJacobs,Rep. Chris Jacobs,1355277101402877953,1276232539510919168,en,1355277101402877953,2021-01-29T22:10:15.000Z,"It was my honor to designate Margaret Peri of Batavia as NY-27’s Veteran of the Month this morning.

She has an impressive record of service to our nation and our community representing the very best of what it means to be an American.
https://t.co/AV07tnRjRx https://t.co/LRewjyiufZ",False,1355277101402877953,2,4,4,0
RepJacobs,Rep. Chris Jacobs,1355260424653074442,1276232539510919168,en,1355260424653074442,2021-01-29T21:03:59.000Z,"RT @NatalieKucko: NOW: Procession down Main St. in Mt. Morris carrying the remains of Chief Warrant Officer Christian Koch, who died in a h…",False,1355260424653074442,20,0,0,0
RepJacobs,Rep. Chris Jacobs,1355259624254013444,1276232539510919168,en,1355259624254013444,2021-01-29T21:00:48.000Z,"Proud to join my colleagues in calling for President Biden to develop an actionable and binational plan to safely open the US-Canadian Border.

Families need to reunite and local economies are struggling.

Full statement:https://t.co/BN9Gtg3G0V https://t.co/fWlzP8cIT0",False,1355259624254013444,2,7,7,0
RepJacobs,Rep. Chris Jacobs,1354987470472040448,1276232539510919168,en,1354987470472040448,2021-01-29T02:59:22.000Z,"Thank you Wheatfield Gardens for the tour of their greenhouse operations. 

They're using hydroponics and clean energy tech to grow high quality produce. 

Our farmers use impressive cutting edge tech, and as a member of @HouseAgGOP I'll work to help them continue to thrive. https://t.co/2fP4A1c0jP",False,1354987470472040448,1,10,10,2
RepJacobs,Rep. Chris Jacobs,1354897566882799627,1276232539510919168,en,1354897566882799627,2021-01-28T21:02:07.000Z,"Today’s report showing the number of COVID-19 deaths in NYS nursing homes has been severely under reported is appalling.

Governor Cuomo and Commissioner Zucker must be held accountable, these grieving families deserve justice.

My full statement: https://t.co/2xM04TlP7c",False,1354897566882799627,3,20,20,0
RepJacobs,Rep. Chris Jacobs,1354597501299548164,1276232539510919168,en,1354597501299548164,2021-01-28T01:09:46.000Z,"I was proud to honor three officers this morning.

Trooper Gregson, Orleans County Sheriff Investigator Colonna, and Undersheriff Mele have gone above and beyond the call of duty. 

Im proud to support them and all the great men and women of our Western New York law enforcement. https://t.co/mBYI9Wv41L",False,1354597501299548164,1,14,14,0
RepJacobs,Rep. Chris Jacobs,1354596238662971394,1276232539510919168,en,1354596238662971394,2021-01-28T01:04:45.000Z,"On this Holocaust Remembrance Day we remember the millions of lives lost at the hands of Nazi regime.

We must continue our efforts to root out hatred and anti-semitism from our society and ensure the protection and advancement of human rights. https://t.co/fggZaIEYYC",False,1354596238662971394,1,11,11,0
RepJacobs,Rep. Chris Jacobs,1354592008329957377,1276232539510919168,en,1354592008329957377,2021-01-28T00:47:56.000Z,"Great meeting with the Orleans County IDA today to receive an update on their work to advance economic development.

Orleans County is set to be an economic driver in WNY and I plan to keep supporting their efforts to create good paying jobs and attract new opportunities. https://t.co/8CSZ6ym81F",False,1354592008329957377,1,6,6,0
RepJacobs,Rep. Chris Jacobs,1354184300040773633,1276232539510919168,en,1354184300040773633,2021-01-26T21:47:51.000Z,"I’m proud to say I‘m returning to @HouseAgGOP for the 117th Congress.

There I’ll keep fighting for our farms and rural communities and work to expand broadband access, support farms through the pandemic, and set the industry up for future success. https://t.co/6plBiuMEb2 https://t.co/i0jBefThH6",False,1354184300040773633,4,19,19,1
RepJacobs,Rep. Chris Jacobs,1353431848219766785,1276232539510919168,en,1353431848219766785,2021-01-24T19:57:52.000Z,"If you have a couple minutes on this championship Sunday listen to this great story from Chris Berman on receiving the key to the City of Buffalo.

Bills fans are the best in the nation, looking forward to another great game today! #gobills https://t.co/iPJxS0KHsz",False,1353431848219766785,2,17,17,0
RepJacobs,Rep. Chris Jacobs,1352699304994103296,1276232539510919168,en,1352699304994103296,2021-01-22T19:27:00.000Z,"Im saddened at the loss of a member of our NY27 community in the National Guard helicopter crash Wednesday.

My deepest condolences to Christian Koch’s family, and the families of the other service members who passed away.

Please join me in honoring them for their service.",False,1352699304994103296,2,4,4,0
RepJacobs,Rep. Chris Jacobs,1352697956986728448,1276232539510919168,en,1352697956986728448,2021-01-22T19:21:39.000Z,"I’m glad this problem has been corrected but we need answers for why it ever happened.

Thank you to the brave members of the National Guard who have protected the Capitol the last two weeks. 
https://t.co/8t1EjIAyEy",False,1352697956986728448,0,21,21,1
RepJacobs,Rep. Chris Jacobs,1352445715944001538,1276232539510919168,en,1352445715944001538,2021-01-22T02:39:20.000Z,"Today I spoke in favor of the waiver allowing General Austin to serve as Secretary of Defense.
 
The national security threats facing our nation – like China and Iran – require the leadership of an experienced and Senate-confirmed Secretary.
 
My full remarks: https://t.co/xCKYYDt2CI",False,1352445715944001538,1,13,13,0
RepJacobs,Rep. Chris Jacobs,1352440724160196610,1276232539510919168,en,1352440724160196610,2021-01-22T02:19:30.000Z,"Today I joined the Iroquois Job Corps  to learn more about the incredible work they are doing to provide high quality trade education to residents in the GLOW region.

A highly skilled workforce is critical to future prosperity of our region. keep up the great work! https://t.co/NEEqJeVuzx",False,1352440724160196610,2,5,5,0
RepJacobs,Rep. Chris Jacobs,1352088207182192640,1276232539510919168,en,1352088207182192640,2021-01-21T02:58:43.000Z,"RT @monroesheriffny: ""It is with heavy hearts that we stand before you tonight.  Another example that freedom is not free."" -Sheriff Baxter…",False,1352088207182192640,31,0,0,0
RepJacobs,Rep. Chris Jacobs,1352087831888486400,1276232539510919168,en,1352087831888486400,2021-01-21T02:57:14.000Z,"I am deeply saddened by the news of the National Guard helicopter crash in Mendon this evening that resulted in the loss of three lives. 

My prayers are with the loved ones of these service members lost.
https://t.co/UaVC8P3imh",False,1352087831888486400,4,5,5,0
RepJacobs,Rep. Chris Jacobs,1351991289357721600,1276232539510919168,en,1351991289357721600,2021-01-20T20:33:36.000Z,"It was an honor to represent the people of NY27 at the Inauguration today and I wish the new Biden Administration well.

Now we must continue to work toward actionable solutions to safely reopen our country, unleash our economy, and set up new prosperity. 
https://t.co/pRFr9YP3iV",False,1351991289357721600,2,30,30,3
RepJacobs,Rep. Chris Jacobs,1351679750155214849,1276232539510919168,en,1351679750155214849,2021-01-19T23:55:40.000Z,"The members of our National Guard serve our nation honorably and are working to protect our capital. 

Rep. Cohen’s remarks are deeply disrespectful and I’m joining my NY colleagues in demanding he apologize.

Read our full statement here:https://t.co/hKo3KpVV5I",False,1351679750155214849,23,39,39,5
