handle,name,tweet_id,author_id,lang,replied_to,created_at,tweet_text,possibly_sensitive,conversation_id,retweet_count,reply_count,like_count,quote_count
RepJacobs,Rep. Chris Jacobs,1431005578843852812,1276232539510919168,en,1431005578843852812,2021-08-26T21:28:11.000Z,"The attacks today in Kabul are horrific and tragically took the lives of 12 American service members. My heart is with each of their families, and I ask every American to join me in praying for them and every American service member still in harm’s way.
https://t.co/hEu6XXfuS8",False,1431005578843852812,3,6,6,0
RepJacobs,Rep. Chris Jacobs,1430689073593737221,1276232539510919168,en,1430689073593737221,2021-08-26T00:30:30.000Z,"I joined @RepWaltzPress’s resolution condemning the President and his administrations’ incompetence and inability to provide a coherent plan to safely evacuate every American in Afghanistan.

Read the resolution here:
https://t.co/VWOnFoLUeI",False,1430689073593737221,3,20,20,1
RepJacobs,Rep. Chris Jacobs,1430642128527536137,1276232539510919168,en,1430642128527536137,2021-08-25T21:23:58.000Z,"I joined my colleagues in calling for transparent answers from the President on his plans for handling the crisis in Afghanistan and the aftermath.

We need transparency and competence from this administration.

Read here: https://t.co/bTJAXDj2WJ",False,1430642128527536137,2,17,17,0
RepJacobs,Rep. Chris Jacobs,1430623793018441742,1276232539510919168,en,1430623793018441742,2021-08-25T20:11:06.000Z,"""It was Biden’s recklessness and incompetence that stranded these Americans in Taliban-controlled territory, and it would be his cravenness and incompetence that would leave them there.""
https://t.co/zRJ4KA34Oj",False,1430623793018441742,2,11,11,0
RepJacobs,Rep. Chris Jacobs,1430198138263031810,1276232539510919168,en,1430198138263031810,2021-08-24T15:59:42.000Z,RT @RepRickAllen: Every American citizen and ally must be safely evacuated from Afghanistan – no excuses. I joined @RepJacobs in calling on…,False,1430198138263031810,3,0,0,0
RepJacobs,Rep. Chris Jacobs,1429976466763227139,1276232539510919168,en,1429976466763227139,2021-08-24T01:18:52.000Z,"I introduced a resolution calling for the safe evacuation of every American and eligible American ally in Afghanistan.

POTUS has failed to tell us how we will rescue those in harm’s way. That needs to change now.

https://t.co/FOxpLgvHvf",False,1429976466763227139,2,9,9,0
RepJacobs,Rep. Chris Jacobs,1429912882804928518,1276232539510919168,en,1429912882804928518,2021-08-23T21:06:12.000Z,"Yet another falsehood from the President’s speech exposed – 
Al-Qaeda is not “gone” from Afghanistan like he claimed.

Total incompetence being displayed on the world’s stage. There must be accountability when the dust settles. https://t.co/y7miRayljS",False,1429912882804928518,2,11,11,0
RepJacobs,Rep. Chris Jacobs,1429898703331024915,1276232539510919168,en,1429898703331024915,2021-08-23T20:09:51.000Z,".@RepTimRyan and I introduced the Reservists Opportunity Act to give our National Guard and Reserve members improved access to active-duty opportunities.
 
This will remove barriers and allow for flexibility - improving retention and military readiness. https://t.co/iL7395sa2z",False,1429898703331024915,3,2,2,0
RepJacobs,Rep. Chris Jacobs,1429856478857502729,1276232539510919168,en,1429856478857502729,2021-08-23T17:22:04.000Z,"Yet another reminder: 

the President’s policies put a direct tax on hard-working American families https://t.co/kvUkgg7T0d",False,1429856478857502729,2,8,8,0
RepJacobs,Rep. Chris Jacobs,1429589422299881473,1276232539510919168,en,1429589422299881473,2021-08-22T23:40:53.000Z,"On Tuesday I toured Moog in East Aurora. They have an impressive and innovative manufacturing operation that spans the U.S. military, space, and commercial aviation. https://t.co/QTmks9gUv5",False,1429589422299881473,3,1,1,1
RepJacobs,Rep. Chris Jacobs,1429245507206062087,1276232539510919168,en,1429245507206062087,2021-08-22T00:54:17.000Z,Yesterday I was honored to join FeedMore WNY to deliver meals to seniors and families in Lancaster. It was great to be out and to meet some incredibly friendly Western New Yorkers! https://t.co/v9UrCbtptH,False,1429245507206062087,2,9,9,1
RepJacobs,Rep. Chris Jacobs,1429178751393402882,1276232539510919168,en,1429178751393402882,2021-08-21T20:29:01.000Z,"On Monday, I was in Avon to tour Matthews Bus Company. They supply school buses for students across Western and Central New York and have a rich history in our region. https://t.co/bqJOoFk8wB",False,1429178751393402882,2,1,1,0
RepJacobs,Rep. Chris Jacobs,1428868609888116740,1276232539510919168,en,1428868609888116740,2021-08-20T23:56:38.000Z,"The President’s speech today was divorced from the reality of the crisis he created in Afghanistan.
 
The truth is our allies have very publicly criticized his actions and have called into question his leadership. He's hurt our nation’s global standing.
https://t.co/XPS1kJafbf",False,1428868609888116740,6,16,16,0
RepJacobs,Rep. Chris Jacobs,1428830709217730567,1276232539510919168,en,1428830709217730567,2021-08-20T21:26:02.000Z,The President has shown a total failure in leadership. https://t.co/IMUcNn6mMC,False,1428830709217730567,240,61,61,16
RepJacobs,Rep. Chris Jacobs,1428811134384152579,1276232539510919168,en,1428811134384152579,2021-08-20T20:08:15.000Z,"Today, the Biden admin once again extended the closure of the US – Canada border.

This decision prolongs the suffering of our small businesses and families. The border should’ve reopened to nonessential travel months ago. More failure from the President.
https://t.co/q6quSjtkjY",False,1428811134384152579,2,5,5,0
RepJacobs,Rep. Chris Jacobs,1428505029993025538,1276232539510919168,en,1428505029993025538,2021-08-19T23:51:54.000Z,"More evidence of the President's failure in Afghanistan: the Taliban has seized an army’s worth of US weapons and technology. 
 
https://t.co/ZfDnnWW8ME",False,1428505029993025538,2,16,16,0
RepJacobs,Rep. Chris Jacobs,1428463583139176453,1276232539510919168,en,1428463583139176453,2021-08-19T21:07:12.000Z,"China is watching the stunning weakness being shown by President Biden and his admin.
 
The fallout of the devastation in Afghanistan will only weaken our standing on the world stage, dishearten our allies, and embolden our enemies to test our resolve.
https://t.co/mKaXcRn3nc",False,1428463583139176453,4,8,8,0
RepJacobs,Rep. Chris Jacobs,1428430714609995785,1276232539510919168,en,1428430714609995785,2021-08-19T18:56:35.000Z,"Our nation is less safe today because of the actions of President Biden.
 
He’s put our national security at risk.

He’s shown weakness to our enemies.

And worst of all he’s put Americans and our allies directly in harm’s way. https://t.co/4Sk9AC8Ymd",False,1428430714609995785,3,18,18,0
RepJacobs,Rep. Chris Jacobs,1428177250306887683,1276232539510919168,en,1428177250306887683,2021-08-19T02:09:25.000Z,"Every effort and available resource should be used to safely evacuate American citizens and our Afghan allies trapped in Afghanistan as a result of this administration’s recklessness.

The President’s incompetence is devastating. How is there not a plan?
https://t.co/QXEcbdtdYk",False,1428177250306887683,2,19,19,1
RepJacobs,Rep. Chris Jacobs,1428141810350792704,1276232539510919168,en,1428141810350792704,2021-08-18T23:48:35.000Z,"American citizens and our allies shouldn’t have to beg the President to help them. There should’ve been a plan to rescue them.

The President’s failure to lead is putting Americans directly in harms way.
https://t.co/49ep6zmFFq",False,1428141810350792704,2,11,11,0
RepJacobs,Rep. Chris Jacobs,1427763483383377920,1276232539510919168,en,1427763483383377920,2021-08-17T22:45:15.000Z,"In addition, if you are a veteran and need to speak with someone, the National Veteran Crisis Hotline number is 1-800-273-8255.
 
This is a free and confidential service that does not require VA enrollment. (2/2)",False,1427763481869275149,1,1,1,1
RepJacobs,Rep. Chris Jacobs,1427763481869275149,1276232539510919168,en,1427763481869275149,2021-08-17T22:45:15.000Z,"If you have a veteran in your life, reach out to them. The situation in Afghanistan is heartbreaking and impacting many in our community.

To our veterans, thank you for your service in the fight for freedom the last 20 years. We are forever grateful (1/2)https://t.co/hgRNVE91Ms",False,1427763481869275149,3,5,5,0
RepJacobs,Rep. Chris Jacobs,1427047574750515200,1276232539510919168,en,1427047574750515200,2021-08-15T23:20:29.000Z,"The situation in Afghanistan is a direct result of a shameful and devastating foreign policy failure by the Biden admin. 

The President has handed Afghanistan over to the Taliban, put millions in harms way, and will allow for the resurgence of terror organizations once more.",False,1427047574750515200,3,33,33,1
RepJacobs,Rep. Chris Jacobs,1426331809437061121,1276232539510919168,en,1426331809437061121,2021-08-13T23:56:17.000Z,"Great meeting this morning with John King and members of the Niagara County Farm Bureau.

We toured Sun Orchard Fruit Co. and also met with local peach and cabbage growers as well. Learning about the issues facing our farmers is critical to my work on @HouseAgGOP https://t.co/MWlmjs7dUe",False,1426331809437061121,5,8,8,0
RepJacobs,Rep. Chris Jacobs,1426311485509312515,1276232539510919168,en,1426311485509312515,2021-08-13T22:35:32.000Z,"Biden’s Border Crisis is only getting worse 🚨🚨

The President has completely failed to secure our southern border.
https://t.co/fUaDGFCf4N",False,1426311485509312515,2,20,20,1
RepJacobs,Rep. Chris Jacobs,1426272536141176838,1276232539510919168,en,1426272536141176838,2021-08-13T20:00:46.000Z,"Proud to join @RepRonnyJackson this week to ask the VA to prioritize care for veterans living in rural areas. 

Where our heroes choose to live should not impact their ability to access services. https://t.co/32AEHeVZqw",False,1426272536141176838,3,4,4,0
RepJacobs,Rep. Chris Jacobs,1425957502143942656,1276232539510919168,en,1425957502143942656,2021-08-12T23:08:56.000Z,RT @RepLisaMcClain: I joined @RepJacobs and @SenMikeLee in sending a letter to President Biden asking him to end his unconstitutional #evic…,False,1425957502143942656,8,0,0,0
RepJacobs,Rep. Chris Jacobs,1425957346015076363,1276232539510919168,en,1425957346015076363,2021-08-12T23:08:18.000Z,"More taxes on hardworking Americans courtesy of President Biden.
 
The more his administration’s unchecked partisan spending continues, the more prices will continue to rise and hurt families financially.
https://t.co/jKglxmU9bq",False,1425957346015076363,2,16,16,1
RepJacobs,Rep. Chris Jacobs,1425932197920493570,1276232539510919168,en,1425932197920493570,2021-08-12T21:28:23.000Z,RT @RepMann: Extending the eviction moratorium without congressional approval is blatant overreach by President Biden. I joined my colleagu…,False,1425932197920493570,2,0,0,0
RepJacobs,Rep. Chris Jacobs,1425922612258123785,1276232539510919168,en,1425922612258123785,2021-08-12T20:50:17.000Z,RT @RepDustyJohnson: There are mom &amp; pops landlords that haven’t received rent owed for over a year and a half – despite millions of dollar…,False,1425922612258123785,3,0,0,0
RepJacobs,Rep. Chris Jacobs,1425562307246034954,1276232539510919168,en,1425562307246034954,2021-08-11T20:58:34.000Z,"With the upcoming school year approaching fast, today I visited Autumn View Health Center in Hamburg to help distribute school supplies and backpacks to frontline workers for their children.

Thank you for all you do to support our community! https://t.co/2BslRTLPdG",False,1425562307246034954,1,13,13,0
RepJacobs,Rep. Chris Jacobs,1425530339682832390,1276232539510919168,en,1425530339682832390,2021-08-11T18:51:32.000Z,RT @RepHarshbarger: I joined @RepJacobs and @SenMikeLee in continuing to demand President Biden end the unconstitutional eviction moratoriu…,False,1425530339682832390,5,0,0,0
RepJacobs,Rep. Chris Jacobs,1425501428701872132,1276232539510919168,en,1425501428701872132,2021-08-11T16:56:39.000Z,".@SenMikeLee and I led a letter to President Biden urging him to end his unconstitutional eviction moratorium.
 
$50B in rental assistance funds are waiting to be used. It's time to end this government overreach and get our economy back on track. 
https://t.co/R41o4il3eu https://t.co/LXilrIHIeg",False,1425501428701872132,17,51,51,10
RepJacobs,Rep. Chris Jacobs,1425270245565009923,1276232539510919168,en,1425270245565009923,2021-08-11T01:38:01.000Z,"Had a great tour of Lake Shore High School in Angola this morning!

I got to see their new facilities and learn more about the innovative technologies they are using for education. https://t.co/JGZ3YuPzWT",False,1425270245565009923,2,2,2,0
RepJacobs,Rep. Chris Jacobs,1425251569751281664,1276232539510919168,en,1425251569751281664,2021-08-11T00:23:48.000Z,"Great to be in Warsaw this afternoon to recognize volunteers from Wyoming County who were on the frontlines and kept our community going during the pandemic.

Their selflessness and dedication is an example for us all. Thank you! https://t.co/XNveU2nT1D",False,1425251569751281664,2,7,7,1
RepJacobs,Rep. Chris Jacobs,1425191553006440451,1276232539510919168,en,1425191553006440451,2021-08-10T20:25:19.000Z,My statement on Governor Cuomo’s resignation: https://t.co/n0FZgKG6wt,False,1425191553006440451,5,25,25,0
RepJacobs,Rep. Chris Jacobs,1424162348365975555,1276232539510919168,en,1424162348365975555,2021-08-08T00:15:38.000Z,"I joined @GriffJenkins earlier today on @FoxNews to discuss #infrastructure and #Cuomo

Watch my full interview here: https://t.co/1uYoPxAwUz",False,1424162348365975555,2,8,8,1
RepJacobs,Rep. Chris Jacobs,1424148712071340036,1276232539510919168,en,1424148712071340036,2021-08-07T23:21:27.000Z,"Today, on #NationalPurpleHeartDay we honor the selflessness, bravery, and courage of our service members who were wounded or paid the ultimate sacrifice for our nation.

We are forever grateful for and humbled by their sacrifices in defense of our freedom. https://t.co/2dUKcP7uVu",False,1424148712071340036,4,4,4,1
RepJacobs,Rep. Chris Jacobs,1423780986052034564,1276232539510919168,en,1423780986052034564,2021-08-06T23:00:14.000Z,"Reminder: If you’re traveling to Canada next week – you need to be fully vaccinated AND have a negative COVID-19 test with 72 hours of travel.
 
Erie County is offering testing starting Monday – to schedule an appointment call 716-858-2929.
 
More info: https://t.co/W6c7ZjNASc",False,1423780986052034564,1,4,4,0
RepJacobs,Rep. Chris Jacobs,1423341660050796545,1276232539510919168,en,1423341660050796545,2021-08-05T17:54:30.000Z,"Great to be out in Lockport last night to kick off the Niagara County Fair and to dedicate the John K. Hall Memorial Bench and the Gertrude Warren Historic Marker. 

Congratulations to the Niagara County 4-H. Keep up the great work of educating the next generation of farmers! https://t.co/GhweVCaKtj",False,1423341660050796545,2,6,6,0
RepJacobs,Rep. Chris Jacobs,1423065744519188484,1276232539510919168,en,1423065744519188484,2021-08-04T23:38:07.000Z,"I joined my colleagues in calling on the DOJ to explain its decision to not investigate Gov Cuomo’s nursing home scandal.

Cuomo and his staff made blatant attempts to cover up info regarding their deadly decision. They must be held accountable, grieving families deserve justice. https://t.co/xgSEIt7VWK",False,1423065744519188484,24,22,22,2
RepJacobs,Rep. Chris Jacobs,1423005811375284225,1276232539510919168,en,1423005811375284225,2021-08-04T19:39:58.000Z,"Happy 231st Birthday to the @USCG!

Thank you for your tireless work to keep our nation and our citizens safe. https://t.co/C1PCNWhPUR",False,1423005811375284225,4,1,1,1
RepJacobs,Rep. Chris Jacobs,1422896591661371396,1276232539510919168,en,1422896591661371396,2021-08-04T12:25:58.000Z,"Proud to cosponsor the Erie Canalway National Heritage Corridor Commission Reauthorization Act to provide additional federal dollars to support this critical WNY historic site.

The Erie Canal continues to be a major tourism attraction and economic driver.
https://t.co/1pR7JBSomF",False,1422896591661371396,4,2,2,0
RepJacobs,Rep. Chris Jacobs,1422721610331664392,1276232539510919168,en,1422721610331664392,2021-08-04T00:50:39.000Z,RT @HouseGOP: Inflation is taxation and it has increased EVERY MONTH Biden has been in office.,False,1422721610331664392,247,0,0,0
RepJacobs,Rep. Chris Jacobs,1422601439688396807,1276232539510919168,en,1422601439688396807,2021-08-03T16:53:08.000Z,My statement on AG James’ Report on Governor Cuomo: https://t.co/zLLN19sJSB,False,1422601439688396807,7,24,24,0
RepJacobs,Rep. Chris Jacobs,1422370129543847940,1276232539510919168,en,1422370129543847940,2021-08-03T01:33:59.000Z,"Enhanced unemployment benefits continue to dampen our economic recovery.

It’s time to get back to work and end these disincentives.
https://t.co/sLBpZtSug6",False,1422370129543847940,5,17,17,0
RepJacobs,Rep. Chris Jacobs,1422300013552619529,1276232539510919168,en,1422300013552619529,2021-08-02T20:55:22.000Z,"The more we learn, the more it becomes absolutely necessary for a thorough and independent investigation into the origins of COVID-19.

China must be held accountable for their lies and manipulation.
https://t.co/9ra0hfrJLO",False,1422300013552619529,48,25,25,2
RepJacobs,Rep. Chris Jacobs,1421626307864113157,1276232539510919168,en,1421626307864113157,2021-08-01T00:18:18.000Z,"Great to be out in West Sparta today for the Historical Society’s chicken barbecue.

Great company and great food for a great cause! https://t.co/DSwshj868F",False,1421626307864113157,1,6,6,0
RepJacobs,Rep. Chris Jacobs,1420846047216250891,1276232539510919168,en,1420846047216250891,2021-07-29T20:37:50.000Z,"""Under the USMCA, American dairy farmers are supposed to have increased access to sell in Canadian markets...Jacobs said Canada, by specifically setting aside a percentage of its [TRQs] for Canadian producers, is essentially blocking that access."" https://t.co/25GRca8maP",False,1420846047216250891,8,2,2,0
RepJacobs,Rep. Chris Jacobs,1420828426798252037,1276232539510919168,en,1420828426798252037,2021-07-29T19:27:49.000Z,(2/2) I also sent a letter this past week calling for the State Department to address backlogs in passport processing and answer specific questions on staffing and public office access. https://t.co/5w5mRehiSz,False,1420828420397744134,1,1,1,0
RepJacobs,Rep. Chris Jacobs,1420828420397744134,1276232539510919168,en,1420828420397744134,2021-07-29T19:27:47.000Z,"THREAD: If you are planning on traveling in the next 8 months, you should consider renewing your passport now.

In addition, there is new updated information regarding emergency appointments.

Read more here: https://t.co/btaoF1UkKX",False,1420828420397744134,2,3,3,0
RepJacobs,Rep. Chris Jacobs,1420156018370224130,1276232539510919168,en,1420156018370224130,2021-07-27T22:55:54.000Z,"President Biden has completely failed to secure our border and is putting our national security at risk.

His policies have directly fueled a growing crisis at our southern border, and he continues to ignore record-setting mess he has created.
https://t.co/1knHFmZ6ij",False,1420156018370224130,7,20,20,1
RepJacobs,Rep. Chris Jacobs,1420123058896089089,1276232539510919168,en,1420123058896089089,2021-07-27T20:44:56.000Z,"Niagara County has launched a mobile app to help residents who experienced flood damage last week and may have claims.

You can download the app at:  https://t.co/4oVSIQ09YB",False,1420123058896089089,2,2,2,0
RepJacobs,Rep. Chris Jacobs,1420111932665761800,1276232539510919168,en,1420111932665761800,2021-07-27T20:00:43.000Z,"Fair trade is essential to ensuring our farmers prosper as we emerge from COVID-19.

Canada is denying our dairy farmers access to expanded markets in violation of the USMCA. This must change immediately.
https://t.co/U9myrl92TS",False,1420111932665761800,5,3,3,1
RepJacobs,Rep. Chris Jacobs,1420006315800334353,1276232539510919168,en,1420006315800334353,2021-07-27T13:01:02.000Z,"Sunday I joined @NewsRadio930 on Hardline to discuss the U.S. – Canada border closure, the ALLIES Act, and more.

You can listen to my interview in the second half of the first hour here: https://t.co/0dYRiUJkSh",False,1420006315800334353,2,3,3,0
RepJacobs,Rep. Chris Jacobs,1419828054856241154,1276232539510919168,en,1419828054856241154,2021-07-27T01:12:42.000Z,"This morning I was in Lockport meeting with Mayor Roman, Sen. Ortt, and Assm. Norris about the flooding that occurred during last week’s storm.

We received a briefing and then went to the wastewater treatment plant to hear from the staff about the impact and water damage there. https://t.co/pZ2zMGWsvc",False,1419828054856241154,2,4,4,0
RepJacobs,Rep. Chris Jacobs,1419799637985304585,1276232539510919168,en,1419799637985304585,2021-07-26T23:19:46.000Z,"In addition, I sent a letter to Canadian Ambassador Hillman highlighting this specific issue and the need for a resolution that adheres to the provisions of the USMCA. https://t.co/fYTxIv8mVb",False,1419799626929090560,3,0,0,0
RepJacobs,Rep. Chris Jacobs,1419799626929090560,1276232539510919168,en,1419799626929090560,2021-07-26T23:19:44.000Z,"Today I was at Reyncrest Farms in Corfu to discuss the need for full implementation of the dairy market expansion provisions of the USMCA.
 
Canada’s unfair trade practices are causing American producers to lose out on over $220M in potential sales. 
More: https://t.co/q78pHaLu72 https://t.co/hVAvTelu6N",False,1419799626929090560,8,9,9,0
RepJacobs,Rep. Chris Jacobs,1418662954824867840,1276232539510919168,en,1418662954824867840,2021-07-23T20:03:00.000Z,"Our Border Patrol agents risk their lives every day to protect our nation, stop illicit drugs, and end human trafficking.

They deserve our full and unwavering support – I’m proud to cosponsor this resolution that makes that support clear.

Read more: 

https://t.co/9vvvK9yz77",False,1418662954824867840,3,8,8,0
RepJacobs,Rep. Chris Jacobs,1418604181825355776,1276232539510919168,en,1418604181825355776,2021-07-23T16:09:27.000Z,"Small businesses, like Butera’s Craft Beer and Craft Pizza, are suffering from massive labor shortages.
Everyday disincentives work remain in place is another day of rising prices for your family, longer wait times, and business closures.
https://t.co/T7r6PhkL9y",False,1418604181825355776,4,16,16,1
RepJacobs,Rep. Chris Jacobs,1418364664635871233,1276232539510919168,en,1418364664635871233,2021-07-23T00:17:42.000Z,"Today I supported the Allies Act of 2021, which gets Afghans who supported the US military and their families out of harm’s way.

Anyone who puts their life on the line to stand alongside American service members deserves not only our gratitude – they deserve our protection. https://t.co/vZh4NAUXGp",False,1418364664635871233,3,12,12,0
RepJacobs,Rep. Chris Jacobs,1418297048537907200,1276232539510919168,en,1418297048537907200,2021-07-22T19:49:01.000Z,"Proud to join my @housebudgetGOP colleagues in calling for Congress to enact fiscally responsible spending plans.

We have seen the impact of unchecked partisan spending already this year, our nation and our grandchildren cannot afford more of it. https://t.co/j0MwwLV8O4",False,1418297048537907200,4,9,9,1
RepJacobs,Rep. Chris Jacobs,1418282595847184387,1276232539510919168,en,1418282595847184387,2021-07-22T18:51:35.000Z,"Yesterday, the Biden admin announced another unacceptable extension of the US – Canada border closure.
 
They have failed to act and have completely ignored families, small business owners, and lawmakers calling for answers and action.
 
This needs to change. https://t.co/XiR33PAu65",False,1418282595847184387,29,12,12,3
RepJacobs,Rep. Chris Jacobs,1418193097096376322,1276232539510919168,en,1418193097096376322,2021-07-22T12:55:57.000Z,"""Many businesses are losing money, shortening hours, or closing down entirely because they cannot find employees. Unfortunately, this translates to longer wait times, higher prices, and shortages of numerous products families need.”
https://t.co/VHt6oFjihb",False,1418193097096376322,2,4,4,0
RepJacobs,Rep. Chris Jacobs,1417979925403947009,1276232539510919168,en,1417979925403947009,2021-07-21T22:48:53.000Z,"Today I delivered a floor speech on the importance of protecting the Hyde Amendment and preventing taxpayer dollars from being used for abortions.

Since its inception, the Hyde Amendment has saved an estimated 2 million lives – it must be preserved. #hydesaveslives https://t.co/Ys48Jzn2YP",False,1417979925403947009,25,12,12,1
RepJacobs,Rep. Chris Jacobs,1417937781217808386,1276232539510919168,en,1417937781217808386,2021-07-21T20:01:25.000Z,"Another month-long extension of the US – Canada border shutdown is regrettably par for course. Reopening the border to nonessential travel can be done safely. Every day we don’t reopen is another day of the Biden admin’s complete failure on this issue.
https://t.co/HAalX4PXQm",False,1417937781217808386,2,5,5,1
RepJacobs,Rep. Chris Jacobs,1417912359826468871,1276232539510919168,en,1417912359826468871,2021-07-21T18:20:24.000Z,"Getting back to work and our economy back on track is essential. That’s why I introduced the Help Wanted Act and oppose partisan spending that raises prices and hurts families.
https://t.co/sZm1uuTpDz",False,1417912359826468871,1,6,6,0
RepJacobs,Rep. Chris Jacobs,1417278760919908353,1276232539510919168,en,1417278760919908353,2021-07-20T00:22:43.000Z,"Democrat’s partisan spending has caused massive labor shortages and skyrocketing prices that hurt hardworking American families.

It is a direct tax on the American people, and it’s only getting worse. https://t.co/mT7MBZVOTc",False,1417278760919908353,2,13,13,0
