handle,name,tweet_id,author_id,lang,replied_to,created_at,tweet_text,possibly_sensitive,conversation_id,retweet_count,reply_count,like_count,quote_count
RepJacobs,Rep. Chris Jacobs,1492889878157316099,1276232539510919168,en,1492889878157316099,2022-02-13T15:54:18.000Z,"This is disgraceful. @EnesFreedom had the courage to speak out about the egregious human rights abuses of the Chinese Communist Party and was fired.

The NBA pretends to be “woke” but they continue to stay silent on the CCP’s abuses to protect their profits. Shameful.",False,1492889878157316099,364,41,41,8
RepJacobs,Rep. Chris Jacobs,1492631562298531850,1276232539510919168,en,1492631562298531850,2022-02-12T22:47:50.000Z,"The crisis at our southern border continues to rage and this administration continues to ignore it.

They must be held accountable, starting with the head of DHS.
https://t.co/8VLXbicPyn",False,1492631562298531850,2,13,13,0
RepJacobs,Rep. Chris Jacobs,1492582611633512448,1276232539510919168,en,1492582611633512448,2022-02-12T19:33:20.000Z,"“Chris Jacobs (R-N.Y.) called on Hochul to drop her mandate for schools, saying that the concept that children must continue to wear masks during class ‘ignores and rejects available scientific data.’”
https://t.co/N3OiHqnS9n",False,1492582611633512448,4,10,10,1
RepJacobs,Rep. Chris Jacobs,1492555027797393409,1276232539510919168,en,1492555027797393409,2022-02-12T17:43:43.000Z,"Today we remember the victims of Flight 3407, and hold their families in our hearts.

In the wake of this crash - the families of those who passed away have worked tirelessly to make our skies across the country safer. Their dedication in face of such tragedy is truly inspiring.",False,1492555027797393409,3,1,1,0
RepJacobs,Rep. Chris Jacobs,1491434646046797825,1276232539510919168,en,1491434646046797825,2022-02-09T15:31:43.000Z,"Today I joined @RepGarbarino and our New York Republican colleagues to call on Governor Hochul to drop her mask mandate in schools.

It is time to unmask our children. https://t.co/NrIdzNXSsa",False,1491434646046797825,24,49,49,5
RepJacobs,Rep. Chris Jacobs,1491424036370673671,1276232539510919168,en,1491424036370673671,2022-02-09T14:49:34.000Z,"Drug smugglers are taking advantage of the Biden administration’s open border policies.

This administration has abandoned our border security - fueling our nation’s opioid epidemic and putting communities around our country at risk.
https://t.co/9VzXGT3G4z",False,1491424036370673671,2,11,11,2
RepJacobs,Rep. Chris Jacobs,1491226968955961344,1276232539510919168,en,1491226968955961344,2022-02-09T01:46:29.000Z,"End the NY mask mandate. Unmask our kids.
https://t.co/gmuwHbgMgD",False,1491226968955961344,7,14,14,0
RepJacobs,Rep. Chris Jacobs,1491214713308737537,1276232539510919168,en,1491214713308737537,2022-02-09T00:57:47.000Z,"RT @HouseGOP: Biden and Congressional Democrats’ failed Socialist agenda is costing American families.
https://t.co/0QtSn9LGg7",False,1491214713308737537,47,0,0,0
RepJacobs,Rep. Chris Jacobs,1490034734331740162,1276232539510919168,en,1490034734331740162,2022-02-05T18:48:58.000Z,"“I call on the New York State Legislature to repeal [bail reform] immediately and for Congress to pass legislation like the SERVE Act to better support our law enforcement officers and the safety of our communities.”

https://t.co/5TBHMAsKtN",False,1490034734331740162,3,13,13,0
RepJacobs,Rep. Chris Jacobs,1490006887693266957,1276232539510919168,en,1490006887693266957,2022-02-05T16:58:19.000Z,"I am proud to join my Senate colleagues in introducing this critical piece of legislation that will ensure students are given consistent and uninterrupted access to in-person learning and quality education.

https://t.co/Ewx0x8Bz4c",False,1490006887693266957,2,3,3,0
RepJacobs,Rep. Chris Jacobs,1489390243602219009,1276232539510919168,en,1489390243602219009,2022-02-04T00:08:00.000Z,"Today we gathered to celebrate the 70th National Prayer Breakfast, a remarkable event that upholds the importance of prayer and faith in God. It presents a time to reflect on the challenges we face, and our optimism and strength to overcome them. https://t.co/SiEIQKU9nR",False,1489390243602219009,2,8,8,1
RepJacobs,Rep. Chris Jacobs,1489359745500827657,1276232539510919168,en,1489359745500827657,2022-02-03T22:06:48.000Z,RT @HouseGOP: Speaker Pelosi and House Democrats are attempting to add fuel to the inflation fire by ramming through their America CONCEDES…,False,1489359745500827657,102,0,0,0
RepJacobs,Rep. Chris Jacobs,1489342255655702530,1276232539510919168,en,1489342255655702530,2022-02-03T20:57:19.000Z,"New Yorkers have suffered under lawlessness fostered by Democrats for far too long. It is reprehensible that the legislature will not admit the failure of this law and repeal so-called “bail reform.”

https://t.co/u5lwDpDN5e",False,1489342255655702530,2,8,8,0
RepJacobs,Rep. Chris Jacobs,1489022502995124224,1276232539510919168,en,1489022502995124224,2022-02-02T23:46:44.000Z,"National Debt: $30,000,000,000,000 for first time in history.

Democrats: We need to spend more on failed policies.
https://t.co/sVgm62U6vW",False,1489022502995124224,2,19,19,0
RepJacobs,Rep. Chris Jacobs,1488986127440785409,1276232539510919168,en,1488986127440785409,2022-02-02T21:22:11.000Z,"Proud to join my partners in the Senate @SenatorTimScott, @SenBillCassidy, and @SenatorBurr by introducing the Kids in Classes Act in the House.

This legislation protects in-person learning and promotes school choice for low-income students.

Read more: https://t.co/DCp8OXY4MR",False,1488986127440785409,1,7,7,0
RepJacobs,Rep. Chris Jacobs,1488948890439200773,1276232539510919168,en,1488948890439200773,2022-02-02T18:54:13.000Z,"Anti-police rhetoric and soft-on-crime policies like the NY “bail reform” laws have led to a spike in violent crime around the nation.

It’s time to implement policies that support our police and put the safety of our communities first.

Read my latest:
https://t.co/F3ZWN5zxnb",False,1488948890439200773,1,4,4,0
RepJacobs,Rep. Chris Jacobs,1488923597162831879,1276232539510919168,en,1488923597162831879,2022-02-02T17:13:43.000Z,"I cosponsored the China Task Force Act, a comprehensive bipartisan package that got tough on China &amp; set our nation up for success.
 
Instead of pursuing that goal, Dems are forcing through the CONCEDES Act that is as soft on China as they are on crime. More unserious legislating https://t.co/hQas5JxiOQ",False,1488923597162831879,5,4,4,0
RepJacobs,Rep. Chris Jacobs,1488678651889655810,1276232539510919168,en,1488678651889655810,2022-02-02T01:00:23.000Z,"""House Republicans from New York are urging President Biden to stop secretly transporting illegal immigrants from the southern border to New York""
 
Proud to join @RepStefanik in calling for the end of secret flights and a return to the rule of law
https://t.co/a91DpsCNIN",False,1488678651889655810,6,6,6,0
RepJacobs,Rep. Chris Jacobs,1488628874036625410,1276232539510919168,en,1488628874036625410,2022-02-01T21:42:35.000Z,"Each member of Congress has a moral obligation to support those who are willing to sacrifice everything to protect us.

We must BACK THE BLUE and end dangerous anti-police rhetoric. https://t.co/1jq9HwTgEn",False,1488628874036625410,3,6,6,0
RepJacobs,Rep. Chris Jacobs,1488604968508698626,1276232539510919168,en,1488604968508698626,2022-02-01T20:07:36.000Z,I was proud to join the Genesee Valley School Boards Association on Saturday in Perry to help recognize the outstanding work our local schools and educators are doing to prepare the next generation of WNY leaders. Keep up the great work! https://t.co/95mQOAr1pm,False,1488604968508698626,2,4,4,0
RepJacobs,Rep. Chris Jacobs,1488576862569873410,1276232539510919168,en,1488576862569873410,2022-02-01T18:15:55.000Z,"The 13th Amendment upheld our constitutional commitment to freedom for every American by outlawing slavery in the US.

Today in honor of that historic day when in 1865 when President Lincoln signed the resolution which became the 13th Amendment, we celebrate National Freedom Day. https://t.co/QN9m3wLus4",False,1488576862569873410,4,4,4,0
RepJacobs,Rep. Chris Jacobs,1487944437988835330,1276232539510919168,en,1487944437988835330,2022-01-31T00:22:53.000Z,"The NY-27 January 2022 Veteran of the Month is Gary Ball of Farmington.

Gary served in the @USNavy from ’74-’80 and served on the USS Bremerton, a Los Angeles class nuclear submarine. Thank you for your service, Gary!
 
Read more here: https://t.co/stCoyGMll2 https://t.co/pHspuKCQZs",False,1487944437988835330,2,4,4,0
RepJacobs,Rep. Chris Jacobs,1487905061497942017,1276232539510919168,en,1487905061497942017,2022-01-30T21:46:25.000Z,"This week, I toured @ArcofMonroe to learn more about the incredible work they are doing. It was especially impressive to see the career development happening at their world-class manufacturing facility! https://t.co/O1ln1vm8pi",False,1487905061497942017,2,3,3,0
RepJacobs,Rep. Chris Jacobs,1487526406816940042,1276232539510919168,en,1487526406816940042,2022-01-29T20:41:46.000Z,(4/4) Read my full statement here: https://t.co/oOMUErSME3,False,1487526396629069826,3,4,4,0
RepJacobs,Rep. Chris Jacobs,1487526404900196359,1276232539510919168,en,1487526404900196359,2022-01-29T20:41:46.000Z,(3/4) Additionally I joined my colleagues in sending a letter to DHS Secretary Mayorkas demanding additional information on this program. This is completely unacceptable. https://t.co/GQipikq3ot,False,1487526396629069826,4,1,1,0
RepJacobs,Rep. Chris Jacobs,1487526397958578181,1276232539510919168,en,1487526397958578181,2022-01-29T20:41:44.000Z,"(2/4) To combat this insanity, I was proud to join @RepMalliotakis is cosponsoring the Crime Doesn’t Fly Act to put an end to this policy that gives yet another benefit to those who are breaking the law by entering our country illegally.",False,1487526396629069826,1,3,3,0
RepJacobs,Rep. Chris Jacobs,1487526396629069826,1276232539510919168,en,1487526396629069826,2022-01-29T20:41:44.000Z,"Illegal immigrants should not be allowed to use an ARREST WARRANT as a way to board a plane, yet the TSA considers it an acceptable form of identification. (1/4)",False,1487526396629069826,6,6,6,0
RepJacobs,Rep. Chris Jacobs,1487182271220273154,1276232539510919168,en,1487182271220273154,2022-01-28T21:54:18.000Z,I joined my colleagues in sending a letter to Gov Hochul urging her to prioritize public safety and end the ‘bail reform’ that has routinely put criminals back on the streets in New York. It is time to back our police and implement smart policies that keep New Yorkers safe. https://t.co/ZIpC74pgxE,False,1487182271220273154,2,6,6,0
RepJacobs,Rep. Chris Jacobs,1487103546164228104,1276232539510919168,en,1487103546164228104,2022-01-28T16:41:29.000Z,"(2/2) In December, I joined @RepStefanik in sending a letter to the President warning him of this very problem. The President ignored our warning and implemented another damaging mandate that threatens our economic recovery. We must end mandates. https://t.co/XRmkb5UIq1",False,1487103540707401731,1,5,5,0
RepJacobs,Rep. Chris Jacobs,1487103540707401731,1276232539510919168,en,1487103540707401731,2022-01-28T16:41:27.000Z,"A great meeting yesterday with @edrath, @SteveHawley139, and local farmers to discuss the disruptive impact President Biden’s vaccine mandate at the northern border.

The mandate is burdening supply chains and threatens the economy of rural agricultural communities in WNY. (1/2) https://t.co/dzgjjcDYsM",False,1487103540707401731,3,5,5,0
RepJacobs,Rep. Chris Jacobs,1486830912855846919,1276232539510919168,en,1486830912855846919,2022-01-27T22:38:08.000Z,"This is completely unacceptable. 

The Biden administration continues to put the safety of every American at risk. 

This administration will do everything except enforce the rule of law and securing our southern border. 

https://t.co/D5J6UUS7VB",False,1486830912855846919,3,9,9,0
RepJacobs,Rep. Chris Jacobs,1486811208623738881,1276232539510919168,en,1486811208623738881,2022-01-27T21:19:50.000Z,"Today on #HolocaustRemembranceDay we remember the 6 million Jews who were murdered at the hands of the Nazis.

We must never forget this, continue to educate, and continue our fight to eradicate anti-Semitism from our world. https://t.co/AgFWhmDtG3",False,1486811208623738881,1,3,3,0
RepJacobs,Rep. Chris Jacobs,1486093956689584129,1276232539510919168,en,1486093956689584129,2022-01-25T21:49:44.000Z,"A NYS judge made clear last night that Governor Hochul’s mask mandate was unconstitutional. The freedom of New York students, residents, and workers must come first.

My statement: https://t.co/3P9OiqIdlb",False,1486093956689584129,1,16,16,1
RepJacobs,Rep. Chris Jacobs,1484263197708361732,1276232539510919168,en,1484263197708361732,2022-01-20T20:34:57.000Z,RT @nmpf: We thank @RepJacobs and @SecVilsack for their efforts to ensure Canada meets its dairy commitments under #USMCA. 🐄🇺🇸,False,1484263197708361732,3,0,0,0
RepJacobs,Rep. Chris Jacobs,1483142261047234565,1276232539510919168,en,1483142261047234565,2022-01-17T18:20:45.000Z,"Today we honor the incredible life and legacy of Martin Luther King Jr.

His work to end discrimination and promote equality for all Americans made our nation a more perfect union.

We must continue to live by his words and promote peace and freedom for every American. #MLKDay https://t.co/XcfgIV5rwv",False,1483142261047234565,2,28,28,2
RepJacobs,Rep. Chris Jacobs,1481768207560097797,1276232539510919168,en,1481768207560097797,2022-01-13T23:20:45.000Z,"Today’s ruling proves what I have said all along: this vaccine mandate was unconstitutional and the President vastly overstepped his authority in trying to enforce it.

My full statement: https://t.co/Jai1HeRsfa",False,1481768207560097797,2,13,13,1
RepJacobs,Rep. Chris Jacobs,1481697380445696008,1276232539510919168,en,1481697380445696008,2022-01-13T18:39:18.000Z,"Iran is a state sponsor of terror and a threat to global security.
 
The Biden admin must drop their fruitless negotiations to revive the Iran nuclear deal and instead enforce existing sanctions to the fullest extent possible. https://t.co/U2ch1Lz4HR",False,1481697380445696008,25,11,11,0
RepJacobs,Rep. Chris Jacobs,1481634842626383873,1276232539510919168,en,1481634842626383873,2022-01-13T14:30:48.000Z,"For months President Biden and his administration falsely claimed inflation was “transitory.” 

The fact is inflation continues to set records thanks to the Biden admin’s horrible policies and partisan spending, and Americans are feeling it everyday.
https://t.co/8Da57K2JfW",False,1481634842626383873,2,10,10,0
RepJacobs,Rep. Chris Jacobs,1481378552167677952,1276232539510919168,en,1481378552167677952,2022-01-12T21:32:24.000Z,"Yesterday, I sent a letter to IRS Commissioner Rettig urging the quick resolution to the backlog of amended 2020 tax returns.
 
With the 2021 tax season looming, this could become a major issue if not resolved soon. https://t.co/AEdh4QNitE https://t.co/MMzC0KZLoK",False,1481378552167677952,3,2,2,0
RepJacobs,Rep. Chris Jacobs,1481296557865590789,1276232539510919168,en,1481296557865590789,2022-01-12T16:06:35.000Z,"Reminder to local fire departments: the SAFER program for hiring and retention funding is open for applications until February 4th, 2022.
 
More info here: https://t.co/5nABzNOOaH",False,1481296557865590789,2,0,0,0
RepJacobs,Rep. Chris Jacobs,1481059290517491720,1276232539510919168,en,1481059290517491720,2022-01-12T00:23:46.000Z,(2/2) Parents have a right to be involved in the child’s classroom and they have a right to transparency. That is why I cosponsored the Parents Bill of Rights.,False,1481059289024323590,1,5,5,0
RepJacobs,Rep. Chris Jacobs,1481059289024323590,1276232539510919168,en,1481059289024323590,2022-01-12T00:23:45.000Z,"(1/2) This represents a complete betrayal of public trust. The Secretary must testify before Congress immediately and the admin must be held accountable for their war on parents. 
https://t.co/a6NxPKaOXM",False,1481059289024323590,2,7,7,0
RepJacobs,Rep. Chris Jacobs,1480587007562850307,1276232539510919168,en,1480587007562850307,2022-01-10T17:07:05.000Z,"Children need to be in the classroom. That's why I pushed the CDC to recommend test-to-stay options to keep them in school.

https://t.co/DonpmlXpGA https://t.co/MKDewLhRAy",False,1480587007562850307,2,6,6,0
RepJacobs,Rep. Chris Jacobs,1480340368533114881,1276232539510919168,en,1480340368533114881,2022-01-10T00:47:01.000Z,"LETS GO BUFFALO!

Congratulations to the AFC East Champions! #GoBills https://t.co/AKodvRVvCC",False,1480340368533114881,4,3,3,0
RepJacobs,Rep. Chris Jacobs,1480294312638361601,1276232539510919168,en,1480294312638361601,2022-01-09T21:44:01.000Z,"America’s law enforcement officers risk their lives everyday to keep our communities and our nation safe.

I am forever grateful for their service. Happy Law Enforcement Appreciation Day! 🇺🇸🇺🇸 https://t.co/kpZhydl52l",False,1480294312638361601,2,13,13,0
RepJacobs,Rep. Chris Jacobs,1478756920555184134,1276232539510919168,en,1478756920555184134,2022-01-05T15:54:58.000Z,"Since taking office I have worked to ensure Canada upheld the dairy provisions in the USMCA for American producers.
 
Yesterday, they were held accountable. This is a big win for WNY producers, I am proud to have fought for them.

https://t.co/zqMSF6sIME",False,1478756920555184134,4,22,22,0
RepJacobs,Rep. Chris Jacobs,1476318761070338053,1276232539510919168,en,1476318761070338053,2021-12-29T22:26:35.000Z,"The inflation crisis facing millions of Americans has caused price increases at the pump, at the grocery store, and to heat homes.

Read my latest op-ed on how the President’s reckless policies led us here, and what I’ve done to combat it.

My column here: https://t.co/jxEuPW9rsL",False,1476318761070338053,2,26,26,1
RepJacobs,Rep. Chris Jacobs,1475950697086599178,1276232539510919168,en,1475950697086599178,2021-12-28T22:04:02.000Z,"I am proud to announce my legislation, the Reservists Opportunity Act, has been signed into law.

This bill improves military readiness and retention by giving reservists and Guard members easier access to active duty opportunities. 

More: https://t.co/ZjeHMnReuj",False,1475950697086599178,3,5,5,0
RepJacobs,Rep. Chris Jacobs,1474846624723746823,1276232539510919168,en,1474846624723746823,2021-12-25T20:56:51.000Z,"From my family to yours, Merry Christmas! 🎄

I hope you have a joyous day filled with friends and family. https://t.co/eK9DkKwBdh",False,1474846624723746823,2,4,4,0
RepJacobs,Rep. Chris Jacobs,1474130540710223880,1276232539510919168,en,1474130540710223880,2021-12-23T21:31:23.000Z,"Last week, I joined @RepStefanik in sending a letter to President Biden raising concerns with his vaccine mandate for essential travelers coming over the northern border.
 
Supply chains are already strained – this mandate could amplify those problems.
 
Read more: https://t.co/tMMIFjCLaA",False,1474130540710223880,4,34,34,1
RepJacobs,Rep. Chris Jacobs,1473842774998933505,1276232539510919168,en,1473842774998933505,2021-12-23T02:27:54.000Z,"This week, I joined my colleagues in sending a letter asking for full funding for the Great Lakes Restoration Initiative.
 
This funding is used to protect our lakes, bolster economic activity, and ensure our lakes will be healthy for future generations. https://t.co/btnHCMjO3D",False,1473842774998933505,2,8,8,0
RepJacobs,Rep. Chris Jacobs,1473785024617099268,1276232539510919168,en,1473785024617099268,2021-12-22T22:38:26.000Z,"Proud to join my colleagues yesterday in sending a letter to the Commerce Secretary regarding her decision to raise tariffs on Canadian lumber products. This action could have serious negative impacts on the U.S. homebuilding market. 
 
Read more here: https://t.co/gQZQNSL6Jl",False,1473785024617099268,2,5,5,0
RepJacobs,Rep. Chris Jacobs,1472693961441619972,1276232539510919168,en,1472693961441619972,2021-12-19T22:22:56.000Z,"I'm proud to join @RepJeffDuncan to cosponsor the Protecting Our Democracy by Preventing Foreign Citizens from Voting Act.

This upholds election integrity by ensuring only American citizens are allowed to vote in American elections. https://t.co/L5IkldhLDR",False,1472693961441619972,8,11,11,1
RepJacobs,Rep. Chris Jacobs,1472335059155828744,1276232539510919168,en,1472335059155828744,2021-12-18T22:36:47.000Z,"I’m excited to announce $9,949,000 in USDA funding has been awarded to three #NY27 localities to upgrade and expand drinking water infrastructure and wastewater treatment capabilities.
 
Read more here: https://t.co/V2wnBTt4Ht",False,1472335059155828744,2,14,14,5
RepJacobs,Rep. Chris Jacobs,1471967863074349056,1276232539510919168,en,1471967863074349056,2021-12-17T22:17:41.000Z,"(2/2) You can read the letter we led to the CDC in November here:
https://t.co/rIQo8QYEXm",False,1471967861522448385,1,1,1,0
RepJacobs,Rep. Chris Jacobs,1471967861522448385,1276232539510919168,en,1471967861522448385,2021-12-17T22:17:40.000Z,"Last month I led a letter with @virginiafoxx calling on the CDC to embrace test-to-stay guidance so children can remain in the classroom.
 
Today’s news reflects our calls and allows for students to avoid the negative consequences of virtual learning (1/2) https://t.co/eLExm8seT6",False,1471967861522448385,4,1,1,0
RepJacobs,Rep. Chris Jacobs,1471863907660746763,1276232539510919168,en,1471863907660746763,2021-12-17T15:24:36.000Z,"“The hottest inflation in nearly four decades will cost millions of Americans an additional $3,500""
 
What’s the President’s solution to this inflation crisis? Forcing more reckless spending on the American people.
https://t.co/UXE38PqlK8",False,1471863907660746763,2,15,15,0
RepJacobs,Rep. Chris Jacobs,1471568693645742085,1276232539510919168,en,1471568693645742085,2021-12-16T19:51:31.000Z,"This legislation is a critical step in holding the Biden admin accountable for the crisis they have caused at our southern border. Americans deserve to know the extent of the crisis, and the extent to which it has been ignored by the President. (3/3)",False,1471568690864873474,1,0,0,0
RepJacobs,Rep. Chris Jacobs,1471568692332875788,1276232539510919168,en,1471568692332875788,2021-12-16T19:51:31.000Z,"Specifically, the report will cover vetting procedures, number of illegal immigrants processed and removed, the monitoring of illegal immigrants who are apprehended and released into the country, and states where DHS has resettled illegal immigrants since 1/20/21. (2/3)",False,1471568690864873474,1,1,1,0
RepJacobs,Rep. Chris Jacobs,1471568690864873474,1276232539510919168,en,1471568690864873474,2021-12-16T19:51:30.000Z,"Proud to cosponsor the Upholding the Law at our Border Act. This bill requires the Inspector General and DHS to investigate the apprehension, vetting, and processing of illegal immigrants at our southern border, and deliver a report to Congress. (1/3)",False,1471568690864873474,3,11,11,0
RepJacobs,Rep. Chris Jacobs,1471496645531475971,1276232539510919168,en,1471496645531475971,2021-12-16T15:05:14.000Z,I cosponsored the Strategic Production Response Act to protect our strategic petroleum reserve from being used by the President for non-emergency reasons to bail out his failed energy policy. The bill also lowers gas prices for American families by unleashing domestic production.,False,1471496645531475971,11,9,9,1
RepJacobs,Rep. Chris Jacobs,1471172690245529603,1276232539510919168,en,1471172690245529603,2021-12-15T17:37:57.000Z,"(2/2) President Biden's border crisis has created numerous criminal problems that threaten our nation's security.

His continued avoidance of this crisis is unacceptable. We are a nation of laws – they must be followed and we must stand with those who keep our communities safe.",False,1471172688894955525,2,6,6,0
RepJacobs,Rep. Chris Jacobs,1471172688894955525,1276232539510919168,en,1471172688894955525,2021-12-15T17:37:56.000Z,"Proud to join @RepGarbarino in cosponsoring the POLICE Act.
 
This legislation protects our brave law enforcement officers and improves our border security by increasing penalties for illegal immigrants who assault officers. (1/2)",False,1471172688894955525,3,9,9,2
RepJacobs,Rep. Chris Jacobs,1470790087659171848,1276232539510919168,en,1470790087659171848,2021-12-14T16:17:37.000Z,"""A [DoL] report last week revealed that the price of consumer goods rose by 6.8% in November from last year, the fastest pace since June 1982""

Biden’s economy: massive reckless spending and soaring prices for hardworking American families.
https://t.co/YCooV7NFx5",False,1470790087659171848,2,19,19,0
RepJacobs,Rep. Chris Jacobs,1470540545235865600,1276232539510919168,en,1470540545235865600,2021-12-13T23:46:01.000Z,"Today, we celebrate the 385th birthday of the National Guard. Since its inception, the members of our Guard have stood ready to protect and defend our nation from all threats. I am forever grateful for their service. https://t.co/Acn9WqUBrw",False,1470540545235865600,2,6,6,0
RepJacobs,Rep. Chris Jacobs,1470107383074631690,1276232539510919168,en,1470107383074631690,2021-12-12T19:04:48.000Z,"I was proud to lead a bipartisan letter to House and Senate Appropriators in support of full funding for Save our Seas 2.0, a law that benefits the Great Lakes.

I will continue my work to improve the health of our lakes for our generation and future ones.
https://t.co/9QVVfrPlIl",False,1470107383074631690,4,9,9,0
RepJacobs,Rep. Chris Jacobs,1469765735094403075,1276232539510919168,en,1469765735094403075,2021-12-11T20:27:12.000Z,"(3/3) I believe the vaccines are safe and effective, but I strongly oppose mandates and lockdowns.
 
These mandates are government overreach, and they must be stopped.
 
I am proud to stand for Americans' freedom in Congress.
 
Read more here:
 https://t.co/5RLCx3aBW3",False,1469765730824597515,1,14,14,1
