handle,name,tweet_id,author_id,lang,replied_to,created_at,tweet_text,possibly_sensitive,conversation_id,retweet_count,reply_count,like_count,quote_count
RepKManning,Congresswoman Kathy Manning,1542221368174841856,1337115670161608712,en,1542221368174841856,2022-06-29T19:00:01.000Z,"I’m working hard to ensure that every North Carolinian knows how they can access the reproductive care they need. 

This week, I spoke with members of the Greensboro Jewish Federation to discuss abortion access and share my work in Congress to fight for reproductive health care.",False,1542221368174841856,3,0,0,0
RepKManning,Congresswoman Kathy Manning,1542205325075513350,1337115670161608712,en,1542205325075513350,2022-06-29T17:56:16.000Z,"RT @RepTedDeutch: Only by working together can we ensure the American Jewish community's safety &amp; security.

That's why @RepBrianFitz, @Rep…",False,1542205325075513350,13,0,0,0
RepKManning,Congresswoman Kathy Manning,1542182930864381958,1337115670161608712,en,1542182930864381958,2022-06-29T16:27:17.000Z,"Telehealth for mental health is safe &amp; removes barriers to care. Yet, many face insurance coverage constraints for telehealth services for mental health, especially when compared to physical health. I introduced a bill to help patients afford the telemental health care they need. https://t.co/0Nt57uBfZ1",False,1542182930864381958,3,1,1,0
RepKManning,Congresswoman Kathy Manning,1541896721965363200,1337115670161608712,en,1541896721965363200,2022-06-28T21:30:00.000Z,"I’m firmly committed to lowering prices and curbing inflation. 

This month, I voted to pass the Lower Food and Fuel Costs Act - a bill to strengthen our supply chains and lower costs at the pump and in the grocery aisle. https://t.co/BKVNYwvF8v",False,1541896721965363200,2,0,0,0
RepKManning,Congresswoman Kathy Manning,1541842543062777863,1337115670161608712,en,1541842543062777863,2022-06-28T17:54:42.000Z,I introduced a resolution reaffirming Americans’ right to access contraception - the House must take this up immediately and demonstrate our commitment to protecting reproductive rights. (2/2),False,1541842541187895297,2,1,1,0
RepKManning,Congresswoman Kathy Manning,1541842541187895297,1337115670161608712,en,1541842541187895297,2022-06-28T17:54:42.000Z,"SCOTUS' opinion in Dobbs, Justice Thomas’ concurring opinion, and Republican attempts to restrict birth control in state legislatures across the country make it clear that far-right extremists won’t stop here. We must protect access to contraception for all Americans. (1/2) https://t.co/ThflwHHfPq",False,1541842541187895297,2,1,1,1
RepKManning,Congresswoman Kathy Manning,1541808093767634944,1337115670161608712,en,1541808093767634944,2022-06-28T15:37:49.000Z,I joined The Wake Forest Institute of Regenerative Medicine to celebrate a $36 million grant from the @DeptofDefense to establish a research and development program to provide early warning data related to deadly viral threats. https://t.co/atZE5KmKAS,False,1541808093767634944,2,0,0,0
RepKManning,Congresswoman Kathy Manning,1541524976427323396,1337115670161608712,en,1541524976427323396,2022-06-27T20:52:49.000Z,"Earlier this month, I introduced a resolution reaffirming Americans’ right to access contraception. 
Should the House vote to protect access to contraception ASAP? Vote⬇
https://t.co/MNCJra076E",False,1541524974103662597,1,1,1,0
RepKManning,Congresswoman Kathy Manning,1541524974103662597,1337115670161608712,en,1541524974103662597,2022-06-27T20:52:48.000Z,"The SCOTUS opinion overturning Roe, &amp; the concurrence written by Justice Thomas, make it clear that we must move NOW to safeguard constitutional protections that are at risk, including the right to access contraception.  (1/2)",False,1541524974103662597,2,2,2,0
RepKManning,Congresswoman Kathy Manning,1540410748308000771,1337115670161608712,en,1540410748308000771,2022-06-24T19:05:16.000Z,"I proudly voted to pass the Bipartisan Safer Communities Act, legislation that will help states effectively implement red flag laws, close the boyfriend loophole, enhance background checks for people under twenty-one, and increase access to mental health services. https://t.co/6Xog8YNQkC",False,1540410748308000771,5,3,3,0
RepKManning,Congresswoman Kathy Manning,1540374972471955464,1337115670161608712,en,1540374972471955464,2022-06-24T16:43:06.000Z,But it is clear that Americans cannot wait - the Senate must act immediately to enshrine abortion rights into law to prevent irrevocable harm to millions of Americans. (7/7),False,1540374964586827777,1,2,2,0
RepKManning,Congresswoman Kathy Manning,1540374971159134208,1337115670161608712,en,1540374971159134208,2022-06-24T16:43:06.000Z,"Last year, the House passed the Women’s Health Protection Act, which codifies abortion access into law. The Senate has refused to vote on the legislation. (6/7)",False,1540374964586827777,1,1,1,0
RepKManning,Congresswoman Kathy Manning,1540374969951129600,1337115670161608712,en,1540374969951129600,2022-06-24T16:43:06.000Z,The House must take up this legislation immediately to safeguard civil rights that Americans and their families rely on. (5/7),False,1540374964586827777,0,1,1,0
RepKManning,Congresswoman Kathy Manning,1540374968629972992,1337115670161608712,en,1540374968629972992,2022-06-24T16:43:05.000Z,"This opinion also calls into question what other constitutional protections could soon be upended. Earlier this month, I introduced a resolution reaffirming Americans’ right to access contraception. (4/7)",False,1540374964586827777,0,1,1,0
RepKManning,Congresswoman Kathy Manning,1540374967317106689,1337115670161608712,en,1540374967317106689,2022-06-24T16:43:05.000Z,"Abortion is still legal in North Carolina. But with this decision, Republican controlled states across the country will immediately move to restrict or ban abortions, barring millions of Americans from access to health care. (3/7)",False,1540374964586827777,0,1,1,0
RepKManning,Congresswoman Kathy Manning,1540374965991706624,1337115670161608712,en,1540374965991706624,2022-06-24T16:43:05.000Z,"Today, those rights are being stripped away from millions of Americans who are now at the mercy of extreme state legislatures. (2/7)",False,1540374964586827777,0,1,1,0
RepKManning,Congresswoman Kathy Manning,1540374964586827777,1337115670161608712,en,1540374964586827777,2022-06-24T16:43:04.000Z,"Today’s devastating Supreme Court opinion will set our society back generations. For nearly fifty years, Americans have had the constitutionally protected right to control their own bodies, free from political interference. (1/7)",False,1540374964586827777,5,4,4,2
RepKManning,Congresswoman Kathy Manning,1540307286744260609,1337115670161608712,en,1540307286744260609,2022-06-24T12:14:09.000Z,"RT @RepHorsford: My father was killed by senseless gun violence 30 years ago today.

I felt numb. He was 38.

I threw myself into helping m…",False,1540307286744260609,144,0,0,0
RepKManning,Congresswoman Kathy Manning,1540107434731212801,1337115670161608712,en,1540107434731212801,2022-06-23T23:00:00.000Z,"As a member of the @EdLaborCmte, I’m proud to share my support for Pell Grants and to have supported a $400 increase to the maximum annual award. 

Watch my remarks commemorating the 50th anniversary of the Pell Grant below. https://t.co/4BZ1CKDJGF",False,1540107434731212801,4,0,0,0
RepKManning,Congresswoman Kathy Manning,1540043605620006917,1337115670161608712,en,1540043605620006917,2022-06-23T18:46:22.000Z,"Randall and I are keeping David and the Price family in our thoughts. 

May Lisa's memory forever be a blessing to all who knew her. https://t.co/qF4D9qfYGD",False,1540043605620006917,1,0,0,0
RepKManning,Congresswoman Kathy Manning,1540031937468702720,1337115670161608712,en,1540031937468702720,2022-06-23T18:00:00.000Z,"I’m a cosponsor of the Gas Prices Relief Act, a bill to enact a temporary gas tax holiday. 

I’m glad to see President Biden pushing for this proposal to ease the pain at the pump and protect hard-working Americans' paychecks. https://t.co/TlUWlIQ1Dk",False,1540031937468702720,0,1,1,0
RepKManning,Congresswoman Kathy Manning,1539989650458173440,1337115670161608712,en,1539989650458173440,2022-06-23T15:11:58.000Z,"On the 50th anniversary of the Pell Grant, I’m highlighting a Pell Grant recipient from #NC06.

Kayla, a pre-nursing student at @ncatsuaggies, credits the Pell Grant &amp; her work-study job for being able to afford college and pursue a career in health care. https://t.co/J7YyMcSPNp",False,1539989650458173440,2,1,1,2
RepKManning,Congresswoman Kathy Manning,1539965530471141377,1337115670161608712,en,1539965530471141377,2022-06-23T13:36:08.000Z,RT @NCyouthtour: Special thanks to our North Carolina congressional delegates and their staff for meeting with our Youth Tourists! @RepKMan…,False,1539965530471141377,4,0,0,0
RepKManning,Congresswoman Kathy Manning,1539694812907044864,1337115670161608712,en,1539694812907044864,2022-06-22T19:40:24.000Z,"The #RestoringHope for Mental Health and Well-Being Act strengthens more than 30 programs that support mental health care and substance use disorder prevention, care, treatment, and recovery support services. 

I'm proud to vote YES on this legislation today.",False,1539694812907044864,2,0,0,1
RepKManning,Congresswoman Kathy Manning,1539663356394872832,1337115670161608712,en,1539663356394872832,2022-06-22T17:35:24.000Z,Happy to meet Major Richard Sudds and local JROTC students at the Capitol today. Sending best wishes to West Forsyth High School students as they compete in the national finals of the JROTC Leadership and Academic Championship! https://t.co/Z6znph4hnz,False,1539663356394872832,4,0,0,0
RepKManning,Congresswoman Kathy Manning,1539367559480352768,1337115670161608712,en,1539367559480352768,2022-06-21T22:00:00.000Z,It was my pleasure to attend the Arts Legacy Awards to celebrate Juneteenth and recognize Black artistry in Greensboro. https://t.co/Lg75UEHezG,False,1539367559480352768,2,0,0,0
RepKManning,Congresswoman Kathy Manning,1539307163918561280,1337115670161608712,en,1539307163918561280,2022-06-21T18:00:01.000Z,"I’m incredibly proud to announce fifteen students from #NC06 have received appointments to the U.S. Military Service Academies. 

Congratulations to these exceptional students! https://t.co/AcVs1T56h7",False,1539307163918561280,2,0,0,0
RepKManning,Congresswoman Kathy Manning,1539261344280727553,1337115670161608712,en,1539261344280727553,2022-06-21T14:57:57.000Z,"I voted for the Lower Food and Fuel Costs Act &amp; the Gas Price Gouging Prevention Act, two bills to help lower costs at the pump.

I’m glad to see some local gas prices dropping; I’ll continue working to ease gas prices. https://t.co/KKboRHFm5y",False,1539261344280727553,1,0,0,0
RepKManning,Congresswoman Kathy Manning,1538616858198298624,1337115670161608712,en,1538616858198298624,2022-06-19T20:16:59.000Z,It was fantastic to join the High Point community at the @hpymca to celebrate Juneteenth! https://t.co/EsaFSEaqnn,False,1538616858198298624,1,1,1,0
RepKManning,Congresswoman Kathy Manning,1538539589287170049,1337115670161608712,en,1538539589287170049,2022-06-19T15:09:57.000Z,"Happy Juneteenth to #NC06! Today, I’m celebrating African American heritage, freedom, and culture, reflecting on the racial injustices that persist in our country, and recommitting to addressing those injustices to build a brighter, more equitable future for all. https://t.co/RrN7KV19kQ",False,1538539589287170049,3,2,2,0
RepKManning,Congresswoman Kathy Manning,1538539448039837697,1337115670161608712,en,1538539448039837697,2022-06-19T15:09:23.000Z,"Happy Father’s Day to all in #NC06! And wishing a happy Father’s Day to my dad and my husband, an incredible father to our three children. https://t.co/NaJOrFIOJY",False,1538539448039837697,3,0,0,1
RepKManning,Congresswoman Kathy Manning,1537857609444646912,1337115670161608712,en,1537857609444646912,2022-06-17T18:00:00.000Z,"This Sunday is Juneteenth. 

Here are some ways to celebrate and honor African American history, culture, and contributions in the Triad. 
https://t.co/Y7JjSsCaJn",False,1537857609444646912,1,0,0,0
RepKManning,Congresswoman Kathy Manning,1537806173809913858,1337115670161608712,en,1537806173809913858,2022-06-17T14:35:37.000Z,"This week, I voted for the Lower Food and Fuel Costs Act, legislation that takes meaningful actions to lower prices at the pump and in the grocery aisle. https://t.co/CEtMVAk9HH",False,1537806173809913858,3,1,1,0
RepKManning,Congresswoman Kathy Manning,1537540526135660544,1337115670161608712,en,1537540526135660544,2022-06-16T21:00:02.000Z,It was my pleasure to meet with the @ncnonprofits and discuss the state of the charitable nonprofit sector in North Carolina and federal policy solutions that bolster their efforts. https://t.co/ol0lqEhYcs,False,1537540526135660544,1,1,1,0
RepKManning,Congresswoman Kathy Manning,1537467112205205504,1337115670161608712,en,1537467112205205504,2022-06-16T16:08:18.000Z,"Rising prices are placing a burden on American families. I’m committed to taking action to bring down costs and protect hard-working Americans’ paychecks. 

Today, I voted to pass the #LowerFoodAndFuelCosts Act to lower costs in the grocery store and at the pump. https://t.co/ewg7nEBB6A",False,1537467112205205504,1,3,3,0
RepKManning,Congresswoman Kathy Manning,1537442910370553857,1337115670161608712,en,1537442910370553857,2022-06-16T14:32:08.000Z,"It was great to meet with @CWAUnion members from North Carolina here in Washington, D.C. I’m proud to stand with them to support working families and American workers. https://t.co/yre2sWlZSd",False,1537442910370553857,3,0,0,0
RepKManning,Congresswoman Kathy Manning,1537425954003353601,1337115670161608712,en,1537425954003353601,2022-06-16T13:24:46.000Z,RT @RepStephMurphy: President Trump’s efforts to pressure VP Pence into overturning a free and fair election threatened our democracy &amp; dir…,False,1537425954003353601,469,0,0,0
RepKManning,Congresswoman Kathy Manning,1537193235512037376,1337115670161608712,en,1537193235512037376,2022-06-15T22:00:01.000Z,"I’m grateful to servicemembers &amp; veterans, whose sacrifices protect our freedoms. Following Memorial Day, I'm reflecting on the promises our nation has made to servicemembers &amp; their families, &amp; how we can unite to care for those who protect us. 

Read ⬇
https://t.co/dUr2P8A26K",False,1537193235512037376,2,2,2,0
RepKManning,Congresswoman Kathy Manning,1537140382886023168,1337115670161608712,en,1537140382886023168,2022-06-15T18:30:00.000Z,"This week, I’ll be voting to lower costs for Americans.

The Lower Food &amp; Fuel Act will: 
✅Lower the cost of groceries by lowering costs for farmers 
✅Strengthen our food supply chain 
✅ Lower prices at the pump by making cheaper, cleaner Unleaded 88 gasoline more available",False,1537140382886023168,4,2,2,0
RepKManning,Congresswoman Kathy Manning,1537106916517761024,1337115670161608712,en,1537106916517761024,2022-06-15T16:17:01.000Z,Happy to meet with @RESULTS_Tweets to share the work I’m doing in Congress to advance economic security for hard working Americans. https://t.co/yL3sse7c4q,False,1537106916517761024,2,0,0,0
RepKManning,Congresswoman Kathy Manning,1536762857261613061,1337115670161608712,en,1536762857261613061,2022-06-14T17:29:51.000Z,"Happy 247th birthday, @USArmy! Today and every day, I’m grateful for our brave service members, veterans, and military families and appreciate their commitment to protecting our country and our hard-earned freedoms. https://t.co/dXu5sdxv8m",False,1536762857261613061,2,3,3,0
RepKManning,Congresswoman Kathy Manning,1536747605874597891,1337115670161608712,en,1536747605874597891,2022-06-14T16:29:15.000Z,"Wonderful to meet with @AIPAC National Council members from North Carolina to discuss vital security assistance to Israel, preventing a nuclear-armed Iran, and opposing the one-sided UN COI targeting Israel.

I am proud to support the U.S.-Israel relationship in Congress. https://t.co/5bZpRPn17C",False,1536747605874597891,3,63,63,3
RepKManning,Congresswoman Kathy Manning,1536468461194551303,1337115670161608712,en,1536468461194551303,2022-06-13T22:00:02.000Z,"This weekend, I had the honor of speaking at the @GuilfordGreen Gala. 

@GuilfordGreen is an essential resource for greater Greensboro, and I share their commitment to celebrate, support, and protect members of the LGBTQ community. #PrideMonth https://t.co/cXfBo0j67k",False,1536468461194551303,3,0,0,0
RepKManning,Congresswoman Kathy Manning,1536408057583763456,1337115670161608712,en,1536408057583763456,2022-06-13T18:00:00.000Z,"Toxic exposure is a cost of war - it’s time we treat it as such. 

I cosponsored and voted to pass the Honoring Our Pact ACT to provide healthcare to over 3.5 million veterans exposed to toxic substances during their military service. https://t.co/NW9QGrgmki",False,1536408057583763456,4,0,0,0
RepKManning,Congresswoman Kathy Manning,1536362998708813824,1337115670161608712,en,1536362998708813824,2022-06-13T15:00:57.000Z,"Right now, I'm at the Select Committee to Investigate January 6th hearing to make sure those responsible for the assault on our democracy are held accountable. 

The American people deserve to know the truth about what led to that terrible day. https://t.co/5miZsr5UTs",False,1536362998708813824,6,2,2,0
RepKManning,Congresswoman Kathy Manning,1536356059425693696,1337115670161608712,en,1536356059425693696,2022-06-13T14:33:23.000Z,"RT @ReubenJones1: Rep. Kathy Manning and @GKButterfield are in the hearing room today. 

@RepKManning was in the House Gallery on January 6…",False,1536356059425693696,4,0,0,0
RepKManning,Congresswoman Kathy Manning,1536350976776478721,1337115670161608712,en,1536350976776478721,2022-06-13T14:13:11.000Z,"The House Select Committee to Investigate January 6th will host their second public hearing today. 

Here’s how to watch: 
https://t.co/IZmZl3opbg",False,1536350976776478721,2,1,1,0
RepKManning,Congresswoman Kathy Manning,1535366194416570368,1337115670161608712,en,1535366194416570368,2022-06-10T21:00:01.000Z,"Reproductive rights are under attack by SCOTUS &amp; in states across the country; we must remain vigilant in protecting the American people’s right to make decisions regarding their own bodies. 

That’s why I introduced a resolution reaffirming the right to access birth control. https://t.co/kNyvemrbII",False,1535366194416570368,4,1,1,0
RepKManning,Congresswoman Kathy Manning,1535351092430655489,1337115670161608712,en,1535351092430655489,2022-06-10T20:00:00.000Z,"My heart breaks for Triad families who are struggling to find baby formula due to the shutdown of a major formula production plant and supply chain disruptions. 

I voted to pass two bills to get formula back on the shelves and America’s babies fed. https://t.co/HhPOaleTVX",False,1535351092430655489,3,3,3,0
RepKManning,Congresswoman Kathy Manning,1535347077928165377,1337115670161608712,en,1535347077928165377,2022-06-10T19:44:03.000Z,"@POTUS announced that, beginning Sunday at midnight, it is no longer mandatory for travelers to test negative to COVID-19 before entering the U.S. 
Read more below. https://t.co/xXa1dn4w5X",False,1535347077928165377,0,1,1,0
RepKManning,Congresswoman Kathy Manning,1535318580828463104,1337115670161608712,en,1535318580828463104,2022-06-10T17:50:49.000Z,"As a member of the @NewDemCoalition Inflation Working Group, I’m proud to share our plan for fighting inflation, cutting costs, and bringing relief to families, workers, and businesses. 

Check out the plan below ⬇
https://t.co/ViWGBMNfEj",False,1535318580828463104,4,0,0,1
RepKManning,Congresswoman Kathy Manning,1534958508445093888,1337115670161608712,en,1534958508445093888,2022-06-09T18:00:01.000Z,"Tonight the @January6thcmte will hold its first public hearing. The Committee will present evidence they gathered throughout their investigation, and witnesses will testify regarding their experiences before and during the insurrection. Here's how to watch:https://t.co/WQ3M9zSeq5",False,1534958508445093888,1,1,1,0
RepKManning,Congresswoman Kathy Manning,1534921302888353793,1337115670161608712,en,1534921302888353793,2022-06-09T15:32:10.000Z,"Today, I voted for the Federal Extreme Risk Protection Order Act, which would temporarily remove access to firearms for those deemed a danger to themselves or others by a federal court. 

This legislation, commonly known as ‘red flag laws’, will save lives.",False,1534921302888353793,1,1,1,0
RepKManning,Congresswoman Kathy Manning,1534901337141522433,1337115670161608712,en,1534901337141522433,2022-06-09T14:12:50.000Z,"RT @RepLucyMcBath: Today, we vote with the majority of the American people behind us.

We vote to empower loved ones &amp; law enforcement to h…",False,1534901337141522433,203,0,0,0
RepKManning,Congresswoman Kathy Manning,1534671623684513792,1337115670161608712,en,1534671623684513792,2022-06-08T23:00:02.000Z,"Common sense gun safety legislation saves lives. I urged my colleagues to vote yes on the Protecting Our Kids Act to help ensure our schools, houses of worship, grocery stores, entertainment venues, and streets are free from deadly gun violence.
https://t.co/pkW9kYqyI8",False,1534671623684513792,4,1,1,0
RepKManning,Congresswoman Kathy Manning,1534647507782885377,1337115670161608712,en,1534647507782885377,2022-06-08T21:24:12.000Z,I met with the Equality &amp; Fairness Coalition to discuss my work in Congress to protect LGBTQ rights. #PrideMonth https://t.co/4kFwqPmLJY,False,1534647507782885377,1,1,1,0
RepKManning,Congresswoman Kathy Manning,1534551211382390785,1337115670161608712,en,1534551211382390785,2022-06-08T15:01:34.000Z,"RT @RepJerryNadler: Fact: guns are now the number one killer of children in America. 
 
This is unacceptable, and our children deserve bett…",False,1534551211382390785,446,0,0,0
RepKManning,Congresswoman Kathy Manning,1534249620104261634,1337115670161608712,en,1534249620104261634,2022-06-07T19:03:09.000Z,"RT @RepAdamSmith: I'm proud to be an original cosponsor of @RepKManning's resolution introduced today, expressing support for contraceptive…",False,1534249620104261634,2,0,0,0
RepKManning,Congresswoman Kathy Manning,1534245022962487296,1337115670161608712,en,1534245022962487296,2022-06-07T18:44:53.000Z,Access to contraception has helped women achieve economic and personal progress. We must continue to protect this vital resource so that women can continue to succeed on their own terms.,False,1534245018499788801,2,1,1,0
RepKManning,Congresswoman Kathy Manning,1534245021834166274,1337115670161608712,en,1534245021834166274,2022-06-07T18:44:52.000Z,"Studies show that access to birth control opened professional and educational doors for women.
51% of women report that birth control helped them complete their education and 50% report that it helped them keep or get a job.",False,1534245018499788801,1,1,1,1
RepKManning,Congresswoman Kathy Manning,1534245020814934016,1337115670161608712,en,1534245020814934016,2022-06-07T18:44:52.000Z,Access to birth control is preventive health care—access to contraception improves the health of women and their families and is linked to declines in maternal and infant mortality.,False,1534245018499788801,5,1,1,0
RepKManning,Congresswoman Kathy Manning,1534245019820998661,1337115670161608712,en,1534245019820998661,2022-06-07T18:44:52.000Z,Birth control is nearly universal - 87% of women report using contraception at some point in their life.,False,1534245018499788801,2,1,1,0
RepKManning,Congresswoman Kathy Manning,1534245018499788801,1337115670161608712,en,1534245018499788801,2022-06-07T18:44:51.000Z,"Today is the 57th anniversary of the Griswold decision in which SCOTUS first held that the Constitution protects the right to use contraception. 

I introduced a resolution reaffirming the right to access birth control &amp; pushing back on recent attacks on reproductive freedom.",False,1534245018499788801,66,4,4,6
RepKManning,Congresswoman Kathy Manning,1534230832730329088,1337115670161608712,en,1534230832730329088,2022-06-07T17:48:29.000Z,The UN Commission of Inquiry issued the first report in its open-ended probe targeting and aimed at discrediting Israel. I remain committed to pushing back against this biased investigation and UNHRC’s clear pattern of singling out and undermining Israel. https://t.co/TJAZmjJYy4,False,1534230832730329088,13,171,171,6
RepKManning,Congresswoman Kathy Manning,1533946847110131712,1337115670161608712,en,1533946847110131712,2022-06-06T23:00:02.000Z,"In 2022, there have been over 240 mass shootings in the US. We can’t allow this senseless gun violence to continue. 

In Congress, I’ve supported common sense gun safety legislation. I’m calling on the Senate to do the same.

https://t.co/odbNEwngLT",False,1533946847110131712,3,1,1,0
RepKManning,Congresswoman Kathy Manning,1533886440295354376,1337115670161608712,en,1533886440295354376,2022-06-06T19:00:00.000Z,"ATTN: Forsyth County’s Covid-19 level has been upgraded to high. For high Covid-19 levels, the CDC recommends that everyone wear fitted masks indoors and stay up-to-date on Covid-19 vaccines and boosters. Read more below ⬇
https://t.co/4fUA5vKhkc",False,1533886440295354376,3,5,5,0
RepKManning,Congresswoman Kathy Manning,1533855133200797696,1337115670161608712,en,1533855133200797696,2022-06-06T16:55:36.000Z,"78 years ago, the Allied forces stormed the beaches of Normandy, signaling the beginning of the end of World War II. Today and every day, we honor their bravery, heroism, and sacrifice. https://t.co/XfBNdHPLNS",False,1533855133200797696,4,2,2,1
