handle,name,tweet_id,author_id,lang,replied_to,created_at,tweet_text,possibly_sensitive,conversation_id,retweet_count,reply_count,like_count,quote_count
RepKManning,Congresswoman Kathy Manning,1481275953066266626,1337115670161608712,en,1481275953066266626,2022-01-12T14:44:42.000Z,"RT @RepAdams: Yesterday, I joined @RepDavidEPrice, @GKButterfield, @RepDeborahRoss, and @RepKManning, the Democratic members of NC’s congre…",False,1481275953066266626,27,0,0,0
RepKManning,Congresswoman Kathy Manning,1481010061656928256,1337115670161608712,en,1481010061656928256,2022-01-11T21:08:09.000Z,The Senate must pass the #JohnLewisVotingRightsAct and the #FreedomToVoteAct to secure the promise of democracy for all Americans.,False,1481010032821026820,3,1,1,0
RepKManning,Congresswoman Kathy Manning,1481010032821026820,1337115670161608712,en,1481010032821026820,2022-01-11T21:08:02.000Z,Senate Republicans continue to block voting rights legislation while states pass laws restricting access to the ballot box.,False,1481010032821026820,4,6,6,2
RepKManning,Congresswoman Kathy Manning,1480942470519300097,1337115670161608712,en,1480942470519300097,2022-01-11T16:39:34.000Z,Learn more about this assistance and how you can apply for it by visiting https://t.co/y5sBjjwuU7.,False,1480942399685804032,0,0,0,0
RepKManning,Congresswoman Kathy Manning,1480942399685804032,1337115670161608712,en,1480942399685804032,2022-01-11T16:39:17.000Z,"No North Carolinian should have to worry about staying warm this winter. 

I’m proud to announce that with my support, Congressional Democrats have nearly doubled the funding that NC families and seniors can pay for their heating bills through the American Rescue Plan. https://t.co/yaB1FVOlEi",False,1480942399685804032,1,1,1,1
RepKManning,Congresswoman Kathy Manning,1480645631240667138,1337115670161608712,en,1480645631240667138,2022-01-10T21:00:02.000Z,"The recently enacted bipartisan infrastructure law is creating good-paying jobs &amp; ensuring America can compete in the 21st century by: 
 ✔ Investing in public transit, 
✔ Expanding broadband, 
✔ Securing clean water,
✔ And investing in airports, including @flyfrompti .",False,1480645631240667138,6,2,2,0
RepKManning,Congresswoman Kathy Manning,1480608920137879554,1337115670161608712,en,1480608920137879554,2022-01-10T18:34:09.000Z,"Today, @usmint releases the Maya Angelou quarter.

Maya Angelou was a powerful civil rights leader, poet laureate, professor, and long-time resident of Winston-Salem.

I’m proud to have supported the @RepBarbaraLee bill to enshrine the spirit of Maya Angelou in the U.S. quarter. https://t.co/RPSWjl1jsJ",False,1480608920137879554,7,1,1,1
RepKManning,Congresswoman Kathy Manning,1480576147251515395,1337115670161608712,en,1480576147251515395,2022-01-10T16:23:55.000Z,"The #ChildTaxCredit provided critical support to hardworking families and empowered parents to spend in their local economies. 

Congress must pass the #BuildBackBetter Act to extend the Child Tax Credit so parents can continue to use the #CTC to support their families.",False,1480576147251515395,5,1,1,1
RepKManning,Congresswoman Kathy Manning,1479567158199922694,1337115670161608712,en,1479567158199922694,2022-01-07T21:34:34.000Z,"I was thrilled to be at @ncatsuaggies today to join @NC_Governor as he detailed his plan for clean energy and an equitable economic future for North Carolinians. 

I’m proud to see this executive order signed today to create good-paying jobs and a healthier environment. https://t.co/K04WvXbIQ1",False,1479567158199922694,11,1,1,0
RepKManning,Congresswoman Kathy Manning,1479487165138710529,1337115670161608712,en,1479487165138710529,2022-01-07T16:16:42.000Z,"Today is Jerry Hyman Day at the Greensboro Children’s Museum! To honor the co-founder of the museum, they are offering discounted tickets for $2 and providing an opportunity for visitors to give back through partnerships with local organizations. https://t.co/6pZZaw8a2m",False,1479487165138710529,2,0,0,0
RepKManning,Congresswoman Kathy Manning,1479486631342231559,1337115670161608712,en,1479486631342231559,2022-01-07T16:14:35.000Z,"RT @WhiteHouse: Economic Update:
-Unemployment rate fell to 3.9%, a rate we weren't projected to hit until 2026 before passing the American…",False,1479486631342231559,2437,0,0,0
RepKManning,Congresswoman Kathy Manning,1479126772503519238,1337115670161608712,en,1479126772503519238,2022-01-06T16:24:38.000Z,"One year ago, I was in the House gallery when a violent mob of insurrectionists stormed the U.S. Capitol in an attempt to stop Congress from certifying the results of the 2020 presidential election. I took time to reflect on this day. Watch below ⬇ https://t.co/6hzMFZV4xR",False,1479126772503519238,2,0,0,0
RepKManning,Congresswoman Kathy Manning,1479106833918816263,1337115670161608712,en,1479106833918816263,2022-01-06T15:05:24.000Z,"Today, as we mark the solemn anniversary of the January 6th attack on our democracy, it is important that we reflect on what happened that day, what led people to behave that way, and how we can prevent future ruptures in the fabric of our society. Read my full statement ⬇️ https://t.co/ndxcEcgj2w",False,1479106833918816263,4,4,4,1
RepKManning,Congresswoman Kathy Manning,1478833686690746369,1337115670161608712,en,1478833686690746369,2022-01-05T21:00:00.000Z,"The #ChildTaxCredit has been transformative for North Carolina families. 

94,000 payments, totaling $39.3 million, have been made to hard-working families in #NC06 every month.   

We must pass the #BuildBackBetter Act to extend the #CTC.",False,1478833686690746369,3,1,1,0
RepKManning,Congresswoman Kathy Manning,1478788386185961474,1337115670161608712,en,1478788386185961474,2022-01-05T18:00:00.000Z,"The effects of COVID-19 have resulted in a sharp rise in adolescent mental health cases.
That is why I introduced the Mental Health and Wellness in Schools Act to integrate mental health education into existing wellness programs and provide mental health resources for students. https://t.co/GwL4CdZDlY",False,1478788386185961474,2,1,1,0
RepKManning,Congresswoman Kathy Manning,1478759700623671299,1337115670161608712,en,1478759700623671299,2022-01-05T16:06:01.000Z,"Due to the rapid increase in COVID-19 cases caused by the Omicron variant, Guilford County is reinstating a mask mandate for the health and safety of Guilford County residents.  Check to see if your city is participating below. ⬇⬇
https://t.co/hqkQCV3wKt",False,1478759700623671299,1,2,2,0
RepKManning,Congresswoman Kathy Manning,1478471297315319813,1337115670161608712,en,1478471297315319813,2022-01-04T21:00:00.000Z,"I’m proud to announce that Guilford Child Development has received over $6.6 million in grants from the federal government for Head Start Child Care programs. 
Head Start provides the earliest learners with a strong foundation and supports hard-working parents.",False,1478471297315319813,3,1,1,0
RepKManning,Congresswoman Kathy Manning,1478436033515728897,1337115670161608712,en,1478436033515728897,2022-01-04T18:39:53.000Z,"2022 is the year we lower prescription medication costs! We are off to a strong start with the introduction of my bill, the Capping Prescription Costs Act, which will cap prescription drug copays at $250/month for individuals &amp; $500/month for families on the healthcare exchange. https://t.co/BJ2dhTI0u4",False,1478436033515728897,1,0,0,0
RepKManning,Congresswoman Kathy Manning,1478366468815433729,1337115670161608712,en,1478366468815433729,2022-01-04T14:03:27.000Z,"RT @NCEmergency: Tuesday #ncwx update:
• Winds have calmed, but overnight lows across NC have led to hazardous road conditions that will li…",False,1478366468815433729,14,0,0,0
RepKManning,Congresswoman Kathy Manning,1478093815625834498,1337115670161608712,en,1478093815625834498,2022-01-03T20:00:01.000Z,"As we experience heavy rains, winds, and snow today, I’m sharing some recovery tips for yourself and your property following inclement winter weather. https://t.co/WmOaEUR8Nv",False,1478093815625834498,1,0,0,0
RepKManning,Congresswoman Kathy Manning,1478063615760601093,1337115670161608712,en,1478063615760601093,2022-01-03T18:00:01.000Z,"The Triad is experiencing power outages due to the inclement weather today. Check here to see if your area is affected by the outages and follow Duke Energy’s updates on outages and damages.  
https://t.co/shf3QSJMzM",False,1478063615760601093,2,1,1,0
RepKManning,Congresswoman Kathy Manning,1478060066322403334,1337115670161608712,en,1478060066322403334,2022-01-03T17:45:55.000Z,"One year ago today, I was sworn into office to represent #NC06. In my first year, I secured over $510.8 million in federal investments, co-sponsored &amp; introduced 250 bills, and passed transformative legislative packages. 

I'm proud of this work and look forward to 2022. https://t.co/qNHhJutMQH",False,1478060066322403334,7,4,4,1
RepKManning,Congresswoman Kathy Manning,1478039780357197825,1337115670161608712,en,1478039780357197825,2022-01-03T16:25:18.000Z,Our district is experiencing a winter weather mix today. Please stay safe and check back for updates throughout the day. https://t.co/vKxvq1CpFE,False,1478039780357197825,1,1,1,0
RepKManning,Congresswoman Kathy Manning,1477278438046289920,1337115670161608712,en,1477278438046289920,2022-01-01T14:00:00.000Z,"Wishing all a happy, healthy, and prosperous new year! https://t.co/oDSFYypdCL",False,1477278438046289920,1,2,2,2
RepKManning,Congresswoman Kathy Manning,1476026199549698053,1337115670161608712,en,1476026199549698053,2021-12-29T03:04:03.000Z,"Senator Harry Reid dedicated his life to public service, fighting for American families. His legacy will live on for many years to come. 

I’m holding Senator Reid’s loved ones in my thoughts tonight.",False,1476026199549698053,5,1,1,0
RepKManning,Congresswoman Kathy Manning,1474741721300832260,1337115670161608712,en,1474741721300832260,2021-12-25T14:00:00.000Z,Wishing North Carolina’s Sixth District a Merry Christmas! https://t.co/iQ8qNTkIu3,False,1474741721300832260,1,1,1,1
RepKManning,Congresswoman Kathy Manning,1474069795616215045,1337115670161608712,en,1474069795616215045,2021-12-23T17:30:00.000Z,"Since taking office in January, I’ve introduced and cosponsored 250 bills, brought over $510.8 million to the Triad, and returned over $2.3 million to constituents. 

It’s my honor to serve the people of North Carolina's Sixth District. https://t.co/C5ScmA3URP",False,1474069795616215045,24,64,64,8
RepKManning,Congresswoman Kathy Manning,1473673961015812102,1337115670161608712,en,1473673961015812102,2021-12-22T15:17:06.000Z,"The bipartisan infrastructure law, which passed Congress with my support, includes funding to: 
-repair roads and bridges,
-deliver clean drinking water, 
-upgrade public transportation,
-expand broadband, 
-and improve airports, including @flyfrompti 
https://t.co/H6nTPQVBQg",False,1473673961015812102,3,1,1,0
RepKManning,Congresswoman Kathy Manning,1473669665633177601,1337115670161608712,en,1473669665633177601,2021-12-22T15:00:02.000Z,"Toyota &amp; UPS have announced they’ll build facilities in the Triad, bringing more than 2,000 good-paying jobs to the area. I’m proud to work with state and local officials to attract companies to our region to continue creating jobs and growing our economy. https://t.co/arGpxcGb3j",False,1473669665633177601,1,0,0,1
RepKManning,Congresswoman Kathy Manning,1473422760160509952,1337115670161608712,en,1473422760160509952,2021-12-21T22:38:55.000Z,"This is an important statement by several of our nation’s top national security experts about an effective approach to negotiate with Iran to prevent them from acquiring nuclear weapons.
https://t.co/KjQxAcT3io",False,1473422760160509952,5,2,2,2
RepKManning,Congresswoman Kathy Manning,1473332170005614600,1337115670161608712,en,1473332170005614600,2021-12-21T16:38:57.000Z,"I’m thrilled to see @ncatsuaggies student, U'lia Hargrove, working with @UrbanOutfitters to design an HBCU clothing collection and bring representation to the fashion world. #AggiePride https://t.co/NcATadjlNb",False,1473332170005614600,8,0,0,1
RepKManning,Congresswoman Kathy Manning,1472976667874365446,1337115670161608712,en,1472976667874365446,2021-12-20T17:06:18.000Z,It's my honor to represent you in Congress. Watch this video wrap up of my first year in office ⬇  https://t.co/DXzHmbvdMI,False,1472976667874365446,1,1,1,1
RepKManning,Congresswoman Kathy Manning,1472959036320538632,1337115670161608712,en,1472959036320538632,2021-12-20T15:56:15.000Z,"This isn't over. 

We're going to keep working toward legislation that makes health care more affordable, extends the Child Tax Credit, protects our climate, and invests in our communities. 

I'm optimistic that we will get this done for American families.",False,1472959036320538632,5,9,9,1
RepKManning,Congresswoman Kathy Manning,1472947946681470981,1337115670161608712,en,1472947946681470981,2021-12-20T15:12:11.000Z,@nwncfoodbank is a lifeline for many families in #NC06. Team Manning was glad to volunteer with the organization last week. https://t.co/dVk0qxHPQy,False,1472947946681470981,0,0,0,0
RepKManning,Congresswoman Kathy Manning,1472660635423068167,1337115670161608712,en,1472660635423068167,2021-12-19T20:10:30.000Z,"As Vice Chair of the Middle East, North Africa, and Global Counterterrorism Subcommittee and as a member of the Antisemitism Task Force, I remain committed to rooting out bigotry, discrimination and Antisemitism in every form.",False,1472660469919928332,1,1,1,0
RepKManning,Congresswoman Kathy Manning,1472660600639705097,1337115670161608712,en,1472660600639705097,2021-12-19T20:10:22.000Z,This attack follows a year of increased instances of Antisemitic violence across the country. Antisemitic actions like this are designed to instill fear and spread bigotry. I join fellow members of the Greensboro Jewish community in standing against these intimidation tactics.,False,1472660469919928332,2,1,1,0
RepKManning,Congresswoman Kathy Manning,1472660520905883652,1337115670161608712,en,1472660520905883652,2021-12-19T20:10:03.000Z,I’m urging local law enforcement to do everything they can to bring the culprits to justice.,False,1472660469919928332,0,1,1,0
RepKManning,Congresswoman Kathy Manning,1472660469919928332,1337115670161608712,en,1472660469919928332,2021-12-19T20:09:51.000Z,"I am appalled by the Antisemitic flyers that were distributed across Greensboro this morning in driveways and on porches, causing great distress to many people who reached out to me with concerns.  These flyers spread hatred and false information about the COVID-19 pandemic.",False,1472660469919928332,15,6,6,3
RepKManning,Congresswoman Kathy Manning,1471883664392867852,1337115670161608712,en,1471883664392867852,2021-12-17T16:43:06.000Z,"The bipartisan infrastructure law, that passed Congress with my support, is bringing $5.1 million to @flyfrompti. 
I’m proud to bring federal funding home to #NC06  
https://t.co/RJUSXf7iG5",False,1471883664392867852,2,3,3,1
RepKManning,Congresswoman Kathy Manning,1471584480691376129,1337115670161608712,en,1471584480691376129,2021-12-16T20:54:15.000Z,"I was proud to announce that, following my advocacy, High Point received a $19.8 million RAISE grant from @USDOT to improve public transit. 
These funds will go to High Point on the Rise, a multimodal transportation project in the heart of downtown. https://t.co/NB4prdRdcZ",False,1471584480691376129,1,1,1,1
RepKManning,Congresswoman Kathy Manning,1471565799596998669,1337115670161608712,en,1471565799596998669,2021-12-16T19:40:01.000Z,"Afghanistan is facing a dire economic crisis, and we have an obligation to help avert a humanitarian disaster. I joined my colleagues @RepMalinowski, @RepMeijer  and @RepJasonCrow in urging the @StateDept &amp; @USTreasury provide humanitarian assistance.
https://t.co/t0g7BKEoox",False,1471565799596998669,1,2,2,1
RepKManning,Congresswoman Kathy Manning,1471531251379150853,1337115670161608712,en,1471531251379150853,2021-12-16T17:22:44.000Z,"I’m proud to announce that the bipartisan infrastructure law, that passed Congress with my support, includes $5,117,453 in federal funding for @flyfrompti . 
I'm thrilled to see federal funding improving infrastructure in the Triad. https://t.co/vsra7JGeVv",False,1471531251379150853,2,1,1,1
RepKManning,Congresswoman Kathy Manning,1471176120087289858,1337115670161608712,en,1471176120087289858,2021-12-15T17:51:34.000Z,"Since July, a total of $235,800,000 in #ChildTaxCredit payments have been put back into the pockets of #NC06 families. If the Senate doesn't act, this will be the last CTC payment families receive.
The Senate must pass the #BuildBackBetter Act and extend the Child Tax Credit. https://t.co/7Lpdimg0C4",False,1471176120087289858,2,1,1,2
RepKManning,Congresswoman Kathy Manning,1471145318418894848,1337115670161608712,en,1471145318418894848,2021-12-15T15:49:11.000Z,Today is the final day of open enrollment. Visit https://t.co/DrWu6GIAqc to #getcovered. https://t.co/MHlnIRUVMK,False,1471145318418894848,1,2,2,1
RepKManning,Congresswoman Kathy Manning,1470822405794893827,1337115670161608712,en,1470822405794893827,2021-12-14T18:26:02.000Z,"94,000 payments have been sent to #NC06 families monthly since July, putting an average of $422/month back in the pockets of hardworking parents. 

The Senate must pass the #BuildBackBetter Act and extend the Child Tax Credit.
https://t.co/QhGnYkfmQW",False,1470822405794893827,1,1,1,1
RepKManning,Congresswoman Kathy Manning,1470815988815904778,1337115670161608712,en,1470815988815904778,2021-12-14T18:00:32.000Z,"RT @RepJahanaHayes: Today, we remember the 20 innocent children and 6 selfless educators whose lives were taken during the Sandy Hook Eleme…",False,1470815988815904778,74,0,0,0
RepKManning,Congresswoman Kathy Manning,1470803933836853255,1337115670161608712,en,1470803933836853255,2021-12-14T17:12:38.000Z,"I’m thrilled to announce the 2021 Congressional App Challenge winners from #NC06: Anika Suman and Ayush Khanna. Their app, 'AnatoLearn,' is an educational app that teaches users about anatomy. 
Watch their submission here: https://t.co/mFo2hed1SV",False,1470803933836853255,1,1,1,1
RepKManning,Congresswoman Kathy Manning,1470468573848129536,1337115670161608712,en,1470468573848129536,2021-12-13T19:00:02.000Z,One in four Americans taking a prescription drug reported skipping doses or cutting pills in half due to costs. I introduced the Capping Prescription Costs Act to cap prescription drug copays at $250/month for individuals and $500/month for families on the health care exchange.,False,1470468573848129536,1,1,1,1
RepKManning,Congresswoman Kathy Manning,1470434563444948999,1337115670161608712,en,1470434563444948999,2021-12-13T16:44:53.000Z,I was thrilled to attend @mtzbcgso Christmas at Zion event this Sunday! This event is a testament to their longstanding commitment to community and generosity. https://t.co/lJx53N1Rkm,False,1470434563444948999,1,2,2,0
RepKManning,Congresswoman Kathy Manning,1469673290285391877,1337115670161608712,en,1469673290285391877,2021-12-11T14:19:52.000Z,Congratulations  Dudley High School on winning the state 3A football championship! Go Panthers! https://t.co/Wq3R42iUq8,False,1469673290285391877,1,0,0,0
RepKManning,Congresswoman Kathy Manning,1469396502128824334,1337115670161608712,en,1469396502128824334,2021-12-10T20:00:00.000Z,Families are experiencing higher prices due to the pandemic. I joined @RepAxne in sending a letter to House leadership calling for additional legislation to ease the supply chain bottleneck &amp; lower costs. https://t.co/PAyWFD4Bfl,False,1469396502128824334,3,1,1,0
RepKManning,Congresswoman Kathy Manning,1469350636949057541,1337115670161608712,en,1469350636949057541,2021-12-10T16:57:45.000Z,The Senate must pass the #BuildBackBetter Act to extend the #ChildTaxCredit.,False,1469350525091078147,0,1,1,0
RepKManning,Congresswoman Kathy Manning,1469350525091078147,1337115670161608712,en,1469350525091078147,2021-12-10T16:57:19.000Z,"94,000 families in #NC06 have been receiving monthly Child Tax Credit payments averaging $422/month since July.

This tax cut has put money back in the pockets of hard-working parents so they can put food on the table and fuel their local economies.  
https://t.co/P2GbRzQYtA",False,1469350525091078147,4,1,1,0
RepKManning,Congresswoman Kathy Manning,1469312842029535233,1337115670161608712,en,1469312842029535233,2021-12-10T14:27:34.000Z,"This morning, my colleagues and I on the @HouseForeign Committee are preparing to continue consideration of legislation pertaining to international security, diplomacy, mental health, and more. https://t.co/6ukHCtK0hB",False,1469312842029535233,6,4,4,1
RepKManning,Congresswoman Kathy Manning,1469019018149302272,1337115670161608712,en,1469019018149302272,2021-12-09T19:00:01.000Z,"The bipartisan infrastructure law will deliver concrete results for North Carolina and communities across the country. I voted to secure much-needed funding to repair the country’s crumbling roads and bridges, invest in clean water infrastructure, and expand broadband. https://t.co/KN6G0K5Xp5",False,1469019018149302272,14,1,1,0
RepKManning,Congresswoman Kathy Manning,1468994362361196545,1337115670161608712,en,1468994362361196545,2021-12-09T17:22:03.000Z,"I’m proud to introduce the Capping Prescription Costs Act, which will cap prescription drug copays at $250/month for individuals and $500/month for families on the health care exchange, helping people to afford the medication they need to stay healthy. https://t.co/3ur7FwPYS7",False,1468994268329086981,0,0,0,0
RepKManning,Congresswoman Kathy Manning,1468994268329086981,1337115670161608712,en,1468994268329086981,2021-12-09T17:21:40.000Z,"When my daughter was diagnosed with a chronic illness, the medication prescribed by her doctor cost $10,000/month. The insurance company refused coverage, and I fought until they relented.  I came to Congress to fight for other families who struggle to pay for their medications.",False,1468994268329086981,1,1,1,0
RepKManning,Congresswoman Kathy Manning,1468992537973174272,1337115670161608712,en,1468992537973174272,2021-12-09T17:14:48.000Z,"RT @RepAdamSchiff: Today, the House will take up the #ProtectingOurDemocracy Act.
 
It will root out corruption, curtail presidential abuse…",False,1468992537973174272,3372,0,0,0
RepKManning,Congresswoman Kathy Manning,1468682441061773314,1337115670161608712,en,1468682441061773314,2021-12-08T20:42:35.000Z,"With those conversations in mind, last night I voted for the National Defense Authorization Act to:
-give servicemembers a raise
-combat sexual assault in the military
-root out extremism 
-increase partnerships with HBCUs &amp; MSIs
-invest in mental health care",False,1468682375341264899,0,0,0,0
RepKManning,Congresswoman Kathy Manning,1468682375341264899,1337115670161608712,en,1468682375341264899,2021-12-08T20:42:19.000Z,"I visited Ft. Bragg alongside @POTUS &amp; @FLOTUS to serve Thanksgiving dinner to our troops and show my appreciation for their commitment to our country. During my visit, I spoke with service members who shared their concerns and ideas about the future of our military. https://t.co/4gRNZbtZfq",False,1468682375341264899,2,1,1,0
RepKManning,Congresswoman Kathy Manning,1468668857657221122,1337115670161608712,en,1468668857657221122,2021-12-08T19:48:36.000Z,It was great to welcome my dear friend and Israel’s Minister of Diaspora Affairs @DrNachmanShai for a discussion with @RepTedDeutch about strengthening ties between the American Jewish community and Israel and working together to combat rising antisemitism. https://t.co/01no9IwtGV,False,1468668857657221122,0,0,0,0
RepKManning,Congresswoman Kathy Manning,1468634969664860160,1337115670161608712,en,1468634969664860160,2021-12-08T17:33:57.000Z,"As Freshmen Class Representative, I'm proud to welcome my colleagues @RepShontelBrown and @RepNikema to @NewDemCoalition. https://t.co/bb2waXTysP",False,1468634969664860160,3,1,1,0
RepKManning,Congresswoman Kathy Manning,1468339536656625665,1337115670161608712,en,1468339536656625665,2021-12-07T22:00:00.000Z,"I’m thrilled that Toyota will be building their electric-vehicle battery plant at the Greensboro-Randolph Megasite. This $1.3 billion investment will boost the local economy and provide good-paying jobs to people across the Triad.
https://t.co/w84PH8DxOm",False,1468339536656625665,1,0,0,1
RepKManning,Congresswoman Kathy Manning,1468279141971763202,1337115670161608712,en,1468279141971763202,2021-12-07T18:00:01.000Z,": Social Security provides critical benefits to millions of Americans. Yet, it's been 50 years since Congress has improved Social Security benefits. 

I’m joining @RepJohnLarson to protect and enhance social security benefits with the Social Security 2100: A Sacred Trust Act.",False,1468279141971763202,2,0,0,0
RepKManning,Congresswoman Kathy Manning,1468271929270358018,1337115670161608712,en,1468271929270358018,2021-12-07T17:31:21.000Z,The international community should join in this important effort to hold China accountable for violating and undermining fundamental human rights.,False,1468271882910715904,6,2,2,1
RepKManning,Congresswoman Kathy Manning,1468271882910715904,1337115670161608712,en,1468271882910715904,2021-12-07T17:31:10.000Z,"I applaud the President’s announcement that the U.S. will implement a diplomatic boycott of the 2022 Beijing Olympics in protest of the Chinese government’s human rights abuses and ongoing genocide of the Uyghurs in Xinjiang. 
https://t.co/P1SIqa87qH",False,1468271882910715904,47,7,7,2
