handle,name,tweet_id,author_id,lang,replied_to,created_at,tweet_text,possibly_sensitive,conversation_id,retweet_count,reply_count,like_count,quote_count
SenatorBurr,Richard Burr,748188036513566720,21157904,en,748188036513566720,2016-06-29T16:15:03.000Z,My statement on the terror attack in #Istanbul https://t.co/kARowkvAtk,False,748188036513566720,3,0,0,0
SenatorBurr,Richard Burr,747894462060371968,21157904,en,747894462060371968,2016-06-28T20:48:29.000Z,Great to meet with NC members of the @ANANursingWorld. #Nurses touch so many lives in times of need. https://t.co/EsUWIcwzWJ,False,747894462060371968,5,2,2,3
SenatorBurr,Richard Burr,747839440530345985,21157904,en,747839440530345985,2016-06-28T17:09:51.000Z,"This is a reasonable bill, and for many North Carolinians, lives may be at stake.",False,747839440530345985,0,2,2,0
SenatorBurr,Richard Burr,747839255246962688,21157904,en,747839255246962688,2016-06-28T17:09:07.000Z,"For our veterans who need health care, VA funding is not a game.",False,747839255246962688,1,4,4,0
SenatorBurr,Richard Burr,747839099516530689,21157904,en,747839099516530689,2016-06-28T17:08:30.000Z,"Some of my colleagues seem to think this is a game. For pregnant women, and women who hope to become pregnant, the Zika virus is not a game.",False,747839099516530689,5,9,9,4
SenatorBurr,Richard Burr,747838865977774081,21157904,en,747838865977774081,2016-06-28T17:07:34.000Z,"It also allocates a record level of funding for our veterans, providing every cent that the President himself asked for in his budget.",False,747838865977774081,1,2,2,0
SenatorBurr,Richard Burr,747838701246550016,21157904,en,747838701246550016,2016-06-28T17:06:55.000Z,This legislation provides the funding for Zika that every Democrat Senator voted for six weeks ago.,False,747838701246550016,0,4,4,0
SenatorBurr,Richard Burr,747838570270973952,21157904,en,747838570270973952,2016-06-28T17:06:23.000Z,"I’m disappointed Democrats voted to block a bill to fight Zika, take care of veterans, and fund military construction projects.",False,747838570270973952,3,11,11,4
SenatorBurr,Richard Burr,747472584049070080,21157904,en,747472584049070080,2016-06-27T16:52:06.000Z,".@CBSNews: Burr: Obama pays ""lip service"" to ISIS threat https://t.co/SBZHABnCTV",False,747472584049070080,4,5,5,0
SenatorBurr,Richard Burr,746822189215780864,21157904,en,746822189215780864,2016-06-25T21:47:39.000Z,"RT @SenateGOP: ""We must attack ISIL and al-Qai’da, and those who want to do us harm ..."" – @SenatorBurr #GOPAddress #ISIS
https://t.co/fvKA…",False,746822189215780864,24,0,0,0
SenatorBurr,Richard Burr,746725376769032193,21157904,en,746725376769032193,2016-06-25T15:22:57.000Z,RT @SenateMajLdr: The principal way to prevent #ISIS inspired attacks here in America is to defeat ISIS in Iraq &amp; Syria → @SenatorBurr http…,False,746725376769032193,15,0,0,0
SenatorBurr,Richard Burr,746706188901957632,21157904,en,746706188901957632,2016-06-25T14:06:43.000Z,"RT @SenateGOP: ""We face a growing and significant threat from ISIL."" – @SenatorBurr #GOPAddress #ISIS
https://t.co/fvKApBG5RG",False,746706188901957632,16,0,0,0
SenatorBurr,Richard Burr,746680715043971073,21157904,en,746680715043971073,2016-06-25T12:25:29.000Z,"The principal way to prevent ISIL inspired attacks here in America is to defeat ISIL in Iraq and in Syria.
https://t.co/XETHuRHN8H",False,746680715043971073,8,17,17,1
SenatorBurr,Richard Burr,746374566927273984,21157904,en,746374566927273984,2016-06-24T16:08:58.000Z,Jabber is giving high fives in the Senate today #TakeYourDogToWorkDay https://t.co/JtaFoveJ7b,False,746374566927273984,10,4,4,1
SenatorBurr,Richard Burr,746352608005267456,21157904,en,746352608005267456,2016-06-24T14:41:42.000Z,"Our UK friends and allies should know this: we respect their decision, and we stand by them, just as they have always stood by us. #Brexit",False,746352608005267456,6,7,7,4
SenatorBurr,Richard Burr,746352350806286337,21157904,en,746352350806286337,2016-06-24T14:40:41.000Z,While there will be a great deal of discussion in the coming days and weeks about what the 'Leave' win means for them and for us #Brexit,False,746352350806286337,1,3,3,0
SenatorBurr,Richard Burr,746352263040479232,21157904,en,746352263040479232,2016-06-24T14:40:20.000Z,"The people of the United Kingdom have just completed a historic referendum, and have rendered a decision on their future. #Brexit",False,746352263040479232,3,1,1,0
SenatorBurr,Richard Burr,745699594986721282,21157904,en,745699594986721282,2016-06-22T19:26:52.000Z,Senate passes Burr resolution designating July 8th as “Collector Car Appreciation Day” https://t.co/QL7Njcstr5 https://t.co/I3mhj5IoPS,False,745699594986721282,4,29,29,23
SenatorBurr,Richard Burr,745660019551645696,21157904,en,745660019551645696,2016-06-22T16:49:37.000Z,Senate filibusters legislation to enable law enforcement to more effectively combat terrorism https://t.co/9Y5KARi6Wt,False,745660019551645696,0,17,17,1
SenatorBurr,Richard Burr,745659163720687616,21157904,en,745659163720687616,2016-06-22T16:46:12.000Z,RT @EnvDefenseFund: BREAKING: Obama just signed one of the biggest enviro laws in history. What this means: https://t.co/PDGuYQS7eC,False,745659163720687616,25,0,0,0
SenatorBurr,Richard Burr,745619592886816768,21157904,en,745619592886816768,2016-06-22T14:08:58.000Z,Headed to the floor to talk about my amdt to target lone wolf terrorists. WATCH LIVE https://t.co/EV9IQz2Qr3,False,745619592886816768,1,14,14,3
SenatorBurr,Richard Burr,745359694085128193,21157904,en,745359694085128193,2016-06-21T20:56:13.000Z,RT @SenThomTillis: Happy #NationalSelfieDay! https://t.co/xZkBJ7R8TK,False,745359694085128193,11,0,0,0
SenatorBurr,Richard Burr,745332196806922240,21157904,en,745332196806922240,2016-06-21T19:06:57.000Z,RT @ADouglasNews: E. Chapel Hill High student honored in DC today. Here's Jay Pande w/ @SenatorBurr (it's national selfie day) https://t.co…,False,745332196806922240,5,0,0,0
SenatorBurr,Richard Burr,745325255472848896,21157904,en,745325255472848896,2016-06-21T18:39:23.000Z,East Chapel Hill High student Jay Pande named presidential scholar via @newsobserver https://t.co/t8pajggFAU,False,745325255472848896,0,2,2,0
SenatorBurr,Richard Burr,745324839871852544,21157904,en,745324839871852544,2016-06-21T18:37:43.000Z,Celebrating #NationalSelfieDay with Presidential Scholar Jay Pande from Chapel Hill https://t.co/4ZaH6loL2l,False,745324839871852544,3,2,2,0
SenatorBurr,Richard Burr,745261268462870529,21157904,en,745261268462870529,2016-06-21T14:25:07.000Z,"Chairmen Burr and McCain enhance counterrorism tools to target lone wolf attackers, vote expected tomorrow https://t.co/OuwnDdgHE9",False,745261268462870529,6,11,11,2
SenatorBurr,Richard Burr,743540251218579456,21157904,en,743540251218579456,2016-06-16T20:26:24.000Z,RT @lawanamayfield: Thank you @BigJohnDC and #AnnWoodsHawks for meeting this morning with @leagueofcities on behalf of @SenatorBurr https:/…,False,743540251218579456,2,0,0,0
SenatorBurr,Richard Burr,743491697552801792,21157904,en,743491697552801792,2016-06-16T17:13:28.000Z,"RT @SenateGOP: Obama: ""ISIL is on defense.""
CIA Director Brennan: ISIS is preparing for more attacks. #RealityCheck
https://t.co/GBkSN0x36U",False,743491697552801792,172,0,0,0
SenatorBurr,Richard Burr,743491677688631296,21157904,en,743491677688631296,2016-06-16T17:13:24.000Z,"RT @SenateGOP: Obama: ISIS' ranks and morale are shrinking.
CIA Director Brennan: U.S. has not reduced ISIS’ capability and reach.
https://…",False,743491677688631296,118,0,0,0
SenatorBurr,Richard Burr,743477798778642433,21157904,en,743477798778642433,2016-06-16T16:18:15.000Z,".@WSJ: Islamic State’s Terror Capabilities Intact, CIA Chief Says https://t.co/g9wyvJ2TGr",False,743477798778642433,7,9,9,2
SenatorBurr,Richard Burr,743476162555416576,21157904,en,743476162555416576,2016-06-16T16:11:44.000Z,.@CNN: CIA director warns ISIS terror capability not slowed despite battle losses https://t.co/iQdeyJh99o,False,743476162555416576,12,5,5,0
SenatorBurr,Richard Burr,743474883313664000,21157904,en,743474883313664000,2016-06-16T16:06:39.000Z,.@AP: CIA chief: IS working to send operatives to the West https://t.co/ApFXR8DHHo,False,743474883313664000,3,6,6,1
SenatorBurr,Richard Burr,743472580963753984,21157904,en,743472580963753984,2016-06-16T15:57:31.000Z,".@FoxNews: CIA director’s chilling warning: ISIS to ‘intensify’ global attacks, not losing influence https://t.co/xjQKJQN2eV",False,743472580963753984,4,1,1,0
SenatorBurr,Richard Burr,743439945906401280,21157904,en,743439945906401280,2016-06-16T13:47:50.000Z,CIA Director John Brennan’s prepared remarks from the Intelligence hearing happening now https://t.co/H9720uWYay,False,743439945906401280,0,6,6,0
SenatorBurr,Richard Burr,743431588155891712,21157904,en,743431588155891712,2016-06-16T13:14:37.000Z,CIA Director John Brennan’s prepared remarks from the Senate Intelligence hearing happening now https://t.co/DMs5tx3y1d,False,743431588155891712,2,2,2,0
SenatorBurr,Richard Burr,743429928067211264,21157904,en,743429928067211264,2016-06-16T13:08:01.000Z,My prepared remarks from the Intelligence hearing happening now https://t.co/3weqRhPbB7,False,743429928067211264,3,1,1,0
SenatorBurr,Richard Burr,743429758826983425,21157904,en,743429758826983425,2016-06-16T13:07:21.000Z,"should be able to go to sporting events, and concerts, and dance clubs, and experience life with their families in safety.",False,743429758826983425,2,6,6,0
SenatorBurr,Richard Burr,743429720256225280,21157904,en,743429720256225280,2016-06-16T13:07:12.000Z,"Our friends in Europe, and Asia, and across the world,",False,743429720256225280,1,0,0,0
SenatorBurr,Richard Burr,743429685762232320,21157904,en,743429685762232320,2016-06-16T13:07:03.000Z,We should be able to live securely in a free society. And we are not alone.,False,743429685762232320,1,4,4,0
SenatorBurr,Richard Burr,743429648357429248,21157904,en,743429648357429248,2016-06-16T13:06:55.000Z,I am not willing to accept the events in San Bernardino and Orlando as the new normal.  Nor should anyone.,False,743429648357429248,7,36,36,3
SenatorBurr,Richard Burr,743429576483799040,21157904,en,743429576483799040,2016-06-16T13:06:37.000Z,"We must attack them where they raise funds, where they plan, and where they recruit.  We must deny them their safe haven.",False,743429576483799040,3,4,4,0
SenatorBurr,Richard Burr,743429534184259584,21157904,en,743429534184259584,2016-06-16T13:06:27.000Z,ISIL’s global battlefield now includes the United States and we cannot stand idly by – we must take the fight to them.,False,743429534184259584,4,13,13,0
SenatorBurr,Richard Burr,743422722584248320,21157904,en,743422722584248320,2016-06-16T12:39:23.000Z,I’m chairing an open Intelligence Committee hearing at 9am. CIA Director Brennan will testify. WATCH LIVE:  https://t.co/jbtGzeEKFO,False,743422722584248320,8,0,0,0
SenatorBurr,Richard Burr,743168902889242629,21157904,en,743168902889242629,2016-06-15T19:50:48.000Z,"Thank you @SenatorBarb for working to improve child care. Encouraged to hear today that our law is protecting kids.
https://t.co/vCu0u0BgSV",False,743168902889242629,5,5,5,0
SenatorBurr,Richard Burr,743083909802565632,21157904,en,743083909802565632,2016-06-15T14:13:04.000Z,"RT @SenatorBarb: Headed to co-chair HELP Committee hearing w @SenatorBurr fighting for access to safe, affordable, quality child care https…",False,743083909802565632,6,0,0,0
SenatorBurr,Richard Burr,743083412358082560,21157904,en,743083412358082560,2016-06-15T14:11:05.000Z,It is my strong desire that the implementation of this law ensures it never happens again. @GOPHELP,False,743083412358082560,1,3,3,0
SenatorBurr,Richard Burr,743083218644160512,21157904,en,743083218644160512,2016-06-15T14:10:19.000Z,Or where basic health and safety measures weren’t followed. It was an outrage that federal dollars were going to this. @GOPHELP,False,743083218644160512,0,2,2,0
SenatorBurr,Richard Burr,743082947163639808,21157904,en,743082947163639808,2016-06-15T14:09:15.000Z,Not one Senator here would send their child to a facility where convicted felons cared for their child @GOPHELP,False,743082947163639808,0,6,6,0
SenatorBurr,Richard Burr,743082686072426497,21157904,en,743082686072426497,2016-06-15T14:08:12.000Z,Child care shouldn’t be about cramming as many children as possible into substandard care. @GOPHELP,False,743082686072426497,0,3,3,0
SenatorBurr,Richard Burr,743082156919009280,21157904,en,743082156919009280,2016-06-15T14:06:06.000Z,I’m chairing @GOPHELP now. WATCH LIVE https://t.co/tcthYivdPI,False,743082156919009280,2,1,1,0
SenatorBurr,Richard Burr,742818756896792576,21157904,en,742818756896792576,2016-06-14T20:39:27.000Z,"The Islamic State has created a global battlefield
https://t.co/gTJWIeKRPx",False,742818756896792576,10,11,11,0
SenatorBurr,Richard Burr,742806472971714561,21157904,en,742806472971714561,2016-06-14T19:50:38.000Z,Burr Introduces Bipartisan Bill to Provide Veterans with Dental Care https://t.co/V5vPB9SQ3F,False,742806472971714561,5,4,4,0
SenatorBurr,Richard Burr,742759337169461248,21157904,en,742759337169461248,2016-06-14T16:43:20.000Z,Burr statement on Senate passage of defense bill  https://t.co/ICeb2OkKfm,False,742759337169461248,0,1,1,0
SenatorBurr,Richard Burr,742731790192906240,21157904,en,742731790192906240,2016-06-14T14:53:52.000Z,Happy 241st Birthday to the @USArmy https://t.co/UhzQm5fOZv,False,742731790192906240,6,0,0,0
SenatorBurr,Richard Burr,742467974142038017,21157904,en,742467974142038017,2016-06-13T21:25:34.000Z,Joining @wolfblitzer now live in the @CNN studio to talk about the #OrlandoShooting. https://t.co/bdW2cZRBvn,False,742467974142038017,3,21,21,0
SenatorBurr,Richard Burr,742441328479506433,21157904,en,742441328479506433,2016-06-13T19:39:41.000Z,RT @benyc: Soon on @ABCNews Digital - @AliABCNews interviews Senate Intel Cmte Chairman @SenatorBurr for the latest on #OrlandoShooting,False,742441328479506433,4,0,0,0
SenatorBurr,Richard Burr,742437923534966784,21157904,en,742437923534966784,2016-06-13T19:26:09.000Z,"I joined @FoxNews to discuss the Orlando attack. Investigators are in the process of discovering a digital footprint
https://t.co/1KXWJx1zR5",False,742437923534966784,6,8,8,0
SenatorBurr,Richard Burr,742400726425604096,21157904,en,742400726425604096,2016-06-13T16:58:20.000Z,The flag over the Capitol is flying at half-staff today in memory of the victims of the horrific attack in Orlando. https://t.co/3MRuhbQHHP,False,742400726425604096,14,29,29,0
SenatorBurr,Richard Burr,742074902946193409,21157904,en,742074902946193409,2016-06-12T19:23:38.000Z,Joining Fox News to discuss the #OrlandoAttack https://t.co/yFQputbebT,False,742074902946193409,8,29,29,0
SenatorBurr,Richard Burr,742068631366864896,21157904,en,742068631366864896,2016-06-12T18:58:43.000Z,Will be on @FoxNews with @BretBaier in a few minutes,False,742068631366864896,1,6,6,0
SenatorBurr,Richard Burr,742013568762122242,21157904,en,742013568762122242,2016-06-12T15:19:55.000Z,"I am confident FBI and its partners will be able to present a full picture of the suspect, his motives or inspiration, and his background.",False,742013568762122242,51,42,42,24
SenatorBurr,Richard Burr,742009448110100484,21157904,en,742009448110100484,2016-06-12T15:03:32.000Z,"Law enforcement authorities are investigating the attack as a terrorist incident, and we should allow the investigation to unfold.",False,742009448110100484,10,6,6,0
SenatorBurr,Richard Burr,742008835993444352,21157904,en,742008835993444352,2016-06-12T15:01:07.000Z,My thoughts and prayers are with the victims of this morning's horrific attack in Orlando and their loved ones.,False,742008835993444352,27,277,277,3
SenatorBurr,Richard Burr,740984265534492672,21157904,en,740984265534492672,2016-06-09T19:09:50.000Z,"RT @GOPSenFinance: Chair @SenOrrinHatch, @RonWyden &amp; @SenatorBurr highlight @USGAO's work on Medicare Audit and Appeals process: https://t.…",False,740984265534492672,4,0,0,0
SenatorBurr,Richard Burr,740963380354224129,21157904,en,740963380354224129,2016-06-09T17:46:50.000Z,The duct tape adds character. I’m not sending The Thing to the junk yard any time soon. https://t.co/AsQ7RC9vQY,False,740963380354224129,2,0,0,0
SenatorBurr,Richard Burr,740959817376927744,21157904,en,740959817376927744,2016-06-09T17:32:41.000Z,Lawmakers seek to boost funding for mosquito control to combat Zika virus https://t.co/G5gN9xPm24,False,740959817376927744,1,5,5,0
SenatorBurr,Richard Burr,740927029567184896,21157904,en,740927029567184896,2016-06-09T15:22:24.000Z,"On #Zika, the Administration should use the tools we gave them https://t.co/SEgzgPBJui",False,740927029567184896,1,1,1,0
SenatorBurr,Richard Burr,740904765790560256,21157904,en,740904765790560256,2016-06-09T13:53:56.000Z,The Thing needs some repairs. Sometimes you just need a little duct tape #LongLiveTheThing https://t.co/GD8ihq7NfG,False,740904765790560256,5,1,1,0
SenatorBurr,Richard Burr,740565864190214148,21157904,en,740565864190214148,2016-06-08T15:27:15.000Z,Honored to receive the Semper Fidelis Award from the @MarineScholars Foundation. https://t.co/XehEIKv7G7,False,740565864190214148,6,3,3,0
SenatorBurr,Richard Burr,740349430923153409,21157904,en,740349430923153409,2016-06-08T01:07:14.000Z,RT @EnvDefenseFund: BREAKING: Congress just passed one of the biggest environmental laws in history to protect us from toxic chemicals. htt…,False,740349430923153409,138,0,0,0
SenatorBurr,Richard Burr,740293534377463808,21157904,en,740293534377463808,2016-06-07T21:25:07.000Z,Congress shouldn’t rush to make changes that could drastically increase the cost of living for our military families https://t.co/zwVIbyDvLQ,False,740293534377463808,4,2,2,0
SenatorBurr,Richard Burr,740266729545289730,21157904,en,740266729545289730,2016-06-07T19:38:36.000Z,Proud to host the @NCMBC #supporthewarfighter symposium with @SenThomTillis https://t.co/UVu8THFI7K,False,740266729545289730,7,3,3,0
SenatorBurr,Richard Burr,740259443858870272,21157904,en,740259443858870272,2016-06-07T19:09:39.000Z,I’m proud to cosponsor Kevin &amp; Avonte’s Law. Congress should pass it. @missingkids @autismspeaks @alzimpact https://t.co/ZoQGLJUemR,False,740259443858870272,11,1,1,0
SenatorBurr,Richard Burr,740246896481083392,21157904,en,740246896481083392,2016-06-07T18:19:47.000Z,"At 2:30, Intel hearing on confirmation of Susan Gibson to serve as IG of the National Reconnaissance Office WATCH: https://t.co/lZ8q8qxKjB",False,740246896481083392,0,0,0,0
SenatorBurr,Richard Burr,739888275880607744,21157904,en,739888275880607744,2016-06-06T18:34:46.000Z,Thousands gave their lives on #DDay. We must remember the sacrifices the #GreatestGeneration made for our nation. https://t.co/0J1ZC0kvCj,False,739888275880607744,13,0,0,0
SenatorBurr,Richard Burr,739864740567130112,21157904,en,739864740567130112,2016-06-06T17:01:14.000Z,"Float like a butterfly, sting like a bee. Muhammad Ali was one of our greatest sports icons. RIP https://t.co/hN6fcSvjkd",False,739864740567130112,10,3,3,0
SenatorBurr,Richard Burr,738837410923040768,21157904,en,738837410923040768,2016-06-03T20:59:00.000Z,Visited NC seniors at Piedmont Health SeniorCare today. Thanks for sharing your concerns and your bingo tips. https://t.co/Fq34UJeHbl,False,738837410923040768,4,4,4,0
SenatorBurr,Richard Burr,738824436325994496,21157904,en,738824436325994496,2016-06-03T20:07:26.000Z,Sgt. Maj. Raymond Echevarria recognized decades after final mission https://t.co/e1oxsnFwl5,False,738824436325994496,1,0,0,0
SenatorBurr,Richard Burr,738793867248603137,21157904,en,738793867248603137,2016-06-03T18:05:58.000Z,Appreciate recognition from @SwainNCSchools. I’ll keep fighting to ensure NC kids get fair share of federal funding. https://t.co/E8ItdjKRUa,False,738793867248603137,3,0,0,0
SenatorBurr,Richard Burr,738792271441715200,21157904,en,738792271441715200,2016-06-03T17:59:38.000Z,Had a great time at Robeson County Community College. These nursing students may save your life someday. https://t.co/ONwyFwXXbv,False,738792271441715200,1,0,0,0
SenatorBurr,Richard Burr,738785238923481088,21157904,en,738785238923481088,2016-06-03T17:31:41.000Z,"RT @FAYTECHCC: We enjoyed talking transition tech, federal contracting environment, and prior learning credit with @SenatorBurr! https://t.…",False,738785238923481088,5,0,0,0
SenatorBurr,Richard Burr,738425860852703232,21157904,en,738425860852703232,2016-06-02T17:43:39.000Z,Burr says technology is the key to building the economy via @WWAY @TaylorYakowenko https://t.co/K2NdAc5faD,False,738425860852703232,2,3,3,0
SenatorBurr,Richard Burr,738081529423876096,21157904,en,738081529423876096,2016-06-01T18:55:24.000Z,Congrats to @uncmenslacrosse &amp; @uncwlax! #NationalChamps,False,738081529423876096,4,0,0,0
SenatorBurr,Richard Burr,738080003158626304,21157904,en,738080003158626304,2016-06-01T18:49:20.000Z,RT @VGAgolf: @SenThomTillis @SenatorBurr @RepRichHudson @PatMcCroryNC this is why @VGAgolf is so important to veterans &amp; NC  https://t.co/c…,False,738080003158626304,7,0,0,0
SenatorBurr,Richard Burr,737702147014463488,21157904,en,737702147014463488,2016-05-31T17:47:52.000Z,I spent #MemorialDay remembering the fallen with veterans in Gaston County. Thank you for serving. https://t.co/yX70oCJfIv,False,737702147014463488,4,1,1,0
SenatorBurr,Richard Burr,737352391473799169,21157904,en,737352391473799169,2016-05-30T18:38:04.000Z,This #MemorialDay please take a moment to remember those who gave their lives so that we may live free. https://t.co/aGmkatofHR,False,737352391473799169,20,5,5,0
SenatorBurr,Richard Burr,737307104403292160,21157904,en,737307104403292160,2016-05-30T15:38:06.000Z,This #MemorialDay please take a moment to remember those who gave their lives so that we may live free. https://t.co/oDavIx9kLP,False,737307104403292160,11,4,4,0
SenatorBurr,Richard Burr,737299729592242180,21157904,en,737299729592242180,2016-05-30T15:08:48.000Z,"RT @BrianFox46: @SenatorBurr speaks to veterans during the Gaston County Memorial Day ceremony. ""This is not about a single day"". https://t…",False,737299729592242180,4,0,0,0
SenatorBurr,Richard Burr,737261306068099074,21157904,en,737261306068099074,2016-05-30T12:36:07.000Z,This #MemorialDay please take a moment to remember those who gave their lives so that we may live free. https://t.co/cOtAo9v2n3,False,737261306068099074,26,0,0,0
SenatorBurr,Richard Burr,735514877079519232,21157904,en,735514877079519232,2016-05-25T16:56:26.000Z,Thanks for taking the time to tell me about the important work @ShawUniversity is doing to help students succeed. https://t.co/zEq5oKHRgt,False,735514877079519232,2,5,5,0
SenatorBurr,Richard Burr,735509582601195521,21157904,en,735509582601195521,2016-05-25T16:35:24.000Z,.@BlueStarFamily #MilSpouseStudy shows spouses face high unemployment &amp; underemployment rates. We must do better. https://t.co/iZ8DgyUaiV,False,735509582601195521,11,2,2,0
SenatorBurr,Richard Burr,735487224381378560,21157904,en,735487224381378560,2016-05-25T15:06:33.000Z,This is an important step in the fight to secure weather radar coverage for communities in the Charlotte area https://t.co/JcyEXP9RKq,False,735487224381378560,4,1,1,0
SenatorBurr,Richard Burr,735474350976040960,21157904,en,735474350976040960,2016-05-25T14:15:24.000Z,.@nytimes: Advocates Praise Senate Bill on Sexual Assault Victims’ Rights https://t.co/qEPFPO6wZP,False,735474350976040960,1,0,0,0
SenatorBurr,Richard Burr,735226311308939269,21157904,en,735226311308939269,2016-05-24T21:49:47.000Z,BREAKING: Senate Intelligence Committee Advances FY2017 Authorization Bill https://t.co/TXjHvOXq3m,False,735226311308939269,3,3,3,0
SenatorBurr,Richard Burr,734872121780916225,21157904,en,734872121780916225,2016-05-23T22:22:21.000Z,My statement on passage of bill to reauthorize the national sex offender registry https://t.co/rlRCtAyRp2,False,734872121780916225,4,1,1,0
SenatorBurr,Richard Burr,734833532909060100,21157904,en,734833532909060100,2016-05-23T19:49:01.000Z,Waiting for VA care is not the same as waiting in line to meet Mickey Mouse https://t.co/R4R3N3CKfH,False,734833532909060100,8,12,12,0
SenatorBurr,Richard Burr,734817622429163520,21157904,en,734817622429163520,2016-05-23T18:45:48.000Z,Thank you @SenatorWicker&amp;@SenThadCochran 4 supporting effort to bring perpetrators of civil rights crimes to justice https://t.co/lWseL3lFKm,False,734817622429163520,2,4,4,0
SenatorBurr,Richard Burr,733709547169271808,21157904,en,733709547169271808,2016-05-20T17:22:42.000Z,Here’s The Law We Passed To Help Disabled Americans Work Towards The American Dream #ABLE #ABLE2Work @NDSS @INJO https://t.co/rOBKqOrLvj,False,733709547169271808,15,4,4,0
SenatorBurr,Richard Burr,733664247415201792,21157904,en,733664247415201792,2016-05-20T14:22:42.000Z,RT @INJO: From @SenatorBurr: Here’s The Law We Passed To Help Disabled Americans Work Towards The American Dream https://t.co/ezQxzGHEP3,False,733664247415201792,11,0,0,0
SenatorBurr,Richard Burr,733385688360595456,21157904,en,733385688360595456,2016-05-19T19:55:48.000Z,Keeping our country safe is my top priority and improving military facilities keeps America at the forefront of national security.,False,733385688360595456,3,28,28,0
SenatorBurr,Richard Burr,733385600129241093,21157904,en,733385600129241093,2016-05-19T19:55:27.000Z,I’m proud of North Carolina’s commitment to keeping America safe and I will ensure that our troops have top notch facilities for training.,False,733385600129241093,3,0,0,0
SenatorBurr,Richard Burr,733385462426050562,21157904,en,733385462426050562,2016-05-19T19:54:54.000Z,Maintaining and enhancing our military bases across the state is paramount for military readiness in North Carolina.,False,733385462426050562,2,0,0,0
