handle,name,tweet_id,author_id,lang,replied_to,created_at,tweet_text,possibly_sensitive,conversation_id,retweet_count,reply_count,like_count,quote_count
SenatorBurr,Richard Burr,955826711798706176,21157904,en,955826711798706176,2018-01-23T15:37:01.000Z,RT @SenAlexander: It is critical that we reauthorize #PAHPA before many of its provisions expire in September. I hope we will do this in a…,False,955826711798706176,6,0,0,0
SenatorBurr,Richard Burr,955819591883722754,21157904,en,955819591883722754,2018-01-23T15:08:43.000Z,@GOPHELP @SenAlexander @SenatorIsakson @PattyMurray My opening remarks for today’s @GOPHELP hearing here: https://t.co/yS2pYWqDRq,False,955794846199042050,3,26,26,0
SenatorBurr,Richard Burr,955794846199042050,21157904,en,955794846199042050,2018-01-23T13:30:23.000Z,REMINDER: I'll be chairing the 2nd @GOPHelp Committee hearing this morning at 10am examining our nation's preparedness and response capabilities to 21st century public health threats. Stream the hearing live here: https://t.co/ACv7qBAebL https://t.co/yQDERcRJFr,False,955794846199042050,11,39,39,2
SenatorBurr,Richard Burr,954365532991643648,21157904,en,954365532991643648,2018-01-19T14:50:48.000Z,"@SenThomTillis and I aren't the only ones noticing the benefits of #TaxReform, thousands of employees in North Carolina are too. 

Our Op-Ed via @theobserver: Tax Cuts Are Paying Off in N.C. Already https://t.co/YFaHiWHgnS",False,954365532991643648,14,42,42,2
SenatorBurr,Richard Burr,954062311651758080,21157904,en,954062311651758080,2018-01-18T18:45:55.000Z,RT @SenAlexander: I was glad to have @SenatorBurr’s leadership in chairing today’s health committee hearing on reauthorizing PAPHA—a bill h…,False,954062311651758080,7,0,0,0
SenatorBurr,Richard Burr,953665726530768897,21157904,en,953665726530768897,2018-01-17T16:30:02.000Z,"Senate Intel Committee open hearing is starting, stream live here: https://t.co/NJhK0QU5Cq",False,953665726530768897,13,50,50,2
SenatorBurr,Richard Burr,953644344757583874,21157904,en,953644344757583874,2018-01-17T15:05:04.000Z,@GOPHELP @CDCgov @US_FDA @HHSGov My prepared remarks for today’s @GOPHELP hearing: https://t.co/rtgk7SAyze,False,953641812014452736,3,15,15,1
SenatorBurr,Richard Burr,953641812014452736,21157904,en,953641812014452736,2018-01-17T14:55:00.000Z,"I’m chairing a @GOPHELP Committee hearing on 21st century public health threats and our ability to respond. Follow here live with @CDCGov Dir. of Public Health Prep. &amp; Response, @US_FDA Administrator, and @HHSGov Asst. Sec. for Prep. &amp; Response: https://t.co/SsMCxKh9If",False,953641812014452736,6,19,19,1
SenatorBurr,Richard Burr,953597782023069697,21157904,en,953597782023069697,2018-01-17T12:00:02.000Z,Reminder: Senate Intel Committee will hold an open confirmation hearing today for the Intelligence Community Inspector General and DNI General Counsel nominees. Follow here for witness statements and live streaming starting at 11:30am: https://t.co/NJhK0QU5Cq,False,953597782023069697,24,18,18,1
SenatorBurr,Richard Burr,953420147758333953,21157904,en,953420147758333953,2018-01-17T00:14:11.000Z,I’m very pleased to see the Senate move forward on the consideration of FISA. As I said earlier: “Section 702 is the single most important national security tool we have in the United States.” https://t.co/Da2zIIfqem,False,953420147758333953,22,62,62,4
SenatorBurr,Richard Burr,953391851037446145,21157904,en,953391851037446145,2018-01-16T22:21:45.000Z,"I’m speaking on the Senate floor this evening ahead of the Senate’s consideration of FISA, follow along here: https://t.co/DPX6xUwRW4",False,953391851037446145,8,20,20,2
SenatorBurr,Richard Burr,953347042381836288,21157904,en,953347042381836288,2018-01-16T19:23:41.000Z,I'll be leading a @GOPHELP Committee hearing tomorrow morning at 10am to examine our nation’s preparedness and response to 21st Century public health threats. Follow here for more info and to stream live: https://t.co/SsMCxKyL6P,False,953347042381836288,6,34,34,2
SenatorBurr,Richard Burr,952918301650313216,21157904,en,952918301650313216,2018-01-15T15:00:02.000Z,"Today, we honor Dr. Martin Luther King, Jr. for his tireless efforts in the Civil Rights Movement. I join the rest of the nation in expressing the deepest gratitude for his sacrifices. I know we have work yet to be done and the light of his leadership still shows the way. #MLKDay",False,952918301650313216,21,123,123,6
SenatorBurr,Richard Burr,951893674853531648,21157904,en,951893674853531648,2018-01-12T19:08:32.000Z,"The Senate Intelligence Committee will hold an open confirmation hearing for Michael Atkinson, Intel. Community Inspector General nominee, and Jason Klitenic, DNI General Counsel nominee, next Wed., Jan. 17th. Follow here for more info: https://t.co/NJhK0RbH10",False,951893674853531648,18,61,61,2
SenatorBurr,Richard Burr,951836881423134720,21157904,en,951836881423134720,2018-01-12T15:22:51.000Z,"In today's @WSJ, an Anti-Terror Victory in Congress. Looking forward to passing this critical intelligence tool in the Senate next week: https://t.co/mdoHTfmoTv",False,951836881423134720,8,48,48,2
SenatorBurr,Richard Burr,951507002529808384,21157904,en,951507002529808384,2018-01-11T17:32:02.000Z,"I am pleased by the House passage of legislation to reauthorize Sec. 702 of FISA. These authorities are critical to the Intel Community’s understanding of terrorists, cyber criminals, and foreign intel services. I look forward to Senate consideration of this important legislation",False,951507002529808384,107,213,213,35
SenatorBurr,Richard Burr,951227655264780289,21157904,en,951227655264780289,2018-01-10T23:02:00.000Z,"Great news folks - you can follow me on @Instagram with the same handle, @SenatorBurr. Follow along there for more photos and fewer socks. https://t.co/naoOKMn7iv …",False,951227655264780289,5,53,53,2
SenatorBurr,Richard Burr,950843542364131328,21157904,en,950843542364131328,2018-01-09T21:35:40.000Z,Officers put their lives on the line on a daily basis to protect our communities. I’m always deeply grateful for their service and their sacrifice. #LawEnforcementAppreciationDay https://t.co/94cbcVPz97,False,950843542364131328,14,35,35,2
SenatorBurr,Richard Burr,950117841495355392,21157904,en,950117841495355392,2018-01-07T21:32:00.000Z,"It's a new year, and in the @NFL playoffs, that means everyone is 0-0. The @Panthers take on the @Saints in the Wild Card today on the road to #SuperBowlLII, and I know they're ready to make a run. #KeepPounding #GoPanthers https://t.co/JywUKQ2eJH",False,950117841495355392,8,50,50,1
SenatorBurr,Richard Burr,949644796158730240,21157904,en,949644796158730240,2018-01-06T14:12:17.000Z,Glad to see @SecArmy sworn in yesterday to assume his duties as the 23rd Secretary of the Army. I look forward to working with him to maintain North Carolina’s strong and positive influence on our nation’s defense capabilities. https://t.co/wCLqN6pdRe,False,949644796158730240,9,37,37,1
SenatorBurr,Richard Burr,948694211234115584,21157904,en,948694211234115584,2018-01-03T23:15:00.000Z,"Stay safe tonight and tomorrow, North Carolina. You can get weather alerts and closure notifications here @FayObserver: https://t.co/qNlFGMgEsC",False,948694211234115584,4,40,40,0
SenatorBurr,Richard Burr,948647095547949058,21157904,en,948647095547949058,2018-01-03T20:07:47.000Z,"On Fusion GPS’ @NYTimes op-ed: Our investigation is not complete.  However, given that Fusion seems to have more to say, if Mr. Simpson and Mr. Fritsch would like to return to the Committee for an open hearing, we will certainly entertain such an event.",False,948647095547949058,720,690,690,157
SenatorBurr,Richard Burr,946795449716948992,21157904,en,946795449716948992,2017-12-29T17:30:00.000Z,"With @WakeForest taking on @TAMU in Charlotte, NC today, I think you know where my allegiances lie. #GoDeacs #BeattheAggies @BelkBowl  https://t.co/3zCK00EdhR https://t.co/Y3pgHwaSSo",False,946795449716948992,12,53,53,1
SenatorBurr,Richard Burr,945354307234353152,21157904,en,945354307234353152,2017-12-25T18:03:25.000Z,Wishing a very Merry Christmas to everyone!,False,945354307234353152,19,86,86,3
SenatorBurr,Richard Burr,945025635608616962,21157904,en,945025635608616962,2017-12-24T20:17:23.000Z,Families across the country and at every income level will reap the benefits of #TaxReform. https://t.co/I47C7mJ4WL,False,945025635608616962,53,354,354,28
SenatorBurr,Richard Burr,944301340301328384,21157904,en,944301340301328384,2017-12-22T20:19:18.000Z,RT @82ndABNDiv: Great surprise visit by @DeptofDefense #SecDef Mattis to our Paratroopers here at @FtBraggNC.  The Secretary talked readine…,False,944301340301328384,114,0,0,0
SenatorBurr,Richard Burr,944245510671659008,21157904,en,944245510671659008,2017-12-22T16:37:27.000Z,Proud to have Kevin and Avonte's Law pass the Senate unanimously last night. This bill authorizes key programs to help families of patients with Autism and Alzheimer's reunite in tragic cases where they wander from their caregivers. My statement below: https://t.co/u2rXPrtn1W,False,944245510671659008,12,29,29,3
SenatorBurr,Richard Burr,943556242840186881,21157904,en,943556242840186881,2017-12-20T18:58:33.000Z,"Congratulations to @UNCWBBCoach Sylvia Hatchell on her 1,000th win! She joins just 4 other @NCAA College Basketball Coaches in history to win 1,000 games. Thank you for your dedication to @UNC's student-athletes for more than 30 years. #Hatchell1k https://t.co/DOnqD0BLEg",False,943556242840186881,22,37,37,1
SenatorBurr,Richard Burr,943508143216218112,21157904,en,943508143216218112,2017-12-20T15:47:25.000Z,"RT @SenateGOP: “This is good news for the American people, and we’re going to get the economy roaring back again, and improve pay, and incr…",False,943508143216218112,104,0,0,0
SenatorBurr,Richard Burr,943480339741233153,21157904,en,943480339741233153,2017-12-20T13:56:56.000Z,From my hometown paper: Winston-Salem @JournalNow: Tax Bill Would Enhance Savings Options for Parents of Disabled Children https://t.co/1Tez95YU0h,False,943480339741233153,13,146,146,7
SenatorBurr,Richard Burr,942767423392043008,21157904,en,942767423392043008,2017-12-18T14:44:04.000Z,"So proud of Amy Wright's @bittyandbeaus Coffee Shop of Wilmington, NC - Amy is your 2017 @CNNHeroes of the Year! I've been there a number of times, and I'm thrilled for her and her family, congratulations! https://t.co/wR9cVpAMvR",False,942767423392043008,13,48,48,2
SenatorBurr,Richard Burr,941691378119135232,21157904,en,941691378119135232,2017-12-15T15:28:14.000Z,"During my talk last week in North Carolina, I also had the chance to speak about the importance of reauthorizing the Foreign Intelligence Surveillance Act (FISA), which ""is absolutely essential to fulfill our obligations"" of keeping America safe. https://t.co/09OnWzpEaF",False,941691378119135232,9,103,103,2
SenatorBurr,Richard Burr,941397054328360961,21157904,en,941397054328360961,2017-12-14T19:58:42.000Z,"I sat down in North Carolina last week to talk about of number of issues, including the #TaxReform currently under consideration - ""We want people to invest in the future"" https://t.co/nvxcbUBLKG",False,941397054328360961,12,219,219,9
SenatorBurr,Richard Burr,940699283711410178,21157904,en,940699283711410178,2017-12-12T21:46:01.000Z,"Very pleased to see #NDAA signed into law today. This bill gives our troops the pay increase they deserve and provides nearly $300 million in funding for North Carolina's military bases at Camp Lejeune, Cherry Point, and Seymour Johnson Air Force Base. https://t.co/uhZh3x3cma",False,940699283711410178,18,54,54,2
SenatorBurr,Richard Burr,939206128252145664,21157904,en,939206128252145664,2017-12-08T18:52:45.000Z,The alternative minimum tax is unfair and adds unnecessary complexity to our tax code.  It must be repealed to bring tax relief to the millions of Americans who need it. https://t.co/3UL1Os0dWx,False,939206128252145664,16,163,163,5
SenatorBurr,Richard Burr,938817372701552640,21157904,en,938817372701552640,2017-12-07T17:07:58.000Z,"76 years ago today the U.S. was attacked at #PearlHarbor, in what Pres. Roosevelt described as ""a date which will live in infamy.” Today, we remember those who sacrificed their lives defending our nation, and honor their memory by continuing to strive for American liberty. https://t.co/RgHDuqDFdp",False,938817372701552640,9,34,34,2
SenatorBurr,Richard Burr,938768410208546817,21157904,en,938768410208546817,2017-12-07T13:53:25.000Z,Glad to see @EPA taking seriously the issue of dangerous chemicals like GenX in an effort to ensure folks across the country have clean and safe drinking water. https://t.co/X5jToPW4bh,False,938768410208546817,7,41,41,2
SenatorBurr,Richard Burr,938528202745630722,21157904,en,938528202745630722,2017-12-06T21:58:55.000Z,"This problem isn’t new, but I don’t think we’ve kept Russia focused as the threat. There was once a time where 70% of folks working in the intelligence community were educated in Russian, that's not the case today as you can well imagine. https://t.co/BhmP8kpbQx",False,938528202745630722,125,102,102,21
SenatorBurr,Richard Burr,938466025544343553,21157904,en,938466025544343553,2017-12-06T17:51:51.000Z,I'm speaking live now with @SangerNYT at the @CFR_org https://t.co/YDJltDpOis https://t.co/tmC2zYJTd1,False,938466025544343553,5,23,23,0
SenatorBurr,Richard Burr,938415204622327810,21157904,en,938415204622327810,2017-12-06T14:29:54.000Z,RT @CFR_org: Today we welcome @SenatorBurr for a discussion on the cybersecurity threats to democracies with @SangerNYT. Watch LIVE at 12:4…,False,938415204622327810,6,0,0,0
SenatorBurr,Richard Burr,938170681111580672,21157904,en,938170681111580672,2017-12-05T22:18:15.000Z,"""I'm very encouraged to see Kirstjen Nielsen confirmed today to be the Secretary of @DHSgov... I look forward to working with her in the coming years to keep America and her citizens safe as we face an increasingly large and troubling range of threats.”
https://t.co/NbxF5oyYS2 https://t.co/hFfmBFGBsS",False,938170681111580672,9,70,70,2
SenatorBurr,Richard Burr,937785950972862466,21157904,en,937785950972862466,2017-12-04T20:49:28.000Z,"RT @SenThomTillis: The @washingtonpost story on NC #taxreform completely misses the mark. #ncpol

4 yrs since tax reform:
Jobs: ⬆️360,000+…",False,937785950972862466,84,0,0,0
SenatorBurr,Richard Burr,936359189693325312,21157904,en,936359189693325312,2017-11-30T22:20:02.000Z,"The #TaxCutsandJobsAct doubles the standard deduction, doubles the child tax credit, and lowers rates across the board. The time for #TaxReform is now. https://t.co/NTcm84Bkqy",False,936359189693325312,30,751,751,54
SenatorBurr,Richard Burr,936356667511341057,21157904,en,936356667511341057,2017-11-30T22:10:00.000Z,America will see real economic growth with the #TaxCutsandJobsAct. Nearly a million more jobs and close to 4% economic growth is not something we can afford to pass up. #TaxReform https://t.co/NVCmYnTOjG,False,936356667511341057,10,318,318,29
SenatorBurr,Richard Burr,936354163235131393,21157904,en,936354163235131393,2017-11-30T22:00:03.000Z,"The numbers are cut and dry, lower- and middle-income individuals will play less federal taxes under the #TaxCutsandJobsAct. We have to give these families the relief they so desperately need. #TaxReform https://t.co/RQJmkKAygK",False,936354163235131393,11,278,278,33
SenatorBurr,Richard Burr,936341574929338368,21157904,en,936341574929338368,2017-11-30T21:10:02.000Z,Had a great talk with His Majesty King Abdullah II of Jordan and several other members of the Senate Intelligence Committee yesterday afternoon. https://t.co/0ToPBQVYm0,False,936341574929338368,8,62,62,3
SenatorBurr,Richard Burr,936273158323232771,21157904,en,936273158323232771,2017-11-30T16:38:10.000Z,"Looks like someone decorated The Thing for my birthday. Maybe these decorations will help hold it together for another year. Plus, I sure do appreciate the snack. It might be a long one in the Capitol tonight. https://t.co/Tzqjfu2mPV",False,936273158323232771,21,78,78,12
SenatorBurr,Richard Burr,935938575065079808,21157904,en,935938575065079808,2017-11-29T18:28:39.000Z,"After 48 long days and overwhelming poll results, The Thing finally got some sunshine yesterday. She really enjoyed the fresh air. https://t.co/XzzqH5puDi",False,930792230058676224,11,54,54,8
SenatorBurr,Richard Burr,935600434718310400,21157904,en,935600434718310400,2017-11-28T20:05:00.000Z,"I've introduced legislation, along with Senators @KamalaHarris, @AmyKlobuchar, and @RepSpeier, that would make sharing explicit content without the consent of those involved a federal crime. Enough is enough. 

https://t.co/2sZmMJwPoS",False,935600434718310400,15,36,36,3
SenatorBurr,Richard Burr,935575019270344705,21157904,en,935575019270344705,2017-11-28T18:24:01.000Z,The #TaxCutsandJobsAct brings relief to all income levels - via @IBDeditorials: The Latest Tax Cut Lie: The Senate Bill Will Hurt The Poor https://t.co/xgyCmMzKK9,False,935575019270344705,12,191,191,7
SenatorBurr,Richard Burr,935555009848250369,21157904,en,935555009848250369,2017-11-28T17:04:30.000Z,via @TheHill: Multiple State Treasurers Agree - Congress Should Pass Commonsense ABLE to Work Act to Empower Individuals with Disabilities https://t.co/qbfba5gnJP,False,935555009848250369,4,31,31,2
SenatorBurr,Richard Burr,935256140514021381,21157904,en,935256140514021381,2017-11-27T21:16:54.000Z,"@GOPSenFinance The average family of four will see a $2,200 per year tax cut, which represents a nearly 60 PERCENT reduction. These savings are vital to getting Americans back on their feet and getting the economy growing again. #TaxCutsandJobsAct #TaxReform https://t.co/tNjki9gMhl",False,935251157907312640,7,120,120,8
SenatorBurr,Richard Burr,935253846745604099,21157904,en,935253846745604099,2017-11-27T21:07:47.000Z,"@GOPSenFinance Individuals and families in literally every income bracket will receive relief under the #TaxCutsandJobsAct and by doubling the standard deduction, the zero tax bracket is expanded, reducing or eliminating federal income taxes for millions of Americans. #TaxReform https://t.co/mbezYpQMpA",False,935251157907312640,17,94,94,8
SenatorBurr,Richard Burr,935251157907312640,21157904,en,935251157907312640,2017-11-27T20:57:06.000Z,I'm excited to get back to work this week on the Senate's historic opportunity to reform our tax code. The #TaxCutsandJobsAct will bring relief to millions of middle-class Americans who deserve to keep more of their hard-earned dollars. #TaxReform @GOPSenFinance,False,935251157907312640,8,317,317,30
SenatorBurr,Richard Burr,933708757292539921,21157904,en,933708757292539921,2017-11-23T14:48:09.000Z,"I’m thankful today for our country’s service members serving all across the world, away from their families, keeping America safe. We wouldn’t be able to celebrate today without their incredible sacrifices. Happy Thanksgiving to all! #HappyThanksgiving2017",False,933708757292539921,17,71,71,3
SenatorBurr,Richard Burr,933054757861765120,21157904,en,933054757861765120,2017-11-21T19:29:24.000Z,"Happy 228th Birthday to the State of North Carolina! On November 21,1789, North Carolina ratified the Constitution and joined the Union. I, for one, am glad they did. https://t.co/ql2rln5wQi",False,933054757861765120,36,57,57,5
SenatorBurr,Richard Burr,933026742649982977,21157904,en,933026742649982977,2017-11-21T17:38:04.000Z,"So proud to see TEN North Carolina Universities make the list of @MilitaryTimes' 218 Best Colleges of 2018. Very thankful for all of the great universities throughout our State!

https://t.co/lHghHi59fh",False,933026742649982977,4,22,22,1
SenatorBurr,Richard Burr,932721933937934336,21157904,en,932721933937934336,2017-11-20T21:26:52.000Z,"@SenatorBurr, @McCaskillOffice Aim to Close Health Care Law Loophole with Bipartisan Bill: 

https://t.co/45RcEhjgGt https://t.co/qsoD4UPtNQ",False,932721933937934336,8,46,46,7
SenatorBurr,Richard Burr,931593857200021506,21157904,en,931593857200021506,2017-11-17T18:44:18.000Z,"I'm excited by @GOPSenFinance's progress last night by passing the #TaxCutsAndJobsAct. This bill is a historic opportunity to help Americans across the country save their hard-earned money. 

https://t.co/5RGW5OQQib https://t.co/XlVEDepviK",False,931593857200021506,18,385,385,45
SenatorBurr,Richard Burr,930882631239127045,21157904,en,930882631239127045,2017-11-15T19:38:08.000Z,RT @SenToomey: @GOPSenFinance Non-partisan @jctgov confirms: The @GOPSenFinance Tax Cuts and Jobs Act makes no changes to health care progr…,False,930882631239127045,12,0,0,0
SenatorBurr,Richard Burr,930882386505674753,21157904,en,930882386505674753,2017-11-15T19:37:10.000Z,"via @WashTimes: GOP Senators: Dems Can Help Us Make Individual Tax Cuts Permanent
https://t.co/1B4frw1k3M",False,930882386505674753,5,51,51,2
SenatorBurr,Richard Burr,930882002471079936,21157904,en,930882002471079936,2017-11-15T19:35:38.000Z,"A great sign to see @NFIB endorsing the Senate's modified tax legislation:
https://t.co/Ht1s5PBQBt https://t.co/O3NWB5ZxVJ",False,930882002471079936,6,41,41,1
SenatorBurr,Richard Burr,930792230058676224,21157904,en,930792230058676224,2017-11-15T13:38:55.000Z,It’s been a few weeks since I’ve driven The Thing. Should I take her for a spin today?,False,930792230058676224,7,120,120,16
SenatorBurr,Richard Burr,930472361836630024,21157904,en,930472361836630024,2017-11-14T16:27:53.000Z,North Carolinians are the winners with the Senate's #TaxReform legislation. The numbers are cut and dry. @GOPSenFinance #TaxCutsAndJobsAct https://t.co/Qr5PBxPZJB,False,930472361836630024,11,185,185,17
SenatorBurr,Richard Burr,930140327985467394,21157904,en,930140327985467394,2017-11-13T18:28:30.000Z,"RT @SenateGOP: Tax relief for middle-income Americans, families, and small businesses is on the way with the Tax Cuts &amp; Jobs Act. #TaxRefor…",False,930140327985467394,26,0,0,0
SenatorBurr,Richard Burr,930129635672842241,21157904,en,930129635672842241,2017-11-13T17:46:00.000Z,"Via @TheHill: Analysis: All Income Groups Would See Tax Cuts Under Senate Bill
https://t.co/DDk06xc9cd",False,930129635672842241,4,64,64,1
SenatorBurr,Richard Burr,930124601757073410,21157904,en,930124601757073410,2017-11-13T17:26:00.000Z,"Via @Politico: Middle Class Biggest Winners in Senate Tax Plan, Study Says
https://t.co/eUN4tZ1WpM",False,930124601757073410,15,99,99,4
SenatorBurr,Richard Burr,930119463097323520,21157904,en,930119463097323520,2017-11-13T17:05:35.000Z,"According to the @TaxFoundation, North Carolina adds more than 27,000 jobs and the average middle-income family saves roughly $2,300. #TaxReform
https://t.co/mmGEkIkUKB",False,930119463097323520,9,66,66,0
SenatorBurr,Richard Burr,929363099999784970,21157904,en,929363099999784970,2017-11-11T15:00:04.000Z,"This Veterans Day, we pause to thank the approximately 20 million men and women who have served in our armed forces, from every corner of America and every service branch. Today, I join a grateful nation when I say ""thank you"" to our veterans and their families. https://t.co/0daSPworf4",False,929363099999784970,23,44,44,1
SenatorBurr,Richard Burr,928985599712907264,21157904,en,928985599712907264,2017-11-10T14:00:01.000Z,"Happy 242nd Birthday to the U.S. Marine Corps! Thank you to all the Marines who have served. I couldn't be prouder of this Marine, our Defense Fellow who has been with us this year. After 24 years, Jason has been selected as a Master Gunnery Sergeant. Congratulations! #SemperFi https://t.co/ZJrjvnAesY",False,928985599712907264,12,11,11,1
SenatorBurr,Richard Burr,928676064007659520,21157904,en,928676064007659520,2017-11-09T17:30:02.000Z,"I was a day ahead, but I was ready for #NationalScrappleDay with this tie: https://t.co/lMowwrAXdl",False,928676064007659520,11,39,39,9
SenatorBurr,Richard Burr,928646758833573888,21157904,en,928646758833573888,2017-11-09T15:33:35.000Z,"#TBT to the Halloween Dog Costume Contest. I don't care what anyone says, #TeamBurr pups Daenerys and John Snow were the winners in my book. https://t.co/MCPQ9k8utv",False,928646758833573888,7,27,27,4
SenatorBurr,Richard Burr,928285428515516418,21157904,en,928285428515516418,2017-11-08T15:37:47.000Z,via @NSJNews: Ground broken for veterans life center in Butner - Senator Richard Burr: “Global War on Terror veterans have seen the worst of humanity. Initiatives like this ... create as many new opportunities for them as we could ever imagine.” https://t.co/3OzdVgM7Ne,False,928285428515516418,7,18,18,1
SenatorBurr,Richard Burr,928002180614942720,21157904,en,928002180614942720,2017-11-07T20:52:15.000Z,"""Senate Dems should be ashamed. Let's move the President's nominees so our government can fully function."" (3/3)",False,928001387702771712,6,106,106,6
SenatorBurr,Richard Burr,928001941061406721,21157904,en,928001941061406721,2017-11-07T20:51:18.000Z,"""Since position was created, Senate has approved it by voice vote...longer Def. Dept. waits for full staff, more our military suffers..(2/3)",False,928001387702771712,2,8,8,2
SenatorBurr,Richard Burr,928001691831689216,21157904,en,928001691831689216,2017-11-07T20:50:19.000Z,"""Senate Dems, still reeling from their 2016 loss, are forcing roll call votes on qualified nominees like Gibson...(1/3)",False,928001387702771712,2,27,27,2
SenatorBurr,Richard Burr,928001387702771712,21157904,en,928001387702771712,2017-11-07T20:49:06.000Z,"My statement after today's first-ever roll call vote for the Dep. Chief Mgmt. Off. of Dept. of Def., John Gibson: https://t.co/6K8viTHzxZ)",False,928001387702771712,3,17,17,3
SenatorBurr,Richard Burr,927898539765714944,21157904,en,927898539765714944,2017-11-07T14:00:26.000Z,One of North Carolina's own has been nominated as one of the Top 10 @CNNHeroes of 2017! Couldn't be prouder of them! https://t.co/DOvM15bz9B,False,927898539765714944,8,17,17,0
