handle,name,tweet_id,author_id,lang,replied_to,created_at,tweet_text,possibly_sensitive,conversation_id,retweet_count,reply_count,like_count,quote_count
SenatorBurr,Richard Burr,562764789089193984,21157904,en,562764789089193984,2015-02-04T00:09:16.000Z,"Today a local Winston hero, Bill Rachui of the “Devil’s Brigade,” was honored with a Congressional Medal: http://t.co/OjVrOTkiAy",False,562764789089193984,4,0,0,0
SenatorBurr,Richard Burr,562761113595809796,21157904,en,562761113595809796,2015-02-03T23:54:39.000Z,ICYMI: You can watch my interview w/@WolfBlitzer here: http://t.co/8jeYdlWl4O #ISIS #ISIL,False,562761113595809796,3,2,2,0
SenatorBurr,Richard Burr,562734318670577665,21157904,en,562734318670577665,2015-02-03T22:08:11.000Z,On set with @WolfBlitzer tonight -- I'll be on a little after 5pm discussing the breaking news re: recent terror acts http://t.co/RffSxBNsbw,False,562734318670577665,2,2,2,0
SenatorBurr,Richard Burr,562725159132737537,21157904,en,562725159132737537,2015-02-03T21:31:47.000Z,I’ll be joining @WolfBlitzer today at 5pm on @CNNSitRoom – tune in. #ISIL #ISIS,False,562725159132737537,1,3,3,0
SenatorBurr,Richard Burr,562722041879867392,21157904,en,562722041879867392,2015-02-03T21:19:24.000Z,RT @wolfblitzer: Intelligence Chairman @SenatorBurr joins me live today in @CNNSitRoom to discuss where US war against #ISIS goes next. 5-7…,False,562722041879867392,40,0,0,0
SenatorBurr,Richard Burr,562721792033562624,21157904,en,562721792033562624,2015-02-03T21:18:24.000Z,The suicide rate among veterans is tragically high. My bill modernizes programs that help them. http://t.co/NEqfcgjUuw,False,562721792033562624,5,1,1,0
SenatorBurr,Richard Burr,562720367102681088,21157904,en,562720367102681088,2015-02-03T21:12:45.000Z,This legislation is big step in the right direction to fulfill our nation's promise to its veterans. http://t.co/NEqfcgjUuw,False,562720367102681088,2,1,1,0
SenatorBurr,Richard Burr,562720294755110915,21157904,en,562720294755110915,2015-02-03T21:12:27.000Z,"Today, my legislation w/Senators McCain and Isakson, the Clay Hunt SAV Act, passed the Senate unanimously. http://t.co/NEqfcgjUuw",False,562720294755110915,2,1,1,0
SenatorBurr,Richard Burr,562645917799817217,21157904,en,562645917799817217,2015-02-03T16:16:54.000Z,I hope that my colleagues will swiftly pass this commonsense legislation after POTUS’s recent attempt to kill this popular program.,False,562645917799817217,4,3,3,0
SenatorBurr,Richard Burr,562645849571078145,21157904,en,562645849571078145,2015-02-03T16:16:38.000Z,I won’t let that happen. I intro’d a new bill w/a group of bipartisan Senators to strengthen to these accounts. http://t.co/6GtV0TXLJI,False,562645849571078145,3,2,2,0
SenatorBurr,Richard Burr,562645819548241920,21157904,en,562645819548241920,2015-02-03T16:16:31.000Z,"Last week, POTUS proposed killing a college savings plan that many NC families use to save for their kid’s education. http://t.co/ZmzRgxfXKd",False,562645819548241920,2,6,6,0
SenatorBurr,Richard Burr,562339765413224448,21157904,en,562339765413224448,2015-02-02T20:00:22.000Z,$2.1 tril in new taxes and POTUS’s budget NEVER balances. Unbelievable. What good is a budget if it’s just a wish list of expenditures?,False,562339765413224448,10,7,7,1
SenatorBurr,Richard Burr,562318966446882816,21157904,en,562318966446882816,2015-02-02T18:37:43.000Z,It must be Groundhog Day – another tax and spend budget from POTUS #Budget2015 #GroundhogDay http://t.co/2KhjIlpz98,False,562318966446882816,9,3,3,0
SenatorBurr,Richard Burr,560922379468406784,21157904,en,560922379468406784,2015-01-29T22:08:11.000Z,Our report asks a simple but critical question – how can we do it better? http://t.co/EEigx7avK4 #HealthierAmericans,False,560922379468406784,4,2,2,0
SenatorBurr,Richard Burr,560921952966443008,21157904,en,560921952966443008,2015-01-29T22:06:29.000Z,RT @autismspeaks: Thank you @SenatorBurr and @SenAlexander for your “Innovation for Healthier Americans” Report! http://t.co/pZknbBe39s,False,560921952966443008,6,0,0,0
SenatorBurr,Richard Burr,560905015036891136,21157904,en,560905015036891136,2015-01-29T20:59:11.000Z,Today @SenAlexander and I introduced our “Innovation for #HealthierAmericans” report: http://t.co/byjqGHqWz3,False,560905015036891136,6,1,1,0
SenatorBurr,Richard Burr,560896826891464704,21157904,en,560896826891464704,2015-01-29T20:26:39.000Z,Today’s vote was a strong statement that a majority of the Senate supports the #LWCF. I will continue to champion this self-funded program.,False,560896826891464704,10,3,3,0
SenatorBurr,Richard Burr,560863768242966528,21157904,en,560863768242966528,2015-01-29T18:15:17.000Z,RT @InHealthPolicy: Breaking News: @SenAlexander Launches Senate Version Of 'Cures' Initiative. Read report @InHealthPolicy http://t.co/iLD…,False,560863768242966528,8,0,0,0
SenatorBurr,Richard Burr,560863731932884992,21157904,en,560863731932884992,2015-01-29T18:15:08.000Z,TUNE IN: @SenAlexander and I are discussing our “Innovation for #HealthierAmericans” report on Senate floor http://t.co/xNT4kSmhlz,False,560863731932884992,6,0,0,0
SenatorBurr,Richard Burr,560521005048029184,21157904,en,560521005048029184,2015-01-28T19:33:16.000Z,Last night I took to the floor to talk about my #LWCF amdt to permanently reauthorize the program: http://t.co/84IJZYrGSD,False,560521005048029184,13,2,2,0
SenatorBurr,Richard Burr,560219256978026496,21157904,en,560219256978026496,2015-01-27T23:34:13.000Z,What do teachers and administrators think about fixing No Child Left Behind? http://t.co/24yhHFDGNU,False,560219256978026496,8,6,6,0
SenatorBurr,Richard Burr,560199327906537472,21157904,en,560199327906537472,2015-01-27T22:15:02.000Z,"I spoke with educators, administrators, &amp; experts in the Ed. field during a Senate hearing today about fixing #NCLB http://t.co/PuuW0OAZfJ",False,560199327906537472,1,0,0,0
SenatorBurr,Richard Burr,558679845270736896,21157904,en,558679845270736896,2015-01-23T17:37:09.000Z,"RT @Senate_GOPs: One year in Dem-led Senate = 15 amdt votes.

Three weeks into new GOP majority = 25 amdt votes. http://t.co/ai7yoVfS7W",False,558679845270736896,53,0,0,0
SenatorBurr,Richard Burr,558354923742834688,21157904,en,558354923742834688,2015-01-22T20:06:02.000Z,Today I offered an amdt to permanently authorize #LWCF: awb://1.usa.gov/1Exo00l #LWCF helps protect our nation’s scenic treasures,False,558354923742834688,10,0,0,0
SenatorBurr,Richard Burr,558331648060977153,21157904,en,558331648060977153,2015-01-22T18:33:32.000Z,RT @LWCFCOALITION: THANK YOU @SenatorBurr for filing Amendment (S.A. 92) for permanent reauthorization of #LWCF! We know you care about #NC…,False,558331648060977153,8,0,0,0
SenatorBurr,Richard Burr,558327521193000960,21157904,en,558327521193000960,2015-01-22T18:17:08.000Z,Great speaking to @marthamaccallum on @AmericaNewsroom this morning: http://t.co/9wadknz9d6,False,558327521193000960,2,0,0,0
SenatorBurr,Richard Burr,558030553501274112,21157904,en,558030553501274112,2015-01-21T22:37:06.000Z,"This is one way to help families stretch their $ further, whether it's care for their kids or their elderly parents: http://t.co/rhUXLZEL9C",False,558030553501274112,3,0,0,0
SenatorBurr,Richard Burr,558017394145120256,21157904,en,558017394145120256,2015-01-21T21:44:48.000Z,I introduced new legislation to empower American families to better meet their child care needs: http://t.co/rhUXLZEL9C,False,558017394145120256,5,2,2,0
SenatorBurr,Richard Burr,558011428318097409,21157904,en,558011428318097409,2015-01-21T21:21:06.000Z,"The Older Americans Act supports important programs for seniors, like Meals on Wheels: http://t.co/WKYDEayWWe #OAA",False,558011428318097409,8,3,3,0
SenatorBurr,Richard Burr,558004881433190400,21157904,en,558004881433190400,2015-01-21T20:55:05.000Z,Proud to cosponsor legislation that ensures over 12 million seniors receive the services they rely on: http://t.co/WKYDEayWWe #OAA,False,558004881433190400,3,0,0,0
SenatorBurr,Richard Burr,557987495392997376,21157904,en,557987495392997376,2015-01-21T19:46:00.000Z,ICYMI: My reaction to #SOTU -- POTUS has missed his opportunity to move forward with this Congress. http://t.co/dMllijIy6C,False,557987495392997376,1,4,4,0
SenatorBurr,Richard Burr,557680259668008960,21157904,en,557680259668008960,2015-01-20T23:25:09.000Z,Thanks to @loudobbsnews and @FoxBusiness for having me on last night! You can watch the interview here: http://t.co/ve8Jz7hJmx,False,557680259668008960,3,0,0,0
SenatorBurr,Richard Burr,557666791154274304,21157904,en,557666791154274304,2015-01-20T22:31:38.000Z,Joined @jimsciutto on @CNNsotu this past Sunday – watch here: http://t.co/PbQn9TzwpP,False,557666791154274304,2,1,1,0
SenatorBurr,Richard Burr,555148370936102916,21157904,en,555148370936102916,2015-01-13T23:44:20.000Z,RT @TheLeadCNN: .@SenatorBurr: Paris style attacks could become weekly event in western countries http://t.co/OqoNYT4DUA #TheLead http://t.…,False,555148370936102916,13,0,0,0
SenatorBurr,Richard Burr,554997857531727873,21157904,en,554997857531727873,2015-01-13T13:46:15.000Z,"RT @SenateRadioTV: Today at Noon: @KellyAyotte, @GrahamBlog, @SenJohnMcCain, and @SenatorBurr hold a press conference in our studio to disc…",False,554997857531727873,5,0,0,0
SenatorBurr,Richard Burr,554728842485837824,21157904,en,554728842485837824,2015-01-12T19:57:17.000Z,“We’ve got to collectively do our best to make sure we thwart those attacks.” w/ @GStephanopoulos yesterday. http://t.co/19aGotNqIs,False,554728842485837824,3,21,21,0
SenatorBurr,Richard Burr,554705739877711872,21157904,en,554705739877711872,2015-01-12T18:25:28.000Z,“It doesn’t matter which terrorist group we insert into the blank… they’re out to kill innocent ppl” – on #ThisWeek http://t.co/19aGotNqIs,False,554705739877711872,11,1,1,0
SenatorBurr,Richard Burr,554038238717816832,21157904,en,554038238717816832,2015-01-10T22:13:04.000Z,I'll be joining @GStephanopoulos tomorrow morning on #ThisWeek -- tune in at 9am. http://t.co/rvuPCwg8uj,False,554038238717816832,5,2,2,0
SenatorBurr,Richard Burr,554015889251504129,21157904,en,554015889251504129,2015-01-10T20:44:15.000Z,Thanks to @BillLuMaye for having me on his show last night to discuss the terror attacks in France: http://t.co/Gl8LKxZUys,False,554015889251504129,2,0,0,0
SenatorBurr,Richard Burr,554008489576890368,21157904,en,554008489576890368,2015-01-10T20:14:51.000Z,RT @ThisWeekABC: What is being done to prevent attacks in the U.S. like the ones we saw in Paris? Senate intel head @SenatorBurr weighs in …,False,554008489576890368,3,0,0,0
SenatorBurr,Richard Burr,554008088039419905,21157904,en,554008088039419905,2015-01-10T20:13:15.000Z,"If you missed me on @CNNSitRoom last night, you can watch the full interview here: http://t.co/SEazklI1gP #ParisShooting",False,554008088039419905,4,0,0,0
SenatorBurr,Richard Burr,553680422349979648,21157904,en,553680422349979648,2015-01-09T22:31:14.000Z,"I’ll be joining @BillLuMaye tonight at 5:45pm – Raleigh area, tune in to 850 AM. Also you can listen here: http://t.co/bEzyzWYVNw",False,553680422349979648,2,0,0,0
SenatorBurr,Richard Burr,553670028789571585,21157904,en,553670028789571585,2015-01-09T21:49:56.000Z,RT @wolfblitzer: Senate Intelligence Chairman @SenatorBurr joins me live to discuss latest #ParisShooting developments. @CNNSitRoom 5-7PM ET,False,553670028789571585,15,0,0,0
SenatorBurr,Richard Burr,553564414746845184,21157904,en,553564414746845184,2015-01-09T14:50:15.000Z,Spoke w/ @BoyumTWCnews earlier in the week about my new role as Chairman &amp; my thoughts about the coming year: http://t.co/9uqloSRCwN,False,553564414746845184,3,2,2,0
SenatorBurr,Richard Burr,553314257572737024,21157904,en,553314257572737024,2015-01-08T22:16:13.000Z,"As Chairman, it will be my job to ask the tough and probing questions and I intend to do just that.",False,553314257572737024,6,8,8,0
SenatorBurr,Richard Burr,553311377713283072,21157904,en,553311377713283072,2015-01-08T22:04:47.000Z,I’ve officially been named Chairman of the U.S. Senate Select Committee on Intelligence. http://t.co/7FcyCGzRkh,False,553311377713283072,33,18,18,0
SenatorBurr,Richard Burr,553254081536745473,21157904,en,553254081536745473,2015-01-08T18:17:06.000Z,Joined my colleagues @SenAlexander and @SenBennetCO to simplify the FASFA form to 2 simple questions – more here: http://t.co/MSHJ2gqXQF,False,553254081536745473,13,2,2,0
SenatorBurr,Richard Burr,553240987766906881,21157904,en,553240987766906881,2015-01-08T17:25:04.000Z,It’s time to #fixthemaze -- @SenAngusKing and I reintroduced our leg. to reform student loan repayment programs: http://t.co/B9nJNMnKt9,False,553240987766906881,5,1,1,0
SenatorBurr,Richard Burr,553231117906878464,21157904,en,553231117906878464,2015-01-08T16:45:51.000Z,Reintroduced my legislation w/ @SenAngusKing to reform student loan repayment programs – read about it here: http://t.co/B9nJNMnKt9,False,553231117906878464,7,1,1,0
SenatorBurr,Richard Burr,553214964031578113,21157904,en,553214964031578113,2015-01-08T15:41:40.000Z,“We will have a massive intelligence community response” - spoke w/ @BretBaier about the attack on Charlie Hebdo: http://t.co/nhBHd0Fwn8,False,553214964031578113,3,2,2,0
SenatorBurr,Richard Burr,553207015259258880,21157904,en,553207015259258880,2015-01-08T15:10:05.000Z,Last night I joined @WolfBlitzer on @CNNSitRoom and discussed the attack on Charlie Hebdo: http://t.co/U630kgIcNd,False,553207015259258880,4,3,3,0
SenatorBurr,Richard Burr,552963466328559617,21157904,en,552963466328559617,2015-01-07T23:02:18.000Z,Bret Baier and I discussed the needless violence that took place in France today – tune in to Fox during the 6pm hour.,False,552963466328559617,2,2,2,0
SenatorBurr,Richard Burr,552951461127389184,21157904,en,552951461127389184,2015-01-07T22:14:36.000Z,I’ll be joining Wolf Blitzer on CNN tonight to discuss the terrorist attack on Charlie Hebdo. Tune in: http://t.co/m8xq9m97g7,False,552951461127389184,5,2,2,0
SenatorBurr,Richard Burr,552869807432146944,21157904,en,552869807432146944,2015-01-07T16:50:08.000Z,Our intelligence community will work with our partners around the world to find those who planned and carried out this attack.,False,552869807432146944,4,2,2,0
SenatorBurr,Richard Burr,552869753786994690,21157904,en,552869753786994690,2015-01-07T16:49:55.000Z,My thoughts &amp; prayers are with the victims &amp; families affected by the attack on Charlie Hebdo. This terrorist attack will not go unanswered.,False,552869753786994690,8,1,1,0
SenatorBurr,Richard Burr,552214962245238784,21157904,en,552214962245238784,2015-01-05T21:28:01.000Z,Stuart Scott has made Winston Salem and UNC proud and will be missed by many. He and his family are in my thoughts and prayers.,False,552214962245238784,9,3,3,0
SenatorBurr,Richard Burr,548129790700814337,21157904,en,548129790700814337,2014-12-25T14:55:00.000Z,"From my family to yours, we hope you have a safe and Merry Christmas and best wishes for a Happy New Year",False,548129790700814337,3,5,5,0
SenatorBurr,Richard Burr,543484818647171072,21157904,en,543484818647171072,2014-12-12T19:17:32.000Z,Yesterday Sen Casey &amp; I joined our colleagues from both sides of the capital at a press conference on #ABLEact http://t.co/Zgnq7aSnYS,False,543484818647171072,7,4,4,0
SenatorBurr,Richard Burr,543133052403458048,21157904,en,543133052403458048,2014-12-11T19:59:45.000Z,Yesterday I joined @BillLuMaye and discussed the Intel Report: http://t.co/Pv1VgzntnL,False,543133052403458048,3,1,1,0
SenatorBurr,Richard Burr,542747422590779392,21157904,en,542747422590779392,2014-12-10T18:27:23.000Z,You can see a summary of intel gained on pages 96 and 97 of the Minority View: http://t.co/acRtW96qqD,False,542747422590779392,2,3,3,0
SenatorBurr,Richard Burr,542745157284937728,21157904,en,542745157284937728,2014-12-10T18:18:23.000Z,The intelligence gained from the program helped us identify and capture important al-Qa’ida terrorists and disrupt their ongoing plotting.,False,542745157284937728,11,2,2,0
SenatorBurr,Richard Burr,542744036701126656,21157904,en,542744036701126656,2014-12-10T18:13:56.000Z,Bottom line: the CIA’s Detention and Interrogation Program developed significant intelligence. http://t.co/acRtW96qqD,False,542744036701126656,6,5,5,0
SenatorBurr,Richard Burr,542700116977917953,21157904,en,542700116977917953,2014-12-10T15:19:25.000Z,On this recent report: “The Senate's Intelligence Committee staff chose to interview no one.” http://t.co/z4FUyuU6tI,False,542700116977917953,4,2,2,0
SenatorBurr,Richard Burr,542698429215170562,21157904,en,542698429215170562,2014-12-10T15:12:43.000Z,“This comm. departed from that high road &amp; slipped into the same partisan mode that marks most of what happens on Capitol Hill these days.”,False,542698429215170562,2,1,1,0
SenatorBurr,Richard Burr,542696732925382656,21157904,en,542696732925382656,2014-12-10T15:05:58.000Z,“I do not have to wait to be certain our interrogation policies and procedures are aligned with our core values.” http://t.co/z4FUyuU6tI,False,542696732925382656,2,4,4,0
SenatorBurr,Richard Burr,542693699776675841,21157904,en,542693699776675841,2014-12-10T14:53:55.000Z,"Sen. Kerrey, who served on the Intel Committee for 8 years, wrote in USA Today abt his thoughts on the Intel report: http://t.co/z4FUyuU6tI",False,542693699776675841,5,1,1,0
SenatorBurr,Richard Burr,542679200625602561,21157904,en,542679200625602561,2014-12-10T13:56:18.000Z,"Former CIA Directors Tenet, Goss, and Hayden wrote a response to the Intel report released yesterday: http://t.co/kBu0KWFX6A",False,542679200625602561,8,3,3,0
SenatorBurr,Richard Burr,542451401473814533,21157904,en,542451401473814533,2014-12-09T22:51:07.000Z,The Minority Views are not a minority report–the minority did not actively participate in the Study.  http://t.co/h6Gew2mcYt,False,542451401473814533,1,3,3,0
SenatorBurr,Richard Burr,542444688314073088,21157904,en,542444688314073088,2014-12-09T22:24:26.000Z,It seems to me that this report only endangers our officers and allies in a blatant attempt to smear the Bush Admin. http://t.co/Ejjm8tg7GV,False,542444688314073088,19,22,22,0
SenatorBurr,Richard Burr,542443142440435712,21157904,en,542443142440435712,2014-12-09T22:18:17.000Z,I urge everyone to read the Minority Views which document many falsehoods propagated by the Study: http://t.co/h6Gew2mcYt,False,542443142440435712,7,4,4,0
SenatorBurr,Richard Burr,542441449380253697,21157904,en,542441449380253697,2014-12-09T22:11:34.000Z,It is regrettable that the Comm’s Dems decided to put their own political agenda before the safety &amp; security of our nation &amp; our allies.,False,542441449380253697,0,0,0,0
SenatorBurr,Richard Burr,542439703941636097,21157904,en,542439703941636097,2014-12-09T22:04:38.000Z,I fear the ramifications for our national security and I stand by my assertion that this report is flawed. http://t.co/Ejjm8tg7GV,False,542439703941636097,9,6,6,0
SenatorBurr,Richard Burr,542438191907614720,21157904,en,542438191907614720,2014-12-09T21:58:37.000Z,"Instead of a thorough, thoughtful redaction process, Dems chose to release more info for political reasons that only they understand.",False,542438191907614720,0,3,3,0
SenatorBurr,Richard Burr,542438076304216064,21157904,en,542438076304216064,2014-12-09T21:58:10.000Z,"In April, I voted to submit the Democrat’s study to the Executive Branch for redaction and, if appropriate, release. http://t.co/Ejjm8tg7GV",False,542438076304216064,2,1,1,0
SenatorBurr,Richard Burr,541629809886244864,21157904,en,541629809886244864,2014-12-07T16:26:24.000Z,God Bless those killed and wounded during the Pearl Harbor attack and God bless all of our nation's veterans.,False,541629809886244864,4,1,1,0
SenatorBurr,Richard Burr,541629724842557441,21157904,en,541629724842557441,2014-12-07T16:26:04.000Z,Today we remember the courage and sacrifice displayed at Pearl Harbor 73 years ago and the subsequent acts of heroism in the following war.,False,541629724842557441,12,1,1,0
SenatorBurr,Richard Burr,541276662009434112,21157904,en,541276662009434112,2014-12-06T17:03:07.000Z,Glad I could have such a dynamic team of legislators as partners when working on ABLE. #passtheABLEact,False,541276662009434112,3,1,1,0
SenatorBurr,Richard Burr,541276600999108609,21157904,en,541276600999108609,2014-12-06T17:02:52.000Z,".@CathyMcMorris, @PeteSessions, &amp; @AnderCrenshaw delivered the Weekly Radio Address on ABLE's House passage: http://t.co/oHiPNhtaJ8",False,541276600999108609,1,2,2,0
SenatorBurr,Richard Burr,540613774575947776,21157904,en,540613774575947776,2014-12-04T21:09:02.000Z,Great press call w/ @SenBobCasey and Sara Wolff on #ABLEact. Thanks for the questions. #passtheABLEact http://t.co/iAMzNwVSwK,False,540613774575947776,3,1,1,0
SenatorBurr,Richard Burr,540558476486144000,21157904,en,540558476486144000,2014-12-04T17:29:18.000Z,"This week, I ensured that #Hatteras ORV access will finally get a vote – we can protect our beaches while still enjoying them.",False,540558476486144000,5,4,4,0
SenatorBurr,Richard Burr,540547742222020609,21157904,en,540547742222020609,2014-12-04T16:46:39.000Z,Last night the House overwhelmingly passed the ABLE Act (404-17)  – I am confident the Senate will swiftly do the same #passtheABLEact,False,540547742222020609,8,3,3,0
SenatorBurr,Richard Burr,539877582565818369,21157904,en,539877582565818369,2014-12-02T20:23:40.000Z,.@newtgingrich wrote a great piece on #ABLEAct – read it here: http://t.co/niVMz5D1nV #passtheABLEact,False,539877582565818369,23,2,2,0
SenatorBurr,Richard Burr,539498489211019264,21157904,en,539498489211019264,2014-12-01T19:17:17.000Z,At @PoliticoPro Healthcare Briefing w/ @SenBobCasey discussing public health emergency preparedness. #ebola #ProHCBB http://t.co/7hHlCawwWY,False,539498489211019264,4,2,2,0
SenatorBurr,Richard Burr,539496387403337729,21157904,en,539496387403337729,2014-12-01T19:08:56.000Z,RT @cspan: LIVE now on C-SPAN3: @POLITICOPro panel on public health emergency preparedness ... with @SenBobCasey &amp; @SenatorBurr,False,539496387403337729,6,0,0,0
SenatorBurr,Richard Burr,539463066178842624,21157904,en,539463066178842624,2014-12-01T16:56:32.000Z,"Today is an opportunity to recommit ourselves to the global fight against HIV/AIDS, both at home and abroad: http://t.co/iuS39wGPsg",False,539463066178842624,2,3,3,0
SenatorBurr,Richard Burr,539442603641827330,21157904,en,539442603641827330,2014-12-01T15:35:13.000Z,"Today marks World AIDS Day, a day which affirms the global commitment to eliminate HIV/AIDS once and for all.  http://t.co/iuS39wGPsg",False,539442603641827330,6,2,2,0
SenatorBurr,Richard Burr,538047030753759232,21157904,en,538047030753759232,2014-11-27T19:09:43.000Z,Happy Thanksgiving from my family to yours: http://t.co/tLcZq98WLC,False,538047030753759232,4,1,1,0
SenatorBurr,Richard Burr,535621425869381632,21157904,en,535621425869381632,2014-11-21T02:31:13.000Z,POTUS's decision tonight signifies a dangerous shift from a nation of laws to a nation of men: http://t.co/EPpZNuKIDf #ExecutiveAmnesty,False,535621425869381632,33,24,24,0
SenatorBurr,Richard Burr,535574892360773632,21157904,en,535574892360773632,2014-11-20T23:26:19.000Z,"@MsWZ Didn’t choose poorly, considering plans available on Obamacare exchange. Not on FEHB.",False,535509724570349568,0,1,1,0
SenatorBurr,Richard Burr,535134377605599232,21157904,en,535134377605599232,2014-11-19T18:15:52.000Z,"VA committee is holding a ""Mental Health and Suicide Among Veterans"" hearing – watch my opening statement here: http://t.co/ZHMvNPbbSm",False,535134377605599232,3,3,3,0
SenatorBurr,Richard Burr,534497924877926401,21157904,en,534497924877926401,2014-11-18T00:06:50.000Z,We are proud to intro. this bipartisan leg. to improve &amp; modernize the suicide prevention programs available to our fighting men and women.,False,534497924877926401,7,0,0,0
SenatorBurr,Richard Burr,534497779075522562,21157904,en,534497779075522562,2014-11-18T00:06:15.000Z,"Today, I introduced, with 5 other Senators, The Clay Hunt Suicide Prevention for American Veterans Act – read more: http://t.co/UFKQLI7P9j",False,534497779075522562,16,2,2,0
SenatorBurr,Richard Burr,534452675715547136,21157904,en,534452675715547136,2014-11-17T21:07:02.000Z,"WECT reports on the bipartisan Child Care and Development Block Grant, introduced by @SenatorBarb and Me: http://t.co/ZH7cNxRX3y #CCDBG",False,534452675715547136,6,1,1,0
SenatorBurr,Richard Burr,532216583377412096,21157904,en,532216583377412096,2014-11-11T17:01:36.000Z,"Today, may every NCian remember the service and sacrifice of our veterans. God bless them and may God bless America:  http://t.co/4qkUQwWlir",False,532216583377412096,5,2,2,0
SenatorBurr,Richard Burr,527840011467915264,21157904,en,527840011467915264,2014-10-30T15:10:40.000Z,Congratulations to NC-native and 2014 World Series MVP Madison Bumgarner for last night's win -- 3 in 5 is not too shabby #nc #madbum,False,527840011467915264,11,1,1,0
SenatorBurr,Richard Burr,526803758064619520,21157904,en,526803758064619520,2014-10-27T18:32:58.000Z,Quarantine Decisions: Actions must be based on the consistent application of science and weighing of risks: http://t.co/DGzvMyQSyY #Ebola,False,526803758064619520,4,4,4,0
SenatorBurr,Richard Burr,525750426285912064,21157904,en,525750426285912064,2014-10-24T20:47:24.000Z,"At Pope Airfield, got 2 watch our uniformed men &amp; women in action, everything from a cargo drop 2 aeromedical drills http://t.co/64Obgj2wT6",False,525750426285912064,2,0,0,0
SenatorBurr,Richard Burr,525728967865929728,21157904,en,525728967865929728,2014-10-24T19:22:08.000Z,Visited the Career Academy &amp; Technical School in Troutman this week. Thanks for having me! http://t.co/3AhCmlQndV,False,525728967865929728,0,1,1,0
