handle,name,tweet_id,author_id,lang,replied_to,created_at,tweet_text,possibly_sensitive,conversation_id,retweet_count,reply_count,like_count,quote_count
SenBrianSchatz,Senator Brian Schatz,1008827468982169601,1262099252,en,1008827468982169601,2018-06-18T21:43:06.000Z,"“Then people brought little children to Jesus for him to place his hands on them and pray for them. But the disciples rebuked them. Jesus said, ‘Let the little children come to me, and do not hinder them, for the kingdom of heaven belongs to such as these.’” -Matthew 19:13-14",False,1008827465123409921,6,4,4,0
SenBrianSchatz,Senator Brian Schatz,1008827467069575168,1262099252,en,1008827467069575168,2018-06-18T21:43:05.000Z,"“When a stranger sojourns with you in your land, you shall not do him wrong. You shall treat the stranger who sojourns with you as the native among you, and you shall love him as yourself, for you were strangers in the land of Egypt: I am the Lord your God.” -Leviticus 19:33-34",False,1008827465123409921,8,5,5,0
SenBrianSchatz,Senator Brian Schatz,1008827465123409921,1262099252,en,1008827465123409921,2018-06-18T21:43:05.000Z,We can disagree on immigration policy. But we cannot disagree on what’s happening at our southern border. It is a moral outrage. And you do not have to take my word for it.,False,1008827465123409921,84,30,30,3
SenBrianSchatz,Senator Brian Schatz,1007429048954490880,1262099252,en,1007429048954490880,2018-06-15T01:06:17.000Z,RT @HawaiiNewsNow: President Trump approves individual assistance for some Big Island residents https://t.co/mSX5p6nygy #HNN,False,1007429048954490880,9,0,0,0
SenBrianSchatz,Senator Brian Schatz,1007413692764442624,1262099252,en,1007413692764442624,2018-06-15T00:05:15.000Z,"The Appropriations Committee just passed a bill that includes $1M for Papahanaumokuakea and for coral reefs, and more than $36M to fund Hawaii’s tsunami warning system. This new funding is critical for our state priorities – glad to see it moving forward. https://t.co/pAaeZuybZT",False,1007413692764442624,6,1,1,1
SenBrianSchatz,Senator Brian Schatz,1007402623237083137,1262099252,en,1007402623237083137,2018-06-14T23:21:16.000Z,"Separating families should never be the policy of the United States government, under any circumstances. Proud to be an original co-sponsor of @SenFeinstein’s bill to end this cruel action. #familiesbelongtogether",False,1007402623237083137,20,11,11,0
SenBrianSchatz,Senator Brian Schatz,1007380512787361793,1262099252,en,1007380512787361793,2018-06-14T21:53:25.000Z,"Banks should be held accountable when they deny minorities and low income families access to affordable credit. At a Senate Banking Committee hearing today, I got a commitment from a top Trump bank regulator to be tougher on discriminatory lending. https://t.co/40axqpQbLr",False,1007380512787361793,38,12,12,1
SenBrianSchatz,Senator Brian Schatz,1007359666043654146,1262099252,en,1007359666043654146,2018-06-14T20:30:34.000Z,"Hawaii just got $4.1M for the fight against cancer &amp; HIV/AIDS. When someone is diagnosed with either of these diseases, their whole life changes. This funding will help people manage cancer &amp; HIV/AIDS or prevent them from getting sick in the first place. https://t.co/Q4Ysmzy7T8",False,1007359666043654146,3,0,0,0
SenBrianSchatz,Senator Brian Schatz,1007029966289195008,1262099252,en,1007029966289195008,2018-06-13T22:40:28.000Z,"Mahalo to @KauaiCoffeeCo, @BICandies, @KauaiCoffeeCo, @mauibrewingco, @KingsHawaiian, @KoloaRum, @KonaBrewingCo &amp; @LappertsHawaii for bringing some much needed aloha to the Capitol. #HawaiiOnTheHill. https://t.co/sWvWB9IkVt",False,1007029966289195008,3,3,3,1
SenBrianSchatz,Senator Brian Schatz,1007029574343983111,1262099252,en,1007029574343983111,2018-06-13T22:38:54.000Z,Great catching up with state and county leaders at #HawaiiOnTheHill. Always a great reminder of how much our state has to offer. https://t.co/c2UkSSml3n,False,1007029574343983111,1,0,0,1
SenBrianSchatz,Senator Brian Schatz,1006944625511288832,1262099252,en,1006944625511288832,2018-06-13T17:01:21.000Z,"RT @postlive: .@pw_cunningham asks @brianschatz @SenThomTillis to respond to the stigma surrounding mental illness, and about the new CDC r…",False,1006944625511288832,3,0,0,0
SenBrianSchatz,Senator Brian Schatz,1006937322754060288,1262099252,en,1006937322754060288,2018-06-13T16:32:20.000Z,"Given my unique commute, I’ve seen over and over how hard America’s flight attendants work. Thanks to the @afa_cwa for all you do to keep people safe in the air. https://t.co/JIuSN0Xi7G",False,1006937322754060288,5,0,0,1
SenBrianSchatz,Senator Brian Schatz,1006884803596181504,1262099252,en,1006884803596181504,2018-06-13T13:03:38.000Z,RT @postlive: Live now: @brianschatz @SenThomTillis @NYCFirstLady &amp; others talk mental health in America. #PostLive https://t.co/iI92DTV2bL,False,1006884803596181504,7,0,0,0
SenBrianSchatz,Senator Brian Schatz,1006883428216786944,1262099252,en,1006883428216786944,2018-06-13T12:58:10.000Z,RT @postlive: Starting at 9am ET: Tune in live on https://t.co/mtUQ1oOroC to hear from @SenThomTillis @brianschatz @NYCFirstLady @NAMICEOMa…,False,1006883428216786944,2,0,0,0
SenBrianSchatz,Senator Brian Schatz,1006641416641171456,1262099252,en,1006641416641171456,2018-06-12T20:56:30.000Z,"Nice catching up with the late Congressman Takai’s parents, Erik and Naomi. They’re in town for #HawaiiOnTheHill. https://t.co/VVnqufWXTH",False,1006641416641171456,1,1,1,0
SenBrianSchatz,Senator Brian Schatz,1006278678983200779,1262099252,en,1006278678983200779,2018-06-11T20:55:07.000Z,Had a great time with these students today. I hope there’s more than a few of them that pursue a career in public service. https://t.co/NaK7vk3n2F,False,1006278678983200779,1,1,1,0
SenBrianSchatz,Senator Brian Schatz,1006236494225465344,1262099252,en,1006236494225465344,2018-06-11T18:07:29.000Z,"Today the FCC’s repeal of #netneutrality protections goes into effect, ending the free and open internet as we know it. This move will take away your ability to use the internet the way you want to—putting the internet in the hands of companies instead.",False,1006236494225465344,26,3,3,1
SenBrianSchatz,Senator Brian Schatz,1005215644453765120,1262099252,en,1005215644453765120,2018-06-08T22:31:00.000Z,"When it comes to North Korea, I strongly support diplomacy. But we still need to be prepared for the worst. That’s why I introduced a bill to improve our missile defense system – so that we can protect Hawaii, Alaska, and the mainland from an ever-evolving missile threat. https://t.co/XOyD7RXU0K",False,1005215644453765120,3,1,1,0
SenBrianSchatz,Senator Brian Schatz,1004801850854473728,1262099252,en,1004801850854473728,2018-06-07T19:06:44.000Z,Thanks to the Domingo family for spending some time with me today. https://t.co/Er2iLiLbyo,False,1004801850854473728,2,1,1,0
SenBrianSchatz,Senator Brian Schatz,1004493442368622592,1262099252,en,1004493442368622592,2018-06-06T22:41:13.000Z,"Had a productive meeting with William Aila, Sol Kaho‘ohalahala, Dr. Doug McCauley and conservationists who are fighting to protect our oceans. Mahalo for all you do to preserve our environment. https://t.co/2q0f4PAmpP",False,1004493442368622592,5,2,2,1
SenBrianSchatz,Senator Brian Schatz,1004413227013410816,1262099252,en,1004413227013410816,2018-06-06T17:22:29.000Z,RT @DataCoalition: We are thrilled to have #OPENGovData Act champion Senator @brianschatz close out out our inaugural #DataDemoDay 2018! ht…,False,1004413227013410816,2,0,0,0
SenBrianSchatz,Senator Brian Schatz,1004386101514121216,1262099252,en,1004386101514121216,2018-06-06T15:34:41.000Z,Looking forward to talking about how access to government data can change everything at #DataDemoDay. https://t.co/FQP2D6BO8Q,False,1004386101514121216,0,0,0,0
SenBrianSchatz,Senator Brian Schatz,1004168181894778885,1262099252,en,1004168181894778885,2018-06-06T01:08:45.000Z,Highlight of my day was meeting some amazing young climate advocates at @LCVoters. These leaders are building a movement to save the planet. https://t.co/V1dkzGjP3x,False,1004168181894778885,0,1,1,1
SenBrianSchatz,Senator Brian Schatz,1002595791347777542,1262099252,en,1002595791347777542,2018-06-01T17:00:38.000Z,"Student debt is holding back an entire generation from preparing for their futures, pursuing their dreams, and reaching their potential. My #DebtFreeCollege Act will guarantee a debt free path through college for people who need it. https://t.co/m9AweIDkDc",False,1002595791347777542,4,1,1,0
SenBrianSchatz,Senator Brian Schatz,1002357774192463874,1262099252,en,1002357774192463874,2018-06-01T01:14:50.000Z,Not long ago this wasn’t more than a patch of yellow grass &amp; dirt. The 50MW Schofield generating station being dedicated today will be the most survivable power plant on Oahu &amp; will also bring the state closer to our renewable energy goals. Congrats to all who made this possible. https://t.co/2E4AXBzwSR,False,1002357774192463874,4,2,2,0
SenBrianSchatz,Senator Brian Schatz,1001864361323978753,1262099252,en,1001864361323978753,2018-05-30T16:34:12.000Z,"The Kilauea eruptions are growing more serious. The good news is that state, county, and federal officials are working very well together. I will continue to fight for maximum federal resources for everyone affected by this difficult situation. https://t.co/nDBNAjeIFY",False,1001864361323978753,13,5,5,0
SenBrianSchatz,Senator Brian Schatz,996813363798831104,1262099252,en,996813363798831104,2018-05-16T18:03:20.000Z,"This is one of the biggest weeks for the Internet the Senate has ever seen. Today, the Senate has an opportunity to right this wrong with an up or down vote to overturn the FCC’s repeal and restore the free and open internet.  https://t.co/fP2sxx2ffJ",False,996813363798831104,25,13,13,5
SenBrianSchatz,Senator Brian Schatz,994336209127096320,1262099252,en,994336209127096320,2018-05-09T22:00:00.000Z,This week the Senate has an opportunity to undo the FCC’s rollback of #netneutrality protections. Let’s turn anger into action. https://t.co/oYy3BusZmE,False,994336209127096320,22,8,8,0
SenBrianSchatz,Senator Brian Schatz,994222962009083904,1262099252,en,994222962009083904,2018-05-09T14:30:00.000Z,Update on #netneutrality. WATCH https://t.co/h2iBynlwI2,False,994222962009083904,175,26,26,14
SenBrianSchatz,Senator Brian Schatz,989608744651771905,1262099252,en,989608744651771905,2018-04-26T20:54:45.000Z,RT @NFWFnews: NFWF today awarded a $900K grant to a team of researchers from the @bishopmuseum and @UHawaiiNews to conduct a research exped…,False,989608744651771905,22,0,0,0
SenBrianSchatz,Senator Brian Schatz,987014021789478913,1262099252,en,987014021789478913,2018-04-19T17:04:15.000Z,There is a simple reason why the Senate should reject James Bridenstine’s nomination to lead NASA: he is a climate denier with no scientific background who has made a career out of ignoring science. https://t.co/RVq3NSEL8m,False,987014021789478913,107,25,25,8
SenBrianSchatz,Senator Brian Schatz,985962619034054656,1262099252,en,985962619034054656,2018-04-16T19:26:21.000Z,"RT @jstreetdotorg: ""We are not a monolith... That's the antithesis of our tradition as Americans and as Jews. Instead of fearing debate, we…",False,985962619034054656,4,0,0,0
SenBrianSchatz,Senator Brian Schatz,985962575010594817,1262099252,en,985962575010594817,2018-04-16T19:26:10.000Z,"RT @jstreetdotorg: ""I'm here today because I'm a progressive. I'm here today because I'm a Jew. I'm here today because I believe in Israel.…",False,985962575010594817,6,0,0,0
SenBrianSchatz,Senator Brian Schatz,984411013285113856,1262099252,en,984411013285113856,2018-04-12T12:40:49.000Z,"I will be voting no on Mike Pompeo’s nomination to be Secretary of State. Diplomats should believe in diplomacy. America’s top diplomat must be passionate about diplomacy. Mike Pompeo has not demonstrated that he values diplomacy, diplomats, or the State Department itself. https://t.co/1kDUqq5nea",False,984411013285113856,2875,388,388,185
SenBrianSchatz,Senator Brian Schatz,983857190678290433,1262099252,en,983857190678290433,2018-04-11T00:00:08.000Z,"People should be paid based on their expertise, effort and experience – not their gender. Let’s all work to move #EqualPayDay to December 31, where it belongs. https://t.co/nYSnRdPawq",False,983857190678290433,12,8,8,0
SenBrianSchatz,Senator Brian Schatz,983448242749890561,1262099252,en,983448242749890561,2018-04-09T20:55:07.000Z,The U.S. Senate—and our country—would be better off if there were more leaders like Senator Daniel K. Akaka. https://t.co/pclZBTC7KJ,False,983448242749890561,11,5,5,0
SenBrianSchatz,Senator Brian Schatz,981988407038676994,1262099252,en,981988407038676994,2018-04-05T20:14:15.000Z,Today I’m chairing a Senate Commerce Committee field hearing here in Honolulu. We’ll be talking about what happened when the false missile alert went out—and how to move forward to fix what went wrong. https://t.co/9LaB3qRIo3,False,981988407038676994,16,2,2,1
SenBrianSchatz,Senator Brian Schatz,981740743009202176,1262099252,en,981740743009202176,2018-04-05T03:50:07.000Z,The FCC’s E-Rate program creates opportunities by bringing fast and affordable internet to public schools and libraries. FCC Commissioner @JRosenworcel and I visited Moanalua Middle School to learn how they’re putting this program to good use. https://t.co/ogIUY6rBb2,False,981740743009202176,5,1,1,1
SenBrianSchatz,Senator Brian Schatz,979406106039635969,1262099252,en,979406106039635969,2018-03-29T17:13:06.000Z,"""Students and their families have struggled to build their dreams on top of student debt… Now is the time for the United States to recommit to higher education by better funding public colleges and reducing the burden of debt.” #DebtFreeCollege https://t.co/YJAMuVBwEv",False,979406106039635969,15,3,3,0
SenBrianSchatz,Senator Brian Schatz,979380103066062851,1262099252,en,979380103066062851,2018-03-29T15:29:47.000Z,RT @NBCNews: Sen. Brian Schatz: The student debt crisis threatens the American way of life. Washington can't keep ignoring it. https://t.co…,False,979380103066062851,87,0,0,0
SenBrianSchatz,Senator Brian Schatz,978326740895436801,1262099252,en,978326740895436801,2018-03-26T17:44:06.000Z,RT @NYMag: The Republican-controlled Congress has produced roughly zero serious ideas for addressing the college-debt crisis. But Democrat…,False,978326740895436801,31,0,0,0
SenBrianSchatz,Senator Brian Schatz,977001991175069696,1262099252,en,977001991175069696,2018-03-23T02:00:01.000Z,Each college class graduates with more student loan debt than the last. It’s time to guarantee that all Americans have a #DebtFreeCollege option if they need it. https://t.co/lQCOLyzska,False,977001991175069696,11,7,7,0
SenBrianSchatz,Senator Brian Schatz,976971793381511168,1262099252,en,976971793381511168,2018-03-23T00:00:01.000Z,Half of Hawaii’s students graduated with student loan debt in 2016. What would you do without any college debt? #DebtFreeCollege https://t.co/9CJGPJDoiT,False,976971793381511168,5,3,3,1
SenBrianSchatz,Senator Brian Schatz,976947796354977798,1262099252,en,976947796354977798,2018-03-22T22:24:40.000Z,In 1977 the maximum Pell grant covered 70% of the cost of college attendance. Federal investment in education has not kept pace with rising college cost. It’s time for a #DebtFreeCollege option for those who need it. https://t.co/aiRsmM8f77,False,976947796354977798,13,3,3,0
SenBrianSchatz,Senator Brian Schatz,976914100428173312,1262099252,en,976914100428173312,2018-03-22T20:10:46.000Z,U.S. college loan debt totals more than $1.4 trillion and holds back an entire generation of Americans from pursuing their dreams. I asked Federal Reserve Chairman Jay Powell about how this affects the economy. #DebtFreeCollege https://t.co/tNaCBp0N6b,False,976914100428173312,41,6,6,2
SenBrianSchatz,Senator Brian Schatz,976881947707428866,1262099252,en,976881947707428866,2018-03-22T18:03:00.000Z,For more than a decade student loan debt has been on the rise. The #DebtFreeCollege Act will ensure a debt free path through college for those who need it. https://t.co/BtfomftUqz,False,976881947707428866,19,5,5,2
SenBrianSchatz,Senator Brian Schatz,976855128862085121,1262099252,en,976855128862085121,2018-03-22T16:16:26.000Z,The #DebtFreeCollege Act brings states back to the table and leverages federal dollars to reinvest in public education and help the people who need it most. https://t.co/fD6h8ygNH6,False,976854937941536768,10,1,1,0
SenBrianSchatz,Senator Brian Schatz,976854937941536768,1262099252,en,976854937941536768,2018-03-22T16:15:40.000Z,"We’re at a point now where the full cost of college is more than twice as much as tuition, which is why solutions to the student debt crisis need to focus on the full cost to students and their families.",False,976854937941536768,11,2,2,1
SenBrianSchatz,Senator Brian Schatz,976805711102459904,1262099252,en,976805711102459904,2018-03-22T13:00:04.000Z,Today I’m introducing the #DebtFreeCollege Act. Student debt currently stands at over $1.4 trillion and affects over 44 million people. Now is the time to get serious about ending the student debt crisis. https://t.co/r1s8O8OSAb,False,976805711102459904,162,47,47,20
SenBrianSchatz,Senator Brian Schatz,976167429872156673,1262099252,en,976167429872156673,2018-03-20T18:43:46.000Z,"RT @voxdotcom: Exclusive: Sen. Brian Schatz’s ambitious new plan for debt-free college, explained https://t.co/r8GiX1BnAL",False,976167429872156673,18,0,0,0
SenBrianSchatz,Senator Brian Schatz,973714180464369664,1262099252,en,973714180464369664,2018-03-14T00:15:26.000Z,So we will continue to shine a light on the many ways this administration is failing the American people by ignoring climate change. But we will also continue to hope.,False,973712812735455233,6,3,3,0
SenBrianSchatz,Senator Brian Schatz,973713907897524224,1262099252,en,973713907897524224,2018-03-14T00:14:21.000Z,"These efforts are making a difference. Researchers at Carnegie Mellon found that the United States can meet our original commitment to the Paris Agreement, even if the EPA continues to undermine our efforts.",False,973712812735455233,8,2,2,0
SenBrianSchatz,Senator Brian Schatz,973713563939430400,1262099252,en,973713563939430400,2018-03-14T00:12:59.000Z,"When it comes to the Paris Agreement, U.S. companies, states, and cities have stood up to declare “We Are Still In.”",False,973712812735455233,6,1,1,0
SenBrianSchatz,Senator Brian Schatz,973713244761321473,1262099252,en,973713244761321473,2018-03-14T00:11:42.000Z,The economics are on our side. Clean energy is now cheaper than dirty energy. We continue to move to a low-carbon economy.,False,973712812735455233,4,1,1,0
SenBrianSchatz,Senator Brian Schatz,973713032487587841,1262099252,en,973713032487587841,2018-03-14T00:10:52.000Z,The rest of the world is moving forward. Every single nation in the world is working to lower their emissions and meet their commitments as part of the Paris Agreement.,False,973712812735455233,3,1,1,0
SenBrianSchatz,Senator Brian Schatz,973712812735455233,1262099252,en,973712812735455233,2018-03-14T00:09:59.000Z,This administration is not simply ignoring climate change. It is throwing fuel on the fire. But there are 3 reasons why we should remain hopeful: https://t.co/BTpMI7kqi0,False,973712812735455233,19,3,3,6
SenBrianSchatz,Senator Brian Schatz,971892147946442752,1262099252,en,971892147946442752,2018-03-08T23:35:19.000Z,Hawaii is a better place because of these three women. #IWD2018 https://t.co/t07TdmBgMM,False,971892147946442752,9,4,4,0
SenBrianSchatz,Senator Brian Schatz,971517615221985280,1262099252,en,971517615221985280,2018-03-07T22:47:04.000Z,Too many people who are eligible for compassionate release die in prison because the decision takes so long. And many others wait for months just to get a response. It’s time to fix the system. https://t.co/R129i4cRAs,False,971517615221985280,13,4,4,0
SenBrianSchatz,Senator Brian Schatz,968646832069980160,1262099252,en,968646832069980160,2018-02-28T00:39:36.000Z,"I am honored to receive a perfect score from @LCVoters on their National Environmental Scorecard. Climate change is the challenge of our time, and I will keep working to solve it. https://t.co/UzR3o4AnLc https://t.co/S5AZeL4F8j",False,968646832069980160,6,4,4,2
SenBrianSchatz,Senator Brian Schatz,968613753624375296,1262099252,en,968613753624375296,2018-02-27T22:28:09.000Z,"Today, the internet is uniting for a day-of-action to preserve the free and open internet as we know it. We only need #onemorevote in the Senate to save #netneutrality. Make you voice heard. https://t.co/uTy2027ScS",False,968613753624375296,125,9,9,12
SenBrianSchatz,Senator Brian Schatz,961645594791104512,1262099252,en,961645594791104512,2018-02-08T16:59:10.000Z,Equifax failed consumers with its data breach. So why isn’t the US agency that looks out for consumers doing anything? Today I sent a letter to the @CFPB to find out why its investigation into Equifax has been stopped. https://t.co/3ujaW7zgOU https://t.co/wOhIzn7Hq9,False,961645594791104512,92,19,19,7
SenBrianSchatz,Senator Brian Schatz,961400533931167745,1262099252,en,961400533931167745,2018-02-08T00:45:23.000Z,"The federal government is positioned to know first if a missile is on its way. If they make that call, there shouldn’t be a middleman involved in getting the word out. The ALERT Act will give the responsibility of alerting the public of a missile threat to the federal government. https://t.co/smh5P6WTIS",False,961400533931167745,13,5,5,2
SenBrianSchatz,Senator Brian Schatz,955293073210331136,1262099252,en,955293073210331136,2018-01-22T04:16:31.000Z,"On January 13, the public’s trust was broken in Hawaii. Now we have to fix it. https://t.co/Vq9HkIFc4e",False,955293073210331136,10,13,13,4
SenBrianSchatz,Senator Brian Schatz,952317844364189697,1262099252,en,952317844364189697,2018-01-13T23:14:01.000Z,RT @RoseBernardo: False alarm ‘absolutely unacceptable’ says Schatz @StarAdvertiser  https://t.co/aqvUDlDtk2,False,952317844364189697,7,0,0,0
SenBrianSchatz,Senator Brian Schatz,952296451790524417,1262099252,en,952296451790524417,2018-01-13T21:49:01.000Z,"RT @AnaCabrera: ""They don't understand how bad this was ... one person was in a position to make a human error and send more than a million…",False,952296451790524417,195,0,0,0
SenBrianSchatz,Senator Brian Schatz,941379406626516993,1262099252,en,941379406626516993,2017-12-14T18:48:35.000Z,"They are now free to block apps, slow websites, or even limit access to certain kinds of content. The best way to move forward is to turn our tweets and our comments into action.",False,941379404353232898,23,15,15,3
SenBrianSchatz,Senator Brian Schatz,941379404353232898,1262099252,en,941379404353232898,2017-12-14T18:48:34.000Z,"Trump’s FCC dealt a major blow to the free and open internet by repealing #netneutrality rules. Because of Chairman Pai and the other Republican commissioners, there are no longer any rules in place to stop internet service providers from changing the internet as we know it.",False,941379404353232898,36,13,13,4
SenBrianSchatz,Senator Brian Schatz,941050504641048576,1262099252,en,941050504641048576,2017-12-13T21:01:38.000Z,"This week the FCC will vote to roll back #netneutrality protections, ending the free and open internet as we know it. This move will take away your ability to use the internet the way you want to—putting the internet in the hands of companies instead. https://t.co/mK5W3BoEUG",False,941050504641048576,25,5,5,3
SenBrianSchatz,Senator Brian Schatz,936348120060977152,1262099252,en,936348120060977152,2017-11-30T21:36:02.000Z,Exhibit C: https://t.co/rDtgaywuUS,False,936345244945195008,16,11,11,2
SenBrianSchatz,Senator Brian Schatz,936347317912985602,1262099252,en,936347317912985602,2017-11-30T21:32:51.000Z,Exhibit B: https://t.co/YJQK65owq5,False,936345244945195008,10,2,2,2
SenBrianSchatz,Senator Brian Schatz,936346767922212864,1262099252,en,936346767922212864,2017-11-30T21:30:40.000Z,They say big corporations and the wealthy will re-invest their tax cuts—they won’t.,False,936345244945195008,24,7,7,1
SenBrianSchatz,Senator Brian Schatz,936345622998867968,1262099252,en,936345622998867968,2017-11-30T21:26:07.000Z,Exhibit A: https://t.co/ZOnNrVw1ct,False,936345244945195008,45,3,3,3
SenBrianSchatz,Senator Brian Schatz,936345244945195008,1262099252,en,936345244945195008,2017-11-30T21:24:37.000Z,This Republican tax scam gives millionaires a tax cut paid for by the middle class.,False,936345244945195008,63,14,14,3
SenBrianSchatz,Senator Brian Schatz,929354946264424450,1262099252,en,929354946264424450,2017-11-11T14:27:40.000Z,"I have joined with some of my Senate colleagues at the COP23 UN Climate Change Chance Conference in Bonn, Germany, to show the world that #WeAreStillIn on the Paris Agreement. Watch: https://t.co/h2ODsYkzca",False,929354946264424450,16,11,11,4
SenBrianSchatz,Senator Brian Schatz,928913934060609536,1262099252,en,928913934060609536,2017-11-10T09:15:14.000Z,"Wheels down in Bonn for #COP23. We’re here to tell the world that when it comes to addressing climate change, #WeAreStillIn. https://t.co/qRtgCOsZ6A",False,928913934060609536,30,23,23,1
SenBrianSchatz,Senator Brian Schatz,923534149213999106,1262099252,en,923534149213999106,2017-10-26T12:57:54.000Z,RT @NYMag: An interview with Senator Brian Schatz on his new plan to let all Americans buy into the federal program https://t.co/Ptx6c32jc8,False,923534149213999106,22,0,0,0
SenBrianSchatz,Senator Brian Schatz,923532455725993985,1262099252,en,923532455725993985,2017-10-26T12:51:10.000Z,"RT @intelligencer: Would ""Medicaid for all"" cure what ails our health-care system? An interview with Hawaii senator Brian Schatz https://t.…",False,923532455725993985,21,0,0,0
