handle,name,tweet_id,author_id,lang,replied_to,created_at,tweet_text,possibly_sensitive,conversation_id,retweet_count,reply_count,like_count,quote_count
SenBrianSchatz,Senator Brian Schatz,713059091480858624,1262099252,en,713059091480858624,2016-03-24T17:45:10.000Z,I thank @LaborSec for helping HC&amp;S workers get the money they need to provide for their families and find new jobs. https://t.co/MHbCzV9wTA,False,713059091480858624,0,0,0,0
SenBrianSchatz,Senator Brian Schatz,713039983167336448,1262099252,en,713039983167336448,2016-03-24T16:29:14.000Z,This is great news for HC&amp;S workers and for Maui. https://t.co/MHbCzURW22,False,713039983167336448,1,0,0,0
SenBrianSchatz,Senator Brian Schatz,712449544202489856,1262099252,en,712449544202489856,2016-03-23T01:23:02.000Z,Senate Republicans' refusal to consider Judge Garland sets a dangerous precedent. Tell them to get back to work and #DoYourJob.,False,712449544202489856,18,1,1,0
SenBrianSchatz,Senator Brian Schatz,712416595474141184,1262099252,en,712416595474141184,2016-03-22T23:12:07.000Z,We have a lot of work to do in the Senate and no time for political games. Tell the GOP to #DoYourJob and give Judge Garland a fair hearing.,False,712416595474141184,16,1,1,0
SenBrianSchatz,Senator Brian Schatz,712388892310134784,1262099252,en,712388892310134784,2016-03-22T21:22:02.000Z,Choosing to not fill the Supreme Court vacancy is simply irresponsible. Tell the GOP to #DoYourJob.,False,712388892310134784,3,4,4,0
SenBrianSchatz,Senator Brian Schatz,712086943249596416,1262099252,en,712086943249596416,2016-03-22T01:22:11.000Z,".@POTUS did his job, Senate Dems are ready to do their job, but Republicans are still refusing to even consider Judge Garland. #DoYourJob",False,712086943249596416,10,0,0,0
SenBrianSchatz,Senator Brian Schatz,711643325351071744,1262099252,en,711643325351071744,2016-03-20T19:59:25.000Z,Let’s #GoBows! #HawaiiMBB #MarchMadness,False,711643325351071744,5,1,1,0
SenBrianSchatz,Senator Brian Schatz,711300484884074496,1262099252,en,711300484884074496,2016-03-19T21:17:05.000Z,This week I had the chance to meet with members of the @Hawaii_PCA. Mahalo for taking the time to visit. #Hawaii https://t.co/N3RGEPPKvK,False,711300484884074496,2,0,0,0
SenBrianSchatz,Senator Brian Schatz,710900947510304768,1262099252,en,710900947510304768,2016-03-18T18:49:28.000Z,"Thank you @SenatorBarb, @SenatorCardin &amp; @SenSherrodBrown for your support to give federal workers a raise. https://t.co/rnSu1jLfjD #FAIRAct",False,710900947510304768,3,2,2,0
SenBrianSchatz,Senator Brian Schatz,710893196637822976,1262099252,en,710893196637822976,2016-03-18T18:18:40.000Z,Our bill would help give federal workers the raise they deserve. #FAIRAct https://t.co/rnSu1jLfjD,False,710893196637822976,4,2,2,0
SenBrianSchatz,Senator Brian Schatz,710892575620734977,1262099252,en,710892575620734977,2016-03-18T18:16:12.000Z,"Federal workers have seen their pay decrease as a result of furloughs, sequestration, and a freeze on pay. #FAIRAct https://t.co/rnSu1jLfjD",False,710892575620734977,1,0,0,0
SenBrianSchatz,Senator Brian Schatz,710572218774921216,1262099252,en,710572218774921216,2016-03-17T21:03:13.000Z,"Today, I stood with my Senate colleagues to call on Republicans to give Judge Garland a fair confirmation process. https://t.co/jnwONNW0e4",False,710572218774921216,5,0,0,0
SenBrianSchatz,Senator Brian Schatz,710503546890772481,1262099252,en,710503546890772481,2016-03-17T16:30:20.000Z,LIVE: Sen. Schatz is speaking at a press conf. to urge Republicans to consider Judge Garland for the Supreme Court.  https://t.co/8NlTPLV8o4,False,710503546890772481,3,0,0,0
SenBrianSchatz,Senator Brian Schatz,710460870518710272,1262099252,en,710460870518710272,2016-03-17T13:40:45.000Z,Today at 12:30pmET I’ll be joining Senate colleagues to call on Republicans to consider the nomination of Judge Garland.,False,710460870518710272,1,0,0,0
SenBrianSchatz,Senator Brian Schatz,710242010913841153,1262099252,en,710242010913841153,2016-03-16T23:11:05.000Z,"Introduced the #STOPPainAct, a bill that will help us find alternative treatments for pain so we can stop opioid addiction before it starts.",False,710242010913841153,1,0,0,0
SenBrianSchatz,Senator Brian Schatz,710227928345251841,1262099252,en,710227928345251841,2016-03-16T22:15:08.000Z,I had a great time today meeting with students all the way from Maui Waena School. Mahalo for visiting. https://t.co/mzG8gu9LM9,False,710227928345251841,2,0,0,0
SenBrianSchatz,Senator Brian Schatz,710221207698841601,1262099252,en,710221207698841601,2016-03-16T21:48:25.000Z,"I had a productive meeting on the importance of US-Japan relations w/ @CarolineKennedy, our Ambassador to Japan. https://t.co/KrjkCyQxUQ",False,710221207698841601,2,0,0,0
SenBrianSchatz,Senator Brian Schatz,710221007060148224,1262099252,en,710221007060148224,2016-03-16T21:47:38.000Z,RT @AARPHawaii: Sen. @brianschatz calls on @SecretaryFoxx to help reduce pedestrian fatalities https://t.co/j5zHwBBlV4 https://t.co/vJxcaXc…,False,710221007060148224,6,0,0,0
SenBrianSchatz,Senator Brian Schatz,710220362865192962,1262099252,en,710220362865192962,2016-03-16T21:45:04.000Z,Thank you @SenOrrinHatch for working with me to help find alternatives to opioid treatment for chronic pain. https://t.co/6urPTlRPZV,False,710220362865192962,0,0,0,0
SenBrianSchatz,Senator Brian Schatz,710180097836195840,1262099252,en,710180097836195840,2016-03-16T19:05:04.000Z,The GOP’s refusal to consider a #SCOTUS nominee is unprecedented &amp; unreasonable. #DoYourJob,False,710180097836195840,10,0,0,0
SenBrianSchatz,Senator Brian Schatz,710172560034430977,1262099252,en,710172560034430977,2016-03-16T18:35:07.000Z,At least 14 Supreme Court justices have been confirmed during a presidential election year. Tell the Senate GOP to #DoYourJob.,False,710172560034430977,14,2,2,0
SenBrianSchatz,Senator Brian Schatz,710163791997046784,1262099252,en,710163791997046784,2016-03-16T18:00:16.000Z,"Since the 1980s, every Supreme Court nominee has been given a Senate hearing and vote within 100 days. #DoYourJob",False,710163791997046784,123,7,7,0
SenBrianSchatz,Senator Brian Schatz,710154938421084160,1262099252,en,710154938421084160,2016-03-16T17:25:06.000Z,It’s time to end the political gamesmanship and do the job that the American people elected us to do. #SCOTUS #DoYourJob,False,710154938421084160,13,1,1,0
SenBrianSchatz,Senator Brian Schatz,710149924654952448,1262099252,en,710149924654952448,2016-03-16T17:05:10.000Z,".@POTUS has done his job, now it’s time for the Senate to do ours. Tell the Senate GOP to consider Merrick Garland and #DoYourJob.",False,710149924654952448,10,1,1,0
SenBrianSchatz,Senator Brian Schatz,710146887676985344,1262099252,en,710146887676985344,2016-03-16T16:53:06.000Z,"RT @SCOTUSnom: Meet Chief Judge Merrick Garland, the President's nominee to the Supreme Court. #SCOTUSnominee https://t.co/ACujysyyDJ",False,710146887676985344,4094,0,0,0
SenBrianSchatz,Senator Brian Schatz,710124068901625857,1262099252,en,710124068901625857,2016-03-16T15:22:26.000Z,We now must fulfill our constitutional obligation &amp; give Chief Judge Garland a fair hearing and vote in the Senate. #DoYourJob,False,710124068901625857,23,4,4,0
SenBrianSchatz,Senator Brian Schatz,709865778506432512,1262099252,en,709865778506432512,2016-03-15T22:16:04.000Z,".@GoodJobsNation No, Thank you for standing up for a fair wage.",False,709835972784033794,2,0,0,0
SenBrianSchatz,Senator Brian Schatz,709561040732688385,1262099252,en,709561040732688385,2016-03-15T02:05:09.000Z,I thank @LaborSec for working with me to deliver these funds for the hard-working men and women at HC&amp;S. https://t.co/X1MTzXIM5m,False,709561040732688385,2,1,1,0
SenBrianSchatz,Senator Brian Schatz,709540923831549952,1262099252,en,709540923831549952,2016-03-15T00:45:13.000Z,These federal funds will give workers the resources to support their families and find jobs. https://t.co/X1MTzXIM5m,False,709540923831549952,2,1,1,0
SenBrianSchatz,Senator Brian Schatz,709528550357884929,1262099252,en,709528550357884929,2016-03-14T23:56:03.000Z,Workers can get money to replace lost wages &amp; pay for job training expenses such as books &amp; tuition. Learn more here https://t.co/X1MTzXIM5m,False,709528550357884929,0,0,0,0
SenBrianSchatz,Senator Brian Schatz,709514168722989056,1262099252,en,709514168722989056,2016-03-14T22:58:54.000Z,Good news: millions of federal dollars for HC&amp;S workers are on the way. https://t.co/X1MTzXrbdO,False,709514168722989056,2,1,1,0
SenBrianSchatz,Senator Brian Schatz,708690536115216385,1262099252,en,708690536115216385,2016-03-12T16:26:05.000Z,These are exactly the type of moonshot discoveries that we need to help us reach our global energy goals. https://t.co/14eBb78FHq,False,708690536115216385,4,0,0,0
SenBrianSchatz,Senator Brian Schatz,708111783215697920,1262099252,en,708111783215697920,2016-03-11T02:06:19.000Z,Today HUD @SecretaryCastro assured me that our state would receive its fair share of funds to address homelessness. https://t.co/m0NEweQStr,False,708111783215697920,1,0,0,0
SenBrianSchatz,Senator Brian Schatz,708105946921197570,1262099252,en,708105946921197570,2016-03-11T01:43:08.000Z,A recent poll shows Americans say 2-to-1 that Senate should hold hearings on Obama’s #SCOTUS nominee. #DoYourJob https://t.co/e1cf4yOJWr,False,708105946921197570,12,1,1,0
SenBrianSchatz,Senator Brian Schatz,708090058407075841,1262099252,en,708090058407075841,2016-03-11T00:40:00.000Z,The same Senators refusing to consider the next SCOTUS nominee once spoke on the need to do just that. https://t.co/8v0IPG5gc5 #DoYourJob,False,708090058407075841,4,1,1,0
SenBrianSchatz,Senator Brian Schatz,708046787001524225,1262099252,en,708046787001524225,2016-03-10T21:48:03.000Z,These standards will improve public health and leave a healthier planet for our kids. https://t.co/qEm5nx7wWg #ActOnClimate,False,708046787001524225,4,0,0,0
SenBrianSchatz,Senator Brian Schatz,708025936638124033,1262099252,en,708025936638124033,2016-03-10T20:25:12.000Z,This is what it means to #ActOnClimate: Today the US &amp; Canada have agreed to reduce methane emissions 40-45% in the next decade.,False,708025936638124033,2,0,0,0
SenBrianSchatz,Senator Brian Schatz,708015361225039873,1262099252,en,708015361225039873,2016-03-10T19:43:11.000Z,21 senators and I spoke and the @EPA listened: https://t.co/qEm5nxp8kQ #ActOnClimate,False,708015361225039873,3,1,1,0
SenBrianSchatz,Senator Brian Schatz,707924475543752704,1262099252,en,707924475543752704,2016-03-10T13:42:02.000Z,.@EPA's new efforts to cut methane emissions from existing sources is key to fighting climate change. #ActOnClimate https://t.co/qEm5nxp8kQ,False,707924475543752704,4,2,2,0
SenBrianSchatz,Senator Brian Schatz,707734573132685313,1262099252,en,707734573132685313,2016-03-10T01:07:25.000Z,Congrats to Perry from Aiea High &amp; Zach from Kailua High for representing #Hawaii in the @SenateYouth Program. https://t.co/JfBCetW7ht,False,707734573132685313,8,1,1,0
SenBrianSchatz,Senator Brian Schatz,707667391233310720,1262099252,en,707667391233310720,2016-03-09T20:40:28.000Z,"Good news: Hawai‘i will be part of the @WhiteHouse’s #TechHire Initiative, a program to help grow our tech sector. https://t.co/ePS703qo7c",False,707667391233310720,2,0,0,0
SenBrianSchatz,Senator Brian Schatz,707407329352749056,1262099252,en,707407329352749056,2016-03-09T03:27:04.000Z,These funds will help protect our coastal communities against the threat of climate change and natural disasters. https://t.co/R9sFogzzJt,False,707407329352749056,4,1,1,0
SenBrianSchatz,Senator Brian Schatz,707362041158303744,1262099252,en,707362041158303744,2016-03-09T00:27:07.000Z,Mahalo to Emily and Suzy from #Mililani for visiting to discuss increasing funding for kidney diseases. #Hawaii https://t.co/o8X5Q22Bni,False,707362041158303744,3,0,0,0
SenBrianSchatz,Senator Brian Schatz,706951349485703168,1262099252,en,706951349485703168,2016-03-07T21:15:10.000Z,"In a year when nearly 200 countries recognized the threat of climate change, major networks actually cut their coverage of climate change.",False,706951349485703168,4,1,1,0
SenBrianSchatz,Senator Brian Schatz,706940855727292418,1262099252,en,706940855727292418,2016-03-07T20:33:28.000Z,"The Senate GOP have met with #SCOTUS nominees before, but refuse to do it now. Tell them to #DoYourJob. https://t.co/BXxXw9BXR7",False,706940855727292418,9,1,1,0
SenBrianSchatz,Senator Brian Schatz,706929666137976833,1262099252,en,706929666137976833,2016-03-07T19:49:01.000Z,"In 2015, the network Sunday shows devoted just 73 minutes to climate change, a ten percent decrease from the year before. #ActOnClimate",False,706929666137976833,4,1,1,0
SenBrianSchatz,Senator Brian Schatz,706645432995196928,1262099252,en,706645432995196928,2016-03-07T00:59:34.000Z,It's time to raise the tobacco age of sale to 21 nationwide and my bill would do just that. https://t.co/YCU3Gu3NCv #TobaccoTo21,False,706645432995196928,6,2,2,0
SenBrianSchatz,Senator Brian Schatz,705884994623905793,1262099252,en,705884994623905793,2016-03-04T22:37:52.000Z,Yesterday Justice Roberts refused to block an @EPA mercury emission regulation. This a big victory for our planet. https://t.co/qRnKzWWyqY,False,705884994623905793,4,0,0,0
SenBrianSchatz,Senator Brian Schatz,705562678299910144,1262099252,en,705562678299910144,2016-03-04T01:17:05.000Z,69% of Americans say the Senate GOP should consider the president's Supreme Court nominee. Tell the GOP to #DoYourJob.,False,705562678299910144,2,1,1,0
SenBrianSchatz,Senator Brian Schatz,705532213610188800,1262099252,en,705532213610188800,2016-03-03T23:16:02.000Z,Imagine the innovation we might enable with more unlicensed spectrum in the future. https://t.co/6qHfIjs6Z4,False,705532213610188800,1,0,0,0
SenBrianSchatz,Senator Brian Schatz,705510989064757248,1262099252,en,705510989064757248,2016-03-03T21:51:42.000Z,Today I signed onto @SenatorCardin’s #50x30 resolution that will set the goal of achieving more than 50% clean electricity by 2030.,False,705510989064757248,3,0,0,0
SenBrianSchatz,Senator Brian Schatz,705498324015718401,1262099252,en,705498324015718401,2016-03-03T21:01:22.000Z,Developing a national plan for unlicensed spectrum will enable more innovation like Wi-Fi. https://t.co/xBlTfZ1r1c #MOBILENOW,False,705498324015718401,1,0,0,0
SenBrianSchatz,Senator Brian Schatz,705467855811162112,1262099252,en,705467855811162112,2016-03-03T19:00:18.000Z,Who knew that Wi-Fi would emerge out of what was originally used for garage door openers? https://t.co/6qHfIjs6Z4,False,705467855811162112,0,0,0,0
SenBrianSchatz,Senator Brian Schatz,705198895341707264,1262099252,en,705198895341707264,2016-03-03T01:11:33.000Z,I stand with Whole Woman’s Health and those making their voices heard outside the Supreme Court today. #StopTheSham https://t.co/fE12khYqnO,False,705198895341707264,2,0,0,0
SenBrianSchatz,Senator Brian Schatz,705182133619466244,1262099252,en,705182133619466244,2016-03-03T00:04:56.000Z,Congratulations #SanFrancisco for raising the smoking age to 21. Hawaii has led the way &amp; it's time for the country to follow. #TobaccoTo21,False,705182133619466244,3,3,3,0
SenBrianSchatz,Senator Brian Schatz,705169612653002752,1262099252,en,705169612653002752,2016-03-02T23:15:11.000Z,The impact of this technology for consumers and our economy is significant and its potential is unlimited. https://t.co/6qHfIjs6Z4,False,705169612653002752,3,0,0,0
SenBrianSchatz,Senator Brian Schatz,705098820577857540,1262099252,en,705098820577857540,2016-03-02T18:33:53.000Z,.@TheHill: Reaching our Wireless Potential – Sens. Brian Schatz D-HI &amp; @JerryMoran R-Kan. https://t.co/6qHfIjJInE,False,705098820577857540,3,0,0,0
SenBrianSchatz,Senator Brian Schatz,704855015505190912,1262099252,en,704855015505190912,2016-03-02T02:25:05.000Z,RT @HRC: 82 orgs condemned Republican Senate Judiciary Committee members for obstruction of #SCOTUS nom process #DoYourJob https://t.co/HqD…,False,704855015505190912,100,0,0,0
SenBrianSchatz,Senator Brian Schatz,704807230353182720,1262099252,en,704807230353182720,2016-03-01T23:15:13.000Z,"If the Senate GOP wants to vote against a #SCOTUS nominee, that’s fine, but to deny our country a fair process is unreasonable. #DoYourJob",False,704807230353182720,4,0,0,0
SenBrianSchatz,Senator Brian Schatz,704776747670089728,1262099252,en,704776747670089728,2016-03-01T21:14:05.000Z,At least 14 Supreme Court justices have been confirmed during a presidential election year. Tell the Senate GOP to #DoYourJob.,False,704776747670089728,13,0,0,0
SenBrianSchatz,Senator Brian Schatz,704754371180032005,1262099252,en,704754371180032005,2016-03-01T19:45:10.000Z,RT @BarackObama: It's the Senate's duty to give the President's nominee a fair hearing and a timely vote. #DoYourJob https://t.co/yquRBNfS9k,False,704754371180032005,3757,0,0,0
SenBrianSchatz,Senator Brian Schatz,704478832804261888,1262099252,en,704478832804261888,2016-03-01T01:30:16.000Z,We can all agree that we must strike a balance between protecting privacy and strengthening national security. https://t.co/oeGBQe0ngW,False,704478832804261888,2,0,0,0
SenBrianSchatz,Senator Brian Schatz,704447101258829825,1262099252,en,704447101258829825,2016-02-29T23:24:11.000Z,The debate between Apple and the FBI must be taken very seriously. This bill would help us find solutions. https://t.co/oeGBQdIMpo,False,704447101258829825,1,0,0,0
SenBrianSchatz,Senator Brian Schatz,703337559208955904,1262099252,en,703337559208955904,2016-02-26T21:55:16.000Z,The key to solving homelessness is providing housing &amp; tailored services. This grant will help us get there. https://t.co/JT8SZCEtju,False,703337559208955904,0,0,0,0
SenBrianSchatz,Senator Brian Schatz,703077943484903424,1262099252,en,703077943484903424,2016-02-26T04:43:38.000Z,"I met with Col John Felix, Commander of the Hawaii Civil Air Patrol who relinquished command to Col Patrick Collins. https://t.co/PI1FKevqKX",False,703077943484903424,5,1,1,0
SenBrianSchatz,Senator Brian Schatz,702995256841674752,1262099252,en,702995256841674752,2016-02-25T23:15:04.000Z,You can stay up to date on tax scams and identity theft threats from @IRSNews here: https://t.co/fWSt6CWv5I,False,702995256841674752,0,0,0,0
SenBrianSchatz,Senator Brian Schatz,702988488577306624,1262099252,en,702988488577306624,2016-02-25T22:48:11.000Z,"Travel and tourism are the backbone of Hawaii’s economy and employ thousands. Thank you, @USTravel for this award. https://t.co/NJO7cq45fX",False,702988488577306624,2,0,0,0
SenBrianSchatz,Senator Brian Schatz,702666886765350913,1262099252,en,702666886765350913,2016-02-25T01:30:15.000Z,Today I got to talk w/ 60+ @HawaiiCULeague members. Mahalo for helping to strengthen credit unions and our economy. https://t.co/zvttSjgbBb,False,702666886765350913,1,2,2,0
SenBrianSchatz,Senator Brian Schatz,702634073525755904,1262099252,en,702634073525755904,2016-02-24T23:19:52.000Z,RT @LCVoters: @SenBrianSchatz got 96% on the Nat'l Environmental Scorecard! See all the 2015 votes at: https://t.co/Gz5ScHVtm7 #LCVScorecard,False,702634073525755904,2,0,0,0
SenBrianSchatz,Senator Brian Schatz,702622730076745729,1262099252,en,702622730076745729,2016-02-24T22:34:47.000Z,I'm proud to have received one of the highest ratings on the @LCVoters’ 2015 Environmental Scorecard. https://t.co/We1GvJzKU1 #LCVScorecard,False,702622730076745729,1,1,1,0
SenBrianSchatz,Senator Brian Schatz,702584889946800128,1262099252,en,702584889946800128,2016-02-24T20:04:25.000Z,It’s clear from our forum w/ legal scholars that the GOP’s refusal to consider a #SCOTUS nominee is unprecedented &amp; unreasonable. #DoYourJob,False,702584889946800128,2,1,1,0
SenBrianSchatz,Senator Brian Schatz,702572132232986625,1262099252,en,702572132232986625,2016-02-24T19:13:44.000Z,Headed to a forum with Dems and legal scholars to discuss the impact of the #SCOTUS vacancy. Livestream: https://t.co/3VV01orWEU #DoYourJob,False,702572132232986625,2,0,0,0
SenBrianSchatz,Senator Brian Schatz,702285121857134593,1262099252,in,702285121857134593,2016-02-24T00:13:15.000Z,"Mahalo for visiting Arryl Kaneshiro, @kipukai, @MikeVictorino, Riki Hokama, @DonCouch4Maui &amp; @ikaikaanderson. https://t.co/lQAgljPyzL",False,702285121857134593,0,0,0,0
SenBrianSchatz,Senator Brian Schatz,702275512211623936,1262099252,en,702275512211623936,2016-02-23T23:35:04.000Z,Tell Senate Republicans to #DoYourJob and commit to a fair and timely Supreme Court nomination process.,False,702275512211623936,8,2,2,0
SenBrianSchatz,Senator Brian Schatz,702245227105533957,1262099252,en,702245227105533957,2016-02-23T21:34:43.000Z,RT @BarackObama: The Senate should not play political games with our Supreme Court. https://t.co/RoNN4vaw0a,False,702245227105533957,3475,0,0,0
SenBrianSchatz,Senator Brian Schatz,702146030465261568,1262099252,en,702146030465261568,2016-02-23T15:00:33.000Z,On my way to discuss my telehealth bill at the @AmerMedicalAssn Natl Advocacy Conference. Details on the bill here: https://t.co/sJmtukXM8A,False,702146030465261568,1,0,0,0
SenBrianSchatz,Senator Brian Schatz,701928797633957891,1262099252,en,701928797633957891,2016-02-23T00:37:21.000Z,This tax season make sure to protect yourself against potential tax and identity theft scams: https://t.co/fWSt6CEUea,False,701928797633957891,1,0,0,0
SenBrianSchatz,Senator Brian Schatz,701873528551948289,1262099252,en,701873528551948289,2016-02-22T20:57:44.000Z,Our country is facing a gun violence epidemic. #GunViolence https://t.co/06DeyzryPW,False,701873528551948289,6,1,1,0
SenBrianSchatz,Senator Brian Schatz,701173250424905729,1262099252,en,701173250424905729,2016-02-20T22:35:04.000Z,Only 54% of eligible voters participated in the 2012 election. We can do better. Our democracy needs your voice.,False,701173250424905729,2,3,3,0
SenBrianSchatz,Senator Brian Schatz,701122935910576128,1262099252,en,701122935910576128,2016-02-20T19:15:08.000Z,Our democracy only works when you are involved. This year I hope you will register to vote and make your voice heard.,False,701122935910576128,4,0,0,0
SenBrianSchatz,Senator Brian Schatz,700859496009084929,1262099252,en,700859496009084929,2016-02-20T01:48:19.000Z,I went to @JointBasePHH to see a waste-to-energy system that can help our bases reduce waste and create energy. https://t.co/8devnVK8oW,False,700859496009084929,3,0,0,0
SenBrianSchatz,Senator Brian Schatz,700770145501728768,1262099252,en,700770145501728768,2016-02-19T19:53:17.000Z,"RT @USMC: #OTD in 1945, Marines began the Battle of Iwo Jima. Today, bitter adversaries have become steadfast allies.
https://t.co/MlBRChcg…",False,700770145501728768,398,0,0,0
SenBrianSchatz,Senator Brian Schatz,700518498603180032,1262099252,en,700518498603180032,2016-02-19T03:13:19.000Z,Today @SenatorDurbin and I discussed federal appropriations with members of the @HonJapaneseJC. #Hawaii https://t.co/k2t6Y0QevE,False,700518498603180032,2,1,1,0
SenBrianSchatz,Senator Brian Schatz,700431111009206273,1262099252,en,700431111009206273,2016-02-18T21:26:04.000Z,NEWS: Schatz Applauds Expanded Flights to Tokyo: https://t.co/SWQ403RFPL #Hawaii #808News,False,700431111009206273,0,0,0,0
SenBrianSchatz,Senator Brian Schatz,700403270184013824,1262099252,en,700403270184013824,2016-02-18T19:35:27.000Z,Yesterday @SenatorDurbin and I spoke with students at UH Law about criminal justice and the future of the #SCOTUS. https://t.co/ASazqtAiPv,False,700403270184013824,1,0,0,0
SenBrianSchatz,Senator Brian Schatz,700386737013530625,1262099252,en,700386737013530625,2016-02-18T18:29:45.000Z,"Reid to GOP: For the good of the country, stop your nakedly partisan obstruction - @SenatorReid, @WashingtonPost: https://t.co/1y8JHLacgd",False,700386737013530625,4,0,0,0
SenBrianSchatz,Senator Brian Schatz,700379195046760448,1262099252,en,700379195046760448,2016-02-18T17:59:47.000Z,The heat goes on: Earth sets 9th straight monthly record: https://t.co/TwQPbH8dGG,False,700379195046760448,1,0,0,0
SenBrianSchatz,Senator Brian Schatz,700032711096954881,1262099252,en,700032711096954881,2016-02-17T19:02:58.000Z,"Since the 1980s, every Supreme Court nominee has been given a Senate hearing and vote within 100 days. #SCOTUS",False,700032711096954881,25,3,3,0
SenBrianSchatz,Senator Brian Schatz,699762698075004928,1262099252,en,699762698075004928,2016-02-17T01:10:02.000Z,The Constitution is pretty clear about what is supposed to happen now. -@POTUS https://t.co/hoAeSyijQ4,False,699762698075004928,15,0,0,0
SenBrianSchatz,Senator Brian Schatz,699742312788701184,1262099252,en,699742312788701184,2016-02-16T23:49:02.000Z,"After creating chaos in Congress for years, the GOP is attempting to spread their dysfunction to the Supreme Court. https://t.co/DhC6h2CY6D",False,699742312788701184,9,0,0,0
SenBrianSchatz,Senator Brian Schatz,699661273181659137,1262099252,en,699661273181659137,2016-02-16T18:27:01.000Z,President Obama has the constitutional obligation to fill the Supreme Court vacancy. #SCOTUS https://t.co/dUZcepeAjB,False,699661273181659137,10,0,0,0
SenBrianSchatz,Senator Brian Schatz,698872590249504769,1262099252,en,698872590249504769,2016-02-14T14:13:04.000Z,You can learn more about how to protect yourself against dengue here: https://t.co/pHVxv9PuCu,False,698872590249504769,2,0,0,0
SenBrianSchatz,Senator Brian Schatz,698510193508818944,1262099252,en,698510193508818944,2016-02-13T14:13:02.000Z,What is #dengue? How is it treated? For these answers and more please see my resource page here: https://t.co/pHVxv9PuCu,False,698510193508818944,1,0,0,0
SenBrianSchatz,Senator Brian Schatz,698374267986169856,1262099252,en,698374267986169856,2016-02-13T05:12:55.000Z,For information on how to protect yourself against #dengue please see my resource page here: https://t.co/pHVxva7614 #Hawaii #808news,False,698374267986169856,3,1,1,0
