handle,name,tweet_id,author_id,lang,replied_to,created_at,tweet_text,possibly_sensitive,conversation_id,retweet_count,reply_count,like_count,quote_count
SenBrianSchatz,Senator Brian Schatz,1334964435518099462,1262099252,en,1334964435518099462,2020-12-04T20:54:58.000Z,"This extension of federal funding for the Hawai‘i national guard means they can continue their essential missions, including contact tracing and food and medical supply distribution, without interruption.
https://t.co/o2OZ0L8rvx",False,1334964435518099462,0,1,1,0
SenBrianSchatz,Senator Brian Schatz,1332003937344491520,1262099252,en,1332003937344491520,2020-11-26T16:51:00.000Z,Have a safe and happy Thanksgiving. https://t.co/5W7KMFCLx6,False,1332003937344491520,12,9,9,1
SenBrianSchatz,Senator Brian Schatz,1331690732176945156,1262099252,en,1331690732176945156,2020-11-25T20:06:26.000Z,"This $350,000 federal grant for Kauai will help those who have lost their job or had their hours cut make rent. During this tough time, we’ll keep working to deliver more relief to help both renters and landlords avoid falling into debt. https://t.co/zWF1hn6fxr",False,1331690732176945156,2,2,2,0
SenBrianSchatz,Senator Brian Schatz,1330954461666304008,1262099252,en,1330954461666304008,2020-11-23T19:20:46.000Z,"Pacific Islanders are getting infected at much higher rates, and we need to do more to fight outbreaks in these communities. This federal grant is a good start.
https://t.co/kbFGUVcc4b",False,1330954461666304008,1,1,1,0
SenBrianSchatz,Senator Brian Schatz,1329631083038695424,1262099252,en,1329631083038695424,2020-11-20T03:42:08.000Z,"By ramping up testing and supporting the targeted outreach efforts of local agencies on the ground, we can help stop the spread of the virus in Pacific Islander communities.

There’s still more work to do, but this federal grant is a good start.

https://t.co/ZPXd68AcEP",False,1329631083038695424,0,3,3,0
SenBrianSchatz,Senator Brian Schatz,1326682860355543040,1262099252,en,1326682860355543040,2020-11-12T00:26:57.000Z,"Since the Revolutionary War, Native Hawaiians &amp; native veterans have put their lives on the line for our country. With this new memorial, we can begin to properly honor their sacrifice.

Mahalo to those who've served—especially the more than 120,000 who call Hawai‘i home. https://t.co/7yWSv8yFfT",False,1326682860355543040,14,7,7,1
SenBrianSchatz,Senator Brian Schatz,1326325015252439040,1262099252,en,1326325015252439040,2020-11-11T00:45:00.000Z,Families should not have to worry about being evicted in the midst of a public health emergency. This grant will help some of our most vulnerable residents make rent and stay in their homes while we ride out this pandemic. https://t.co/Le0NUbSvlz,False,1326325015252439040,5,4,4,0
SenBrianSchatz,Senator Brian Schatz,1326268396745338880,1262099252,en,1326268396745338880,2020-11-10T21:00:01.000Z,"For those who have lost jobs or had hours cut, this federal money will help make rent.

Read more about this new grant ⬇️ https://t.co/tRNFUCKyHs",False,1326268396745338880,5,4,4,0
SenBrianSchatz,Senator Brian Schatz,1326242572575109121,1262099252,en,1326242572575109121,2020-11-10T19:17:24.000Z,"Ripping away health care is a horrific thing to do during normal times. But it’s particularly egregious during a pandemic that’s already claimed nearly 240,000 American lives.

#SaveTheACA https://t.co/At1zWKfW2p",False,1326242572575109121,2,1,1,0
SenBrianSchatz,Senator Brian Schatz,1321545204399284225,1262099252,en,1321545204399284225,2020-10-28T20:11:44.000Z,"We all know how important internet access has become during this pandemic as we try work or go to school from home — so this is good news.

And we'll keep working to help more people access faster and more reliable internet service. https://t.co/Q946Y8mx7V",False,1321545204399284225,1,10,10,0
SenBrianSchatz,Senator Brian Schatz,1320822592215932930,1262099252,en,1320822592215932930,2020-10-26T20:20:20.000Z,"RT @nowthisnews: ‘This is the most rank hypocrisy I’ve ever seen ... We’re not the world’s greatest deliberative body, we’re just a little…",False,1320822592215932930,286,0,0,0
SenBrianSchatz,Senator Brian Schatz,1316905754285264896,1262099252,en,1316905754285264896,2020-10-16T00:56:13.000Z,"RT @SenBrianSchatz: Today is the last day to take the #2020Census — and you have until 11:59pm HST to respond.

It only takes a few minutes…",False,1316905754285264896,20,0,0,0
SenBrianSchatz,Senator Brian Schatz,1316892376154087425,1262099252,en,1316892376154087425,2020-10-16T00:03:03.000Z,"Today is the last day to take the #2020Census — and you have until 11:59pm HST to respond.

It only takes a few minutes, but getting counted will be a big help to your community.

You can fill it out online at https://t.co/fSTUOpJI2g or call (844) 330-2020.",False,1316892376154087425,20,18,18,2
SenBrianSchatz,Senator Brian Schatz,1313880658780053505,1262099252,en,1313880658780053505,2020-10-07T16:35:34.000Z,"RT @votevets: THURSDAY -- VOTEVETS LIVE with U.S. Senator @brianschatz.  

We'll discuss protecting our nation’s public lands, climate chan…",False,1313880658780053505,73,0,0,0
SenBrianSchatz,Senator Brian Schatz,1313670925959802880,1262099252,en,1313670925959802880,2020-10-07T02:42:10.000Z,"This is personal cruelty: President Trump is sick and he’s affecting others physically adjacent to him.

He just doesn’t care about the people working right next to him. https://t.co/oCdhbWWWA8",False,1313670925959802880,32,18,18,6
SenBrianSchatz,Senator Brian Schatz,1313590421487071237,1262099252,en,1313590421487071237,2020-10-06T21:22:16.000Z,"Once a safe, effective COVID-19 vaccine is available, Hawai‘i must be prepared to successfully distribute it to families across our state.

These federal funds will ensure that we have the infrastructure in place to quickly and widely administer the vaccine https://t.co/puNwJGa9Tt",False,1313590421487071237,4,3,3,0
SenBrianSchatz,Senator Brian Schatz,1311856818713432064,1262099252,en,1311856818713432064,2020-10-02T02:33:33.000Z,"Social media platforms should not publicize election-related misinformation, regardless of whether Ted Cruz or Rick Scott or anyone else in the Republican universe considers that to be biased. Because there are some principles that go beyond our partisan objectives. https://t.co/wlxcAlgZnZ",False,1311856818713432064,16,12,12,2
SenBrianSchatz,Senator Brian Schatz,1311749672957095936,1262099252,en,1311749672957095936,2020-10-01T19:27:47.000Z,"Unfortunately, Senate Republicans are still blocking some federal workers, like air traffic controllers, from receiving these benefits.

We won't stop pushing until everyone has the right to take 12 weeks of paid family leave.",False,1311749671879147525,7,2,2,0
SenBrianSchatz,Senator Brian Schatz,1311749671879147525,1262099252,en,1311749671879147525,2020-10-01T19:27:47.000Z,"Today, our #PaidLeave policy for federal workers takes effect. This means that 2 million public servants no longer have to choose between getting a paycheck and taking care of a new child.

Hear more about why &amp; how we got it done 👇 https://t.co/sW5eelE2qR",False,1311749671879147525,8,3,3,0
SenBrianSchatz,Senator Brian Schatz,1311434397388877825,1262099252,en,1311434397388877825,2020-09-30T22:35:00.000Z,"Our Family Crisis Cash Assistance Act would provide cash relief during natural disasters or economic crises to those who need it most.

Individuals could get up to $2000/month. Families could get up to $4000/month. And the cash would go out automatically after disaster strikes. https://t.co/lette4FpLn",False,1311434397388877825,2,6,6,0
SenBrianSchatz,Senator Brian Schatz,1311404383867985920,1262099252,en,1311404383867985920,2020-09-30T20:35:44.000Z,"During a crisis, we need to act fast to help families in real need.

By making cash relief payments to families automatic and fair, we can quickly provide direct cash aid to those who need it most. https://t.co/LYFsLGwjum",False,1311404383867985920,2,1,1,0
SenBrianSchatz,Senator Brian Schatz,1311094341797109760,1262099252,en,1311094341797109760,2020-09-30T00:03:44.000Z,"By expanding access to COVID-19 testing and teaching preventative practices to students in rural areas, this grant will help us keep more Hawai'i families safe.

I'm proud that UH is leading this effort to bring additional resources to areas that need it most. https://t.co/DQuhx4zlTy",False,1311094341797109760,0,3,3,0
SenBrianSchatz,Senator Brian Schatz,1309966916530974722,1262099252,en,1309966916530974722,2020-09-26T21:23:45.000Z,My statement on today’s Supreme Court nomination https://t.co/SQT14B37Zc,False,1309966916530974722,131,47,47,10
SenBrianSchatz,Senator Brian Schatz,1309289484169687041,1262099252,en,1309289484169687041,2020-09-25T00:31:53.000Z,"As schools prepare to reopen for in-person learning, it's important that we take every precaution to prevent the spread of COVID-19.

We need proper ventilation in schools to keep students, families, teachers, and other school workers safe. https://t.co/Dc0HBratkg",False,1309289484169687041,4,4,4,1
SenBrianSchatz,Senator Brian Schatz,1308859084159037446,1262099252,en,1308859084159037446,2020-09-23T20:01:37.000Z,"Republicans have said they already have the votes, with many announcing their support for the nominee — without even knowing who she or he may be.

Senate Republicans have turned “advise and consent” into “agreeing in advance.” https://t.co/1RreWppUA6",False,1308859084159037446,27,12,12,1
SenBrianSchatz,Senator Brian Schatz,1308784820613509120,1262099252,en,1308784820613509120,2020-09-23T15:06:31.000Z,"We’ve heard the Majority Leader say he feels “no sense of urgency” to move on COVID relief. 

Yet when Justice Ginsburg tragically passes, he feels a tremendous sense of urgency to fill her seat.

It's shameful that he's prioritizing this vacancy over helping the American people. https://t.co/2TduBeiT9x",False,1308784820613509120,208,34,34,17
SenBrianSchatz,Senator Brian Schatz,1308635848766820352,1262099252,en,1308635848766820352,2020-09-23T05:14:34.000Z,"The President has made clear that his Supreme Court nominee will vote to strike down the ACA.

That means ripping away health care from at least 20 million people and denying coverage to those with preexisting conditions during a pandemic.

We can't let that happen. https://t.co/fjoS3ND9uG",False,1308635848766820352,158,33,33,7
SenBrianSchatz,Senator Brian Schatz,1308119290374168577,1262099252,en,1308119290374168577,2020-09-21T19:01:57.000Z,"We've known all along that nursing homes were particularly vulnerable to COVID-19, so it is infuriating to see that basic infection control practices were not in place months after the pandemic began. 

Avalon must take immediate action to ensure the safety of residents &amp; staff. https://t.co/X9hCSwedef",False,1308119290374168577,2,4,4,0
SenBrianSchatz,Senator Brian Schatz,1307025621533503494,1262099252,en,1307025621533503494,2020-09-18T18:36:06.000Z,"Small businesses in Hawai'i need immediate relief to help them get through this tough time.

We need to pass the RESTART Act. Our bill will provide more loans with extra flexibility to our hardest-hit businesses. https://t.co/RoHp515R0Z",False,1307025621533503494,0,4,4,0
SenBrianSchatz,Senator Brian Schatz,1306708922376519686,1262099252,en,1306708922376519686,2020-09-17T21:37:39.000Z,RT @SenWhitehouse: We need corporate America to #TradeUp to trade associations that will actively support climate action in Congress. https…,False,1306708922376519686,79,0,0,0
SenBrianSchatz,Senator Brian Schatz,1306656349598740482,1262099252,en,1306656349598740482,2020-09-17T18:08:44.000Z,"Telehealth is the future of health care, offering more people access to quality care at lower cost. During this pandemic, it's become an essential strategy for keeping people healthy during this pandemic.

Tune in today at 2:30PM ET/8:30AM HT for more 👇 https://t.co/uJLcXEVCZv",False,1306656349598740482,3,3,3,0
SenBrianSchatz,Senator Brian Schatz,1306385524215746565,1262099252,en,1306385524215746565,2020-09-17T00:12:35.000Z,"It's clear from today's hearing that this Administration isn't doing enough testing.

If we want to beat this virus, we need to actually deploy more tests—not just claim they’re ‘available’. https://t.co/elncqi2AeF",False,1306385524215746565,25,6,6,1
SenBrianSchatz,Senator Brian Schatz,1306340236234981381,1262099252,en,1306340236234981381,2020-09-16T21:12:37.000Z,"Hawai‘i will get $70M more in federal dollars to provide those unemployed due to COVID-19 with an additional $300/week.

While this will provide some immediate help, it’s not enough for families struggling to make ends meet. We’ll continue working to secure more federal funding. https://t.co/lrzmq1OxAH",False,1306340236234981381,1,5,5,0
SenBrianSchatz,Senator Brian Schatz,1306305548640489473,1262099252,en,1306305548640489473,2020-09-16T18:54:47.000Z,"It's not enough to just be officially 'for' the census. President Trump is trying to interfere with the constitutional process — and without Republicans making serious noise, we very much run the risk of the period of time during which the census is conducted being cut short. https://t.co/mmxbuQOVpx",False,1306305548640489473,4,3,3,0
SenBrianSchatz,Senator Brian Schatz,1306297019447881730,1262099252,en,1306297019447881730,2020-09-16T18:20:53.000Z,RT @TimesTalks: What is the new prognosis for high-tech health care? Join the #TimesTalksTech conversation 9/17 with @SenBrianSchatz @vivia…,False,1306297019447881730,4,0,0,0
SenBrianSchatz,Senator Brian Schatz,1306261407634259971,1262099252,en,1306261407634259971,2020-09-16T15:59:23.000Z,"Hawai‘i small businesses need immediate help to meet their payroll and keep the lights on.
 
We need to pass the bipartisan RESTAURANTS Act, which creates a $120B fund to support restaurants &amp; prioritizes those owned by women, vets &amp; people of color. https://t.co/X3MTzjUcqg",False,1306261407634259971,11,3,3,1
SenBrianSchatz,Senator Brian Schatz,1305969569098592256,1262099252,en,1305969569098592256,2020-09-15T20:39:43.000Z,"I‘m alarmed that Avalon’s facilities are not able to adequately protect their residents and staff from COVID-19.

With outbreaks at all three of its homes in Hawaiʻi — including the veterans home in Hilo — it's clear that Avalon Health Care needs to do more to keep people safe. https://t.co/kp3wQdccio",False,1305969569098592256,2,2,2,0
SenBrianSchatz,Senator Brian Schatz,1305574535010246656,1262099252,en,1305574535010246656,2020-09-14T18:30:00.000Z,"With outbreaks at all three of its homes in Hawaiʻi, including the veterans home in Hilo, it's clear that Avalon Health Care needs to do more to protect its residents &amp; staff.

We're working to make sure they do everything they can to stop these outbreaks &amp; keep everyone safe. https://t.co/Ilz4agAp8a",False,1305574535010246656,2,1,1,0
SenBrianSchatz,Senator Brian Schatz,1304871045757906945,1262099252,en,1304871045757906945,2020-09-12T19:54:35.000Z,"I‘m alarmed that Avalon’s facilities are not able to adequately protect their residents and staff.

Avalon needs to immediately review the infection control practices at every facility to make sure they’re keeping people safe.
https://t.co/9EExjcawMY",False,1304871045757906945,0,3,3,0
SenBrianSchatz,Senator Brian Schatz,1304556829297573888,1262099252,en,1304556829297573888,2020-09-11T23:06:00.000Z,"More help is on the way for the Big Island.

This medical team from @DeptVetAffairs will be a big help in containing the outbreak, and we will continue working with the VA and state and local officials to make sure we are utilizing all the federal help that’s available. https://t.co/y65pmo90k5",False,1304556829297573888,0,1,1,0
SenBrianSchatz,Senator Brian Schatz,1304526557134942208,1262099252,en,1304526557134942208,2020-09-11T21:05:42.000Z,"UPDATE — @DeptVetAffairs will immediately send a team of infection control experts, nurses, and other health care professionals to help contain the COVID-19 outbreak at the Yukio Okutsu State Veterans Home in Hilo. https://t.co/SVHx6gFWON",False,1304526557134942208,4,1,1,0
SenBrianSchatz,Senator Brian Schatz,1304200483138138119,1262099252,en,1304200483138138119,2020-09-10T23:30:00.000Z,More than $27 million in federal funding is headed to Hawaiʻi to support 23 Native Hawaiian education programs across the state. This new funding will give these programs the resources they need as they prepare for the upcoming school year. https://t.co/HpDlyifeuE,False,1304200483138138119,4,1,1,1
SenBrianSchatz,Senator Brian Schatz,1304148136559083520,1262099252,en,1304148136559083520,2020-09-10T20:02:00.000Z,"Meth misuse and addiction has been a serious problem in Hawai‘i for decades — but recently the meth-related death rate has skyrocketed.

This grant will help us put critical resources towards saving lives and combating this crisis.
https://t.co/ID4xAceGVW",False,1304148136559083520,3,2,2,0
SenBrianSchatz,Senator Brian Schatz,1304112904145305603,1262099252,en,1304112904145305603,2020-09-10T17:42:00.000Z,"This is a public health emergency, and we need all the help we can get to stop this outbreak and save lives.
https://t.co/DALkkwfUEX",False,1304112904145305603,4,6,6,0
SenBrianSchatz,Senator Brian Schatz,1303831298843181057,1262099252,en,1303831298843181057,2020-09-09T23:03:00.000Z,"Are you a hard worker, excellent communicator &amp; passionate about public service?

We're looking for high school students for our internship program this school year. It's entirely virtual, so we encourage students from all islands to apply.

Learn more: https://t.co/oRAifPPHy4 https://t.co/Q2DN7B7UoR",False,1303831298843181057,1,2,2,0
SenBrianSchatz,Senator Brian Schatz,1303777947036180480,1262099252,en,1303777947036180480,2020-09-09T19:31:00.000Z,"While this new funding will provide some immediate help, it’s not enough for Hawaii families who are struggling to make ends meet.

We’ll continue working to secure more federal funding to help Hawaii get through this tough time.

https://t.co/4GfkkHlOUJ",False,1303777947036180480,4,1,1,0
SenBrianSchatz,Senator Brian Schatz,1303752774459559942,1262099252,en,1303752774459559942,2020-09-09T17:50:58.000Z,"We need to contain this outbreak immediately, and we need federal help to save lives.

@DeptVetAffairs must step in and send us the federal resources we need to get this under control. https://t.co/19AMTAIJAD",False,1303752774459559942,3,2,2,2
SenBrianSchatz,Senator Brian Schatz,1303048302867484672,1262099252,en,1303048302867484672,2020-09-07T19:11:39.000Z,"For generations, unions have protected the rights of workers and supported families. Hawai‘i is a better place because of our unions.

Happy Labor Day!",False,1303048302867484672,17,3,3,0
SenBrianSchatz,Senator Brian Schatz,1301958709749276672,1262099252,en,1301958709749276672,2020-09-04T19:02:00.000Z,"This September is the first ever #HawaiianHistoryMonth — a chance to honor the history, culture, and the many contributions of the Native Hawaiian community.
https://t.co/ekU1KDspqQ",False,1301958709749276672,7,3,3,0
SenBrianSchatz,Senator Brian Schatz,1301926888378691584,1262099252,en,1301926888378691584,2020-09-04T16:55:33.000Z,"Are you a high school student who wants to learn how government works or is interested in a career in public service?

Apply for our virtual internship program — applications are due Sunday 9/13.

Learn more: https://t.co/oRAifQ7iWE https://t.co/cZuaLNcfpj",False,1301926888378691584,1,2,2,1
SenBrianSchatz,Senator Brian Schatz,1301583583489019904,1262099252,en,1301583583489019904,2020-09-03T18:11:23.000Z,"Are you a hard worker, excellent communicator &amp; passionate about public service?

We're looking for high school students for our internship program this school year. It's entirely virtual, so we encourage students from all islands to apply.

Learn more: https://t.co/oRAifQ7iWE https://t.co/FEHOzcLGTC",False,1301583583489019904,4,1,1,1
SenBrianSchatz,Senator Brian Schatz,1300191156861652995,1262099252,en,1300191156861652995,2020-08-30T21:58:22.000Z,"We are all in the same canoe, and if we don’t paddle in unison, we will continue to go in circles.

By focusing on vulnerable communities, ramping up testing &amp; tracing, mandating masks &amp; communicating clearly, we can get back on track to fight the virus.

https://t.co/L8xN9WPJXX",False,1300191156861652995,6,6,6,1
SenBrianSchatz,Senator Brian Schatz,1299453719826894850,1262099252,en,1299453719826894850,2020-08-28T21:08:04.000Z,"RT @SenDemsClimate: Climate action means 👇

https://t.co/a8c4SKIXik https://t.co/dBg2BnwR6g",False,1299453719826894850,9,0,0,0
SenBrianSchatz,Senator Brian Schatz,1299422827771236353,1262099252,en,1299422827771236353,2020-08-28T19:05:18.000Z,"RT @SenDemsClimate: Our transition to a clean economy can’t succeed without organized labor.

Our bold climate action will promote the righ…",False,1299422827771236353,3,0,0,0
SenBrianSchatz,Senator Brian Schatz,1299085527384113153,1262099252,en,1299085527384113153,2020-08-27T20:45:00.000Z,"We haven’t fully recovered from the natural disasters in 2018 yet, so this new funding will give Hawai‘i County more resources to continue working with residents on how to best rebuild. https://t.co/2mKU8c1A6c",False,1299085527384113153,2,3,3,0
SenBrianSchatz,Senator Brian Schatz,1299055192302850050,1262099252,en,1299055192302850050,2020-08-27T18:44:27.000Z,"Too much of the climate movement of the past was about what climate change is doing to us—not about what climate action will do for us.

Our #CaseForClimateAction report lays out how we can solve the climate crisis in a way that works for everyone ↓

https://t.co/XFHAErPIWN",False,1299055192302850050,21,4,4,1
SenBrianSchatz,Senator Brian Schatz,1298997436753408006,1262099252,en,1298997436753408006,2020-08-27T14:54:57.000Z,"RT @SenJeffMerkley: If we are going to address climate chaos and bring environmental justice to marginalized communities, we have to addres…",False,1298997436753408006,71,0,0,0
SenBrianSchatz,Senator Brian Schatz,1298752274295123968,1262099252,en,1298752274295123968,2020-08-26T22:40:46.000Z,"Our goal with the #CaseForClimateAction report was to do the coalition-building necessary to actually win this thing.

Now, we have a bold action plan and a powerful enough coalition to win on climate. https://t.co/K8be8WUznQ",False,1298752274295123968,4,2,2,0
SenBrianSchatz,Senator Brian Schatz,1298704572559564800,1262099252,en,1298704572559564800,2020-08-26T19:31:13.000Z,"We don’t have to keep losing on climate – the work we’ve done shows that we can unite Americans and finally get this done.

Read more about our #CaseForClimateAction https://t.co/nDgAnqVXfz",False,1298704572559564800,2,1,1,0
SenBrianSchatz,Senator Brian Schatz,1298698366956822534,1262099252,en,1298698366956822534,2020-08-26T19:06:33.000Z,"RT @SenDemsClimate: For more than a year, we've been uncovering how Americans are experiencing the climate crisis &amp; charting a path toward…",False,1298698366956822534,15,0,0,0
SenBrianSchatz,Senator Brian Schatz,1298673991633297410,1262099252,en,1298673991633297410,2020-08-26T17:29:42.000Z,"RT @voxdotcom: The Senate Democrats’ committee on climate change just released its big report, addressing political barriers to action. @dr…",False,1298673991633297410,116,0,0,0
SenBrianSchatz,Senator Brian Schatz,1298653799951872000,1262099252,en,1298653799951872000,2020-08-26T16:09:28.000Z,RT @StevenMufson: Top Democrats try to show unity on climate change ahead of election. @dino_grandoni in The Energy 202: Senate Dems unveil…,False,1298653799951872000,5,0,0,0
SenBrianSchatz,Senator Brian Schatz,1298601984438734849,1262099252,en,1298601984438734849,2020-08-26T12:43:34.000Z,"RT @SenSchumer: If Democrats retake the majority in the Senate, we will be unified to move swiftly on legislation to tackle the climate cri…",False,1298601984438734849,442,0,0,0
SenBrianSchatz,Senator Brian Schatz,1298414568927100928,1262099252,en,1298414568927100928,2020-08-26T00:18:51.000Z,RT @SenBooker: Climate change is the greatest existential threat of our lifetime. We must take aggressive action to achieve net zero emissi…,False,1298414568927100928,36,0,0,0
SenBrianSchatz,Senator Brian Schatz,1298365418663542787,1262099252,en,1298365418663542787,2020-08-25T21:03:32.000Z,"RT @SenTinaSmith: I’m a member of the Special Committee on the Climate Crisis. Today, we released our final report. It’s based on a year of…",False,1298365418663542787,60,0,0,0
SenBrianSchatz,Senator Brian Schatz,1298364654058692608,1262099252,en,1298364654058692608,2020-08-25T21:00:30.000Z,"RT @SenTinaSmith: Our world is moving toward a more sustainable future, and the US can either lead or follow. I think we should lead. Check…",False,1298364654058692608,27,0,0,0
SenBrianSchatz,Senator Brian Schatz,1298351659391868929,1262099252,en,1298351659391868929,2020-08-25T20:08:52.000Z,RT @SenatorBaldwin: #BREAKING: @SenDemsClimate just released the #CaseForClimateAction report on the need to combat the #ClimateCrisis that…,False,1298351659391868929,46,0,0,0
SenBrianSchatz,Senator Brian Schatz,1298351625061437442,1262099252,en,1298351625061437442,2020-08-25T20:08:44.000Z,"RT @SenateDems: .@SenDemsClimate Committee's #CaseForClimateAction report is a huge step forward for climate action in Congress

The new re…",False,1298351625061437442,22,0,0,0
SenBrianSchatz,Senator Brian Schatz,1298351430252875776,1262099252,en,1298351430252875776,2020-08-25T20:07:57.000Z,"RT @SenatorDurbin: Climate change is an existential threat to life as we know it.
 
I'm proud to support @SenDemsClimate #CaseForClimateAct…",False,1298351430252875776,55,0,0,0
