handle,name,tweet_id,author_id,lang,replied_to,created_at,tweet_text,possibly_sensitive,conversation_id,retweet_count,reply_count,like_count,quote_count
USRepKeating,Congressman Bill Keating,1412903724347953154,232992031,en,1412903724347953154,2021-07-07T22:37:53.000Z,"On July 5, anti-LGBTQI+ demonstrators broke into the offices of Pride march organizers, @TbilisiPride and the @ShameMovement, and attacked journalists attempting to document the violence.",False,1412903722645135361,0,1,1,1
USRepKeating,Congressman Bill Keating,1412903722645135361,232992031,en,1412903722645135361,2021-07-07T22:37:52.000Z,Today I am condemning the violence against the LGBTQI+ rights activists and journalists who participated in @TbilisiPride in #Georgia. #TbilisiPride21,False,1412903722645135361,4,2,2,1
USRepKeating,Congressman Bill Keating,1412888025323954177,232992031,en,1412888025323954177,2021-07-07T21:35:30.000Z,"As a member of the House Foreign Affairs Committee, I am calling for an investigation into this attack and will continue to monitor this unfolding situation.",False,1412888024430620676,1,0,0,1
USRepKeating,Congressman Bill Keating,1412888024430620676,232992031,en,1412888024430620676,2021-07-07T21:35:29.000Z,"The news of Haitian President Jovenel Moïse's assassination this morning is chilling. My thoughts and prayers are with the people of Haiti, the Haitian diaspora locally and across the United States, and with First Lady Moïse as she recovers from this morning's attack.",False,1412888024430620676,5,1,1,1
USRepKeating,Congressman Bill Keating,1410698845219139589,232992031,en,1410698845219139589,2021-07-01T20:36:28.000Z,"Today’s ruling, alongside dozens of GOP-backed attempts to roll back voter rights across the country, underscores the importance of the Senate passing the John Lewis Voting Rights Act and the For the People Act to protect our democracy from these transparent, partisan attacks.",False,1410698843889573892,0,1,1,1
USRepKeating,Congressman Bill Keating,1410698843889573892,232992031,en,1410698843889573892,2021-07-01T20:36:28.000Z,"I am deeply disappointed that the Arizona GOP’s efforts to make it harder to vote have been upheld by the Supreme Court and, in the process, have further chipped away at the Voting Rights Act.",False,1410698843889573892,1,2,2,1
USRepKeating,Congressman Bill Keating,1410645074673799171,232992031,en,1410645074673799171,2021-07-01T17:02:48.000Z,"@HouseForeign @RepGregoryMeeks @StateDept I echo @RepGregoryMeeks statement and am proud and encouraged that the @StateDept has made this decision. The fight for equality in this country and around the world goes on regardless of what month it is, and I am proud to be part of that fight.",False,1410598608051720201,2,2,2,3
USRepKeating,Congressman Bill Keating,1410644966133710849,232992031,en,1410644966133710849,2021-07-01T17:02:23.000Z,"RT @HouseForeign: This is an important step for our country, and shows the world America’s commitment to the fair treatment of LGBTQI+ pers…",False,1410644966133710849,7,0,0,0
USRepKeating,Congressman Bill Keating,1410644954964180994,232992031,en,1410644954964180994,2021-07-01T17:02:20.000Z,RT @HouseForeign: Chairman @RepGregoryMeeks: I applaud @StateDept’s decision to allow Americans to self-select their gender marker on their…,False,1410644954964180994,12,0,0,0
USRepKeating,Congressman Bill Keating,1410320664972742656,232992031,en,1410320664972742656,2021-06-30T19:33:43.000Z,"Today @RepMarcyKaptur and I, as Democratic Co-Chairs of the Congressional Poland Caucus, issued a statement on LGBTQI+ issues in #Poland. https://t.co/ZVjargebVl",False,1410320664972742656,5,0,0,1
USRepKeating,Congressman Bill Keating,1410303048661020672,232992031,en,1410303048661020672,2021-06-30T18:23:43.000Z,"RT @VineyardWindUS: ""This decision means we will have good, clean energy jobs coming to our shores and a new generation of economic growth…",False,1410303048661020672,2,0,0,0
USRepKeating,Congressman Bill Keating,1409944001998770179,232992031,en,1409944001998770179,2021-06-29T18:37:00.000Z,"For too long, symbols of slavery and segregation have held a place of honor in the U.S. Capitol. Today I will vote to #RemoveHate and right this historic wrong.",False,1409944001998770179,2,2,2,1
USRepKeating,Congressman Bill Keating,1408446955521445894,232992031,en,1408446955521445894,2021-06-25T15:28:16.000Z,"Today, I voted to restore Obama-era methane pollution standards that Trump gutted. Addressing methane pollution from the oil and gas sector is a critical step to combat #ClimateChange and protect our communities.",False,1408446955521445894,5,2,2,1
USRepKeating,Congressman Bill Keating,1408445726623928322,232992031,en,1408445726623928322,2021-06-25T15:23:23.000Z,"We have an experienced President at the helm, bipartisan majorities in Congress committed to change, and our relationship with our European partners is as strong as ever. My @GlobeOpinion piece on what the US can unilaterally do today on Russia: https://t.co/XgypyvfB2k",False,1408445726623928322,6,0,0,2
USRepKeating,Congressman Bill Keating,1408130695763988481,232992031,en,1408130695763988481,2021-06-24T18:31:34.000Z,Women Veterans deserve the same access to co-pay free contraception that active-duty women and civilian women already have. That's why I'm a co-sponsor of @RepBrownley's #EqualAccess to Contraception for Veterans Act.,False,1408130695763988481,5,1,1,2
USRepKeating,Congressman Bill Keating,1408116788206911497,232992031,en,1408116788206911497,2021-06-24T17:36:18.000Z,"I want to thank all of today's witnesses for sharing their testimony at today's important hearing. The US remains firmly committed to @NATO, and we will continue to bolster the transatlantic alliance to meet current and future challenges.",False,1408116788206911497,4,1,1,1
USRepKeating,Congressman Bill Keating,1408096334905851913,232992031,en,1408096334905851913,2021-06-24T16:15:02.000Z,"On @climate, @Gottemoeller says #NATO ""has turned its attention to this in a significant way"" after this month's summit. I wholeheartedly endorse further commitments by #NATO to combatting security impacts of @climatechange.",False,1408096334905851913,9,1,1,1
USRepKeating,Congressman Bill Keating,1408094903112974344,232992031,en,1408094903112974344,2021-06-24T16:09:20.000Z,"In response to a question from @RepSchneider on what Congress can do to demonstrate US commitment to #NATO, @IvoHDaalder says emphasizing that the American people stand firmly behind NATO is an important reminder that NATO meets both US &amp; allied security interests.",False,1408094903112974344,3,0,0,1
USRepKeating,Congressman Bill Keating,1408092253776756742,232992031,en,1408092253776756742,2021-06-24T15:58:49.000Z,".@RepSusanWild is asking what the US can do with @NATO allies to promote cooperation and communication with #Turkey. @AndersFoghR says ""words matter"" and the US should seek to prevent further Turkish-Russian military cooperation.",False,1408092253776756742,2,1,1,1
USRepKeating,Congressman Bill Keating,1408088695253737472,232992031,en,1408088695253737472,2021-06-24T15:44:40.000Z,"Now a question from @repdinatitus on @NATO's involvement in responding to #Russia's Arctic expansion. @AndersFoghR says NATO must adopt a clear Arctic strategy. ""Russia is about to militarize the Arctic,"" he says.",False,1408088695253737472,3,0,0,1
USRepKeating,Congressman Bill Keating,1408080520177721347,232992031,en,1408080520177721347,2021-06-24T15:12:11.000Z,"Wess Mitchell says the ultimate goal must be the internal cohesion of @NATO. ""The right role for #NATO is to focus on the intersection of democracy with external security threats.""",False,1408080520177721347,3,1,1,1
USRepKeating,Congressman Bill Keating,1408080458848641028,232992031,en,1408080458848641028,2021-06-24T15:11:56.000Z,".@GerryConnolly @natopapress is asking about military readiness beyond the 2% GDP @NATO commitment. @IvoHDaalder says ""we need a fundamental recommitment to defense by our European allies... We need to spend our time talking about readiness &amp; investments in real capabilities.""",False,1408080458848641028,5,1,1,1
USRepKeating,Congressman Bill Keating,1408080276522213376,232992031,en,1408080276522213376,2021-06-24T15:11:13.000Z,"In response to my question on @NATO expansion, @Gottemoeller recommends ""working from the inside out"" through local offices on fighting domestic corruption and promoting reforms.",False,1408080276522213376,2,0,0,1
USRepKeating,Congressman Bill Keating,1408074500508368899,232992031,en,1408074500508368899,2021-06-24T14:48:16.000Z,"When it comes to cyber, ""the best defense may be a good offense"" says @IvoHDaalder. ""@NATO will need to develop the doctrine and capabilities to employ cyber offensively to enhance deterrence of cyber attacks.""",False,1408074500508368899,6,0,0,1
USRepKeating,Congressman Bill Keating,1408072177526657025,232992031,en,1408072177526657025,2021-06-24T14:39:02.000Z,".@Gottemoeller highlights the need for a new strategic concept for @NATO to meet the challenges of this decade and beyond, continued work on burden sharing commitments, and a focus on democratic resilience.",False,1408072177526657025,4,0,0,1
USRepKeating,Congressman Bill Keating,1408070927007457303,232992031,en,1408070927007457303,2021-06-24T14:34:04.000Z,"Insightful words from @AndersFoghR: ""@NATO has been a successful peace movement for nearly 75 years...because of two strengths: a capacity to adapt and determined American global leadership.""",False,1408070927007457303,2,0,0,1
USRepKeating,Congressman Bill Keating,1408070217029226504,232992031,en,1408070217029226504,2021-06-24T14:31:15.000Z,"@AustinScottGA08 on the challenges facing @NATO: ""As we focus on countering #China &amp; #Russia aggression &amp; the expansion in the Arctic, there's also an urgent need to address cyber security and cyber defense threats"" posed by the two countries.",False,1408070217029226504,1,0,0,1
USRepKeating,Congressman Bill Keating,1408069104762724353,232992031,en,1408069104762724353,2021-06-24T14:26:49.000Z,"@GerryConnolly, President of @natopapress says, “As @NATO the SG has observed, #China demands our attention not because the alliance seeks to move into the South China Sea but because China is increasing its influence &amp; expanding its activities in the Euro-Atlantic region.”",False,1408069104762724353,2,2,2,1
USRepKeating,Congressman Bill Keating,1408068720618995712,232992031,en,1408068720618995712,2021-06-24T14:25:18.000Z,"With new and emerging threats from traditional and non-traditional sources, @POTUS’ renewed commitments to our transatlantic alliances and the role of American leadership @NATO has never been more important than it is now.",False,1408068720618995712,3,0,0,2
USRepKeating,Congressman Bill Keating,1408056667842007040,232992031,en,1408056667842007040,2021-06-24T13:37:24.000Z,"Join me at 10am for a hearing on #NATO &amp; #NATO2030 with the @HouseForeign Subcommittee on Europe, Energy, the Environment, &amp; Cyber. Testimony from fmr Denmark PM &amp; NATO SG @AndersFoghR, fmr Deputy SG @Gottemoeller, and fmr #US Amb @NATO @IvoHDaalder. https://t.co/0bLvLxc8XU",False,1408056667842007040,15,1,1,1
USRepKeating,Congressman Bill Keating,1407838063594725383,232992031,en,1407838063594725383,2021-06-23T23:08:45.000Z,"As Chair of @HouseForeign Subcommittee on Europe, it will be great to have fellow Bay Stater, Leader Claire Cronin, as Ambassador to Ireland at an important time when we need to honor the Good Friday Agreement. I look forward to working with her to promote peace &amp; unity. #mapoli",False,1407838063594725383,4,2,2,3
USRepKeating,Congressman Bill Keating,1407835658270523392,232992031,en,1407835658270523392,2021-06-23T22:59:11.000Z,LGBTQI+ advocates at #EURO2020 are protesting legislation passed in Hungary greatly restricting the rights of the LGBTQI+ community by proudly marching in rainbow colors. This is solidarity at its finest. #LoveWins https://t.co/CaTuFN2qmd,False,1407835658270523392,1,0,0,1
USRepKeating,Congressman Bill Keating,1407718427704401925,232992031,en,1407718427704401925,2021-06-23T15:13:21.000Z,As a former prosecutor I know how important it is for victims to feel safe when reporting a sexual assault and I have long held that the military chain of command should not be part of the process. Thank you to @SecDef &amp; Gen. Milley for committing to this necessary reform.,False,1407718427704401925,2,1,1,1
USRepKeating,Congressman Bill Keating,1407493081432301571,232992031,en,1407493081432301571,2021-06-23T00:17:55.000Z,"Yesterday @POTUS announced new sanctions with our European and Canadian Partners in response to the illegal forced landing of a Ryanair flight over #Belarus. See my statement below:

#StandWithBelarus https://t.co/JdQBHkQHiB",False,1407493081432301571,35,1059,1059,3
USRepKeating,Congressman Bill Keating,1407071726563958787,232992031,en,1407071726563958787,2021-06-21T20:23:36.000Z,"Starting July 15 the #ChildTaxCredit from the American Rescue Plan will automatically send monthly payments to nearly all working families of $300/child under six and $250/child over six. If you didn’t file taxes, sign up using the non-filers tool: https://t.co/URVqRkd2g7",False,1407071726563958787,2,0,0,1
USRepKeating,Congressman Bill Keating,1405579365056921605,232992031,en,1405579365056921605,2021-06-17T17:33:29.000Z,"Today I met with @navalny's Chief of Staff @leonidvolkov to address human rights issues in Russia. As @POTUS said yesterday following his meeting with Putin, the U.S. will ""continue to raise issues of fundamental human rights because that's what we are, that's who we are."" https://t.co/yw1OEFjc8w",False,1405579365056921605,19,8,8,2
USRepKeating,Congressman Bill Keating,1405234292020723716,232992031,en,1405234292020723716,2021-06-16T18:42:17.000Z,The U.S. is leading by sending 500 million vaccine doses around the world. We must also lead by ensuring recipient countries do not discriminate against their LGBTQI citizens when vaccinations take place. https://t.co/kIM7mnIhxp,False,1405234292020723716,0,0,0,1
USRepKeating,Congressman Bill Keating,1404975495469535238,232992031,en,1404975495469535238,2021-06-16T01:33:55.000Z,"I joined Terry Moran on ABC News today to talk all things Russia, including my commitment to bringing Paul Whelan home and a prediction on which nation can already claim the “win” on tomorrow’s summit between President Biden and Putin. https://t.co/GsWwAyzThV",False,1404975495469535238,5,0,0,1
USRepKeating,Congressman Bill Keating,1403410745837207555,232992031,en,1403410745837207555,2021-06-11T17:56:10.000Z,Very grateful for the courage of all of today’s witnesses in speaking up and coming forward for #LGBTQI+ rights. The members of #Congress here today will continue pushing forward protections for basic human rights across the region and the world.,False,1403410745837207555,3,0,0,1
USRepKeating,Congressman Bill Keating,1403388690391523332,232992031,en,1403388690391523332,2021-06-11T16:28:32.000Z,Wholly support @repdinatitus’ leadership and suggestion to send @POTUS a letter calling for inclusive vaccine distribution to allies that ensures equal access for #LGBTQI+ individuals.,False,1403388690391523332,2,0,0,1
USRepKeating,Congressman Bill Keating,1403385331634802696,232992031,en,1403385331634802696,2021-06-11T16:15:11.000Z,"Lenny Emson @KyivPride on anti-#LGBTQI+ discrimination in #Ukraine: “If you are open, you stand no chance of getting an apartment… Legislation does not mention any discriminated groups in terms of protecting their right to housing or food or employment.”",False,1403385331634802696,3,0,0,1
USRepKeating,Congressman Bill Keating,1403383360873975808,232992031,en,1403383360873975808,2021-06-11T16:07:21.000Z,"In terms of violence against #LGBTQI+ groups, Lenny Emson @KyivPride says “it’s not only about LGBTQI groups. We are very visible, that’s why we are attacked, but this anger is directed at many more groups like Roma people and homeless people that are not protected.”",False,1403383360873975808,4,0,0,1
USRepKeating,Congressman Bill Keating,1403382262394195971,232992031,en,1403382262394195971,2021-06-11T16:02:59.000Z,".@RepTedDeutch asking about democratic backsliding and #LGBTQI+ rights. Tamás Dombos @hattertarsasag says, “It is the logic of the government to find an enemy and then pretend that they are saving the country from that enemy.”",False,1403382262394195971,3,1,1,1
USRepKeating,Congressman Bill Keating,1403381774466564098,232992031,en,1403381774466564098,2021-06-11T16:01:03.000Z,"In response to my question on the importance of independent reporting such as @RFERL, Svetlana Zakharova says, “We have support from the independent mass media, and we are really grateful for this support because it’s almost the only channel for us to talk about #LGBT rights.”",False,1403381774466564098,2,0,0,1
USRepKeating,Congressman Bill Keating,1403381697975144448,232992031,en,1403381697975144448,2021-06-11T16:00:45.000Z,"“In just 6 years, the @KyivPride march has transformed into a massive rally of more than 10,000 people... The striking difference in numbers...demonstrates the progress our society has made in terms of respecting and protecting #LGBT rights.” – Lenny Emson @KyivPride.",False,1403381697975144448,9,0,0,3
USRepKeating,Congressman Bill Keating,1403381594707083271,232992031,en,1403381594707083271,2021-06-11T16:00:20.000Z,"""People who commit hate crimes believe they are doing the right thing. They believe there are authorities behind them. And the #LGBT+ community... feels targeted, vulnerable, and unprotected.” Svetlana Zakharova @rulgbtnet speaking on the situation for #LGBTQI+ people in #Russia.",False,1403381594707083271,2,0,0,1
USRepKeating,Congressman Bill Keating,1403377065836036100,232992031,en,1403377065836036100,2021-06-11T15:42:20.000Z,"“The problems we face do not only target us as #LGBTQI persons, they target us as human rights defenders, as independent civil society activists, as autonomous citizens. But we do not give up.” Powerful testimony from Tamás Dombos from @hattertarsasag in #Hungary.",False,1403377065836036100,10,1,1,1
USRepKeating,Congressman Bill Keating,1403377000841101319,232992031,en,1403377000841101319,2021-06-11T15:42:05.000Z,"“…discrimination against any person is intolerable and cannot stand, and that equality is the indispensable tool for advancing the rights of all peoples everywhere.” - @davidcicilline",False,1403376999985463301,1,0,0,1
USRepKeating,Congressman Bill Keating,1403376999985463301,232992031,en,1403376999985463301,2021-06-11T15:42:04.000Z,“Violence against any people because of who they are is a violence against all people. An injustice against any people because of how they identify is an injustice against all people…” - @davidcicilline,False,1403376999985463301,6,1,1,1
USRepKeating,Congressman Bill Keating,1403373784086745090,232992031,en,1403373784086745090,2021-06-11T15:29:18.000Z,“The #US @StateDept and @USAID have been financially and politically supportive towards the work of #LGBTQI movements globally for several years and with bipartisan support. It is critically important that this funding and political support continues.” - Bjorn van Roozendaal,False,1403373784086745090,2,0,0,1
USRepKeating,Congressman Bill Keating,1403372307196911623,232992031,en,1403372307196911623,2021-06-11T15:23:26.000Z,"“No person should ever feel threatened based on who they are, what they believe, or who they love.” Couldn’t agree more, @RepBrianFitz.",False,1403372307196911623,8,4,4,1
USRepKeating,Congressman Bill Keating,1403372260069711873,232992031,en,1403372260069711873,2021-06-11T15:23:14.000Z,"Now we, the #US, as an historic leader for human rights globally must make it clear that #LGBTQI+ rights are universal, and I commend the Biden administration for making it US policy to lead by the power of our example...",False,1403372257666383877,0,1,1,1
USRepKeating,Congressman Bill Keating,1403372257666383877,232992031,en,1403372257666383877,2021-06-11T15:23:14.000Z,This will be the first hearing in the @HouseForeign committee focused solely on the advancement of #LGBTQI+ rights – but it won’t be the last.,False,1403372257666383877,7,1,1,2
USRepKeating,Congressman Bill Keating,1403357190207967235,232992031,en,1403357190207967235,2021-06-11T14:23:21.000Z,"Join me today at 11am as I Chair the first-ever Foreign Affairs hearing on LGBTQI+ rights. This hearing of the Subcommittee on Europe, Energy, the Environment and Cyber will focus on understanding the fight to protect LGBTQI+ rights in Europe &amp; Eurasia. https://t.co/kxWxYAYD7v",False,1403357190207967235,12,4,4,11
USRepKeating,Congressman Bill Keating,1400855515333267457,232992031,en,1400855515333267457,2021-06-04T16:42:36.000Z,"RT @SenMarkey: Today, @USRepKeating and I had the opportunity to welcome @SecRaimondo to @WHOI and NOAA's Northeast Fisheries Science Cente…",False,1400855515333267457,11,0,0,0
USRepKeating,Congressman Bill Keating,1398760967492734980,232992031,en,1398760967492734980,2021-05-29T21:59:37.000Z,"Tevis and I were glad to join the hundreds of volunteers this morning at our nations second largest national cemetery, the Massachusetts National Cemetery in Bourne, as we placed flags on the graves of those who stepped up to protect our country in times of war and peace. https://t.co/F2qTRtuyZ4",False,1398760967492734980,4,2,2,1
USRepKeating,Congressman Bill Keating,1398690700426977283,232992031,en,1398690700426977283,2021-05-29T17:20:24.000Z,"May 28th must be remembered alongside January 6th as the day that 35 U.S. Senators, representing a minority of Americans, put their personal political future ahead of the future of our democracy.",False,1398690690062749699,3,1,1,1
USRepKeating,Congressman Bill Keating,1398690698812178439,232992031,en,1398690698812178439,2021-05-29T17:20:23.000Z,The bipartisan majority voted in favor of a January 6th commission in fear of what further damage could be inflicted on our democracy. The minority used the un-democratic filibuster to block it in fear of losing elections.,False,1398690690062749699,2,1,1,1
USRepKeating,Congressman Bill Keating,1398690697910312969,232992031,en,1398690697910312969,2021-05-29T17:20:23.000Z,"I, along with the majority of members of the House and Senate, on a bipartisan basis and representing the vast majority of Americans, voted AGAINST doing nothing in response to the insurrection.",False,1398690690062749699,1,1,1,1
USRepKeating,Congressman Bill Keating,1398690696555601920,232992031,en,1398690696555601920,2021-05-29T17:20:23.000Z,"Voting to block the bipartisan 1/6 commission was the minority’s way of declaring that doing nothing is their response to keeping Capitol Police, congressional staff, and members themselves safe from future attacks.",False,1398690690062749699,0,1,1,1
USRepKeating,Congressman Bill Keating,1398690695263801345,232992031,en,1398690695263801345,2021-05-29T17:20:22.000Z,Voting to block the bipartisan 1/6 commission was the minority’s way of declaring that doing nothing is their response to the greatest number of first responder injuries since September 11th.,False,1398690690062749699,0,1,1,1
USRepKeating,Congressman Bill Keating,1398690693955084289,232992031,en,1398690693955084289,2021-05-29T17:20:22.000Z,Voting to block the bipartisan 1/6 commission was the minority’s way of declaring that doing nothing is their response to the death of a Capitol Police officer who came to work every day to protect them.,False,1398690690062749699,0,1,1,1
USRepKeating,Congressman Bill Keating,1398690692742909957,232992031,en,1398690692742909957,2021-05-29T17:20:22.000Z,"Voting to block the bipartisan 1/6 commission was the minority’s way of declaring that doing nothing is their response to an attack focused on taking hostage not just the physical documents declaring the winner of the election, but the Vice President of the United States.",False,1398690690062749699,0,1,1,1
USRepKeating,Congressman Bill Keating,1398690691430195204,232992031,en,1398690691430195204,2021-05-29T17:20:21.000Z,Voting to block the bipartisan 1/6 commission yesterday was the minority’s way of declaring that doing nothing is their response to an attack on our democracy.,False,1398690690062749699,0,2,2,1
USRepKeating,Congressman Bill Keating,1398690690062749699,232992031,en,1398690690062749699,2021-05-29T17:20:21.000Z,"As I read the names of the 35 Senators who blocked the bipartisan 1/6 Commission, I thought of a quote of unknown origin, often misattributed to the great Irish statesman Sir Edmund Burke: “The only thing necessary for the triumph of evil is for good people to do nothing.” https://t.co/knQuCu0Hle",False,1398690690062749699,11,5,5,2
USRepKeating,Congressman Bill Keating,1398680393558155266,232992031,en,1398680393558155266,2021-05-29T16:39:26.000Z,It was an honor to attend the Cape Cod Municipal Police Academy graduation earlier this week as Sgt. Sean Gannon’s widow Dara and mother Denise presented the scholarship established in his memory. Best of luck to the graduating class as they put their training to work. https://t.co/RK61j20d4C,False,1398680393558155266,3,0,0,2
USRepKeating,Congressman Bill Keating,1398625170735071237,232992031,en,1398625170735071237,2021-05-29T13:00:00.000Z,"Today marks the one-year anniversary since non-violent protests began in Belarus, calling for free and fair elections. In honor of this day, Sviatlana Tsikhanouskaya has called for a Global Picket of Solidary. In support, I am releasing the following statement: https://t.co/iUecdAHMMM",False,1398625170735071237,113,18,18,5
