handle,name,tweet_id,author_id,lang,replied_to,created_at,tweet_text,possibly_sensitive,conversation_id,retweet_count,reply_count,like_count,quote_count
USRepKeating,Congressman Bill Keating,514827642538057728,232992031,en,514827642538057728,2014-09-24T17:24:09.000Z,Toured #Barnstable Water Pollution Control Facility to see how private &amp;public help #ma09 meet renewable energy goals http://t.co/aMpq04VMQ9,False,514827642538057728,2,0,0,0
USRepKeating,Congressman Bill Keating,514430900697038848,232992031,en,514430900697038848,2014-09-23T15:07:39.000Z,September 27th is #NationalDrugTakeBackDay -call 1-800-882-9539 to find a location. #ma09 http://t.co/7ItSpL7F2O http://t.co/ZiPIgNpwzD,False,514430900697038848,1,1,1,0
USRepKeating,Congressman Bill Keating,514136491023687680,232992031,en,514136491023687680,2014-09-22T19:37:46.000Z,Spoke today @ National Association of Marine Laboratories &amp;Organization of Biological Field Stations #ma09 http://t.co/QGZpdFr20i #Woodshole,False,514136491023687680,1,0,0,0
USRepKeating,Congressman Bill Keating,513356509871607808,232992031,en,513356509871607808,2014-09-20T15:58:24.000Z,Proud to join so many today in #Plymouth for Alzheimer Association’s #SouthShore Walk to End Alzheimer. #ma09 http://t.co/0U8m090kYI,False,513356509871607808,3,0,0,0
USRepKeating,Congressman Bill Keating,511995852928593920,232992031,en,511995852928593920,2014-09-16T21:51:38.000Z,I applaud the reauthorization of vital #childcare grants. http://t.co/wukxHyQucV #ma09 #mapoli,False,511995852928593920,1,0,0,0
USRepKeating,Congressman Bill Keating,511673950737559552,232992031,en,511673950737559552,2014-09-16T00:32:30.000Z,Pleased to announce Homeland Security grants for #Dennis &amp; #Barnstable fire departments. #ma09 http://t.co/aTC2j8qt7Q,False,511673950737559552,4,0,0,0
USRepKeating,Congressman Bill Keating,510795538368057344,232992031,en,510795538368057344,2014-09-13T14:22:01.000Z,Emotional candlelight vigil in #Middleborough to raise awareness for childhood cancer. #JesseHeikkilaFoundation #ma09 http://t.co/rnbHpOTgsm,False,510795538368057344,2,0,0,0
USRepKeating,Congressman Bill Keating,510554292827467777,232992031,en,510554292827467777,2014-09-12T22:23:23.000Z,Proud to announce the House passage of the Tick-borne Disease Research Transparency and Accountability Act. #ma09 http://t.co/h5E1Wcz2tg,False,510554292827467777,5,2,2,0
USRepKeating,Congressman Bill Keating,510514301527138304,232992031,en,510514301527138304,2014-09-12T19:44:29.000Z,The agreement between @masscec &amp; @capewindproject to use @newbedford_ma to stage for offshore wind is a win for #ma09 environment &amp; economy.,False,510514301527138304,3,0,0,0
USRepKeating,Congressman Bill Keating,510441277142609920,232992031,en,510441277142609920,2014-09-12T14:54:18.000Z,Great to join both business leaders &amp; elected officials at the #Plymouth @PACC1620 2014 Legislative Breakfast. #ma09 http://t.co/48i2ULck6L,False,510441277142609920,5,0,0,0
USRepKeating,Congressman Bill Keating,510423563049136128,232992031,en,510423563049136128,2014-09-12T13:43:55.000Z,Congrats to #Middleborough High School on a great event to celebrate the 200th birthday of the national anthem. #ma09 http://t.co/4bwhdiZ31U,False,510423563049136128,4,0,0,0
USRepKeating,Congressman Bill Keating,510093348359905280,232992031,en,510093348359905280,2014-09-11T15:51:45.000Z,"Proud to display this tribute to patriotism in #Plymouth. TY @BaileyMagno, of #CarverHighSchool for the picture http://t.co/kXy32Zjyxu #ma09",False,510093348359905280,1,0,0,0
USRepKeating,Congressman Bill Keating,510075112343994368,232992031,en,510075112343994368,2014-09-11T14:39:18.000Z,"On this solemn day we honor the lives lost, the loved ones left behind, &amp; men and women who have heroically served and protected us. #911",False,510075112343994368,5,2,2,0
USRepKeating,Congressman Bill Keating,509782896769777664,232992031,en,509782896769777664,2014-09-10T19:18:08.000Z,Attention Veterans the @DeptVetAffairs hosting seminars @bristolcc &amp; @CapeCodComCol on filing disability claims #ma09 http://t.co/MwzD2UXQRN,False,509782896769777664,2,0,0,0
USRepKeating,Congressman Bill Keating,508721757143195648,232992031,en,508721757143195648,2014-09-07T21:01:33.000Z,I had a great time marching in #Dartmouth’s 350th Anniversary parade this afternoon! #ma09 http://t.co/cdTVmJ4ZpS http://t.co/9flRyyfC1d,False,508721757143195648,3,0,0,0
USRepKeating,Congressman Bill Keating,508315721194299392,232992031,en,508315721194299392,2014-09-06T18:08:06.000Z,Had blast as the Grand Marshall of Seaside Lemans race in #Mashpee  -fundraiser for the #CapeCod Foundation #ma09 http://t.co/wk2xNpXe4d,False,508315721194299392,2,0,0,0
USRepKeating,Congressman Bill Keating,507571814050979840,232992031,en,507571814050979840,2014-09-04T16:52:05.000Z,Great to join the #Barnstable County Public Works Assn. &amp; #Plymouth County Highway Assn. joint meeting today! #ma09 http://t.co/7HaXVp2COV,False,507571814050979840,1,0,0,0
USRepKeating,Congressman Bill Keating,507294028422205442,232992031,en,507294028422205442,2014-09-03T22:28:16.000Z,My statement on France’s decision to place the delivery of an assault ship to Russia on hold: http://t.co/viyj2SFEzf,False,507294028422205442,5,0,0,0
USRepKeating,Congressman Bill Keating,506815388177694720,232992031,en,506815388177694720,2014-09-02T14:46:19.000Z,Great to join @DivinaGrossman for the @UMassD Convocation breakfast and launch of #UMassDTransform2020. #ma09 http://t.co/S39V7sczt4,False,506815388177694720,6,1,1,0
USRepKeating,Congressman Bill Keating,506440696602316801,232992031,en,506440696602316801,2014-09-01T13:57:25.000Z,Thank you to the Labor Movement for everything they have done to fight to keep our economy #unionstrong and our workers safe. #ma09,False,506440696602316801,8,0,0,0
USRepKeating,Congressman Bill Keating,504692008334938112,232992031,en,504692008334938112,2014-08-27T18:08:46.000Z,"Today, I attended the ribbon cutting ceremony for the @SouthcoastHlth Urgent Care Center at #Wareham Crossing. http://t.co/JCg7DUJliV #ma09",False,504692008334938112,6,1,1,0
USRepKeating,Congressman Bill Keating,504362651510906881,232992031,en,504362651510906881,2014-08-26T20:20:01.000Z,My statement on the recent Russian incursions into #Ukraine. #ma09 http://t.co/AzEWiF9rWy,False,504362651510906881,1,1,1,0
USRepKeating,Congressman Bill Keating,503232915191635968,232992031,en,503232915191635968,2014-08-23T17:30:51.000Z,I commend the DEA for its decision to restrict the availability &amp; distribution of products containing hydrocodone http://t.co/DkvcUyoHNN,False,503232915191635968,2,1,1,0
USRepKeating,Congressman Bill Keating,503209151850618880,232992031,en,503209151850618880,2014-08-23T15:56:25.000Z,"Proud to announce a total of $50k in Assistance to Firefighters Grants for the #Acushnet Fire Department.  #ma09 

http://t.co/c43AscBNUF",False,503209151850618880,1,0,0,0
USRepKeating,Congressman Bill Keating,502554880108949504,232992031,en,502554880108949504,2014-08-21T20:36:35.000Z,Great to join @BurkheadBill  @MassEducation &amp; others for the ribbon cutting of @MonomoyRHS! Go @MonomoySharks http://t.co/4TFRwzROHa #ma09,False,502554880108949504,3,0,0,0
USRepKeating,Congressman Bill Keating,502470713195118592,232992031,en,502470713195118592,2014-08-21T15:02:08.000Z,Proud to announce $200K in USDA Value-Added Producer Grant funding for Ocean Spray Cranberries http://t.co/nnEIBRMC7r,False,502470713195118592,2,2,2,0
USRepKeating,Congressman Bill Keating,502225941297643520,232992031,en,502225941297643520,2014-08-20T22:49:29.000Z,"RT @skpeake: Great day with usrepkeating, @senwarren @danwolfma touring @CapeAbilities and #WeCan! #ma09 #mapoli http://t.co/Y9Z4QUe6y6",False,502225941297643520,3,0,0,0
USRepKeating,Congressman Bill Keating,502187354199977985,232992031,en,502187354199977985,2014-08-20T20:16:10.000Z,Informative #Barnstable town hall discussion w/ @senwarren @danwolfma @brianmannal on a host of topics. Proud to serve #ma09 #CapeCod!,False,502187354199977985,11,3,3,0
USRepKeating,Congressman Bill Keating,502148116192456704,232992031,en,502148116192456704,2014-08-20T17:40:15.000Z,Great discussion w/the staff @ #WeCan &amp; @SenWarren on how we can empower women in navigating life’s challenges #ma09 http://t.co/r27TXbuhDg,False,502148116192456704,1,0,0,0
USRepKeating,Congressman Bill Keating,502115658147328000,232992031,en,502115658147328000,2014-08-20T15:31:16.000Z,Great to join @senwarren @danwolfma @skpeake &amp; Rep Turner for a tour of @CapeAbilities! #ma09 http://t.co/lJxj7qigKQ http://t.co/dq7NJA1h7R,False,502115658147328000,4,0,0,0
USRepKeating,Congressman Bill Keating,501836063137337344,232992031,en,501836063137337344,2014-08-19T21:00:15.000Z,Thanks to the #CapeCod #Cranberry Growers for the chance to speak today re: this vital agricultural industry in #MA09 http://t.co/8Ct0faTUVA,False,501836063137337344,2,0,0,0
USRepKeating,Congressman Bill Keating,501809615718584321,232992031,en,501809615718584321,2014-08-19T19:15:10.000Z,Today's #MA09 Veterans Adv Bd reviewed new law 2 give vets health care they deserve. Progress - but we need 2 do more http://t.co/ZtrFldQ5Y5,False,501809615718584321,2,0,0,0
USRepKeating,Congressman Bill Keating,501432251255902210,232992031,en,501432251255902210,2014-08-18T18:15:39.000Z,Proud to join @polanowj &amp; @NHPHealth to celebrate $2.6m in grants to support Community Health Centers on #CapeCod http://t.co/wplRmKfmda,False,501432251255902210,2,0,0,0
USRepKeating,Congressman Bill Keating,499959222994759680,232992031,en,499959222994759680,2014-08-14T16:42:22.000Z,Attended a ribbon cutting for @Harbor_Health #Plymouth -made possible from a 650k grant  that my office secured http://t.co/kVR89Tq3ej #ma09,False,499959222994759680,1,0,0,0
USRepKeating,Congressman Bill Keating,499612345732452352,232992031,en,499612345732452352,2014-08-13T17:44:00.000Z,Proud to announce over 190K in Justice Assistance Grants for #Fall River &amp; #NewBedford. #ma09 http://t.co/xv5ieW7Rbz http://t.co/yhnFdBUrxR,False,499612345732452352,3,0,0,0
USRepKeating,Congressman Bill Keating,498875642742849536,232992031,en,498875642742849536,2014-08-11T16:56:36.000Z,I had a tremendous time last night @ the 29th Pops by the Sea Concert in #Hyannis.  A great #CapeCod tradition. http://t.co/ywBL9Bbmrn #ma09,False,498875642742849536,1,0,0,0
USRepKeating,Congressman Bill Keating,498161906696593409,232992031,en,498161906696593409,2014-08-09T17:40:28.000Z,I attended the bridge dedication ceremony to honor the memory of US Navy SEAL Kevin A. Houston in Barnstable #ma09 https://t.co/1K0dWy81RZ,False,498161906696593409,4,1,1,0
USRepKeating,Congressman Bill Keating,498132333376331776,232992031,en,498132333376331776,2014-08-09T15:42:57.000Z,Joined 31 agencies today for #StandDownCapeCod. Stand Down is an event that provides services to our Vets. #ma09 http://t.co/QppRlGM4in,False,498132333376331776,3,0,0,0
USRepKeating,Congressman Bill Keating,497846869650075648,232992031,en,497846869650075648,2014-08-08T20:48:37.000Z,Proud to announced a $250K grant for @Harbor_Health Services - which operates several health care centers in #ma09 http://t.co/HNpozsdyDl,False,497846869650075648,2,0,0,0
USRepKeating,Congressman Bill Keating,497778924563480576,232992031,en,497778924563480576,2014-08-08T16:18:38.000Z,"Today, I joined the community of #Marshfield for the ribbon cutting to mark the opening of the new MHS! #ma09 http://t.co/0AOgc4PUYl #GoRams",False,497778924563480576,5,0,0,0
USRepKeating,Congressman Bill Keating,497495117167882240,232992031,en,497495117167882240,2014-08-07T21:30:53.000Z,"Today, POTUS signed the Veterans Access, Choice &amp; Accountability Act, a bill to improve accountability &amp; access to care for #Veterans. #ma09",False,497495117167882240,2,0,0,0
USRepKeating,Congressman Bill Keating,497058833131646976,232992031,en,497058833131646976,2014-08-06T16:37:15.000Z,"RT @massdcr: @MassDCR Advisory - Due to rip currents and effects of Tropical Storm Bertha, swimming is prohibited at Horseneck Beach in...",False,497058833131646976,0,0,0,0
USRepKeating,Congressman Bill Keating,496701848007753728,232992031,en,496701848007753728,2014-08-05T16:58:43.000Z,Great to attend the groundbreaking for the conversion of the #Hyannis Days Inn to a Marriott Fairfield Inn. #ma09 http://t.co/M2duqR40sr,False,496701848007753728,3,0,0,0
USRepKeating,Congressman Bill Keating,496377253358747648,232992031,en,496377253358747648,2014-08-04T19:28:54.000Z,Happy 224th birthday @USCG. #ma09 relies on the great work that the USCG does to promote safety &amp; save lives every day. TY for your service!,False,496377253358747648,6,1,1,0
USRepKeating,Congressman Bill Keating,496373437120905217,232992031,en,496373437120905217,2014-08-04T19:13:44.000Z,Had a great visit today @WHOI to tour the @NSF arctic research vessel @sikuliaq. #ma09 http://t.co/Lv0mEwo8a6 http://t.co/bNMnQoItfa,False,496373437120905217,4,0,0,0
USRepKeating,Congressman Bill Keating,496067329655308288,232992031,en,496067329655308288,2014-08-03T22:57:22.000Z,RT @ChrisMarkeyRep: Great time marching  in the feast parade with @USRepKeating and the New Bedford delegation. Enormous crowd!!,False,496067329655308288,3,0,0,0
USRepKeating,Congressman Bill Keating,496031776456708097,232992031,en,496031776456708097,2014-08-03T20:36:05.000Z,Enjoyed celebrating the 100th Anniversary of the Feast of the Blessed Sacrament by marching in today’s parade. #ma09 http://t.co/cZgmgsdpba,False,496031776456708097,3,0,0,0
USRepKeating,Congressman Bill Keating,494489522873569280,232992031,en,494489522873569280,2014-07-30T14:27:44.000Z,My statement on new European Union sanctions against Russia: http://t.co/1XFpSBsKEs #ma09 #mapoli,False,494489522873569280,2,0,0,0
USRepKeating,Congressman Bill Keating,494287675889704961,232992031,en,494287675889704961,2014-07-30T01:05:40.000Z,RT @congapps: An app that tracks school store inventory wins @USRepKeating  #STEM competition. http://t.co/Ry083aGDnI,False,494287675889704961,3,0,0,0
USRepKeating,Congressman Bill Keating,494123038389325824,232992031,en,494123038389325824,2014-07-29T14:11:27.000Z,Tevis and I are proud to join the #CapeCodCanal Centennial Committee in celebrating today’s 100th Anniversary. http://t.co/pnnyJ2WtRK #ma09,False,494123038389325824,3,0,0,0
USRepKeating,Congressman Bill Keating,493550067232833536,232992031,en,493550067232833536,2014-07-28T00:14:40.000Z,Today I was proud to attend &amp; support the 4th @theMDSC Buddy Walk By the Sea in #Falmouth. #ma09 http://t.co/eWJ70axdSq,False,493550067232833536,3,0,0,0
USRepKeating,Congressman Bill Keating,493058698194219008,232992031,en,493058698194219008,2014-07-26T15:42:08.000Z,Last night I attended @coastguardfound reception aboard the USCG Eagle to kickoff #CapeCodCanal100anniversary. #ma09 http://t.co/xQH8YQUc13,False,493058698194219008,3,0,0,0
USRepKeating,Congressman Bill Keating,492730053545820160,232992031,en,492730053545820160,2014-07-25T17:56:13.000Z,Congrats to Patricia Dias of @NewBedford_MA High School -  the winner of the #ma09 Congressional #STEM Competition! http://t.co/gYvHhDhB8H,False,492730053545820160,5,0,0,0
USRepKeating,Congressman Bill Keating,491997326043783168,232992031,en,491997326043783168,2014-07-23T17:24:38.000Z,Proud to announce $260K in Homeland Security #Firefighter Grants for the #Centerville -#Osterville - #MarstonsMills Fire Department. #ma09,False,491997326043783168,1,0,0,0
USRepKeating,Congressman Bill Keating,490187349608112128,232992031,en,490187349608112128,2014-07-18T17:32:26.000Z,Disaster Assistance Funding Should Go Directly to #Fishermen. http://t.co/EyN3foGcpo #ma09 #mapoli #fishing,False,490187349608112128,1,0,0,0
USRepKeating,Congressman Bill Keating,489444435680559104,232992031,en,489444435680559104,2014-07-16T16:20:21.000Z,Proud to announce w/@SenWarren that the Social Security Administration will begin video teleconferencing services on #Nantucket. #ma09,False,489444435680559104,1,0,0,0
USRepKeating,Congressman Bill Keating,486975220893233153,232992031,en,486975220893233153,2014-07-09T20:48:34.000Z,Proud to announce 467K in Homeland Security Assistance to Firefighters Grants for #Pembroke Fire Department. #ma09 http://t.co/hrbYyRiTHW,False,486975220893233153,2,0,0,0
USRepKeating,Congressman Bill Keating,486212095898578944,232992031,en,486212095898578944,2014-07-07T18:16:11.000Z,Yesterday I attended Phinney’s Harbor Day in #Bourne. All proceeds from Phinney's Harbor Day go towards Bourne Community Boating. #ma09,False,486212095898578944,1,1,1,0
USRepKeating,Congressman Bill Keating,486168448678895616,232992031,en,486168448678895616,2014-07-07T15:22:45.000Z,Attention #fishermen deadline to apply for SBA Working Capital Loans in Mass commercial fishery is approaching. #ma09 http://t.co/vltLAd8ZuZ,False,486168448678895616,2,0,0,0
USRepKeating,Congressman Bill Keating,485467444472197121,232992031,en,485467444472197121,2014-07-05T16:57:12.000Z,Great to join @ChrisMarkeyRep at a gorgeous day in #NewBedford for the 42nd Cape Verdean Recognition parade. http://t.co/oH3dbFzHVi #ma09,False,485467444472197121,4,0,0,0
USRepKeating,Congressman Bill Keating,485094659627048960,232992031,en,485094659627048960,2014-07-04T16:15:54.000Z,Tevis and I enjoyed a great morning at the #Bourne July 4th parade.  We wish everyone a very safe and happy Independence Day! - BK,False,485094659627048960,1,1,1,0
USRepKeating,Congressman Bill Keating,484813374035750912,232992031,en,484813374035750912,2014-07-03T21:38:10.000Z,Tevis &amp; I were proud to join #Plymouth in honoring the town's Fallen Heroes from the Vietnam War today. #ma09 http://t.co/YcmRuOsxeS,False,484813374035750912,4,0,0,0
USRepKeating,Congressman Bill Keating,484793966597267456,232992031,en,484793966597267456,2014-07-03T20:21:03.000Z,"Residents of #ma09, as you make plans for the 4th, please be sure that your hurricane preparedness plans are in place http://t.co/Csy26RiOqd",False,484793966597267456,1,0,0,0
USRepKeating,Congressman Bill Keating,484464641511137280,232992031,en,484464641511137280,2014-07-02T22:32:26.000Z,"Proud to announce $387,482 in Homeland Security Assistance to Firefighters Grants (AFG) for the #Chatham, #Fairhaven, &amp; #Onset FD. #ma09",False,484464641511137280,2,0,0,0
USRepKeating,Congressman Bill Keating,484370956023250944,232992031,en,484370956023250944,2014-07-02T16:20:09.000Z,In honor of the 50th anniversary of the #CivilRightsAct1964 we must continue to fight for equality for all. #ma09,False,484370956023250944,3,0,0,0
USRepKeating,Congressman Bill Keating,483676612094066688,232992031,en,483676612094066688,2014-06-30T18:21:05.000Z,I spoke @ #DrugFreeNewBedford on the #STOPPAct -my bill that calls for abuse deterrence in prescription opioids #ma09 http://t.co/mpDfYqrVXZ,False,483676612094066688,2,0,0,0
USRepKeating,Congressman Bill Keating,482939710818746368,232992031,en,482939710818746368,2014-06-28T17:32:54.000Z,Joined @SenWarren &amp; @MayorMitchellNB for the Charles W. Morgan Homecoming! #NewBedford #ma09 http://t.co/OBarYr1NTN http://t.co/iE3MZOlG6x,False,482939710818746368,2,0,0,0
USRepKeating,Congressman Bill Keating,482596118292090880,232992031,en,482596118292090880,2014-06-27T18:47:35.000Z,Joined @massgovernor in #Plymouth to announce the designation of state coastal waters as a #NoDischargeArea. #ma09 http://t.co/UUrCJg63Fz,False,482596118292090880,2,0,0,0
USRepKeating,Congressman Bill Keating,480820542216228864,232992031,en,480820542216228864,2014-06-22T21:12:05.000Z,Best of luck to @ussoccer today! #worldcup #USAvsPOR #OneNationOneTeam,False,480820542216228864,3,0,0,0
USRepKeating,Congressman Bill Keating,480074898950615040,232992031,en,480074898950615040,2014-06-20T19:49:09.000Z,Joined my colleague @RepJoeKennedy in securing 3.6million in HUD Grants for #FallRiver. #ma09 #mapoli http://t.co/hTmwEKMBMw,False,480074898950615040,6,0,0,0
USRepKeating,Congressman Bill Keating,478590250554773504,232992031,en,478590250554773504,2014-06-16T17:29:42.000Z,Tevis &amp; I got a lesson in sea salting at the Aptucxet Trading Post Museum Complex in #Bourne over the weekend. #ma09 http://t.co/NRpW6SPAz2,False,478590250554773504,2,0,0,0
USRepKeating,Congressman Bill Keating,478215305094004736,232992031,en,478215305094004736,2014-06-15T16:39:48.000Z,Great to spend time yesterday hearing about history from the Musketeer Regiment at #Sandwich 375th Celebration #ma09 http://t.co/tlfYFpr72z,False,478215305094004736,2,0,0,0
USRepKeating,Congressman Bill Keating,478166961663508480,232992031,en,478166961663508480,2014-06-15T13:27:42.000Z,Happy Father’s Day!,False,478166961663508480,2,0,0,0
USRepKeating,Congressman Bill Keating,477866094410366976,232992031,en,477866094410366976,2014-06-14T17:32:09.000Z,Re-dedication of the Gray Gables RR station w/Pres Grover Cleveland’s grandson George Cleveland in #Bourne. #ma09 http://t.co/OWzhp9Igyb,False,477866094410366976,2,0,0,0
USRepKeating,Congressman Bill Keating,477550974597619712,232992031,en,477550974597619712,2014-06-13T20:39:59.000Z,It was great to see @repjimcantwell and #Marshfield Furnace Brook 8th graders in DC this past week! #ma09 http://t.co/qN2Sskb7Ke,False,477550974597619712,2,0,0,0
USRepKeating,Congressman Bill Keating,477500181974228992,232992031,en,477500181974228992,2014-06-13T17:18:09.000Z,Thank you to West #Barnstable Elementary School for inviting me to your very patriotic #flagday ceremony! http://t.co/7w5nMZrBLn #ma09,False,477500181974228992,2,0,0,0
USRepKeating,Congressman Bill Keating,476496653269340160,232992031,en,476496653269340160,2014-06-10T22:50:29.000Z,TY #Ma09 residents who participated in my Telephone Town Hall tonight. I hope you found it as informative as I did. http://t.co/JJELVGZCNg,False,476496653269340160,3,0,0,0
USRepKeating,Congressman Bill Keating,476114363804557312,232992031,en,476114363804557312,2014-06-09T21:31:24.000Z,I had a great time last night for the celebration of the 350th Anniversary of the Incorporation  of #Dartmouth #ma09 http://t.co/xbjMYpS3D0,False,476114363804557312,1,0,0,0
USRepKeating,Congressman Bill Keating,476003318826037250,232992031,en,476003318826037250,2014-06-09T14:10:09.000Z,On Sat I joined @RhondaNyman &amp; @SenJohnFKeenan for the dedication of the Robert J Nyman Senior Center #Rockland #ma09 http://t.co/XSa4lXKBvf,False,476003318826037250,1,0,0,0
USRepKeating,Congressman Bill Keating,475704179378618369,232992031,en,475704179378618369,2014-06-08T18:21:29.000Z,Attended a very moving #NewBedford #Firefighters Memorial. We must never forget the brave firefighters who made the ultimate sacrifice #ma09,False,475704179378618369,2,0,0,0
USRepKeating,Congressman Bill Keating,475661925070954497,232992031,en,475661925070954497,2014-06-08T15:33:34.000Z,Attended @thenationsfirst Change of Command @ J.Base #CapeCod where Brig.Gen.Smith relinquished command to Col.Magurn.,False,475661925070954497,4,0,0,0
USRepKeating,Congressman Bill Keating,475323423741448192,232992031,en,475323423741448192,2014-06-07T17:08:29.000Z,I am honored to receive Legislator of the Year from MA @AmericanLegion at their state convention in #Plymouth. http://t.co/BZwRCDmNnr #ma09,False,475323423741448192,5,0,0,0
USRepKeating,Congressman Bill Keating,474977739683168257,232992031,en,474977739683168257,2014-06-06T18:14:52.000Z,RT @StephGray: TY 4 including Tom Ruggiero who came home &amp; continued 2 serve the residents of Plymouth as a Fire Fighter he remains our...,False,474977739683168257,0,0,0,0
USRepKeating,Congressman Bill Keating,474950190672400384,232992031,en,474950190672400384,2014-06-06T16:25:24.000Z,As we commemorate #Dday70 please take a moment to listen to our heroes reflect on their remarkable experiences. http://t.co/1q3XSwkIQc #ma09,False,474950190672400384,2,1,1,0
USRepKeating,Congressman Bill Keating,474920312333938688,232992031,en,474920312333938688,2014-06-06T14:26:40.000Z,Remember &amp; honor all our heroes from #ma09 &amp; beyond who stormed the beaches of Normandy 70 years ago today. #DDay http://t.co/9cbAT3OKbh,False,474920312333938688,9,0,0,0
USRepKeating,Congressman Bill Keating,474717304467386368,232992031,en,474717304467386368,2014-06-06T00:59:59.000Z,RT @MarkeyMemo: New fire rescue boat for COMM Fire Dept will help strengthen #CapeCod public safety. Proud to join w @USRepKeating http://t…,False,474717304467386368,2,0,0,0
USRepKeating,Congressman Bill Keating,474633707765383169,232992031,en,474633707765383169,2014-06-05T19:27:48.000Z,Thank you to Normandin Middle School &amp; principal @BurkheadBill for hosting me on visit today!  #NewBedford #ma09 http://t.co/eEaySnTJOu,False,474633707765383169,3,0,0,0
USRepKeating,Congressman Bill Keating,474624180403830785,232992031,en,474624180403830785,2014-06-05T18:49:57.000Z,I  joined the Spirit of Liberty Foundation &amp; @MayorMitchellNB to honor the life &amp; legacy of Sgt.Carney #the54th #ma09 http://t.co/Frxxu59WXK,False,474624180403830785,5,1,1,0
USRepKeating,Congressman Bill Keating,474279417611821056,232992031,en,474279417611821056,2014-06-04T19:59:59.000Z,Last night I joined @JoshCutler &amp; the #Duxbury Selectboard for a community meeting focused on coastal issues. #ma09 http://t.co/t5xpncWdI4,False,474279417611821056,3,0,0,0
USRepKeating,Congressman Bill Keating,474254488925372416,232992031,en,474254488925372416,2014-06-04T18:20:56.000Z,Joined @TheNationsFirst &amp; @bcrepc @ #JointBaseCapeCod for #Nantucket &amp; #Barnstable emergency response training http://t.co/WYWA2mpayz #ma09,False,474254488925372416,4,0,0,0
USRepKeating,Congressman Bill Keating,472445559224426496,232992031,en,472445559224426496,2014-05-30T18:32:53.000Z,My provision to strengthen intelligence-sharing in the wake of the Boston Marathon bombings passed the House. #ma09 http://t.co/82cZhSatNO,False,472445559224426496,4,1,1,0
